{
  "address": "0xDC9Ced376b52990ac0c66dcc25785513E8c626b4",
  "abi": [
    {
      "inputs": [
        {
          "internalType": "address",
          "name": "_controller",
          "type": "address"
        }
      ],
      "stateMutability": "nonpayable",
      "type": "constructor"
    },
    {
      "anonymous": false,
      "inputs": [
        {
          "indexed": true,
          "internalType": "address",
          "name": "newDelegate",
          "type": "address"
        },
        {
          "indexed": true,
          "internalType": "address",
          "name": "oldDelegate",
          "type": "address"
        },
        {
          "indexed": true,
          "internalType": "address",
          "name": "delegator",
          "type": "address"
        },
        {
          "indexed": false,
          "internalType": "uint256",
          "name": "additionalAmount",
          "type": "uint256"
        },
        {
          "indexed": false,
          "internalType": "uint256",
          "name": "bondedAmount",
          "type": "uint256"
        }
      ],
      "name": "Bond",
      "type": "event"
    },
    {
      "anonymous": false,
      "inputs": [
        {
          "indexed": true,
          "internalType": "address",
          "name": "delegate",
          "type": "address"
        },
        {
          "indexed": true,
          "internalType": "address",
          "name": "delegator",
          "type": "address"
        },
        {
          "indexed": false,
          "internalType": "uint256",
          "name": "rewards",
          "type": "uint256"
        },
        {
          "indexed": false,
          "internalType": "uint256",
          "name": "fees",
          "type": "uint256"
        },
        {
          "indexed": false,
          "internalType": "uint256",
          "name": "startRound",
          "type": "uint256"
        },
        {
          "indexed": false,
          "internalType": "uint256",
          "name": "endRound",
          "type": "uint256"
        }
      ],
      "name": "EarningsClaimed",
      "type": "event"
    },
    {
      "anonymous": false,
      "inputs": [
        {
          "indexed": false,
          "internalType": "string",
          "name": "param",
          "type": "string"
        }
      ],
      "name": "ParameterUpdate",
      "type": "event"
    },
    {
      "anonymous": false,
      "inputs": [
        {
          "indexed": true,
          "internalType": "address",
          "name": "delegate",
          "type": "address"
        },
        {
          "indexed": true,
          "internalType": "address",
          "name": "delegator",
          "type": "address"
        },
        {
          "indexed": false,
          "internalType": "uint256",
          "name": "unbondingLockId",
          "type": "uint256"
        },
        {
          "indexed": false,
          "internalType": "uint256",
          "name": "amount",
          "type": "uint256"
        }
      ],
      "name": "Rebond",
      "type": "event"
    },
    {
      "anonymous": false,
      "inputs": [
        {
          "indexed": true,
          "internalType": "address",
          "name": "transcoder",
          "type": "address"
        },
        {
          "indexed": false,
          "internalType": "uint256",
          "name": "amount",
          "type": "uint256"
        }
      ],
      "name": "Reward",
      "type": "event"
    },
    {
      "anonymous": false,
      "inputs": [
        {
          "indexed": false,
          "internalType": "address",
          "name": "controller",
          "type": "address"
        }
      ],
      "name": "SetController",
      "type": "event"
    },
    {
      "anonymous": false,
      "inputs": [
        {
          "indexed": true,
          "internalType": "address",
          "name": "transcoder",
          "type": "address"
        },
        {
          "indexed": false,
          "internalType": "uint256",
          "name": "activationRound",
          "type": "uint256"
        }
      ],
      "name": "TranscoderActivated",
      "type": "event"
    },
    {
      "anonymous": false,
      "inputs": [
        {
          "indexed": true,
          "internalType": "address",
          "name": "transcoder",
          "type": "address"
        },
        {
          "indexed": false,
          "internalType": "uint256",
          "name": "deactivationRound",
          "type": "uint256"
        }
      ],
      "name": "TranscoderDeactivated",
      "type": "event"
    },
    {
      "anonymous": false,
      "inputs": [
        {
          "indexed": true,
          "internalType": "address",
          "name": "transcoder",
          "type": "address"
        },
        {
          "indexed": false,
          "internalType": "address",
          "name": "finder",
          "type": "address"
        },
        {
          "indexed": false,
          "internalType": "uint256",
          "name": "penalty",
          "type": "uint256"
        },
        {
          "indexed": false,
          "internalType": "uint256",
          "name": "finderReward",
          "type": "uint256"
        }
      ],
      "name": "TranscoderSlashed",
      "type": "event"
    },
    {
      "anonymous": false,
      "inputs": [
        {
          "indexed": true,
          "internalType": "address",
          "name": "transcoder",
          "type": "address"
        },
        {
          "indexed": false,
          "internalType": "uint256",
          "name": "rewardCut",
          "type": "uint256"
        },
        {
          "indexed": false,
          "internalType": "uint256",
          "name": "feeShare",
          "type": "uint256"
        }
      ],
      "name": "TranscoderUpdate",
      "type": "event"
    },
    {
      "anonymous": false,
      "inputs": [
        {
          "indexed": true,
          "internalType": "address",
          "name": "oldDelegator",
          "type": "address"
        },
        {
          "indexed": true,
          "internalType": "address",
          "name": "newDelegator",
          "type": "address"
        },
        {
          "indexed": false,
          "internalType": "uint256",
          "name": "oldUnbondingLockId",
          "type": "uint256"
        },
        {
          "indexed": false,
          "internalType": "uint256",
          "name": "newUnbondingLockId",
          "type": "uint256"
        },
        {
          "indexed": false,
          "internalType": "uint256",
          "name": "amount",
          "type": "uint256"
        }
      ],
      "name": "TransferBond",
      "type": "event"
    },
    {
      "anonymous": false,
      "inputs": [
        {
          "indexed": true,
          "internalType": "address",
          "name": "transcoder",
          "type": "address"
        },
        {
          "indexed": false,
          "internalType": "address",
          "name": "treasury",
          "type": "address"
        },
        {
          "indexed": false,
          "internalType": "uint256",
          "name": "amount",
          "type": "uint256"
        }
      ],
      "name": "TreasuryReward",
      "type": "event"
    },
    {
      "anonymous": false,
      "inputs": [
        {
          "indexed": true,
          "internalType": "address",
          "name": "delegate",
          "type": "address"
        },
        {
          "indexed": true,
          "internalType": "address",
          "name": "delegator",
          "type": "address"
        },
        {
          "indexed": false,
          "internalType": "uint256",
          "name": "unbondingLockId",
          "type": "uint256"
        },
        {
          "indexed": false,
          "internalType": "uint256",
          "name": "amount",
          "type": "uint256"
        },
        {
          "indexed": false,
          "internalType": "uint256",
          "name": "withdrawRound",
          "type": "uint256"
        }
      ],
      "name": "Unbond",
      "type": "event"
    },
    {
      "anonymous": false,
      "inputs": [
        {
          "indexed": true,
          "internalType": "address",
          "name": "delegator",
          "type": "address"
        },
        {
          "indexed": false,
          "internalType": "address",
          "name": "recipient",
          "type": "address"
        },
        {
          "indexed": false,
          "internalType": "uint256",
          "name": "amount",
          "type": "uint256"
        }
      ],
      "name": "WithdrawFees",
      "type": "event"
    },
    {
      "anonymous": false,
      "inputs": [
        {
          "indexed": true,
          "internalType": "address",
          "name": "delegator",
          "type": "address"
        },
        {
          "indexed": false,
          "internalType": "uint256",
          "name": "unbondingLockId",
          "type": "uint256"
        },
        {
          "indexed": false,
          "internalType": "uint256",
          "name": "amount",
          "type": "uint256"
        },
        {
          "indexed": false,
          "internalType": "uint256",
          "name": "withdrawRound",
          "type": "uint256"
        }
      ],
      "name": "WithdrawStake",
      "type": "event"
    },
    {
      "inputs": [
        {
          "internalType": "uint256",
          "name": "_amount",
          "type": "uint256"
        },
        {
          "internalType": "address",
          "name": "_to",
          "type": "address"
        }
      ],
      "name": "bond",
      "outputs": [],
      "stateMutability": "nonpayable",
      "type": "function"
    },
    {
      "inputs": [
        {
          "internalType": "uint256",
          "name": "_amount",
          "type": "uint256"
        },
        {
          "internalType": "address",
          "name": "_owner",
          "type": "address"
        },
        {
          "internalType": "address",
          "name": "_to",
          "type": "address"
        },
        {
          "internalType": "address",
          "name": "_oldDelegateNewPosPrev",
          "type": "address"
        },
        {
          "internalType": "address",
          "name": "_oldDelegateNewPosNext",
          "type": "address"
        },
        {
          "internalType": "address",
          "name": "_currDelegateNewPosPrev",
          "type": "address"
        },
        {
          "internalType": "address",
          "name": "_currDelegateNewPosNext",
          "type": "address"
        }
      ],
      "name": "bondForWithHint",
      "outputs": [],
      "stateMutability": "nonpayable",
      "type": "function"
    },
    {
      "inputs": [
        {
          "internalType": "uint256",
          "name": "_amount",
          "type": "uint256"
        },
        {
          "internalType": "address",
          "name": "_to",
          "type": "address"
        },
        {
          "internalType": "address",
          "name": "_oldDelegateNewPosPrev",
          "type": "address"
        },
        {
          "internalType": "address",
          "name": "_oldDelegateNewPosNext",
          "type": "address"
        },
        {
          "internalType": "address",
          "name": "_currDelegateNewPosPrev",
          "type": "address"
        },
        {
          "internalType": "address",
          "name": "_currDelegateNewPosNext",
          "type": "address"
        }
      ],
      "name": "bondWithHint",
      "outputs": [],
      "stateMutability": "nonpayable",
      "type": "function"
    },
    {
      "inputs": [
        {
          "internalType": "address",
          "name": "_account",
          "type": "address"
        }
      ],
      "name": "checkpointBondingState",
      "outputs": [],
      "stateMutability": "nonpayable",
      "type": "function"
    },
    {
      "inputs": [
        {
          "internalType": "uint256",
          "name": "_endRound",
          "type": "uint256"
        }
      ],
      "name": "claimEarnings",
      "outputs": [],
      "stateMutability": "nonpayable",
      "type": "function"
    },
    {
      "inputs": [],
      "name": "controller",
      "outputs": [
        {
          "internalType": "contract IController",
          "name": "",
          "type": "address"
        }
      ],
      "stateMutability": "view",
      "type": "function"
    },
    {
      "inputs": [],
      "name": "currentRoundTotalActiveStake",
      "outputs": [
        {
          "internalType": "uint256",
          "name": "",
          "type": "uint256"
        }
      ],
      "stateMutability": "view",
      "type": "function"
    },
    {
      "inputs": [
        {
          "internalType": "address",
          "name": "_delegator",
          "type": "address"
        }
      ],
      "name": "delegatorStatus",
      "outputs": [
        {
          "internalType": "enum BondingManager.DelegatorStatus",
          "name": "",
          "type": "uint8"
        }
      ],
      "stateMutability": "view",
      "type": "function"
    },
    {
      "inputs": [
        {
          "internalType": "address",
          "name": "_delegator",
          "type": "address"
        }
      ],
      "name": "getDelegator",
      "outputs": [
        {
          "internalType": "uint256",
          "name": "bondedAmount",
          "type": "uint256"
        },
        {
          "internalType": "uint256",
          "name": "fees",
          "type": "uint256"
        },
        {
          "internalType": "address",
          "name": "delegateAddress",
          "type": "address"
        },
        {
          "internalType": "uint256",
          "name": "delegatedAmount",
          "type": "uint256"
        },
        {
          "internalType": "uint256",
          "name": "startRound",
          "type": "uint256"
        },
        {
          "internalType": "uint256",
          "name": "lastClaimRound",
          "type": "uint256"
        },
        {
          "internalType": "uint256",
          "name": "nextUnbondingLockId",
          "type": "uint256"
        }
      ],
      "stateMutability": "view",
      "type": "function"
    },
    {
      "inputs": [
        {
          "internalType": "address",
          "name": "_delegator",
          "type": "address"
        },
        {
          "internalType": "uint256",
          "name": "_unbondingLockId",
          "type": "uint256"
        }
      ],
      "name": "getDelegatorUnbondingLock",
      "outputs": [
        {
          "internalType": "uint256",
          "name": "amount",
          "type": "uint256"
        },
        {
          "internalType": "uint256",
          "name": "withdrawRound",
          "type": "uint256"
        }
      ],
      "stateMutability": "view",
      "type": "function"
    },
    {
      "inputs": [],
      "name": "getFirstTranscoderInPool",
      "outputs": [
        {
          "internalType": "address",
          "name": "",
          "type": "address"
        }
      ],
      "stateMutability": "view",
      "type": "function"
    },
    {
      "inputs": [
        {
          "internalType": "address",
          "name": "_transcoder",
          "type": "address"
        }
      ],
      "name": "getNextTranscoderInPool",
      "outputs": [
        {
          "internalType": "address",
          "name": "",
          "type": "address"
        }
      ],
      "stateMutability": "view",
      "type": "function"
    },
    {
      "inputs": [],
      "name": "getTotalBonded",
      "outputs": [
        {
          "internalType": "uint256",
          "name": "",
          "type": "uint256"
        }
      ],
      "stateMutability": "view",
      "type": "function"
    },
    {
      "inputs": [
        {
          "internalType": "address",
          "name": "_transcoder",
          "type": "address"
        }
      ],
      "name": "getTranscoder",
      "outputs": [
        {
          "internalType": "uint256",
          "name": "lastRewardRound",
          "type": "uint256"
        },
        {
          "internalType": "uint256",
          "name": "rewardCut",
          "type": "uint256"
        },
        {
          "internalType": "uint256",
          "name": "feeShare",
          "type": "uint256"
        },
        {
          "internalType": "uint256",
          "name": "lastActiveStakeUpdateRound",
          "type": "uint256"
        },
        {
          "internalType": "uint256",
          "name": "activationRound",
          "type": "uint256"
        },
        {
          "internalType": "uint256",
          "name": "deactivationRound",
          "type": "uint256"
        },
        {
          "internalType": "uint256",
          "name": "activeCumulativeRewards",
          "type": "uint256"
        },
        {
          "internalType": "uint256",
          "name": "cumulativeRewards",
          "type": "uint256"
        },
        {
          "internalType": "uint256",
          "name": "cumulativeFees",
          "type": "uint256"
        },
        {
          "internalType": "uint256",
          "name": "lastFeeRound",
          "type": "uint256"
        }
      ],
      "stateMutability": "view",
      "type": "function"
    },
    {
      "inputs": [
        {
          "internalType": "address",
          "name": "_transcoder",
          "type": "address"
        },
        {
          "internalType": "uint256",
          "name": "_round",
          "type": "uint256"
        }
      ],
      "name": "getTranscoderEarningsPoolForRound",
      "outputs": [
        {
          "internalType": "uint256",
          "name": "totalStake",
          "type": "uint256"
        },
        {
          "internalType": "uint256",
          "name": "transcoderRewardCut",
          "type": "uint256"
        },
        {
          "internalType": "uint256",
          "name": "transcoderFeeShare",
          "type": "uint256"
        },
        {
          "internalType": "uint256",
          "name": "cumulativeRewardFactor",
          "type": "uint256"
        },
        {
          "internalType": "uint256",
          "name": "cumulativeFeeFactor",
          "type": "uint256"
        }
      ],
      "stateMutability": "view",
      "type": "function"
    },
    {
      "inputs": [],
      "name": "getTranscoderPoolMaxSize",
      "outputs": [
        {
          "internalType": "uint256",
          "name": "",
          "type": "uint256"
        }
      ],
      "stateMutability": "view",
      "type": "function"
    },
    {
      "inputs": [],
      "name": "getTranscoderPoolSize",
      "outputs": [
        {
          "internalType": "uint256",
          "name": "",
          "type": "uint256"
        }
      ],
      "stateMutability": "view",
      "type": "function"
    },
    {
      "inputs": [
        {
          "internalType": "address",
          "name": "_transcoder",
          "type": "address"
        }
      ],
      "name": "isActiveTranscoder",
      "outputs": [
        {
          "internalType": "bool",
          "name": "",
          "type": "bool"
        }
      ],
      "stateMutability": "view",
      "type": "function"
    },
    {
      "inputs": [
        {
          "internalType": "address",
          "name": "_transcoder",
          "type": "address"
        }
      ],
      "name": "isRegisteredTranscoder",
      "outputs": [
        {
          "internalType": "bool",
          "name": "",
          "type": "bool"
        }
      ],
      "stateMutability": "view",
      "type": "function"
    },
    {
      "inputs": [
        {
          "internalType": "address",
          "name": "_delegator",
          "type": "address"
        },
        {
          "internalType": "uint256",
          "name": "_unbondingLockId",
          "type": "uint256"
        }
      ],
      "name": "isValidUnbondingLock",
      "outputs": [
        {
          "internalType": "bool",
          "name": "",
          "type": "bool"
        }
      ],
      "stateMutability": "view",
      "type": "function"
    },
    {
      "inputs": [],
      "name": "nextRoundTotalActiveStake",
      "outputs": [
        {
          "internalType": "uint256",
          "name": "",
          "type": "uint256"
        }
      ],
      "stateMutability": "view",
      "type": "function"
    },
    {
      "inputs": [],
      "name": "nextRoundTreasuryRewardCutRate",
      "outputs": [
        {
          "internalType": "uint256",
          "name": "",
          "type": "uint256"
        }
      ],
      "stateMutability": "view",
      "type": "function"
    },
    {
      "inputs": [
        {
          "internalType": "address",
          "name": "_delegator",
          "type": "address"
        },
        {
          "internalType": "uint256",
          "name": "_endRound",
          "type": "uint256"
        }
      ],
      "name": "pendingFees",
      "outputs": [
        {
          "internalType": "uint256",
          "name": "",
          "type": "uint256"
        }
      ],
      "stateMutability": "view",
      "type": "function"
    },
    {
      "inputs": [
        {
          "internalType": "address",
          "name": "_delegator",
          "type": "address"
        },
        {
          "internalType": "uint256",
          "name": "_endRound",
          "type": "uint256"
        }
      ],
      "name": "pendingStake",
      "outputs": [
        {
          "internalType": "uint256",
          "name": "",
          "type": "uint256"
        }
      ],
      "stateMutability": "view",
      "type": "function"
    },
    {
      "inputs": [
        {
          "internalType": "uint256",
          "name": "_unbondingLockId",
          "type": "uint256"
        }
      ],
      "name": "rebond",
      "outputs": [],
      "stateMutability": "nonpayable",
      "type": "function"
    },
    {
      "inputs": [
        {
          "internalType": "address",
          "name": "_to",
          "type": "address"
        },
        {
          "internalType": "uint256",
          "name": "_unbondingLockId",
          "type": "uint256"
        }
      ],
      "name": "rebondFromUnbonded",
      "outputs": [],
      "stateMutability": "nonpayable",
      "type": "function"
    },
    {
      "inputs": [
        {
          "internalType": "address",
          "name": "_to",
          "type": "address"
        },
        {
          "internalType": "uint256",
          "name": "_unbondingLockId",
          "type": "uint256"
        },
        {
          "internalType": "address",
          "name": "_newPosPrev",
          "type": "address"
        },
        {
          "internalType": "address",
          "name": "_newPosNext",
          "type": "address"
        }
      ],
      "name": "rebondFromUnbondedWithHint",
      "outputs": [],
      "stateMutability": "nonpayable",
      "type": "function"
    },
    {
      "inputs": [
        {
          "internalType": "uint256",
          "name": "_unbondingLockId",
          "type": "uint256"
        },
        {
          "internalType": "address",
          "name": "_newPosPrev",
          "type": "address"
        },
        {
          "internalType": "address",
          "name": "_newPosNext",
          "type": "address"
        }
      ],
      "name": "rebondWithHint",
      "outputs": [],
      "stateMutability": "nonpayable",
      "type": "function"
    },
    {
      "inputs": [],
      "name": "reward",
      "outputs": [],
      "stateMutability": "nonpayable",
      "type": "function"
    },
    {
      "inputs": [
        {
          "internalType": "address",
          "name": "_newPosPrev",
          "type": "address"
        },
        {
          "internalType": "address",
          "name": "_newPosNext",
          "type": "address"
        }
      ],
      "name": "rewardWithHint",
      "outputs": [],
      "stateMutability": "nonpayable",
      "type": "function"
    },
    {
      "inputs": [
        {
          "internalType": "address",
          "name": "_controller",
          "type": "address"
        }
      ],
      "name": "setController",
      "outputs": [],
      "stateMutability": "nonpayable",
      "type": "function"
    },
    {
      "inputs": [],
      "name": "setCurrentRoundTotalActiveStake",
      "outputs": [],
      "stateMutability": "nonpayable",
      "type": "function"
    },
    {
      "inputs": [
        {
          "internalType": "uint256",
          "name": "_numActiveTranscoders",
          "type": "uint256"
        }
      ],
      "name": "setNumActiveTranscoders",
      "outputs": [],
      "stateMutability": "nonpayable",
      "type": "function"
    },
    {
      "inputs": [
        {
          "internalType": "uint256",
          "name": "_ceiling",
          "type": "uint256"
        }
      ],
      "name": "setTreasuryBalanceCeiling",
      "outputs": [],
      "stateMutability": "nonpayable",
      "type": "function"
    },
    {
      "inputs": [
        {
          "internalType": "uint256",
          "name": "_cutRate",
          "type": "uint256"
        }
      ],
      "name": "setTreasuryRewardCutRate",
      "outputs": [],
      "stateMutability": "nonpayable",
      "type": "function"
    },
    {
      "inputs": [
        {
          "internalType": "uint64",
          "name": "_unbondingPeriod",
          "type": "uint64"
        }
      ],
      "name": "setUnbondingPeriod",
      "outputs": [],
      "stateMutability": "nonpayable",
      "type": "function"
    },
    {
      "inputs": [
        {
          "internalType": "address",
          "name": "_transcoder",
          "type": "address"
        },
        {
          "internalType": "address",
          "name": "_finder",
          "type": "address"
        },
        {
          "internalType": "uint256",
          "name": "_slashAmount",
          "type": "uint256"
        },
        {
          "internalType": "uint256",
          "name": "_finderFee",
          "type": "uint256"
        }
      ],
      "name": "slashTranscoder",
      "outputs": [],
      "stateMutability": "nonpayable",
      "type": "function"
    },
    {
      "inputs": [],
      "name": "targetContractId",
      "outputs": [
        {
          "internalType": "bytes32",
          "name": "",
          "type": "bytes32"
        }
      ],
      "stateMutability": "view",
      "type": "function"
    },
    {
      "inputs": [
        {
          "internalType": "uint256",
          "name": "_rewardCut",
          "type": "uint256"
        },
        {
          "internalType": "uint256",
          "name": "_feeShare",
          "type": "uint256"
        }
      ],
      "name": "transcoder",
      "outputs": [],
      "stateMutability": "nonpayable",
      "type": "function"
    },
    {
      "inputs": [
        {
          "internalType": "address",
          "name": "_transcoder",
          "type": "address"
        }
      ],
      "name": "transcoderStatus",
      "outputs": [
        {
          "internalType": "enum BondingManager.TranscoderStatus",
          "name": "",
          "type": "uint8"
        }
      ],
      "stateMutability": "view",
      "type": "function"
    },
    {
      "inputs": [
        {
          "internalType": "address",
          "name": "_transcoder",
          "type": "address"
        }
      ],
      "name": "transcoderTotalStake",
      "outputs": [
        {
          "internalType": "uint256",
          "name": "",
          "type": "uint256"
        }
      ],
      "stateMutability": "view",
      "type": "function"
    },
    {
      "inputs": [
        {
          "internalType": "uint256",
          "name": "_rewardCut",
          "type": "uint256"
        },
        {
          "internalType": "uint256",
          "name": "_feeShare",
          "type": "uint256"
        },
        {
          "internalType": "address",
          "name": "_newPosPrev",
          "type": "address"
        },
        {
          "internalType": "address",
          "name": "_newPosNext",
          "type": "address"
        }
      ],
      "name": "transcoderWithHint",
      "outputs": [],
      "stateMutability": "nonpayable",
      "type": "function"
    },
    {
      "inputs": [
        {
          "internalType": "address",
          "name": "_delegator",
          "type": "address"
        },
        {
          "internalType": "uint256",
          "name": "_amount",
          "type": "uint256"
        },
        {
          "internalType": "address",
          "name": "_oldDelegateNewPosPrev",
          "type": "address"
        },
        {
          "internalType": "address",
          "name": "_oldDelegateNewPosNext",
          "type": "address"
        },
        {
          "internalType": "address",
          "name": "_newDelegateNewPosPrev",
          "type": "address"
        },
        {
          "internalType": "address",
          "name": "_newDelegateNewPosNext",
          "type": "address"
        }
      ],
      "name": "transferBond",
      "outputs": [],
      "stateMutability": "nonpayable",
      "type": "function"
    },
    {
      "inputs": [],
      "name": "treasuryBalanceCeiling",
      "outputs": [
        {
          "internalType": "uint256",
          "name": "",
          "type": "uint256"
        }
      ],
      "stateMutability": "view",
      "type": "function"
    },
    {
      "inputs": [],
      "name": "treasuryRewardCutRate",
      "outputs": [
        {
          "internalType": "uint256",
          "name": "",
          "type": "uint256"
        }
      ],
      "stateMutability": "view",
      "type": "function"
    },
    {
      "inputs": [
        {
          "internalType": "uint256",
          "name": "_amount",
          "type": "uint256"
        }
      ],
      "name": "unbond",
      "outputs": [],
      "stateMutability": "nonpayable",
      "type": "function"
    },
    {
      "inputs": [
        {
          "internalType": "uint256",
          "name": "_amount",
          "type": "uint256"
        },
        {
          "internalType": "address",
          "name": "_newPosPrev",
          "type": "address"
        },
        {
          "internalType": "address",
          "name": "_newPosNext",
          "type": "address"
        }
      ],
      "name": "unbondWithHint",
      "outputs": [],
      "stateMutability": "nonpayable",
      "type": "function"
    },
    {
      "inputs": [],
      "name": "unbondingPeriod",
      "outputs": [
        {
          "internalType": "uint64",
          "name": "",
          "type": "uint64"
        }
      ],
      "stateMutability": "view",
      "type": "function"
    },
    {
      "inputs": [
        {
          "internalType": "address",
          "name": "_transcoder",
          "type": "address"
        },
        {
          "internalType": "uint256",
          "name": "_fees",
          "type": "uint256"
        },
        {
          "internalType": "uint256",
          "name": "_round",
          "type": "uint256"
        }
      ],
      "name": "updateTranscoderWithFees",
      "outputs": [],
      "stateMutability": "nonpayable",
      "type": "function"
    },
    {
      "inputs": [
        {
          "internalType": "address payable",
          "name": "_recipient",
          "type": "address"
        },
        {
          "internalType": "uint256",
          "name": "_amount",
          "type": "uint256"
        }
      ],
      "name": "withdrawFees",
      "outputs": [],
      "stateMutability": "nonpayable",
      "type": "function"
    },
    {
      "inputs": [
        {
          "internalType": "uint256",
          "name": "_unbondingLockId",
          "type": "uint256"
        }
      ],
      "name": "withdrawStake",
      "outputs": [],
      "stateMutability": "nonpayable",
      "type": "function"
    }
  ],
  "transactionHash": "0x3dbb1ae70252ca0af6a5b5d3c9a4fc5bf2d06a8ab68533f8ad74c68a77472146",
  "receipt": {
    "to": null,
    "from": "0xa7BeA8108b77905113c0b22c16806672c38d040b",
    "contractAddress": "0xDC9Ced376b52990ac0c66dcc25785513E8c626b4",
    "transactionIndex": 1,
    "gasUsed": "4565817",
    "logsBloom": "0x00000000000000000000000000000000000000000000000000000000000000000000000000000000000000000000000000000000000000000000000000000000000000000000000000000000000000000000000000000000000000000000000000000000000000000000000000000000000000000000000000000000000000000000000000000000000000000000000000000000000000000000000000000000000000000000000000000000000000000000000000000000000000000000000000000000000000000000000000000000000000000000000000000000000000000000000000000000000000000000000000000000000000000000000000000000",
    "blockHash": "0x1177236f0b98bfaea425ceea0e1574f1530f34efddb5e79209144a6d6d029451",
    "transactionHash": "0x3dbb1ae70252ca0af6a5b5d3c9a4fc5bf2d06a8ab68533f8ad74c68a77472146",
    "logs": [],
    "blockNumber": 35154209,
    "cumulativeGasUsed": "4565817",
    "status": 1,
    "byzantium": true
  },
  "args": [
    "0x53Ea65f3E8B06d07DC1008276c5e4aa15126502B"
  ],
  "numDeployments": 1,
  "solcInputHash": "8d767bf23267fd0b4e34029f9fbd8e3a",
  "metadata": "{\"compiler\":{\"version\":\"0.8.9+commit.e5eed63a\"},\"language\":\"Solidity\",\"output\":{\"abi\":[{\"inputs\":[{\"internalType\":\"address\",\"name\":\"_controller\",\"type\":\"address\"}],\"stateMutability\":\"nonpayable\",\"type\":\"constructor\"},{\"anonymous\":false,\"inputs\":[{\"indexed\":true,\"internalType\":\"address\",\"name\":\"newDelegate\",\"type\":\"address\"},{\"indexed\":true,\"internalType\":\"address\",\"name\":\"oldDelegate\",\"type\":\"address\"},{\"indexed\":true,\"internalType\":\"address\",\"name\":\"delegator\",\"type\":\"address\"},{\"indexed\":false,\"internalType\":\"uint256\",\"name\":\"additionalAmount\",\"type\":\"uint256\"},{\"indexed\":false,\"internalType\":\"uint256\",\"name\":\"bondedAmount\",\"type\":\"uint256\"}],\"name\":\"Bond\",\"type\":\"event\"},{\"anonymous\":false,\"inputs\":[{\"indexed\":true,\"internalType\":\"address\",\"name\":\"delegate\",\"type\":\"address\"},{\"indexed\":true,\"internalType\":\"address\",\"name\":\"delegator\",\"type\":\"address\"},{\"indexed\":false,\"internalType\":\"uint256\",\"name\":\"rewards\",\"type\":\"uint256\"},{\"indexed\":false,\"internalType\":\"uint256\",\"name\":\"fees\",\"type\":\"uint256\"},{\"indexed\":false,\"internalType\":\"uint256\",\"name\":\"startRound\",\"type\":\"uint256\"},{\"indexed\":false,\"internalType\":\"uint256\",\"name\":\"endRound\",\"type\":\"uint256\"}],\"name\":\"EarningsClaimed\",\"type\":\"event\"},{\"anonymous\":false,\"inputs\":[{\"indexed\":false,\"internalType\":\"string\",\"name\":\"param\",\"type\":\"string\"}],\"name\":\"ParameterUpdate\",\"type\":\"event\"},{\"anonymous\":false,\"inputs\":[{\"indexed\":true,\"internalType\":\"address\",\"name\":\"delegate\",\"type\":\"address\"},{\"indexed\":true,\"internalType\":\"address\",\"name\":\"delegator\",\"type\":\"address\"},{\"indexed\":false,\"internalType\":\"uint256\",\"name\":\"unbondingLockId\",\"type\":\"uint256\"},{\"indexed\":false,\"internalType\":\"uint256\",\"name\":\"amount\",\"type\":\"uint256\"}],\"name\":\"Rebond\",\"type\":\"event\"},{\"anonymous\":false,\"inputs\":[{\"indexed\":true,\"internalType\":\"address\",\"name\":\"transcoder\",\"type\":\"address\"},{\"indexed\":false,\"internalType\":\"uint256\",\"name\":\"amount\",\"type\":\"uint256\"}],\"name\":\"Reward\",\"type\":\"event\"},{\"anonymous\":false,\"inputs\":[{\"indexed\":false,\"internalType\":\"address\",\"name\":\"controller\",\"type\":\"address\"}],\"name\":\"SetController\",\"type\":\"event\"},{\"anonymous\":false,\"inputs\":[{\"indexed\":true,\"internalType\":\"address\",\"name\":\"transcoder\",\"type\":\"address\"},{\"indexed\":false,\"internalType\":\"uint256\",\"name\":\"activationRound\",\"type\":\"uint256\"}],\"name\":\"TranscoderActivated\",\"type\":\"event\"},{\"anonymous\":false,\"inputs\":[{\"indexed\":true,\"internalType\":\"address\",\"name\":\"transcoder\",\"type\":\"address\"},{\"indexed\":false,\"internalType\":\"uint256\",\"name\":\"deactivationRound\",\"type\":\"uint256\"}],\"name\":\"TranscoderDeactivated\",\"type\":\"event\"},{\"anonymous\":false,\"inputs\":[{\"indexed\":true,\"internalType\":\"address\",\"name\":\"transcoder\",\"type\":\"address\"},{\"indexed\":false,\"internalType\":\"address\",\"name\":\"finder\",\"type\":\"address\"},{\"indexed\":false,\"internalType\":\"uint256\",\"name\":\"penalty\",\"type\":\"uint256\"},{\"indexed\":false,\"internalType\":\"uint256\",\"name\":\"finderReward\",\"type\":\"uint256\"}],\"name\":\"TranscoderSlashed\",\"type\":\"event\"},{\"anonymous\":false,\"inputs\":[{\"indexed\":true,\"internalType\":\"address\",\"name\":\"transcoder\",\"type\":\"address\"},{\"indexed\":false,\"internalType\":\"uint256\",\"name\":\"rewardCut\",\"type\":\"uint256\"},{\"indexed\":false,\"internalType\":\"uint256\",\"name\":\"feeShare\",\"type\":\"uint256\"}],\"name\":\"TranscoderUpdate\",\"type\":\"event\"},{\"anonymous\":false,\"inputs\":[{\"indexed\":true,\"internalType\":\"address\",\"name\":\"oldDelegator\",\"type\":\"address\"},{\"indexed\":true,\"internalType\":\"address\",\"name\":\"newDelegator\",\"type\":\"address\"},{\"indexed\":false,\"internalType\":\"uint256\",\"name\":\"oldUnbondingLockId\",\"type\":\"uint256\"},{\"indexed\":false,\"internalType\":\"uint256\",\"name\":\"newUnbondingLockId\",\"type\":\"uint256\"},{\"indexed\":false,\"internalType\":\"uint256\",\"name\":\"amount\",\"type\":\"uint256\"}],\"name\":\"TransferBond\",\"type\":\"event\"},{\"anonymous\":false,\"inputs\":[{\"indexed\":true,\"internalType\":\"address\",\"name\":\"transcoder\",\"type\":\"address\"},{\"indexed\":false,\"internalType\":\"address\",\"name\":\"treasury\",\"type\":\"address\"},{\"indexed\":false,\"internalType\":\"uint256\",\"name\":\"amount\",\"type\":\"uint256\"}],\"name\":\"TreasuryReward\",\"type\":\"event\"},{\"anonymous\":false,\"inputs\":[{\"indexed\":true,\"internalType\":\"address\",\"name\":\"delegate\",\"type\":\"address\"},{\"indexed\":true,\"internalType\":\"address\",\"name\":\"delegator\",\"type\":\"address\"},{\"indexed\":false,\"internalType\":\"uint256\",\"name\":\"unbondingLockId\",\"type\":\"uint256\"},{\"indexed\":false,\"internalType\":\"uint256\",\"name\":\"amount\",\"type\":\"uint256\"},{\"indexed\":false,\"internalType\":\"uint256\",\"name\":\"withdrawRound\",\"type\":\"uint256\"}],\"name\":\"Unbond\",\"type\":\"event\"},{\"anonymous\":false,\"inputs\":[{\"indexed\":true,\"internalType\":\"address\",\"name\":\"delegator\",\"type\":\"address\"},{\"indexed\":false,\"internalType\":\"address\",\"name\":\"recipient\",\"type\":\"address\"},{\"indexed\":false,\"internalType\":\"uint256\",\"name\":\"amount\",\"type\":\"uint256\"}],\"name\":\"WithdrawFees\",\"type\":\"event\"},{\"anonymous\":false,\"inputs\":[{\"indexed\":true,\"internalType\":\"address\",\"name\":\"delegator\",\"type\":\"address\"},{\"indexed\":false,\"internalType\":\"uint256\",\"name\":\"unbondingLockId\",\"type\":\"uint256\"},{\"indexed\":false,\"internalType\":\"uint256\",\"name\":\"amount\",\"type\":\"uint256\"},{\"indexed\":false,\"internalType\":\"uint256\",\"name\":\"withdrawRound\",\"type\":\"uint256\"}],\"name\":\"WithdrawStake\",\"type\":\"event\"},{\"inputs\":[{\"internalType\":\"uint256\",\"name\":\"_amount\",\"type\":\"uint256\"},{\"internalType\":\"address\",\"name\":\"_to\",\"type\":\"address\"}],\"name\":\"bond\",\"outputs\":[],\"stateMutability\":\"nonpayable\",\"type\":\"function\"},{\"inputs\":[{\"internalType\":\"uint256\",\"name\":\"_amount\",\"type\":\"uint256\"},{\"internalType\":\"address\",\"name\":\"_owner\",\"type\":\"address\"},{\"internalType\":\"address\",\"name\":\"_to\",\"type\":\"address\"},{\"internalType\":\"address\",\"name\":\"_oldDelegateNewPosPrev\",\"type\":\"address\"},{\"internalType\":\"address\",\"name\":\"_oldDelegateNewPosNext\",\"type\":\"address\"},{\"internalType\":\"address\",\"name\":\"_currDelegateNewPosPrev\",\"type\":\"address\"},{\"internalType\":\"address\",\"name\":\"_currDelegateNewPosNext\",\"type\":\"address\"}],\"name\":\"bondForWithHint\",\"outputs\":[],\"stateMutability\":\"nonpayable\",\"type\":\"function\"},{\"inputs\":[{\"internalType\":\"uint256\",\"name\":\"_amount\",\"type\":\"uint256\"},{\"internalType\":\"address\",\"name\":\"_to\",\"type\":\"address\"},{\"internalType\":\"address\",\"name\":\"_oldDelegateNewPosPrev\",\"type\":\"address\"},{\"internalType\":\"address\",\"name\":\"_oldDelegateNewPosNext\",\"type\":\"address\"},{\"internalType\":\"address\",\"name\":\"_currDelegateNewPosPrev\",\"type\":\"address\"},{\"internalType\":\"address\",\"name\":\"_currDelegateNewPosNext\",\"type\":\"address\"}],\"name\":\"bondWithHint\",\"outputs\":[],\"stateMutability\":\"nonpayable\",\"type\":\"function\"},{\"inputs\":[{\"internalType\":\"address\",\"name\":\"_account\",\"type\":\"address\"}],\"name\":\"checkpointBondingState\",\"outputs\":[],\"stateMutability\":\"nonpayable\",\"type\":\"function\"},{\"inputs\":[{\"internalType\":\"uint256\",\"name\":\"_endRound\",\"type\":\"uint256\"}],\"name\":\"claimEarnings\",\"outputs\":[],\"stateMutability\":\"nonpayable\",\"type\":\"function\"},{\"inputs\":[],\"name\":\"controller\",\"outputs\":[{\"internalType\":\"contract IController\",\"name\":\"\",\"type\":\"address\"}],\"stateMutability\":\"view\",\"type\":\"function\"},{\"inputs\":[],\"name\":\"currentRoundTotalActiveStake\",\"outputs\":[{\"internalType\":\"uint256\",\"name\":\"\",\"type\":\"uint256\"}],\"stateMutability\":\"view\",\"type\":\"function\"},{\"inputs\":[{\"internalType\":\"address\",\"name\":\"_delegator\",\"type\":\"address\"}],\"name\":\"delegatorStatus\",\"outputs\":[{\"internalType\":\"enum BondingManager.DelegatorStatus\",\"name\":\"\",\"type\":\"uint8\"}],\"stateMutability\":\"view\",\"type\":\"function\"},{\"inputs\":[{\"internalType\":\"address\",\"name\":\"_delegator\",\"type\":\"address\"}],\"name\":\"getDelegator\",\"outputs\":[{\"internalType\":\"uint256\",\"name\":\"bondedAmount\",\"type\":\"uint256\"},{\"internalType\":\"uint256\",\"name\":\"fees\",\"type\":\"uint256\"},{\"internalType\":\"address\",\"name\":\"delegateAddress\",\"type\":\"address\"},{\"internalType\":\"uint256\",\"name\":\"delegatedAmount\",\"type\":\"uint256\"},{\"internalType\":\"uint256\",\"name\":\"startRound\",\"type\":\"uint256\"},{\"internalType\":\"uint256\",\"name\":\"lastClaimRound\",\"type\":\"uint256\"},{\"internalType\":\"uint256\",\"name\":\"nextUnbondingLockId\",\"type\":\"uint256\"}],\"stateMutability\":\"view\",\"type\":\"function\"},{\"inputs\":[{\"internalType\":\"address\",\"name\":\"_delegator\",\"type\":\"address\"},{\"internalType\":\"uint256\",\"name\":\"_unbondingLockId\",\"type\":\"uint256\"}],\"name\":\"getDelegatorUnbondingLock\",\"outputs\":[{\"internalType\":\"uint256\",\"name\":\"amount\",\"type\":\"uint256\"},{\"internalType\":\"uint256\",\"name\":\"withdrawRound\",\"type\":\"uint256\"}],\"stateMutability\":\"view\",\"type\":\"function\"},{\"inputs\":[],\"name\":\"getFirstTranscoderInPool\",\"outputs\":[{\"internalType\":\"address\",\"name\":\"\",\"type\":\"address\"}],\"stateMutability\":\"view\",\"type\":\"function\"},{\"inputs\":[{\"internalType\":\"address\",\"name\":\"_transcoder\",\"type\":\"address\"}],\"name\":\"getNextTranscoderInPool\",\"outputs\":[{\"internalType\":\"address\",\"name\":\"\",\"type\":\"address\"}],\"stateMutability\":\"view\",\"type\":\"function\"},{\"inputs\":[],\"name\":\"getTotalBonded\",\"outputs\":[{\"internalType\":\"uint256\",\"name\":\"\",\"type\":\"uint256\"}],\"stateMutability\":\"view\",\"type\":\"function\"},{\"inputs\":[{\"internalType\":\"address\",\"name\":\"_transcoder\",\"type\":\"address\"}],\"name\":\"getTranscoder\",\"outputs\":[{\"internalType\":\"uint256\",\"name\":\"lastRewardRound\",\"type\":\"uint256\"},{\"internalType\":\"uint256\",\"name\":\"rewardCut\",\"type\":\"uint256\"},{\"internalType\":\"uint256\",\"name\":\"feeShare\",\"type\":\"uint256\"},{\"internalType\":\"uint256\",\"name\":\"lastActiveStakeUpdateRound\",\"type\":\"uint256\"},{\"internalType\":\"uint256\",\"name\":\"activationRound\",\"type\":\"uint256\"},{\"internalType\":\"uint256\",\"name\":\"deactivationRound\",\"type\":\"uint256\"},{\"internalType\":\"uint256\",\"name\":\"activeCumulativeRewards\",\"type\":\"uint256\"},{\"internalType\":\"uint256\",\"name\":\"cumulativeRewards\",\"type\":\"uint256\"},{\"internalType\":\"uint256\",\"name\":\"cumulativeFees\",\"type\":\"uint256\"},{\"internalType\":\"uint256\",\"name\":\"lastFeeRound\",\"type\":\"uint256\"}],\"stateMutability\":\"view\",\"type\":\"function\"},{\"inputs\":[{\"internalType\":\"address\",\"name\":\"_transcoder\",\"type\":\"address\"},{\"internalType\":\"uint256\",\"name\":\"_round\",\"type\":\"uint256\"}],\"name\":\"getTranscoderEarningsPoolForRound\",\"outputs\":[{\"internalType\":\"uint256\",\"name\":\"totalStake\",\"type\":\"uint256\"},{\"internalType\":\"uint256\",\"name\":\"transcoderRewardCut\",\"type\":\"uint256\"},{\"internalType\":\"uint256\",\"name\":\"transcoderFeeShare\",\"type\":\"uint256\"},{\"internalType\":\"uint256\",\"name\":\"cumulativeRewardFactor\",\"type\":\"uint256\"},{\"internalType\":\"uint256\",\"name\":\"cumulativeFeeFactor\",\"type\":\"uint256\"}],\"stateMutability\":\"view\",\"type\":\"function\"},{\"inputs\":[],\"name\":\"getTranscoderPoolMaxSize\",\"outputs\":[{\"internalType\":\"uint256\",\"name\":\"\",\"type\":\"uint256\"}],\"stateMutability\":\"view\",\"type\":\"function\"},{\"inputs\":[],\"name\":\"getTranscoderPoolSize\",\"outputs\":[{\"internalType\":\"uint256\",\"name\":\"\",\"type\":\"uint256\"}],\"stateMutability\":\"view\",\"type\":\"function\"},{\"inputs\":[{\"internalType\":\"address\",\"name\":\"_transcoder\",\"type\":\"address\"}],\"name\":\"isActiveTranscoder\",\"outputs\":[{\"internalType\":\"bool\",\"name\":\"\",\"type\":\"bool\"}],\"stateMutability\":\"view\",\"type\":\"function\"},{\"inputs\":[{\"internalType\":\"address\",\"name\":\"_transcoder\",\"type\":\"address\"}],\"name\":\"isRegisteredTranscoder\",\"outputs\":[{\"internalType\":\"bool\",\"name\":\"\",\"type\":\"bool\"}],\"stateMutability\":\"view\",\"type\":\"function\"},{\"inputs\":[{\"internalType\":\"address\",\"name\":\"_delegator\",\"type\":\"address\"},{\"internalType\":\"uint256\",\"name\":\"_unbondingLockId\",\"type\":\"uint256\"}],\"name\":\"isValidUnbondingLock\",\"outputs\":[{\"internalType\":\"bool\",\"name\":\"\",\"type\":\"bool\"}],\"stateMutability\":\"view\",\"type\":\"function\"},{\"inputs\":[],\"name\":\"nextRoundTotalActiveStake\",\"outputs\":[{\"internalType\":\"uint256\",\"name\":\"\",\"type\":\"uint256\"}],\"stateMutability\":\"view\",\"type\":\"function\"},{\"inputs\":[],\"name\":\"nextRoundTreasuryRewardCutRate\",\"outputs\":[{\"internalType\":\"uint256\",\"name\":\"\",\"type\":\"uint256\"}],\"stateMutability\":\"view\",\"type\":\"function\"},{\"inputs\":[{\"internalType\":\"address\",\"name\":\"_delegator\",\"type\":\"address\"},{\"internalType\":\"uint256\",\"name\":\"_endRound\",\"type\":\"uint256\"}],\"name\":\"pendingFees\",\"outputs\":[{\"internalType\":\"uint256\",\"name\":\"\",\"type\":\"uint256\"}],\"stateMutability\":\"view\",\"type\":\"function\"},{\"inputs\":[{\"internalType\":\"address\",\"name\":\"_delegator\",\"type\":\"address\"},{\"internalType\":\"uint256\",\"name\":\"_endRound\",\"type\":\"uint256\"}],\"name\":\"pendingStake\",\"outputs\":[{\"internalType\":\"uint256\",\"name\":\"\",\"type\":\"uint256\"}],\"stateMutability\":\"view\",\"type\":\"function\"},{\"inputs\":[{\"internalType\":\"uint256\",\"name\":\"_unbondingLockId\",\"type\":\"uint256\"}],\"name\":\"rebond\",\"outputs\":[],\"stateMutability\":\"nonpayable\",\"type\":\"function\"},{\"inputs\":[{\"internalType\":\"address\",\"name\":\"_to\",\"type\":\"address\"},{\"internalType\":\"uint256\",\"name\":\"_unbondingLockId\",\"type\":\"uint256\"}],\"name\":\"rebondFromUnbonded\",\"outputs\":[],\"stateMutability\":\"nonpayable\",\"type\":\"function\"},{\"inputs\":[{\"internalType\":\"address\",\"name\":\"_to\",\"type\":\"address\"},{\"internalType\":\"uint256\",\"name\":\"_unbondingLockId\",\"type\":\"uint256\"},{\"internalType\":\"address\",\"name\":\"_newPosPrev\",\"type\":\"address\"},{\"internalType\":\"address\",\"name\":\"_newPosNext\",\"type\":\"address\"}],\"name\":\"rebondFromUnbondedWithHint\",\"outputs\":[],\"stateMutability\":\"nonpayable\",\"type\":\"function\"},{\"inputs\":[{\"internalType\":\"uint256\",\"name\":\"_unbondingLockId\",\"type\":\"uint256\"},{\"internalType\":\"address\",\"name\":\"_newPosPrev\",\"type\":\"address\"},{\"internalType\":\"address\",\"name\":\"_newPosNext\",\"type\":\"address\"}],\"name\":\"rebondWithHint\",\"outputs\":[],\"stateMutability\":\"nonpayable\",\"type\":\"function\"},{\"inputs\":[],\"name\":\"reward\",\"outputs\":[],\"stateMutability\":\"nonpayable\",\"type\":\"function\"},{\"inputs\":[{\"internalType\":\"address\",\"name\":\"_newPosPrev\",\"type\":\"address\"},{\"internalType\":\"address\",\"name\":\"_newPosNext\",\"type\":\"address\"}],\"name\":\"rewardWithHint\",\"outputs\":[],\"stateMutability\":\"nonpayable\",\"type\":\"function\"},{\"inputs\":[{\"internalType\":\"address\",\"name\":\"_controller\",\"type\":\"address\"}],\"name\":\"setController\",\"outputs\":[],\"stateMutability\":\"nonpayable\",\"type\":\"function\"},{\"inputs\":[],\"name\":\"setCurrentRoundTotalActiveStake\",\"outputs\":[],\"stateMutability\":\"nonpayable\",\"type\":\"function\"},{\"inputs\":[{\"internalType\":\"uint256\",\"name\":\"_numActiveTranscoders\",\"type\":\"uint256\"}],\"name\":\"setNumActiveTranscoders\",\"outputs\":[],\"stateMutability\":\"nonpayable\",\"type\":\"function\"},{\"inputs\":[{\"internalType\":\"uint256\",\"name\":\"_ceiling\",\"type\":\"uint256\"}],\"name\":\"setTreasuryBalanceCeiling\",\"outputs\":[],\"stateMutability\":\"nonpayable\",\"type\":\"function\"},{\"inputs\":[{\"internalType\":\"uint256\",\"name\":\"_cutRate\",\"type\":\"uint256\"}],\"name\":\"setTreasuryRewardCutRate\",\"outputs\":[],\"stateMutability\":\"nonpayable\",\"type\":\"function\"},{\"inputs\":[{\"internalType\":\"uint64\",\"name\":\"_unbondingPeriod\",\"type\":\"uint64\"}],\"name\":\"setUnbondingPeriod\",\"outputs\":[],\"stateMutability\":\"nonpayable\",\"type\":\"function\"},{\"inputs\":[{\"internalType\":\"address\",\"name\":\"_transcoder\",\"type\":\"address\"},{\"internalType\":\"address\",\"name\":\"_finder\",\"type\":\"address\"},{\"internalType\":\"uint256\",\"name\":\"_slashAmount\",\"type\":\"uint256\"},{\"internalType\":\"uint256\",\"name\":\"_finderFee\",\"type\":\"uint256\"}],\"name\":\"slashTranscoder\",\"outputs\":[],\"stateMutability\":\"nonpayable\",\"type\":\"function\"},{\"inputs\":[],\"name\":\"targetContractId\",\"outputs\":[{\"internalType\":\"bytes32\",\"name\":\"\",\"type\":\"bytes32\"}],\"stateMutability\":\"view\",\"type\":\"function\"},{\"inputs\":[{\"internalType\":\"uint256\",\"name\":\"_rewardCut\",\"type\":\"uint256\"},{\"internalType\":\"uint256\",\"name\":\"_feeShare\",\"type\":\"uint256\"}],\"name\":\"transcoder\",\"outputs\":[],\"stateMutability\":\"nonpayable\",\"type\":\"function\"},{\"inputs\":[{\"internalType\":\"address\",\"name\":\"_transcoder\",\"type\":\"address\"}],\"name\":\"transcoderStatus\",\"outputs\":[{\"internalType\":\"enum BondingManager.TranscoderStatus\",\"name\":\"\",\"type\":\"uint8\"}],\"stateMutability\":\"view\",\"type\":\"function\"},{\"inputs\":[{\"internalType\":\"address\",\"name\":\"_transcoder\",\"type\":\"address\"}],\"name\":\"transcoderTotalStake\",\"outputs\":[{\"internalType\":\"uint256\",\"name\":\"\",\"type\":\"uint256\"}],\"stateMutability\":\"view\",\"type\":\"function\"},{\"inputs\":[{\"internalType\":\"uint256\",\"name\":\"_rewardCut\",\"type\":\"uint256\"},{\"internalType\":\"uint256\",\"name\":\"_feeShare\",\"type\":\"uint256\"},{\"internalType\":\"address\",\"name\":\"_newPosPrev\",\"type\":\"address\"},{\"internalType\":\"address\",\"name\":\"_newPosNext\",\"type\":\"address\"}],\"name\":\"transcoderWithHint\",\"outputs\":[],\"stateMutability\":\"nonpayable\",\"type\":\"function\"},{\"inputs\":[{\"internalType\":\"address\",\"name\":\"_delegator\",\"type\":\"address\"},{\"internalType\":\"uint256\",\"name\":\"_amount\",\"type\":\"uint256\"},{\"internalType\":\"address\",\"name\":\"_oldDelegateNewPosPrev\",\"type\":\"address\"},{\"internalType\":\"address\",\"name\":\"_oldDelegateNewPosNext\",\"type\":\"address\"},{\"internalType\":\"address\",\"name\":\"_newDelegateNewPosPrev\",\"type\":\"address\"},{\"internalType\":\"address\",\"name\":\"_newDelegateNewPosNext\",\"type\":\"address\"}],\"name\":\"transferBond\",\"outputs\":[],\"stateMutability\":\"nonpayable\",\"type\":\"function\"},{\"inputs\":[],\"name\":\"treasuryBalanceCeiling\",\"outputs\":[{\"internalType\":\"uint256\",\"name\":\"\",\"type\":\"uint256\"}],\"stateMutability\":\"view\",\"type\":\"function\"},{\"inputs\":[],\"name\":\"treasuryRewardCutRate\",\"outputs\":[{\"internalType\":\"uint256\",\"name\":\"\",\"type\":\"uint256\"}],\"stateMutability\":\"view\",\"type\":\"function\"},{\"inputs\":[{\"internalType\":\"uint256\",\"name\":\"_amount\",\"type\":\"uint256\"}],\"name\":\"unbond\",\"outputs\":[],\"stateMutability\":\"nonpayable\",\"type\":\"function\"},{\"inputs\":[{\"internalType\":\"uint256\",\"name\":\"_amount\",\"type\":\"uint256\"},{\"internalType\":\"address\",\"name\":\"_newPosPrev\",\"type\":\"address\"},{\"internalType\":\"address\",\"name\":\"_newPosNext\",\"type\":\"address\"}],\"name\":\"unbondWithHint\",\"outputs\":[],\"stateMutability\":\"nonpayable\",\"type\":\"function\"},{\"inputs\":[],\"name\":\"unbondingPeriod\",\"outputs\":[{\"internalType\":\"uint64\",\"name\":\"\",\"type\":\"uint64\"}],\"stateMutability\":\"view\",\"type\":\"function\"},{\"inputs\":[{\"internalType\":\"address\",\"name\":\"_transcoder\",\"type\":\"address\"},{\"internalType\":\"uint256\",\"name\":\"_fees\",\"type\":\"uint256\"},{\"internalType\":\"uint256\",\"name\":\"_round\",\"type\":\"uint256\"}],\"name\":\"updateTranscoderWithFees\",\"outputs\":[],\"stateMutability\":\"nonpayable\",\"type\":\"function\"},{\"inputs\":[{\"internalType\":\"address payable\",\"name\":\"_recipient\",\"type\":\"address\"},{\"internalType\":\"uint256\",\"name\":\"_amount\",\"type\":\"uint256\"}],\"name\":\"withdrawFees\",\"outputs\":[],\"stateMutability\":\"nonpayable\",\"type\":\"function\"},{\"inputs\":[{\"internalType\":\"uint256\",\"name\":\"_unbondingLockId\",\"type\":\"uint256\"}],\"name\":\"withdrawStake\",\"outputs\":[],\"stateMutability\":\"nonpayable\",\"type\":\"function\"}],\"devdoc\":{\"kind\":\"dev\",\"methods\":{\"bond(uint256,address)\":{\"params\":{\"_amount\":\"The amount of tokens to stake\",\"_to\":\"The address of the transcoder to stake towards\"}},\"bondForWithHint(uint256,address,address,address,address,address,address)\":{\"details\":\"If the caller is decreasing the stake of its old delegate in the transcoder pool, the caller can provide an optional hint for the insertion position of the old delegate via the `_oldDelegateNewPosPrev` and `_oldDelegateNewPosNext` params. If the caller is delegating to a delegate that is in the transcoder pool, the caller can provide an optional hint for the insertion position of the delegate via the `_currDelegateNewPosPrev` and `_currDelegateNewPosNext` params. In both cases, a linear search will be executed starting at the hint to find the correct position. In the best case, the hint is the correct position so no search is executed. See SortedDoublyLL.sol for details on list hints\",\"params\":{\"_amount\":\"The amount of tokens to stake.\",\"_currDelegateNewPosNext\":\"The address of the next transcoder in the pool for the current delegate\",\"_currDelegateNewPosPrev\":\"The address of the previous transcoder in the pool for the current delegate\",\"_oldDelegateNewPosNext\":\"The address of the next transcoder in the pool for the old delegate\",\"_oldDelegateNewPosPrev\":\"The address of the previous transcoder in the pool for the old delegate\",\"_owner\":\"The address of the owner of the bond\",\"_to\":\"The address of the transcoder to stake towards\"}},\"bondWithHint(uint256,address,address,address,address,address)\":{\"details\":\"If the caller is decreasing the stake of its old delegate in the transcoder pool, the caller can provide an optional hint for the insertion position of the old delegate via the `_oldDelegateNewPosPrev` and `_oldDelegateNewPosNext` params. If the caller is delegating to a delegate that is in the transcoder pool, the caller can provide an optional hint for the insertion position of the delegate via the `_currDelegateNewPosPrev` and `_currDelegateNewPosNext` params. In both cases, a linear search will be executed starting at the hint to find the correct position. In the best case, the hint is the correct position so no search is executed. See SortedDoublyLL.sol for details on list hints\",\"params\":{\"_amount\":\"The amount of tokens to stake.\",\"_currDelegateNewPosNext\":\"The address of the next transcoder in the pool for the current delegate\",\"_currDelegateNewPosPrev\":\"The address of the previous transcoder in the pool for the current delegate\",\"_oldDelegateNewPosNext\":\"The address of the next transcoder in the pool for the old delegate\",\"_oldDelegateNewPosPrev\":\"The address of the previous transcoder in the pool for the old delegate\",\"_to\":\"The address of the transcoder to stake towards\"}},\"checkpointBondingState(address)\":{\"details\":\"This is to allow checkpointing an account that has an inconsistent checkpoint with its current state. Implemented as a deploy utility to checkpoint the existing state when deploying the BondingVotes contract.\",\"params\":{\"_account\":\"The account to initialize the bonding checkpoint for\"}},\"claimEarnings(uint256)\":{\"params\":{\"_endRound\":\"The last round for which to claim token pools shares for a delegator\"}},\"constructor\":{\"details\":\"This constructor will not initialize any state variables besides `controller`. The following setter functions should be used to initialize state variables post-deployment: - setUnbondingPeriod() - setNumActiveTranscoders() - setMaxEarningsClaimsRounds()\",\"params\":{\"_controller\":\"Address of Controller that this contract will be registered with\"}},\"delegatorStatus(address)\":{\"params\":{\"_delegator\":\"Address of delegator\"},\"returns\":{\"_0\":\"bonded, unbonded or pending delegator status\"}},\"getDelegator(address)\":{\"params\":{\"_delegator\":\"Address of delegator\"},\"returns\":{\"bondedAmount\":\"total amount bonded by '_delegator'\",\"delegateAddress\":\"address '_delegator' has bonded to\",\"delegatedAmount\":\"total amount delegated to '_delegator'\",\"fees\":\"amount of fees collected by '_delegator'\",\"lastClaimRound\":\"round for which '_delegator' has last claimed earnings\",\"nextUnbondingLockId\":\"ID for the next unbonding lock created for '_delegator'\",\"startRound\":\"round in which bond for '_delegator' became effective\"}},\"getDelegatorUnbondingLock(address,uint256)\":{\"params\":{\"_delegator\":\"Address of delegator\",\"_unbondingLockId\":\"ID of unbonding lock\"},\"returns\":{\"amount\":\"of stake locked up by unbonding lock\",\"withdrawRound\":\"round in which 'amount' becomes available for withdrawal\"}},\"getFirstTranscoderInPool()\":{\"returns\":{\"_0\":\"address for transcoder with highest stake in transcoder pool\"}},\"getNextTranscoderInPool(address)\":{\"params\":{\"_transcoder\":\"Address of a transcoder in the pool\"},\"returns\":{\"_0\":\"address for the transcoder after '_transcoder' in transcoder pool\"}},\"getTotalBonded()\":{\"returns\":{\"_0\":\"total active stake for the current round\"}},\"getTranscoder(address)\":{\"params\":{\"_transcoder\":\"Address of transcoder\"},\"returns\":{\"activationRound\":\"Round in which transcoder became active\",\"activeCumulativeRewards\":\"Transcoder's cumulative rewards that are currently active\",\"cumulativeFees\":\"Transcoder's cumulative fees (earned via its active staked rewards and its fee share)\",\"cumulativeRewards\":\"Transcoder's cumulative rewards (earned via its active staked rewards and its reward cut)\",\"deactivationRound\":\"Round in which transcoder will no longer be active\",\"feeShare\":\"Transcoder's fee share\",\"lastActiveStakeUpdateRound\":\"Round in which transcoder's stake was last updated while active\",\"lastFeeRound\":\"Latest round that the transcoder received fees\",\"lastRewardRound\":\"Trancoder's last reward round\",\"rewardCut\":\"Transcoder's reward cut\"}},\"getTranscoderEarningsPoolForRound(address,uint256)\":{\"params\":{\"_round\":\"Round number\",\"_transcoder\":\"Address of transcoder\"},\"returns\":{\"cumulativeFeeFactor\":\"The cumulative fee factor for delegator fees calculation (only used after LIP-36)\",\"cumulativeRewardFactor\":\"The cumulative reward factor for delegator rewards calculation (only used after LIP-36)\",\"totalStake\":\"Transcoder's total stake in '_round'\",\"transcoderFeeShare\":\"Transcoder's fee share for '_round'\",\"transcoderRewardCut\":\"Transcoder's reward cut for '_round'\"}},\"getTranscoderPoolMaxSize()\":{\"returns\":{\"_0\":\"transcoder pool max size\"}},\"getTranscoderPoolSize()\":{\"returns\":{\"_0\":\"transcoder pool current size\"}},\"isActiveTranscoder(address)\":{\"params\":{\"_transcoder\":\"Transcoder address\"},\"returns\":{\"_0\":\"true if transcoder is active\"}},\"isRegisteredTranscoder(address)\":{\"params\":{\"_transcoder\":\"Transcoder address\"},\"returns\":{\"_0\":\"true if transcoder is self-bonded\"}},\"isValidUnbondingLock(address,uint256)\":{\"params\":{\"_delegator\":\"Address of delegator\",\"_unbondingLockId\":\"ID of unbonding lock\"},\"returns\":{\"_0\":\"true if unbondingLock for ID has a non-zero withdraw round\"}},\"pendingFees(address,uint256)\":{\"params\":{\"_delegator\":\"Address of delegator\",\"_endRound\":\"The last round to compute pending fees from\"},\"returns\":{\"_0\":\"Pending fees for '_delegator' since last claiming fees\"}},\"pendingStake(address,uint256)\":{\"params\":{\"_delegator\":\"Address of delegator\",\"_endRound\":\"The last round to compute pending stake from\"},\"returns\":{\"_0\":\"Pending bonded stake for '_delegator' since last claiming rewards\"}},\"rebond(uint256)\":{\"params\":{\"_unbondingLockId\":\"ID of unbonding lock to rebond with\"}},\"rebondFromUnbonded(address,uint256)\":{\"params\":{\"_to\":\"Address of delegate\",\"_unbondingLockId\":\"ID of unbonding lock to rebond with\"}},\"rebondFromUnbondedWithHint(address,uint256,address,address)\":{\"details\":\"If the delegate joins the transcoder pool, the caller can provide an optional hint for the delegate's insertion position in the pool via the `_newPosPrev` and `_newPosNext` params. A linear search will be executed starting at the hint to find the correct position. In the best case, the hint is the correct position so no search is executed. See SortedDoublyLL.sol for details on list hints\",\"params\":{\"_newPosNext\":\"Address of next transcoder in pool if the delegate joins the pool\",\"_newPosPrev\":\"Address of previous transcoder in pool if the delegate joins the pool\",\"_to\":\"Address of delegate\",\"_unbondingLockId\":\"ID of unbonding lock to rebond with\"}},\"rebondWithHint(uint256,address,address)\":{\"details\":\"If the delegate is in the transcoder pool, the caller can provide an optional hint for the delegate's insertion position in the pool via the `_newPosPrev` and `_newPosNext` params. A linear search will be executed starting at the hint to find the correct position. In the best case, the hint is the correct position so no search is executed. See SortedDoublyLL.sol details on list hints\",\"params\":{\"_newPosNext\":\"Address of next transcoder in pool if the delegate is in the pool\",\"_newPosPrev\":\"Address of previous transcoder in pool if the delegate is in the pool\",\"_unbondingLockId\":\"ID of unbonding lock to rebond with\"}},\"rewardWithHint(address,address)\":{\"details\":\"If the caller is in the transcoder pool, the caller can provide an optional hint for its insertion position in the pool via the `_newPosPrev` and `_newPosNext` params. A linear search will be executed starting at the hint to find the correct position. In the best case, the hint is the correct position so no search is executed. See SortedDoublyLL.sol for details on list hints\",\"params\":{\"_newPosNext\":\"Address of next transcoder in pool if the caller is in the pool\",\"_newPosPrev\":\"Address of previous transcoder in pool if the caller is in the pool\"}},\"setController(address)\":{\"params\":{\"_controller\":\"Controller contract address\"}},\"setNumActiveTranscoders(uint256)\":{\"params\":{\"_numActiveTranscoders\":\"Number of active transcoders\"}},\"setTreasuryBalanceCeiling(uint256)\":{\"params\":{\"_ceiling\":\"Balance at which treasury reward contributions should halt. Specified in LPT fractional units (18-digit precision).\"}},\"setTreasuryRewardCutRate(uint256)\":{\"params\":{\"_cutRate\":\"Percentage of newly minted rewards to route to the treasury. Must be a valid PreciseMathUtils percentage (<100% specified with 27-digits precision).\"}},\"setUnbondingPeriod(uint64)\":{\"params\":{\"_unbondingPeriod\":\"Rounds between unbonding and possible withdrawal\"}},\"slashTranscoder(address,address,uint256,uint256)\":{\"params\":{\"_finder\":\"Finder that proved a transcoder violated a slashing condition. Null address if there is no finder\",\"_finderFee\":\"Percentage of penalty awarded to finder. Zero if there is no finder\",\"_slashAmount\":\"Percentage of transcoder bond to be slashed\",\"_transcoder\":\"Transcoder address\"}},\"transcoder(uint256,uint256)\":{\"details\":\"Percentages are represented as numerators of fractions over MathUtils.PERC_DIVISOR\",\"params\":{\"_feeShare\":\"% of fees paid to delegators by a transcoder\",\"_rewardCut\":\"% of reward paid to transcoder by a delegator\"}},\"transcoderStatus(address)\":{\"params\":{\"_transcoder\":\"Address of transcoder\"},\"returns\":{\"_0\":\"registered or not registered transcoder status\"}},\"transcoderTotalStake(address)\":{\"params\":{\"_transcoder\":\"Address of transcoder\"},\"returns\":{\"_0\":\"total bonded stake for a delegator\"}},\"transcoderWithHint(uint256,uint256,address,address)\":{\"details\":\"Percentages are represented as numerators of fractions over MathUtils.PERC_DIVISOR. If the caller is going to be added to the pool, the caller can provide an optional hint for the insertion position in the pool via the `_newPosPrev` and `_newPosNext` params. A linear search will be executed starting at the hint to find the correct position - in the best case, the hint is the correct position so no search is executed. See SortedDoublyLL.sol for details on list hints\",\"params\":{\"_feeShare\":\"% of fees paid to delegators by a transcoder\",\"_newPosNext\":\"Address of next transcoder in pool if the caller joins the pool\",\"_newPosPrev\":\"Address of previous transcoder in pool if the caller joins the pool\",\"_rewardCut\":\"% of reward paid to transcoder by a delegator\"}},\"transferBond(address,uint256,address,address,address,address)\":{\"details\":\"If the original delegate is in the transcoder pool, the caller can provide an optional hint for the insertion position of the delegate via the `_oldDelegateNewPosPrev` and `_oldDelegateNewPosNext` params. If the target delegate is in the transcoder pool, the caller can provide an optional hint for the insertion position of the delegate via the `_newDelegateNewPosPrev` and `_newDelegateNewPosNext` params. In both cases, a linear search will be executed starting at the hint to find the correct position. In the best case, the hint is the correct position so no search is executed. See SortedDoublyLL.sol for details on list hints\",\"params\":{\"_amount\":\"Portion of the bond to transfer to receiver\",\"_delegator\":\"Receiver of the bond\",\"_newDelegateNewPosNext\":\"Address of next transcoder in pool if the delegate is in the pool\",\"_newDelegateNewPosPrev\":\"Address of previous transcoder in pool if the delegate is in the pool\",\"_oldDelegateNewPosNext\":\"Address of next transcoder in pool if the delegate remains in the pool\",\"_oldDelegateNewPosPrev\":\"Address of previous transcoder in pool if the delegate remains in the pool\"}},\"unbond(uint256)\":{\"params\":{\"_amount\":\"Amount of tokens to unbond\"}},\"unbondWithHint(uint256,address,address)\":{\"details\":\"If the caller remains in the transcoder pool, the caller can provide an optional hint for its insertion position in the pool via the `_newPosPrev` and `_newPosNext` params. A linear search will be executed starting at the hint to find the correct position. In the best case, the hint is the correct position so no search is executed. See SortedDoublyLL.sol details on list hints\",\"params\":{\"_amount\":\"Amount of tokens to unbond\",\"_newPosNext\":\"Address of next transcoder in pool if the caller remains in the pool\",\"_newPosPrev\":\"Address of previous transcoder in pool if the caller remains in the pool\"}},\"updateTranscoderWithFees(address,uint256,uint256)\":{\"params\":{\"_fees\":\"Fees to be added to the fee pool\",\"_transcoder\":\"Transcoder address\"}},\"withdrawStake(uint256)\":{\"params\":{\"_unbondingLockId\":\"ID of unbonding lock to withdraw with\"}}},\"title\":\"BondingManager\",\"version\":1},\"userdoc\":{\"kind\":\"user\",\"methods\":{\"bond(uint256,address)\":{\"notice\":\"Delegate stake towards a specific address\"},\"bondForWithHint(uint256,address,address,address,address,address,address)\":{\"notice\":\"Delegates stake \\\"on behalf of\\\" another address towards a specific address and updates the transcoder pool using optional list hints if needed\"},\"bondWithHint(uint256,address,address,address,address,address)\":{\"notice\":\"Delegates stake towards a specific address and updates the transcoder pool using optional list hints if needed\"},\"checkpointBondingState(address)\":{\"notice\":\"Checkpoints the bonding state for a given account.\"},\"claimEarnings(uint256)\":{\"notice\":\"Claim token pools shares for a delegator from its lastClaimRound through the end round\"},\"constructor\":{\"notice\":\"BondingManager constructor. Only invokes constructor of base Manager contract with provided Controller address\"},\"delegatorStatus(address)\":{\"notice\":\"Computes delegator status\"},\"getDelegator(address)\":{\"notice\":\"Return delegator info\"},\"getDelegatorUnbondingLock(address,uint256)\":{\"notice\":\"Return delegator's unbonding lock info\"},\"getFirstTranscoderInPool()\":{\"notice\":\"Returns transcoder with most stake in pool\"},\"getNextTranscoderInPool(address)\":{\"notice\":\"Returns next transcoder in pool for a given transcoder\"},\"getTotalBonded()\":{\"notice\":\"Return total bonded tokens\"},\"getTranscoder(address)\":{\"notice\":\"Return transcoder information\"},\"getTranscoderEarningsPoolForRound(address,uint256)\":{\"notice\":\"Return transcoder's earnings pool for a given round\"},\"getTranscoderPoolMaxSize()\":{\"notice\":\"Returns max size of transcoder pool\"},\"getTranscoderPoolSize()\":{\"notice\":\"Returns size of transcoder pool\"},\"isActiveTranscoder(address)\":{\"notice\":\"Return whether a transcoder is active for the current round\"},\"isRegisteredTranscoder(address)\":{\"notice\":\"Return whether a transcoder is registered\"},\"isValidUnbondingLock(address,uint256)\":{\"notice\":\"Return whether an unbonding lock for a delegator is valid\"},\"pendingFees(address,uint256)\":{\"notice\":\"Returns pending fees for a delegator from its lastClaimRound through an end round\"},\"pendingStake(address,uint256)\":{\"notice\":\"Returns pending bonded stake for a delegator from its lastClaimRound through an end round\"},\"rebond(uint256)\":{\"notice\":\"Rebond tokens for an unbonding lock to a delegator's current delegate while a delegator is in the Bonded or Pending status\"},\"rebondFromUnbonded(address,uint256)\":{\"notice\":\"Rebond tokens for an unbonding lock to a delegate while a delegator is in the Unbonded status\"},\"rebondFromUnbondedWithHint(address,uint256,address,address)\":{\"notice\":\"Rebond tokens for an unbonding lock to a delegate while a delegator is in the Unbonded status and updates the transcoder pool using an optional list hint if needed\"},\"rebondWithHint(uint256,address,address)\":{\"notice\":\"Rebond tokens for an unbonding lock to a delegator's current delegate while a delegator is in the Bonded or Pending status and updates the transcoder pool using an optional list hint if needed\"},\"reward()\":{\"notice\":\"Mint token rewards for an active transcoder and its delegators\"},\"rewardWithHint(address,address)\":{\"notice\":\"Mint token rewards for an active transcoder and its delegators and update the transcoder pool using an optional list hint if needed\"},\"setController(address)\":{\"notice\":\"Set controller. Only callable by current controller\"},\"setCurrentRoundTotalActiveStake()\":{\"notice\":\"Called during round initialization to set the total active stake for the round. Only callable by the RoundsManager\"},\"setNumActiveTranscoders(uint256)\":{\"notice\":\"Set maximum number of active transcoders. Only callable by Controller owner\"},\"setTreasuryBalanceCeiling(uint256)\":{\"notice\":\"Set treasury balance ceiling. Only callable by Controller owner\"},\"setTreasuryRewardCutRate(uint256)\":{\"notice\":\"Set treasury reward cut rate. Only callable by Controller owner\"},\"setUnbondingPeriod(uint64)\":{\"notice\":\"Set unbonding period. Only callable by Controller owner\"},\"slashTranscoder(address,address,uint256,uint256)\":{\"notice\":\"Slash a transcoder. Only callable by the Verifier\"},\"transcoder(uint256,uint256)\":{\"notice\":\"Sets commission rates as a transcoder and if the caller is not in the transcoder pool tries to add it\"},\"transcoderStatus(address)\":{\"notice\":\"Computes transcoder status\"},\"transcoderTotalStake(address)\":{\"notice\":\"Returns total bonded stake for a transcoder\"},\"transcoderWithHint(uint256,uint256,address,address)\":{\"notice\":\"Sets commission rates as a transcoder and if the caller is not in the transcoder pool tries to add it using an optional list hint\"},\"transferBond(address,uint256,address,address,address,address)\":{\"notice\":\"Transfers ownership of a bond to a new delegator using optional hints if needed If the receiver is already bonded to a different delegate than the bond owner then the stake goes to the receiver's delegate otherwise the receiver's delegate is set as the owner's delegate\"},\"unbond(uint256)\":{\"notice\":\"Unbond an amount of the delegator's bonded stake\"},\"unbondWithHint(uint256,address,address)\":{\"notice\":\"Unbond an amount of the delegator's bonded stake and updates the transcoder pool using an optional list hint if needed\"},\"updateTranscoderWithFees(address,uint256,uint256)\":{\"notice\":\"Update transcoder's fee pool. Only callable by the TicketBroker\"},\"withdrawFees(address,uint256)\":{\"notice\":\"Withdraws fees to the caller\"},\"withdrawStake(uint256)\":{\"notice\":\"Withdraws tokens for an unbonding lock that has existed through an unbonding period\"}},\"notice\":\"Manages bonding, transcoder and rewards/fee accounting related operations of the Livepeer protocol\",\"version\":1}},\"settings\":{\"compilationTarget\":{\"contracts/bonding/BondingManager.sol\":\"BondingManager\"},\"evmVersion\":\"london\",\"libraries\":{},\"metadata\":{\"bytecodeHash\":\"ipfs\",\"useLiteralContent\":true},\"optimizer\":{\"enabled\":true,\"runs\":200},\"remappings\":[]},\"sources\":{\"@openzeppelin/contracts-upgradeable/governance/utils/IVotesUpgradeable.sol\":{\"content\":\"// SPDX-License-Identifier: MIT\\n// OpenZeppelin Contracts (last updated v4.9.0) (governance/utils/IVotes.sol)\\npragma solidity ^0.8.0;\\n\\n/**\\n * @dev Common interface for {ERC20Votes}, {ERC721Votes}, and other {Votes}-enabled contracts.\\n *\\n * _Available since v4.5._\\n */\\ninterface IVotesUpgradeable {\\n    /**\\n     * @dev Emitted when an account changes their delegate.\\n     */\\n    event DelegateChanged(address indexed delegator, address indexed fromDelegate, address indexed toDelegate);\\n\\n    /**\\n     * @dev Emitted when a token transfer or delegate change results in changes to a delegate's number of votes.\\n     */\\n    event DelegateVotesChanged(address indexed delegate, uint256 previousBalance, uint256 newBalance);\\n\\n    /**\\n     * @dev Returns the current amount of votes that `account` has.\\n     */\\n    function getVotes(address account) external view returns (uint256);\\n\\n    /**\\n     * @dev Returns the amount of votes that `account` had at a specific moment in the past. If the `clock()` is\\n     * configured to use block numbers, this will return the value at the end of the corresponding block.\\n     */\\n    function getPastVotes(address account, uint256 timepoint) external view returns (uint256);\\n\\n    /**\\n     * @dev Returns the total supply of votes available at a specific moment in the past. If the `clock()` is\\n     * configured to use block numbers, this will return the value at the end of the corresponding block.\\n     *\\n     * NOTE: This value is the sum of all available votes, which is not necessarily the sum of all delegated votes.\\n     * Votes that have not been delegated are still part of total supply, even though they would not participate in a\\n     * vote.\\n     */\\n    function getPastTotalSupply(uint256 timepoint) external view returns (uint256);\\n\\n    /**\\n     * @dev Returns the delegate that `account` has chosen.\\n     */\\n    function delegates(address account) external view returns (address);\\n\\n    /**\\n     * @dev Delegates votes from the sender to `delegatee`.\\n     */\\n    function delegate(address delegatee) external;\\n\\n    /**\\n     * @dev Delegates votes from signer to `delegatee`.\\n     */\\n    function delegateBySig(address delegatee, uint256 nonce, uint256 expiry, uint8 v, bytes32 r, bytes32 s) external;\\n}\\n\",\"keccak256\":\"0x2d600bbef9320309cd2a86c1d087eb9d6dbcc00430713ee54bbc5c5a2a11ba31\",\"license\":\"MIT\"},\"@openzeppelin/contracts-upgradeable/interfaces/IERC5805Upgradeable.sol\":{\"content\":\"// SPDX-License-Identifier: MIT\\n// OpenZeppelin Contracts (last updated v4.9.0) (interfaces/IERC5805.sol)\\n\\npragma solidity ^0.8.0;\\n\\nimport \\\"../governance/utils/IVotesUpgradeable.sol\\\";\\nimport \\\"./IERC6372Upgradeable.sol\\\";\\n\\ninterface IERC5805Upgradeable is IERC6372Upgradeable, IVotesUpgradeable {}\\n\",\"keccak256\":\"0x19848eec9045c8b91f1ab6b1853966443e3e36bcbc307593ed37a9f0df179d69\",\"license\":\"MIT\"},\"@openzeppelin/contracts-upgradeable/interfaces/IERC6372Upgradeable.sol\":{\"content\":\"// SPDX-License-Identifier: MIT\\n// OpenZeppelin Contracts (last updated v4.9.0) (interfaces/IERC6372.sol)\\n\\npragma solidity ^0.8.0;\\n\\ninterface IERC6372Upgradeable {\\n    /**\\n     * @dev Clock used for flagging checkpoints. Can be overridden to implement timestamp based checkpoints (and voting).\\n     */\\n    function clock() external view returns (uint48);\\n\\n    /**\\n     * @dev Description of the clock\\n     */\\n    // solhint-disable-next-line func-name-mixedcase\\n    function CLOCK_MODE() external view returns (string memory);\\n}\\n\",\"keccak256\":\"0x3026befd6d69d1b46960bdc35a2ad37c0e1352f26983ee3728dd61fd32aa308a\",\"license\":\"MIT\"},\"@openzeppelin/contracts/token/ERC20/IERC20.sol\":{\"content\":\"// SPDX-License-Identifier: MIT\\n// OpenZeppelin Contracts (last updated v4.9.0) (token/ERC20/IERC20.sol)\\n\\npragma solidity ^0.8.0;\\n\\n/**\\n * @dev Interface of the ERC20 standard as defined in the EIP.\\n */\\ninterface IERC20 {\\n    /**\\n     * @dev Emitted when `value` tokens are moved from one account (`from`) to\\n     * another (`to`).\\n     *\\n     * Note that `value` may be zero.\\n     */\\n    event Transfer(address indexed from, address indexed to, uint256 value);\\n\\n    /**\\n     * @dev Emitted when the allowance of a `spender` for an `owner` is set by\\n     * a call to {approve}. `value` is the new allowance.\\n     */\\n    event Approval(address indexed owner, address indexed spender, uint256 value);\\n\\n    /**\\n     * @dev Returns the amount of tokens in existence.\\n     */\\n    function totalSupply() external view returns (uint256);\\n\\n    /**\\n     * @dev Returns the amount of tokens owned by `account`.\\n     */\\n    function balanceOf(address account) external view returns (uint256);\\n\\n    /**\\n     * @dev Moves `amount` tokens from the caller's account to `to`.\\n     *\\n     * Returns a boolean value indicating whether the operation succeeded.\\n     *\\n     * Emits a {Transfer} event.\\n     */\\n    function transfer(address to, uint256 amount) external returns (bool);\\n\\n    /**\\n     * @dev Returns the remaining number of tokens that `spender` will be\\n     * allowed to spend on behalf of `owner` through {transferFrom}. This is\\n     * zero by default.\\n     *\\n     * This value changes when {approve} or {transferFrom} are called.\\n     */\\n    function allowance(address owner, address spender) external view returns (uint256);\\n\\n    /**\\n     * @dev Sets `amount` as the allowance of `spender` over the caller's tokens.\\n     *\\n     * Returns a boolean value indicating whether the operation succeeded.\\n     *\\n     * IMPORTANT: Beware that changing an allowance with this method brings the risk\\n     * that someone may use both the old and the new allowance by unfortunate\\n     * transaction ordering. One possible solution to mitigate this race\\n     * condition is to first reduce the spender's allowance to 0 and set the\\n     * desired value afterwards:\\n     * https://github.com/ethereum/EIPs/issues/20#issuecomment-263524729\\n     *\\n     * Emits an {Approval} event.\\n     */\\n    function approve(address spender, uint256 amount) external returns (bool);\\n\\n    /**\\n     * @dev Moves `amount` tokens from `from` to `to` using the\\n     * allowance mechanism. `amount` is then deducted from the caller's\\n     * allowance.\\n     *\\n     * Returns a boolean value indicating whether the operation succeeded.\\n     *\\n     * Emits a {Transfer} event.\\n     */\\n    function transferFrom(address from, address to, uint256 amount) external returns (bool);\\n}\\n\",\"keccak256\":\"0x287b55befed2961a7eabd7d7b1b2839cbca8a5b80ef8dcbb25ed3d4c2002c305\",\"license\":\"MIT\"},\"@openzeppelin/contracts/utils/math/SafeMath.sol\":{\"content\":\"// SPDX-License-Identifier: MIT\\n// OpenZeppelin Contracts (last updated v4.9.0) (utils/math/SafeMath.sol)\\n\\npragma solidity ^0.8.0;\\n\\n// CAUTION\\n// This version of SafeMath should only be used with Solidity 0.8 or later,\\n// because it relies on the compiler's built in overflow checks.\\n\\n/**\\n * @dev Wrappers over Solidity's arithmetic operations.\\n *\\n * NOTE: `SafeMath` is generally not needed starting with Solidity 0.8, since the compiler\\n * now has built in overflow checking.\\n */\\nlibrary SafeMath {\\n    /**\\n     * @dev Returns the addition of two unsigned integers, with an overflow flag.\\n     *\\n     * _Available since v3.4._\\n     */\\n    function tryAdd(uint256 a, uint256 b) internal pure returns (bool, uint256) {\\n        unchecked {\\n            uint256 c = a + b;\\n            if (c < a) return (false, 0);\\n            return (true, c);\\n        }\\n    }\\n\\n    /**\\n     * @dev Returns the subtraction of two unsigned integers, with an overflow flag.\\n     *\\n     * _Available since v3.4._\\n     */\\n    function trySub(uint256 a, uint256 b) internal pure returns (bool, uint256) {\\n        unchecked {\\n            if (b > a) return (false, 0);\\n            return (true, a - b);\\n        }\\n    }\\n\\n    /**\\n     * @dev Returns the multiplication of two unsigned integers, with an overflow flag.\\n     *\\n     * _Available since v3.4._\\n     */\\n    function tryMul(uint256 a, uint256 b) internal pure returns (bool, uint256) {\\n        unchecked {\\n            // Gas optimization: this is cheaper than requiring 'a' not being zero, but the\\n            // benefit is lost if 'b' is also tested.\\n            // See: https://github.com/OpenZeppelin/openzeppelin-contracts/pull/522\\n            if (a == 0) return (true, 0);\\n            uint256 c = a * b;\\n            if (c / a != b) return (false, 0);\\n            return (true, c);\\n        }\\n    }\\n\\n    /**\\n     * @dev Returns the division of two unsigned integers, with a division by zero flag.\\n     *\\n     * _Available since v3.4._\\n     */\\n    function tryDiv(uint256 a, uint256 b) internal pure returns (bool, uint256) {\\n        unchecked {\\n            if (b == 0) return (false, 0);\\n            return (true, a / b);\\n        }\\n    }\\n\\n    /**\\n     * @dev Returns the remainder of dividing two unsigned integers, with a division by zero flag.\\n     *\\n     * _Available since v3.4._\\n     */\\n    function tryMod(uint256 a, uint256 b) internal pure returns (bool, uint256) {\\n        unchecked {\\n            if (b == 0) return (false, 0);\\n            return (true, a % b);\\n        }\\n    }\\n\\n    /**\\n     * @dev Returns the addition of two unsigned integers, reverting on\\n     * overflow.\\n     *\\n     * Counterpart to Solidity's `+` operator.\\n     *\\n     * Requirements:\\n     *\\n     * - Addition cannot overflow.\\n     */\\n    function add(uint256 a, uint256 b) internal pure returns (uint256) {\\n        return a + b;\\n    }\\n\\n    /**\\n     * @dev Returns the subtraction of two unsigned integers, reverting on\\n     * overflow (when the result is negative).\\n     *\\n     * Counterpart to Solidity's `-` operator.\\n     *\\n     * Requirements:\\n     *\\n     * - Subtraction cannot overflow.\\n     */\\n    function sub(uint256 a, uint256 b) internal pure returns (uint256) {\\n        return a - b;\\n    }\\n\\n    /**\\n     * @dev Returns the multiplication of two unsigned integers, reverting on\\n     * overflow.\\n     *\\n     * Counterpart to Solidity's `*` operator.\\n     *\\n     * Requirements:\\n     *\\n     * - Multiplication cannot overflow.\\n     */\\n    function mul(uint256 a, uint256 b) internal pure returns (uint256) {\\n        return a * b;\\n    }\\n\\n    /**\\n     * @dev Returns the integer division of two unsigned integers, reverting on\\n     * division by zero. The result is rounded towards zero.\\n     *\\n     * Counterpart to Solidity's `/` operator.\\n     *\\n     * Requirements:\\n     *\\n     * - The divisor cannot be zero.\\n     */\\n    function div(uint256 a, uint256 b) internal pure returns (uint256) {\\n        return a / b;\\n    }\\n\\n    /**\\n     * @dev Returns the remainder of dividing two unsigned integers. (unsigned integer modulo),\\n     * reverting when dividing by zero.\\n     *\\n     * Counterpart to Solidity's `%` operator. This function uses a `revert`\\n     * opcode (which leaves remaining gas untouched) while Solidity uses an\\n     * invalid opcode to revert (consuming all remaining gas).\\n     *\\n     * Requirements:\\n     *\\n     * - The divisor cannot be zero.\\n     */\\n    function mod(uint256 a, uint256 b) internal pure returns (uint256) {\\n        return a % b;\\n    }\\n\\n    /**\\n     * @dev Returns the subtraction of two unsigned integers, reverting with custom message on\\n     * overflow (when the result is negative).\\n     *\\n     * CAUTION: This function is deprecated because it requires allocating memory for the error\\n     * message unnecessarily. For custom revert reasons use {trySub}.\\n     *\\n     * Counterpart to Solidity's `-` operator.\\n     *\\n     * Requirements:\\n     *\\n     * - Subtraction cannot overflow.\\n     */\\n    function sub(uint256 a, uint256 b, string memory errorMessage) internal pure returns (uint256) {\\n        unchecked {\\n            require(b <= a, errorMessage);\\n            return a - b;\\n        }\\n    }\\n\\n    /**\\n     * @dev Returns the integer division of two unsigned integers, reverting with custom message on\\n     * division by zero. The result is rounded towards zero.\\n     *\\n     * Counterpart to Solidity's `/` operator. Note: this function uses a\\n     * `revert` opcode (which leaves remaining gas untouched) while Solidity\\n     * uses an invalid opcode to revert (consuming all remaining gas).\\n     *\\n     * Requirements:\\n     *\\n     * - The divisor cannot be zero.\\n     */\\n    function div(uint256 a, uint256 b, string memory errorMessage) internal pure returns (uint256) {\\n        unchecked {\\n            require(b > 0, errorMessage);\\n            return a / b;\\n        }\\n    }\\n\\n    /**\\n     * @dev Returns the remainder of dividing two unsigned integers. (unsigned integer modulo),\\n     * reverting with custom message when dividing by zero.\\n     *\\n     * CAUTION: This function is deprecated because it requires allocating memory for the error\\n     * message unnecessarily. For custom revert reasons use {tryMod}.\\n     *\\n     * Counterpart to Solidity's `%` operator. This function uses a `revert`\\n     * opcode (which leaves remaining gas untouched) while Solidity uses an\\n     * invalid opcode to revert (consuming all remaining gas).\\n     *\\n     * Requirements:\\n     *\\n     * - The divisor cannot be zero.\\n     */\\n    function mod(uint256 a, uint256 b, string memory errorMessage) internal pure returns (uint256) {\\n        unchecked {\\n            require(b > 0, errorMessage);\\n            return a % b;\\n        }\\n    }\\n}\\n\",\"keccak256\":\"0x58b21219689909c4f8339af00813760337f7e2e7f169a97fe49e2896dcfb3b9a\",\"license\":\"MIT\"},\"contracts/IController.sol\":{\"content\":\"// SPDX-License-Identifier: MIT\\npragma solidity 0.8.9;\\n\\nimport \\\"./zeppelin/Pausable.sol\\\";\\n\\nabstract contract IController is Pausable {\\n    event SetContractInfo(bytes32 id, address contractAddress, bytes20 gitCommitHash);\\n\\n    function setContractInfo(\\n        bytes32 _id,\\n        address _contractAddress,\\n        bytes20 _gitCommitHash\\n    ) external virtual;\\n\\n    function updateController(bytes32 _id, address _controller) external virtual;\\n\\n    function getContract(bytes32 _id) public view virtual returns (address);\\n}\\n\",\"keccak256\":\"0x34ea30a2b44d0cbec58fc1d703476ff0085b0fdadab0cd65c35c00b8867f7546\",\"license\":\"MIT\"},\"contracts/IManager.sol\":{\"content\":\"// SPDX-License-Identifier: MIT\\npragma solidity 0.8.9;\\n\\ninterface IManager {\\n    event SetController(address controller);\\n    event ParameterUpdate(string param);\\n\\n    function setController(address _controller) external;\\n}\\n\",\"keccak256\":\"0xc179e4cecc593741514237d5194b4aaac6b829789629fa19ed04f572a8530481\",\"license\":\"MIT\"},\"contracts/Manager.sol\":{\"content\":\"// SPDX-License-Identifier: MIT\\npragma solidity 0.8.9;\\n\\nimport \\\"./IManager.sol\\\";\\nimport \\\"./IController.sol\\\";\\n\\ncontract Manager is IManager {\\n    // Controller that contract is registered with\\n    IController public controller;\\n\\n    // Check if sender is controller\\n    modifier onlyController() {\\n        _onlyController();\\n        _;\\n    }\\n\\n    // Check if sender is controller owner\\n    modifier onlyControllerOwner() {\\n        _onlyControllerOwner();\\n        _;\\n    }\\n\\n    // Check if controller is not paused\\n    modifier whenSystemNotPaused() {\\n        _whenSystemNotPaused();\\n        _;\\n    }\\n\\n    // Check if controller is paused\\n    modifier whenSystemPaused() {\\n        _whenSystemPaused();\\n        _;\\n    }\\n\\n    constructor(address _controller) {\\n        controller = IController(_controller);\\n    }\\n\\n    /**\\n     * @notice Set controller. Only callable by current controller\\n     * @param _controller Controller contract address\\n     */\\n    function setController(address _controller) external onlyController {\\n        controller = IController(_controller);\\n\\n        emit SetController(_controller);\\n    }\\n\\n    function _onlyController() private view {\\n        require(msg.sender == address(controller), \\\"caller must be Controller\\\");\\n    }\\n\\n    function _onlyControllerOwner() private view {\\n        require(msg.sender == controller.owner(), \\\"caller must be Controller owner\\\");\\n    }\\n\\n    function _whenSystemNotPaused() private view {\\n        require(!controller.paused(), \\\"system is paused\\\");\\n    }\\n\\n    function _whenSystemPaused() private view {\\n        require(controller.paused(), \\\"system is not paused\\\");\\n    }\\n}\\n\",\"keccak256\":\"0xc415e3f42da9f82ddd5953031f3f26aed824368fcc34d3b8a17015bfe80dc109\",\"license\":\"MIT\"},\"contracts/ManagerProxyTarget.sol\":{\"content\":\"// SPDX-License-Identifier: MIT\\npragma solidity 0.8.9;\\n\\nimport \\\"./Manager.sol\\\";\\n\\n/**\\n * @title ManagerProxyTarget\\n * @notice The base contract that target contracts used by a proxy contract should inherit from\\n * @dev Both the target contract and the proxy contract (implemented as ManagerProxy) MUST inherit from ManagerProxyTarget in order to guarantee\\n that both contracts have the same storage layout. Differing storage layouts in a proxy contract and target contract can\\n potentially break the delegate proxy upgradeability mechanism\\n */\\nabstract contract ManagerProxyTarget is Manager {\\n    // Used to look up target contract address in controller's registry\\n    bytes32 public targetContractId;\\n}\\n\",\"keccak256\":\"0x920bcc2def240e06272dc06cbcb9f12976f1698cd4f1020c165af25ee837e553\",\"license\":\"MIT\"},\"contracts/bonding/BondingManager.sol\":{\"content\":\"// SPDX-License-Identifier: MIT\\npragma solidity 0.8.9;\\n\\nimport \\\"../ManagerProxyTarget.sol\\\";\\nimport \\\"./IBondingManager.sol\\\";\\nimport \\\"../libraries/SortedDoublyLL.sol\\\";\\nimport \\\"../libraries/MathUtils.sol\\\";\\nimport \\\"../libraries/PreciseMathUtils.sol\\\";\\nimport \\\"./libraries/EarningsPool.sol\\\";\\nimport \\\"./libraries/EarningsPoolLIP36.sol\\\";\\nimport \\\"../token/ILivepeerToken.sol\\\";\\nimport \\\"../token/IMinter.sol\\\";\\nimport \\\"../rounds/IRoundsManager.sol\\\";\\nimport \\\"../snapshots/IMerkleSnapshot.sol\\\";\\nimport \\\"./IBondingVotes.sol\\\";\\n\\nimport \\\"@openzeppelin/contracts/utils/math/SafeMath.sol\\\";\\n\\n/**\\n * @title BondingManager\\n * @notice Manages bonding, transcoder and rewards/fee accounting related operations of the Livepeer protocol\\n */\\ncontract BondingManager is ManagerProxyTarget, IBondingManager {\\n    using SafeMath for uint256;\\n    using SortedDoublyLL for SortedDoublyLL.Data;\\n    using EarningsPool for EarningsPool.Data;\\n    using EarningsPoolLIP36 for EarningsPool.Data;\\n\\n    // Constants\\n    // Occurances are replaced at compile time\\n    // and computed to a single value if possible by the optimizer\\n    uint256 constant MAX_FUTURE_ROUND = 2**256 - 1;\\n\\n    // Time between unbonding and possible withdrawl in rounds\\n    uint64 public unbondingPeriod;\\n\\n    // Represents a transcoder's current state\\n    struct Transcoder {\\n        uint256 lastRewardRound; // Last round that the transcoder called reward\\n        uint256 rewardCut; // % of reward paid to transcoder by a delegator\\n        uint256 feeShare; // % of fees paid to delegators by transcoder\\n        mapping(uint256 => EarningsPool.Data) earningsPoolPerRound; // Mapping of round => earnings pool for the round\\n        uint256 lastActiveStakeUpdateRound; // Round for which the stake was last updated while the transcoder is active\\n        uint256 activationRound; // Round in which the transcoder became active - 0 if inactive\\n        uint256 deactivationRound; // Round in which the transcoder will become inactive\\n        uint256 activeCumulativeRewards; // The transcoder's cumulative rewards that are active in the current round\\n        uint256 cumulativeRewards; // The transcoder's cumulative rewards (earned via the its active staked rewards and its reward cut).\\n        uint256 cumulativeFees; // The transcoder's cumulative fees (earned via the its active staked rewards and its fee share)\\n        uint256 lastFeeRound; // Latest round in which the transcoder received fees\\n    }\\n\\n    // The various states a transcoder can be in\\n    enum TranscoderStatus {\\n        NotRegistered,\\n        Registered\\n    }\\n\\n    // Represents a delegator's current state\\n    struct Delegator {\\n        uint256 bondedAmount; // The amount of bonded tokens\\n        uint256 fees; // The amount of fees collected\\n        address delegateAddress; // The address delegated to\\n        uint256 delegatedAmount; // The amount of tokens delegated to the delegator\\n        uint256 startRound; // The round the delegator transitions to bonded phase and is delegated to someone\\n        uint256 lastClaimRound; // The last round during which the delegator claimed its earnings\\n        uint256 nextUnbondingLockId; // ID for the next unbonding lock created\\n        mapping(uint256 => UnbondingLock) unbondingLocks; // Mapping of unbonding lock ID => unbonding lock\\n    }\\n\\n    // The various states a delegator can be in\\n    enum DelegatorStatus {\\n        Pending,\\n        Bonded,\\n        Unbonded\\n    }\\n\\n    // Represents an amount of tokens that are being unbonded\\n    struct UnbondingLock {\\n        uint256 amount; // Amount of tokens being unbonded\\n        uint256 withdrawRound; // Round at which unbonding period is over and tokens can be withdrawn\\n    }\\n\\n    // Keep track of the known transcoders and delegators\\n    mapping(address => Delegator) private delegators;\\n    mapping(address => Transcoder) private transcoders;\\n\\n    // The total active stake (sum of the stake of active set members) for the current round\\n    uint256 public currentRoundTotalActiveStake;\\n    // The total active stake (sum of the stake of active set members) for the next round\\n    uint256 public nextRoundTotalActiveStake;\\n\\n    // The transcoder pool is used to keep track of the transcoders that are eligible for activation.\\n    // The pool keeps track of the pending active set in round N and the start of round N + 1 transcoders\\n    // in the pool are locked into the active set for round N + 1\\n    SortedDoublyLL.Data private transcoderPool;\\n\\n    // The % of newly minted rewards to be routed to the treasury. Represented as a PreciseMathUtils percPoint value.\\n    uint256 public treasuryRewardCutRate;\\n    // The value for `treasuryRewardCutRate` to be set on the next round initialization.\\n    uint256 public nextRoundTreasuryRewardCutRate;\\n\\n    // If the balance of the treasury in LPT is above this value, automatic treasury contributions will halt.\\n    uint256 public treasuryBalanceCeiling;\\n\\n    // Check if sender is TicketBroker\\n    modifier onlyTicketBroker() {\\n        _onlyTicketBroker();\\n        _;\\n    }\\n\\n    // Check if sender is RoundsManager\\n    modifier onlyRoundsManager() {\\n        _onlyRoundsManager();\\n        _;\\n    }\\n\\n    // Check if sender is Verifier\\n    modifier onlyVerifier() {\\n        _onlyVerifier();\\n        _;\\n    }\\n\\n    // Check if current round is initialized\\n    modifier currentRoundInitialized() {\\n        _currentRoundInitialized();\\n        _;\\n    }\\n\\n    // Automatically claim earnings from lastClaimRound through the current round\\n    modifier autoClaimEarnings(address _delegator) {\\n        _autoClaimEarnings(_delegator);\\n        _;\\n    }\\n\\n    modifier autoCheckpoint(address account) {\\n        _;\\n        checkpointBondingState(account);\\n    }\\n\\n    /**\\n     * @notice BondingManager constructor. Only invokes constructor of base Manager contract with provided Controller address\\n     * @dev This constructor will not initialize any state variables besides `controller`. The following setter functions\\n     * should be used to initialize state variables post-deployment:\\n     * - setUnbondingPeriod()\\n     * - setNumActiveTranscoders()\\n     * - setMaxEarningsClaimsRounds()\\n     * @param _controller Address of Controller that this contract will be registered with\\n     */\\n    constructor(address _controller) Manager(_controller) {}\\n\\n    /**\\n     * @notice Set unbonding period. Only callable by Controller owner\\n     * @param _unbondingPeriod Rounds between unbonding and possible withdrawal\\n     */\\n    function setUnbondingPeriod(uint64 _unbondingPeriod) external onlyControllerOwner {\\n        unbondingPeriod = _unbondingPeriod;\\n\\n        emit ParameterUpdate(\\\"unbondingPeriod\\\");\\n    }\\n\\n    /**\\n     * @notice Set treasury reward cut rate. Only callable by Controller owner\\n     * @param _cutRate Percentage of newly minted rewards to route to the treasury. Must be a valid PreciseMathUtils\\n     * percentage (<100% specified with 27-digits precision).\\n     */\\n    function setTreasuryRewardCutRate(uint256 _cutRate) external onlyControllerOwner {\\n        _setTreasuryRewardCutRate(_cutRate);\\n    }\\n\\n    function _setTreasuryRewardCutRate(uint256 _cutRate) internal {\\n        require(PreciseMathUtils.validPerc(_cutRate), \\\"_cutRate is invalid precise percentage\\\");\\n\\n        nextRoundTreasuryRewardCutRate = _cutRate;\\n\\n        emit ParameterUpdate(\\\"nextRoundTreasuryRewardCutRate\\\");\\n    }\\n\\n    /**\\n     * @notice Set treasury balance ceiling. Only callable by Controller owner\\n     * @param _ceiling Balance at which treasury reward contributions should halt. Specified in LPT fractional units\\n     * (18-digit precision).\\n     */\\n    function setTreasuryBalanceCeiling(uint256 _ceiling) external onlyControllerOwner {\\n        treasuryBalanceCeiling = _ceiling;\\n\\n        emit ParameterUpdate(\\\"treasuryBalanceCeiling\\\");\\n    }\\n\\n    /**\\n     * @notice Set maximum number of active transcoders. Only callable by Controller owner\\n     * @param _numActiveTranscoders Number of active transcoders\\n     */\\n    function setNumActiveTranscoders(uint256 _numActiveTranscoders) external onlyControllerOwner {\\n        transcoderPool.setMaxSize(_numActiveTranscoders);\\n\\n        emit ParameterUpdate(\\\"numActiveTranscoders\\\");\\n    }\\n\\n    /**\\n     * @notice Sets commission rates as a transcoder and if the caller is not in the transcoder pool tries to add it\\n     * @dev Percentages are represented as numerators of fractions over MathUtils.PERC_DIVISOR\\n     * @param _rewardCut % of reward paid to transcoder by a delegator\\n     * @param _feeShare % of fees paid to delegators by a transcoder\\n     */\\n    function transcoder(uint256 _rewardCut, uint256 _feeShare) external {\\n        transcoderWithHint(_rewardCut, _feeShare, address(0), address(0));\\n    }\\n\\n    /**\\n     * @notice Delegate stake towards a specific address\\n     * @param _amount The amount of tokens to stake\\n     * @param _to The address of the transcoder to stake towards\\n     */\\n    function bond(uint256 _amount, address _to) external {\\n        bondWithHint(_amount, _to, address(0), address(0), address(0), address(0));\\n    }\\n\\n    /**\\n     * @notice Unbond an amount of the delegator's bonded stake\\n     * @param _amount Amount of tokens to unbond\\n     */\\n    function unbond(uint256 _amount) external {\\n        unbondWithHint(_amount, address(0), address(0));\\n    }\\n\\n    /**\\n     * @notice Rebond tokens for an unbonding lock to a delegator's current delegate while a delegator is in the Bonded or Pending status\\n     * @param _unbondingLockId ID of unbonding lock to rebond with\\n     */\\n    function rebond(uint256 _unbondingLockId) external {\\n        rebondWithHint(_unbondingLockId, address(0), address(0));\\n    }\\n\\n    /**\\n     * @notice Rebond tokens for an unbonding lock to a delegate while a delegator is in the Unbonded status\\n     * @param _to Address of delegate\\n     * @param _unbondingLockId ID of unbonding lock to rebond with\\n     */\\n    function rebondFromUnbonded(address _to, uint256 _unbondingLockId) external {\\n        rebondFromUnbondedWithHint(_to, _unbondingLockId, address(0), address(0));\\n    }\\n\\n    /**\\n     * @notice Withdraws tokens for an unbonding lock that has existed through an unbonding period\\n     * @param _unbondingLockId ID of unbonding lock to withdraw with\\n     */\\n    function withdrawStake(uint256 _unbondingLockId) external whenSystemNotPaused currentRoundInitialized {\\n        Delegator storage del = delegators[msg.sender];\\n        UnbondingLock storage lock = del.unbondingLocks[_unbondingLockId];\\n\\n        require(isValidUnbondingLock(msg.sender, _unbondingLockId), \\\"invalid unbonding lock ID\\\");\\n        require(\\n            lock.withdrawRound <= roundsManager().currentRound(),\\n            \\\"withdraw round must be before or equal to the current round\\\"\\n        );\\n\\n        uint256 amount = lock.amount;\\n        uint256 withdrawRound = lock.withdrawRound;\\n        // Delete unbonding lock\\n        delete del.unbondingLocks[_unbondingLockId];\\n\\n        // Tell Minter to transfer stake (LPT) to the delegator\\n        minter().trustedTransferTokens(msg.sender, amount);\\n\\n        emit WithdrawStake(msg.sender, _unbondingLockId, amount, withdrawRound);\\n    }\\n\\n    /**\\n     * @notice Withdraws fees to the caller\\n     */\\n    function withdrawFees(address payable _recipient, uint256 _amount)\\n        external\\n        whenSystemNotPaused\\n        currentRoundInitialized\\n        autoClaimEarnings(msg.sender)\\n    {\\n        require(_recipient != address(0), \\\"invalid recipient\\\");\\n        uint256 fees = delegators[msg.sender].fees;\\n        require(fees >= _amount, \\\"insufficient fees to withdraw\\\");\\n        delegators[msg.sender].fees = fees.sub(_amount);\\n\\n        // Tell Minter to transfer fees (ETH) to the address\\n        minter().trustedWithdrawETH(_recipient, _amount);\\n\\n        emit WithdrawFees(msg.sender, _recipient, _amount);\\n    }\\n\\n    /**\\n     * @notice Mint token rewards for an active transcoder and its delegators\\n     */\\n    function reward() external {\\n        rewardWithHint(address(0), address(0));\\n    }\\n\\n    /**\\n     * @notice Update transcoder's fee pool. Only callable by the TicketBroker\\n     * @param _transcoder Transcoder address\\n     * @param _fees Fees to be added to the fee pool\\n     */\\n    function updateTranscoderWithFees(\\n        address _transcoder,\\n        uint256 _fees,\\n        uint256 _round\\n    ) external whenSystemNotPaused onlyTicketBroker {\\n        // Silence unused param compiler warning\\n        _round;\\n\\n        require(isRegisteredTranscoder(_transcoder), \\\"transcoder must be registered\\\");\\n\\n        uint256 currentRound = roundsManager().currentRound();\\n\\n        Transcoder storage t = transcoders[_transcoder];\\n\\n        uint256 lastRewardRound = t.lastRewardRound;\\n        uint256 activeCumulativeRewards = t.activeCumulativeRewards;\\n\\n        // LIP-36: Add fees for the current round instead of '_round'\\n        // https://github.com/livepeer/LIPs/issues/35#issuecomment-673659199\\n        EarningsPool.Data storage earningsPool = t.earningsPoolPerRound[currentRound];\\n        EarningsPool.Data memory prevEarningsPool = latestCumulativeFactorsPool(t, currentRound.sub(1));\\n\\n        // if transcoder hasn't called 'reward()' for '_round' its 'transcoderFeeShare', 'transcoderRewardCut' and 'totalStake'\\n        // on the 'EarningsPool' for '_round' would not be initialized and the fee distribution wouldn't happen as expected\\n        // for cumulative fee calculation this would result in division by zero.\\n        if (currentRound > lastRewardRound) {\\n            earningsPool.setCommission(t.rewardCut, t.feeShare);\\n\\n            uint256 lastUpdateRound = t.lastActiveStakeUpdateRound;\\n            if (lastUpdateRound < currentRound) {\\n                earningsPool.setStake(t.earningsPoolPerRound[lastUpdateRound].totalStake);\\n            }\\n\\n            // If reward() has not been called yet in the current round, then the transcoder's activeCumulativeRewards has not\\n            // yet been set in for the round. When the transcoder calls reward() its activeCumulativeRewards will be set to its\\n            // current cumulativeRewards. So, we can just use the transcoder's cumulativeRewards here because this will become\\n            // the transcoder's activeCumulativeRewards if it calls reward() later on in the current round\\n            activeCumulativeRewards = t.cumulativeRewards;\\n        }\\n\\n        uint256 totalStake = earningsPool.totalStake;\\n        if (prevEarningsPool.cumulativeRewardFactor == 0 && lastRewardRound == currentRound) {\\n            // if transcoder called reward for 'currentRound' but not for 'currentRound - 1' (missed reward call)\\n            // retroactively calculate what its cumulativeRewardFactor would have been for 'currentRound - 1' (cfr. previous lastRewardRound for transcoder)\\n            // based on rewards for currentRound\\n            IMinter mtr = minter();\\n            uint256 rewards = PreciseMathUtils.percOf(\\n                mtr.currentMintableTokens().add(mtr.currentMintedTokens()),\\n                totalStake,\\n                currentRoundTotalActiveStake\\n            );\\n\\n            // Deduct what would have been the treasury rewards\\n            uint256 treasuryRewards = MathUtils.percOf(rewards, treasuryRewardCutRate);\\n            rewards = rewards.sub(treasuryRewards);\\n\\n            uint256 transcoderCommissionRewards = MathUtils.percOf(rewards, earningsPool.transcoderRewardCut);\\n            uint256 delegatorsRewards = rewards.sub(transcoderCommissionRewards);\\n\\n            prevEarningsPool.cumulativeRewardFactor = PreciseMathUtils.percOf(\\n                earningsPool.cumulativeRewardFactor,\\n                totalStake,\\n                delegatorsRewards.add(totalStake)\\n            );\\n        }\\n\\n        uint256 delegatorsFees = MathUtils.percOf(_fees, earningsPool.transcoderFeeShare);\\n        uint256 transcoderCommissionFees = _fees.sub(delegatorsFees);\\n        // Calculate the fees earned by the transcoder's earned rewards\\n        uint256 transcoderRewardStakeFees = PreciseMathUtils.percOf(\\n            delegatorsFees,\\n            activeCumulativeRewards,\\n            totalStake\\n        );\\n        // Track fees earned by the transcoder based on its earned rewards and feeShare\\n        t.cumulativeFees = t.cumulativeFees.add(transcoderRewardStakeFees).add(transcoderCommissionFees);\\n        // Update cumulative fee factor with new fees\\n        // The cumulativeFeeFactor is used to calculate fees for all delegators including the transcoder (self-delegated)\\n        // Note that delegatorsFees includes transcoderRewardStakeFees, but no delegator will claim that amount using\\n        // the earnings claiming algorithm and instead that amount is accounted for in the transcoder's cumulativeFees field\\n        earningsPool.updateCumulativeFeeFactor(prevEarningsPool, delegatorsFees);\\n\\n        t.lastFeeRound = currentRound;\\n    }\\n\\n    /**\\n     * @notice Slash a transcoder. Only callable by the Verifier\\n     * @param _transcoder Transcoder address\\n     * @param _finder Finder that proved a transcoder violated a slashing condition. Null address if there is no finder\\n     * @param _slashAmount Percentage of transcoder bond to be slashed\\n     * @param _finderFee Percentage of penalty awarded to finder. Zero if there is no finder\\n     */\\n    function slashTranscoder(\\n        address _transcoder,\\n        address _finder,\\n        uint256 _slashAmount,\\n        uint256 _finderFee\\n    ) external whenSystemNotPaused onlyVerifier autoClaimEarnings(_transcoder) autoCheckpoint(_transcoder) {\\n        Delegator storage del = delegators[_transcoder];\\n\\n        if (del.bondedAmount > 0) {\\n            uint256 penalty = MathUtils.percOf(delegators[_transcoder].bondedAmount, _slashAmount);\\n\\n            // If active transcoder, resign it\\n            if (transcoderPool.contains(_transcoder)) {\\n                resignTranscoder(_transcoder);\\n            }\\n\\n            // Decrease bonded stake\\n            del.bondedAmount = del.bondedAmount.sub(penalty);\\n\\n            // If still bonded decrease delegate's delegated amount\\n            if (delegatorStatus(_transcoder) == DelegatorStatus.Bonded) {\\n                delegators[del.delegateAddress].delegatedAmount = delegators[del.delegateAddress].delegatedAmount.sub(\\n                    penalty\\n                );\\n            }\\n\\n            // Account for penalty\\n            uint256 burnAmount = penalty;\\n\\n            // Award finder fee if there is a finder address\\n            if (_finder != address(0)) {\\n                uint256 finderAmount = MathUtils.percOf(penalty, _finderFee);\\n                minter().trustedTransferTokens(_finder, finderAmount);\\n\\n                // Minter burns the slashed funds - finder reward\\n                minter().trustedBurnTokens(burnAmount.sub(finderAmount));\\n\\n                emit TranscoderSlashed(_transcoder, _finder, penalty, finderAmount);\\n            } else {\\n                // Minter burns the slashed funds\\n                minter().trustedBurnTokens(burnAmount);\\n\\n                emit TranscoderSlashed(_transcoder, address(0), penalty, 0);\\n            }\\n        } else {\\n            emit TranscoderSlashed(_transcoder, _finder, 0, 0);\\n        }\\n    }\\n\\n    /**\\n     * @notice Claim token pools shares for a delegator from its lastClaimRound through the end round\\n     * @param _endRound The last round for which to claim token pools shares for a delegator\\n     */\\n    function claimEarnings(uint256 _endRound)\\n        external\\n        whenSystemNotPaused\\n        currentRoundInitialized\\n        autoCheckpoint(msg.sender)\\n    {\\n        // Silence unused param compiler warning\\n        _endRound;\\n\\n        _autoClaimEarnings(msg.sender);\\n    }\\n\\n    /**\\n     * @notice Called during round initialization to set the total active stake for the round. Only callable by the RoundsManager\\n     */\\n    function setCurrentRoundTotalActiveStake() external onlyRoundsManager {\\n        currentRoundTotalActiveStake = nextRoundTotalActiveStake;\\n\\n        if (nextRoundTreasuryRewardCutRate != treasuryRewardCutRate) {\\n            treasuryRewardCutRate = nextRoundTreasuryRewardCutRate;\\n            // The treasury cut rate changes in a delayed fashion so we want to emit the parameter update event here\\n            emit ParameterUpdate(\\\"treasuryRewardCutRate\\\");\\n        }\\n\\n        bondingVotes().checkpointTotalActiveStake(currentRoundTotalActiveStake, roundsManager().currentRound());\\n    }\\n\\n    /**\\n     * @notice Sets commission rates as a transcoder and if the caller is not in the transcoder pool tries to add it using an optional list hint\\n     * @dev Percentages are represented as numerators of fractions over MathUtils.PERC_DIVISOR. If the caller is going to be added to the pool, the\\n     * caller can provide an optional hint for the insertion position in the pool via the `_newPosPrev` and `_newPosNext` params. A linear search will\\n     * be executed starting at the hint to find the correct position - in the best case, the hint is the correct position so no search is executed.\\n     * See SortedDoublyLL.sol for details on list hints\\n     * @param _rewardCut % of reward paid to transcoder by a delegator\\n     * @param _feeShare % of fees paid to delegators by a transcoder\\n     * @param _newPosPrev Address of previous transcoder in pool if the caller joins the pool\\n     * @param _newPosNext Address of next transcoder in pool if the caller joins the pool\\n     */\\n    function transcoderWithHint(\\n        uint256 _rewardCut,\\n        uint256 _feeShare,\\n        address _newPosPrev,\\n        address _newPosNext\\n    ) public whenSystemNotPaused currentRoundInitialized {\\n        require(!roundsManager().currentRoundLocked(), \\\"can't update transcoder params, current round is locked\\\");\\n        require(MathUtils.validPerc(_rewardCut), \\\"invalid rewardCut percentage\\\");\\n        require(MathUtils.validPerc(_feeShare), \\\"invalid feeShare percentage\\\");\\n        require(isRegisteredTranscoder(msg.sender), \\\"transcoder must be registered\\\");\\n\\n        Transcoder storage t = transcoders[msg.sender];\\n        uint256 currentRound = roundsManager().currentRound();\\n\\n        require(\\n            !isActiveTranscoder(msg.sender) || t.lastRewardRound == currentRound,\\n            \\\"caller can't be active or must have already called reward for the current round\\\"\\n        );\\n\\n        t.rewardCut = _rewardCut;\\n        t.feeShare = _feeShare;\\n\\n        if (!transcoderPool.contains(msg.sender)) {\\n            tryToJoinActiveSet(\\n                msg.sender,\\n                delegators[msg.sender].delegatedAmount,\\n                currentRound.add(1),\\n                _newPosPrev,\\n                _newPosNext\\n            );\\n        }\\n\\n        emit TranscoderUpdate(msg.sender, _rewardCut, _feeShare);\\n    }\\n\\n    /**\\n     * @notice Delegates stake \\\"on behalf of\\\" another address towards a specific address\\n     * and updates the transcoder pool using optional list hints if needed\\n     * @dev If the caller is decreasing the stake of its old delegate in the transcoder pool, the caller can provide an optional hint\\n     * for the insertion position of the old delegate via the `_oldDelegateNewPosPrev` and `_oldDelegateNewPosNext` params.\\n     * If the caller is delegating to a delegate that is in the transcoder pool, the caller can provide an optional hint for the\\n     * insertion position of the delegate via the `_currDelegateNewPosPrev` and `_currDelegateNewPosNext` params.\\n     * In both cases, a linear search will be executed starting at the hint to find the correct position. In the best case, the hint\\n     * is the correct position so no search is executed. See SortedDoublyLL.sol for details on list hints\\n     * @param _amount The amount of tokens to stake.\\n     * @param _owner The address of the owner of the bond\\n     * @param _to The address of the transcoder to stake towards\\n     * @param _oldDelegateNewPosPrev The address of the previous transcoder in the pool for the old delegate\\n     * @param _oldDelegateNewPosNext The address of the next transcoder in the pool for the old delegate\\n     * @param _currDelegateNewPosPrev The address of the previous transcoder in the pool for the current delegate\\n     * @param _currDelegateNewPosNext The address of the next transcoder in the pool for the current delegate\\n     */\\n    function bondForWithHint(\\n        uint256 _amount,\\n        address _owner,\\n        address _to,\\n        address _oldDelegateNewPosPrev,\\n        address _oldDelegateNewPosNext,\\n        address _currDelegateNewPosPrev,\\n        address _currDelegateNewPosNext\\n    ) public whenSystemNotPaused currentRoundInitialized {\\n        // the `autoClaimEarnings` modifier has been replaced with its internal function as a `Stack too deep` error work-around\\n        _autoClaimEarnings(_owner);\\n        Delegator storage del = delegators[_owner];\\n\\n        uint256 currentRound = roundsManager().currentRound();\\n        // Amount to delegate\\n        uint256 delegationAmount = _amount;\\n        // Current delegate\\n        address currentDelegate = del.delegateAddress;\\n        // Current bonded amount\\n        uint256 currentBondedAmount = del.bondedAmount;\\n\\n        if (delegatorStatus(_owner) == DelegatorStatus.Unbonded) {\\n            // New delegate\\n            // Set start round\\n            // Don't set start round if delegator is in pending state because the start round would not change\\n            del.startRound = currentRound.add(1);\\n            // Unbonded state = no existing delegate and no bonded stake\\n            // Thus, delegation amount = provided amount\\n        } else if (currentBondedAmount > 0 && currentDelegate != _to) {\\n            // Prevents third-party caller to change the delegate of a delegator\\n            require(msg.sender == _owner || msg.sender == l2Migrator(), \\\"INVALID_CALLER\\\");\\n            // A registered transcoder cannot delegate its bonded stake toward another address\\n            // because it can only be delegated toward itself\\n            // In the future, if delegation towards another registered transcoder as an already\\n            // registered transcoder becomes useful (i.e. for transitive delegation), this restriction\\n            // could be removed\\n            require(!isRegisteredTranscoder(_owner), \\\"registered transcoders can't delegate towards other addresses\\\");\\n            // Changing delegate\\n            // Set start round\\n            del.startRound = currentRound.add(1);\\n            // Update amount to delegate with previous delegation amount\\n            delegationAmount = delegationAmount.add(currentBondedAmount);\\n\\n            decreaseTotalStake(currentDelegate, currentBondedAmount, _oldDelegateNewPosPrev, _oldDelegateNewPosNext);\\n        }\\n\\n        {\\n            Transcoder storage newDelegate = transcoders[_to];\\n            EarningsPool.Data storage currPool = newDelegate.earningsPoolPerRound[currentRound];\\n            if (currPool.cumulativeRewardFactor == 0) {\\n                currPool.cumulativeRewardFactor = cumulativeFactorsPool(newDelegate, newDelegate.lastRewardRound)\\n                    .cumulativeRewardFactor;\\n            }\\n            if (currPool.cumulativeFeeFactor == 0) {\\n                currPool.cumulativeFeeFactor = cumulativeFactorsPool(newDelegate, newDelegate.lastFeeRound)\\n                    .cumulativeFeeFactor;\\n            }\\n        }\\n\\n        // cannot delegate to someone without having bonded stake\\n        require(delegationAmount > 0, \\\"delegation amount must be greater than 0\\\");\\n        // Update delegate\\n        del.delegateAddress = _to;\\n        // Update bonded amount\\n        del.bondedAmount = currentBondedAmount.add(_amount);\\n\\n        increaseTotalStake(_to, delegationAmount, _currDelegateNewPosPrev, _currDelegateNewPosNext);\\n\\n        if (_amount > 0) {\\n            // Transfer the LPT to the Minter\\n            livepeerToken().transferFrom(msg.sender, address(minter()), _amount);\\n        }\\n\\n        emit Bond(_to, currentDelegate, _owner, _amount, del.bondedAmount);\\n\\n        // the `autoCheckpoint` modifier has been replaced with its internal function as a `Stack too deep` error work-around\\n        checkpointBondingState(_owner, del, transcoders[_to]);\\n    }\\n\\n    /**\\n     * @notice Checkpoints a delegator state after changes, to be used for historical voting power calculations in\\n     * on-chain governor logic.\\n     */\\n    function checkpointBondingState(\\n        address _owner,\\n        Delegator storage _delegator,\\n        Transcoder storage _transcoder\\n    ) internal {\\n        // start round refers to the round where the checkpointed stake will be active. The actual `startRound` value\\n        // in the delegators doesn't get updated on bond or claim earnings though, so we use currentRound() + 1\\n        // which is the only guaranteed round where the currently stored stake will be active.\\n        uint256 startRound = roundsManager().currentRound() + 1;\\n        bondingVotes().checkpointBondingState(\\n            _owner,\\n            startRound,\\n            _delegator.bondedAmount,\\n            _delegator.delegateAddress,\\n            _delegator.delegatedAmount,\\n            _delegator.lastClaimRound,\\n            _transcoder.lastRewardRound\\n        );\\n    }\\n\\n    /**\\n     * @notice Checkpoints the bonding state for a given account.\\n     * @dev This is to allow checkpointing an account that has an inconsistent checkpoint with its current state.\\n     * Implemented as a deploy utility to checkpoint the existing state when deploying the BondingVotes contract.\\n     * @param _account The account to initialize the bonding checkpoint for\\n     */\\n    function checkpointBondingState(address _account) public {\\n        checkpointBondingState(_account, delegators[_account], transcoders[_account]);\\n    }\\n\\n    /**\\n     * @notice Delegates stake towards a specific address and updates the transcoder pool using optional list hints if needed\\n     * @dev If the caller is decreasing the stake of its old delegate in the transcoder pool, the caller can provide an optional hint\\n     * for the insertion position of the old delegate via the `_oldDelegateNewPosPrev` and `_oldDelegateNewPosNext` params.\\n     * If the caller is delegating to a delegate that is in the transcoder pool, the caller can provide an optional hint for the\\n     * insertion position of the delegate via the `_currDelegateNewPosPrev` and `_currDelegateNewPosNext` params.\\n     * In both cases, a linear search will be executed starting at the hint to find the correct position. In the best case, the hint\\n     * is the correct position so no search is executed. See SortedDoublyLL.sol for details on list hints\\n     * @param _amount The amount of tokens to stake.\\n     * @param _to The address of the transcoder to stake towards\\n     * @param _oldDelegateNewPosPrev The address of the previous transcoder in the pool for the old delegate\\n     * @param _oldDelegateNewPosNext The address of the next transcoder in the pool for the old delegate\\n     * @param _currDelegateNewPosPrev The address of the previous transcoder in the pool for the current delegate\\n     * @param _currDelegateNewPosNext The address of the next transcoder in the pool for the current delegate\\n     */\\n    function bondWithHint(\\n        uint256 _amount,\\n        address _to,\\n        address _oldDelegateNewPosPrev,\\n        address _oldDelegateNewPosNext,\\n        address _currDelegateNewPosPrev,\\n        address _currDelegateNewPosNext\\n    ) public {\\n        bondForWithHint(\\n            _amount,\\n            msg.sender,\\n            _to,\\n            _oldDelegateNewPosPrev,\\n            _oldDelegateNewPosNext,\\n            _currDelegateNewPosPrev,\\n            _currDelegateNewPosNext\\n        );\\n    }\\n\\n    /**\\n     * @notice Transfers ownership of a bond to a new delegator using optional hints if needed\\n     *\\n     * If the receiver is already bonded to a different delegate than the bond owner then the stake goes\\n     * to the receiver's delegate otherwise the receiver's delegate is set as the owner's delegate\\n     *\\n     * @dev If the original delegate is in the transcoder pool, the caller can provide an optional hint for the\\n     * insertion position of the delegate via the `_oldDelegateNewPosPrev` and `_oldDelegateNewPosNext` params.\\n     * If the target delegate is in the transcoder pool, the caller can provide an optional hint for the\\n     * insertion position of the delegate via the `_newDelegateNewPosPrev` and `_newDelegateNewPosNext` params.\\n     *\\n     * In both cases, a linear search will be executed starting at the hint to find the correct position. In the best case, the hint\\n     * is the correct position so no search is executed. See SortedDoublyLL.sol for details on list hints\\n     * @param _delegator Receiver of the bond\\n     * @param _amount Portion of the bond to transfer to receiver\\n     * @param _oldDelegateNewPosPrev Address of previous transcoder in pool if the delegate remains in the pool\\n     * @param _oldDelegateNewPosNext Address of next transcoder in pool if the delegate remains in the pool\\n     * @param _newDelegateNewPosPrev Address of previous transcoder in pool if the delegate is in the pool\\n     * @param _newDelegateNewPosNext Address of next transcoder in pool if the delegate is in the pool\\n     */\\n    function transferBond(\\n        address _delegator,\\n        uint256 _amount,\\n        address _oldDelegateNewPosPrev,\\n        address _oldDelegateNewPosNext,\\n        address _newDelegateNewPosPrev,\\n        address _newDelegateNewPosNext\\n    ) public whenSystemNotPaused currentRoundInitialized {\\n        // the `autoClaimEarnings` modifier has been replaced with its internal function as a `Stack too deep` error work-around\\n        _autoClaimEarnings(msg.sender);\\n        Delegator storage oldDel = delegators[msg.sender];\\n        // Cache delegate address of caller before unbondWithHint because\\n        // if unbondWithHint is for a full unbond the caller's delegate address will be set to null\\n        address oldDelDelegate = oldDel.delegateAddress;\\n\\n        unbondWithHint(_amount, _oldDelegateNewPosPrev, _oldDelegateNewPosNext);\\n\\n        Delegator storage newDel = delegators[_delegator];\\n\\n        uint256 oldDelUnbondingLockId = oldDel.nextUnbondingLockId.sub(1);\\n        uint256 withdrawRound = oldDel.unbondingLocks[oldDelUnbondingLockId].withdrawRound;\\n\\n        // Burn lock for current owner\\n        delete oldDel.unbondingLocks[oldDelUnbondingLockId];\\n\\n        // Create lock for new owner\\n        uint256 newDelUnbondingLockId = newDel.nextUnbondingLockId;\\n\\n        newDel.unbondingLocks[newDelUnbondingLockId] = UnbondingLock({ amount: _amount, withdrawRound: withdrawRound });\\n        newDel.nextUnbondingLockId = newDel.nextUnbondingLockId.add(1);\\n\\n        emit TransferBond(msg.sender, _delegator, oldDelUnbondingLockId, newDelUnbondingLockId, _amount);\\n\\n        // Claim earnings for receiver before processing unbonding lock\\n        uint256 currentRound = roundsManager().currentRound();\\n        uint256 lastClaimRound = newDel.lastClaimRound;\\n        if (lastClaimRound < currentRound) {\\n            updateDelegatorWithEarnings(_delegator, currentRound, lastClaimRound);\\n        }\\n\\n        // Rebond lock for new owner\\n        if (newDel.delegateAddress == address(0) && newDel.bondedAmount == 0) {\\n            newDel.delegateAddress = oldDelDelegate;\\n        }\\n\\n        // Move to Pending state if receiver is currently in Unbonded state\\n        if (delegatorStatus(_delegator) == DelegatorStatus.Unbonded) {\\n            newDel.startRound = currentRound.add(1);\\n        }\\n\\n        // Process rebond using unbonding lock\\n        processRebond(_delegator, newDelUnbondingLockId, _newDelegateNewPosPrev, _newDelegateNewPosNext);\\n    }\\n\\n    /**\\n     * @notice Unbond an amount of the delegator's bonded stake and updates the transcoder pool using an optional list hint if needed\\n     * @dev If the caller remains in the transcoder pool, the caller can provide an optional hint for its insertion position in the\\n     * pool via the `_newPosPrev` and `_newPosNext` params. A linear search will be executed starting at the hint to find the correct position.\\n     * In the best case, the hint is the correct position so no search is executed. See SortedDoublyLL.sol details on list hints\\n     * @param _amount Amount of tokens to unbond\\n     * @param _newPosPrev Address of previous transcoder in pool if the caller remains in the pool\\n     * @param _newPosNext Address of next transcoder in pool if the caller remains in the pool\\n     */\\n    function unbondWithHint(\\n        uint256 _amount,\\n        address _newPosPrev,\\n        address _newPosNext\\n    ) public whenSystemNotPaused currentRoundInitialized autoClaimEarnings(msg.sender) autoCheckpoint(msg.sender) {\\n        require(delegatorStatus(msg.sender) == DelegatorStatus.Bonded, \\\"caller must be bonded\\\");\\n\\n        Delegator storage del = delegators[msg.sender];\\n\\n        require(_amount > 0, \\\"unbond amount must be greater than 0\\\");\\n        require(_amount <= del.bondedAmount, \\\"amount is greater than bonded amount\\\");\\n\\n        address currentDelegate = del.delegateAddress;\\n        uint256 currentRound = roundsManager().currentRound();\\n        uint256 withdrawRound = currentRound.add(unbondingPeriod);\\n        uint256 unbondingLockId = del.nextUnbondingLockId;\\n\\n        // Create new unbonding lock\\n        del.unbondingLocks[unbondingLockId] = UnbondingLock({ amount: _amount, withdrawRound: withdrawRound });\\n        // Increment ID for next unbonding lock\\n        del.nextUnbondingLockId = unbondingLockId.add(1);\\n        // Decrease delegator's bonded amount\\n        del.bondedAmount = del.bondedAmount.sub(_amount);\\n\\n        if (del.bondedAmount == 0) {\\n            // Delegator no longer delegated to anyone if it does not have a bonded amount\\n            del.delegateAddress = address(0);\\n            // Delegator does not have a start round if it is no longer delegated to anyone\\n            del.startRound = 0;\\n\\n            if (transcoderPool.contains(msg.sender)) {\\n                resignTranscoder(msg.sender);\\n            }\\n        }\\n\\n        // If msg.sender was resigned this statement will only decrease delegators[currentDelegate].delegatedAmount\\n        decreaseTotalStake(currentDelegate, _amount, _newPosPrev, _newPosNext);\\n\\n        emit Unbond(currentDelegate, msg.sender, unbondingLockId, _amount, withdrawRound);\\n    }\\n\\n    /**\\n     * @notice Rebond tokens for an unbonding lock to a delegator's current delegate while a delegator is in the Bonded or Pending status and updates\\n     * the transcoder pool using an optional list hint if needed\\n     * @dev If the delegate is in the transcoder pool, the caller can provide an optional hint for the delegate's insertion position in the\\n     * pool via the `_newPosPrev` and `_newPosNext` params. A linear search will be executed starting at the hint to find the correct position.\\n     * In the best case, the hint is the correct position so no search is executed. See SortedDoublyLL.sol details on list hints\\n     * @param _unbondingLockId ID of unbonding lock to rebond with\\n     * @param _newPosPrev Address of previous transcoder in pool if the delegate is in the pool\\n     * @param _newPosNext Address of next transcoder in pool if the delegate is in the pool\\n     */\\n    function rebondWithHint(\\n        uint256 _unbondingLockId,\\n        address _newPosPrev,\\n        address _newPosNext\\n    ) public whenSystemNotPaused currentRoundInitialized autoClaimEarnings(msg.sender) {\\n        require(delegatorStatus(msg.sender) != DelegatorStatus.Unbonded, \\\"caller must be bonded\\\");\\n\\n        // Process rebond using unbonding lock\\n        processRebond(msg.sender, _unbondingLockId, _newPosPrev, _newPosNext);\\n    }\\n\\n    /**\\n     * @notice Rebond tokens for an unbonding lock to a delegate while a delegator is in the Unbonded status and updates the transcoder pool using\\n     * an optional list hint if needed\\n     * @dev If the delegate joins the transcoder pool, the caller can provide an optional hint for the delegate's insertion position in the\\n     * pool via the `_newPosPrev` and `_newPosNext` params. A linear search will be executed starting at the hint to find the correct position.\\n     * In the best case, the hint is the correct position so no search is executed. See SortedDoublyLL.sol for details on list hints\\n     * @param _to Address of delegate\\n     * @param _unbondingLockId ID of unbonding lock to rebond with\\n     * @param _newPosPrev Address of previous transcoder in pool if the delegate joins the pool\\n     * @param _newPosNext Address of next transcoder in pool if the delegate joins the pool\\n     */\\n    function rebondFromUnbondedWithHint(\\n        address _to,\\n        uint256 _unbondingLockId,\\n        address _newPosPrev,\\n        address _newPosNext\\n    ) public whenSystemNotPaused currentRoundInitialized autoClaimEarnings(msg.sender) {\\n        require(delegatorStatus(msg.sender) == DelegatorStatus.Unbonded, \\\"caller must be unbonded\\\");\\n\\n        // Set delegator's start round and transition into Pending state\\n        delegators[msg.sender].startRound = roundsManager().currentRound().add(1);\\n        // Set delegator's delegate\\n        delegators[msg.sender].delegateAddress = _to;\\n        // Process rebond using unbonding lock\\n        processRebond(msg.sender, _unbondingLockId, _newPosPrev, _newPosNext);\\n    }\\n\\n    /**\\n     * @notice Mint token rewards for an active transcoder and its delegators and update the transcoder pool using an optional list hint if needed\\n     * @dev If the caller is in the transcoder pool, the caller can provide an optional hint for its insertion position in the\\n     * pool via the `_newPosPrev` and `_newPosNext` params. A linear search will be executed starting at the hint to find the correct position.\\n     * In the best case, the hint is the correct position so no search is executed. See SortedDoublyLL.sol for details on list hints\\n     * @param _newPosPrev Address of previous transcoder in pool if the caller is in the pool\\n     * @param _newPosNext Address of next transcoder in pool if the caller is in the pool\\n     */\\n    function rewardWithHint(address _newPosPrev, address _newPosNext)\\n        public\\n        whenSystemNotPaused\\n        currentRoundInitialized\\n        autoCheckpoint(msg.sender)\\n    {\\n        uint256 currentRound = roundsManager().currentRound();\\n\\n        require(isActiveTranscoder(msg.sender), \\\"caller must be an active transcoder\\\");\\n        require(\\n            transcoders[msg.sender].lastRewardRound != currentRound,\\n            \\\"caller has already called reward for the current round\\\"\\n        );\\n\\n        Transcoder storage t = transcoders[msg.sender];\\n        EarningsPool.Data storage earningsPool = t.earningsPoolPerRound[currentRound];\\n\\n        // Set last round that transcoder called reward\\n        earningsPool.setCommission(t.rewardCut, t.feeShare);\\n\\n        // If transcoder didn't receive stake updates during the previous round and hasn't called reward for > 1 round\\n        // the 'totalStake' on its 'EarningsPool' for the current round wouldn't be initialized\\n        // Thus we sync the the transcoder's stake to when it was last updated\\n        // 'updateTrancoderWithRewards()' will set the update round to 'currentRound +1' so this synchronization shouldn't occur frequently\\n        uint256 lastUpdateRound = t.lastActiveStakeUpdateRound;\\n        if (lastUpdateRound < currentRound) {\\n            earningsPool.setStake(t.earningsPoolPerRound[lastUpdateRound].totalStake);\\n        }\\n\\n        if (treasuryBalanceCeiling > 0) {\\n            uint256 treasuryBalance = livepeerToken().balanceOf(treasury());\\n            if (treasuryBalance >= treasuryBalanceCeiling && nextRoundTreasuryRewardCutRate > 0) {\\n                // halt treasury contributions until the cut rate param is updated again\\n                _setTreasuryRewardCutRate(0);\\n            }\\n        }\\n\\n        // Create reward based on active transcoder's stake relative to the total active stake\\n        // rewardTokens = (current mintable tokens for the round * active transcoder stake) / total active stake\\n        IMinter mtr = minter();\\n        uint256 totalRewardTokens = mtr.createReward(earningsPool.totalStake, currentRoundTotalActiveStake);\\n        uint256 treasuryRewards = PreciseMathUtils.percOf(totalRewardTokens, treasuryRewardCutRate);\\n        if (treasuryRewards > 0) {\\n            address trsry = treasury();\\n\\n            mtr.trustedTransferTokens(trsry, treasuryRewards);\\n\\n            emit TreasuryReward(msg.sender, trsry, treasuryRewards);\\n        }\\n\\n        uint256 transcoderRewards = totalRewardTokens.sub(treasuryRewards);\\n\\n        updateTranscoderWithRewards(msg.sender, transcoderRewards, currentRound, _newPosPrev, _newPosNext);\\n\\n        // Set last round that transcoder called reward\\n        t.lastRewardRound = currentRound;\\n\\n        emit Reward(msg.sender, transcoderRewards);\\n    }\\n\\n    /**\\n     * @notice Returns pending bonded stake for a delegator from its lastClaimRound through an end round\\n     * @param _delegator Address of delegator\\n     * @param _endRound The last round to compute pending stake from\\n     * @return Pending bonded stake for '_delegator' since last claiming rewards\\n     */\\n    function pendingStake(address _delegator, uint256 _endRound) public view returns (uint256) {\\n        // Silence unused param compiler warning\\n        _endRound;\\n\\n        uint256 endRound = roundsManager().currentRound();\\n        (uint256 stake, ) = pendingStakeAndFees(_delegator, endRound);\\n        return stake;\\n    }\\n\\n    /**\\n     * @notice Returns pending fees for a delegator from its lastClaimRound through an end round\\n     * @param _delegator Address of delegator\\n     * @param _endRound The last round to compute pending fees from\\n     * @return Pending fees for '_delegator' since last claiming fees\\n     */\\n    function pendingFees(address _delegator, uint256 _endRound) public view returns (uint256) {\\n        // Silence unused param compiler warning\\n        _endRound;\\n\\n        uint256 endRound = roundsManager().currentRound();\\n        (, uint256 fees) = pendingStakeAndFees(_delegator, endRound);\\n        return fees;\\n    }\\n\\n    /**\\n     * @notice Returns total bonded stake for a transcoder\\n     * @param _transcoder Address of transcoder\\n     * @return total bonded stake for a delegator\\n     */\\n    function transcoderTotalStake(address _transcoder) public view returns (uint256) {\\n        return delegators[_transcoder].delegatedAmount;\\n    }\\n\\n    /**\\n     * @notice Computes transcoder status\\n     * @param _transcoder Address of transcoder\\n     * @return registered or not registered transcoder status\\n     */\\n    function transcoderStatus(address _transcoder) public view returns (TranscoderStatus) {\\n        if (isRegisteredTranscoder(_transcoder)) return TranscoderStatus.Registered;\\n        return TranscoderStatus.NotRegistered;\\n    }\\n\\n    /**\\n     * @notice Computes delegator status\\n     * @param _delegator Address of delegator\\n     * @return bonded, unbonded or pending delegator status\\n     */\\n    function delegatorStatus(address _delegator) public view returns (DelegatorStatus) {\\n        Delegator storage del = delegators[_delegator];\\n\\n        if (del.bondedAmount == 0) {\\n            // Delegator unbonded all its tokens\\n            return DelegatorStatus.Unbonded;\\n        } else if (del.startRound > roundsManager().currentRound()) {\\n            // Delegator round start is in the future\\n            return DelegatorStatus.Pending;\\n        } else {\\n            // Delegator round start is now or in the past\\n            // del.startRound != 0 here because if del.startRound = 0 then del.bondedAmount = 0 which\\n            // would trigger the first if clause\\n            return DelegatorStatus.Bonded;\\n        }\\n    }\\n\\n    /**\\n     * @notice Return transcoder information\\n     * @param _transcoder Address of transcoder\\n     * @return lastRewardRound Trancoder's last reward round\\n     * @return rewardCut Transcoder's reward cut\\n     * @return feeShare Transcoder's fee share\\n     * @return lastActiveStakeUpdateRound Round in which transcoder's stake was last updated while active\\n     * @return activationRound Round in which transcoder became active\\n     * @return deactivationRound Round in which transcoder will no longer be active\\n     * @return activeCumulativeRewards Transcoder's cumulative rewards that are currently active\\n     * @return cumulativeRewards Transcoder's cumulative rewards (earned via its active staked rewards and its reward cut)\\n     * @return cumulativeFees Transcoder's cumulative fees (earned via its active staked rewards and its fee share)\\n     * @return lastFeeRound Latest round that the transcoder received fees\\n     */\\n    function getTranscoder(address _transcoder)\\n        public\\n        view\\n        returns (\\n            uint256 lastRewardRound,\\n            uint256 rewardCut,\\n            uint256 feeShare,\\n            uint256 lastActiveStakeUpdateRound,\\n            uint256 activationRound,\\n            uint256 deactivationRound,\\n            uint256 activeCumulativeRewards,\\n            uint256 cumulativeRewards,\\n            uint256 cumulativeFees,\\n            uint256 lastFeeRound\\n        )\\n    {\\n        Transcoder storage t = transcoders[_transcoder];\\n\\n        lastRewardRound = t.lastRewardRound;\\n        rewardCut = t.rewardCut;\\n        feeShare = t.feeShare;\\n        lastActiveStakeUpdateRound = t.lastActiveStakeUpdateRound;\\n        activationRound = t.activationRound;\\n        deactivationRound = t.deactivationRound;\\n        activeCumulativeRewards = t.activeCumulativeRewards;\\n        cumulativeRewards = t.cumulativeRewards;\\n        cumulativeFees = t.cumulativeFees;\\n        lastFeeRound = t.lastFeeRound;\\n    }\\n\\n    /**\\n     * @notice Return transcoder's earnings pool for a given round\\n     * @param _transcoder Address of transcoder\\n     * @param _round Round number\\n     * @return totalStake Transcoder's total stake in '_round'\\n     * @return transcoderRewardCut Transcoder's reward cut for '_round'\\n     * @return transcoderFeeShare Transcoder's fee share for '_round'\\n     * @return cumulativeRewardFactor The cumulative reward factor for delegator rewards calculation (only used after LIP-36)\\n     * @return cumulativeFeeFactor The cumulative fee factor for delegator fees calculation (only used after LIP-36)\\n     */\\n    function getTranscoderEarningsPoolForRound(address _transcoder, uint256 _round)\\n        public\\n        view\\n        returns (\\n            uint256 totalStake,\\n            uint256 transcoderRewardCut,\\n            uint256 transcoderFeeShare,\\n            uint256 cumulativeRewardFactor,\\n            uint256 cumulativeFeeFactor\\n        )\\n    {\\n        EarningsPool.Data storage earningsPool = transcoders[_transcoder].earningsPoolPerRound[_round];\\n\\n        totalStake = earningsPool.totalStake;\\n        transcoderRewardCut = earningsPool.transcoderRewardCut;\\n        transcoderFeeShare = earningsPool.transcoderFeeShare;\\n        cumulativeRewardFactor = earningsPool.cumulativeRewardFactor;\\n        cumulativeFeeFactor = earningsPool.cumulativeFeeFactor;\\n    }\\n\\n    /**\\n     * @notice Return delegator info\\n     * @param _delegator Address of delegator\\n     * @return bondedAmount total amount bonded by '_delegator'\\n     * @return fees amount of fees collected by '_delegator'\\n     * @return delegateAddress address '_delegator' has bonded to\\n     * @return delegatedAmount total amount delegated to '_delegator'\\n     * @return startRound round in which bond for '_delegator' became effective\\n     * @return lastClaimRound round for which '_delegator' has last claimed earnings\\n     * @return nextUnbondingLockId ID for the next unbonding lock created for '_delegator'\\n     */\\n    function getDelegator(address _delegator)\\n        public\\n        view\\n        returns (\\n            uint256 bondedAmount,\\n            uint256 fees,\\n            address delegateAddress,\\n            uint256 delegatedAmount,\\n            uint256 startRound,\\n            uint256 lastClaimRound,\\n            uint256 nextUnbondingLockId\\n        )\\n    {\\n        Delegator storage del = delegators[_delegator];\\n\\n        bondedAmount = del.bondedAmount;\\n        fees = del.fees;\\n        delegateAddress = del.delegateAddress;\\n        delegatedAmount = del.delegatedAmount;\\n        startRound = del.startRound;\\n        lastClaimRound = del.lastClaimRound;\\n        nextUnbondingLockId = del.nextUnbondingLockId;\\n    }\\n\\n    /**\\n     * @notice Return delegator's unbonding lock info\\n     * @param _delegator Address of delegator\\n     * @param _unbondingLockId ID of unbonding lock\\n     * @return amount of stake locked up by unbonding lock\\n     * @return withdrawRound round in which 'amount' becomes available for withdrawal\\n     */\\n    function getDelegatorUnbondingLock(address _delegator, uint256 _unbondingLockId)\\n        public\\n        view\\n        returns (uint256 amount, uint256 withdrawRound)\\n    {\\n        UnbondingLock storage lock = delegators[_delegator].unbondingLocks[_unbondingLockId];\\n\\n        return (lock.amount, lock.withdrawRound);\\n    }\\n\\n    /**\\n     * @notice Returns max size of transcoder pool\\n     * @return transcoder pool max size\\n     */\\n    function getTranscoderPoolMaxSize() public view returns (uint256) {\\n        return transcoderPool.getMaxSize();\\n    }\\n\\n    /**\\n     * @notice Returns size of transcoder pool\\n     * @return transcoder pool current size\\n     */\\n    function getTranscoderPoolSize() public view returns (uint256) {\\n        return transcoderPool.getSize();\\n    }\\n\\n    /**\\n     * @notice Returns transcoder with most stake in pool\\n     * @return address for transcoder with highest stake in transcoder pool\\n     */\\n    function getFirstTranscoderInPool() public view returns (address) {\\n        return transcoderPool.getFirst();\\n    }\\n\\n    /**\\n     * @notice Returns next transcoder in pool for a given transcoder\\n     * @param _transcoder Address of a transcoder in the pool\\n     * @return address for the transcoder after '_transcoder' in transcoder pool\\n     */\\n    function getNextTranscoderInPool(address _transcoder) public view returns (address) {\\n        return transcoderPool.getNext(_transcoder);\\n    }\\n\\n    /**\\n     * @notice Return total bonded tokens\\n     * @return total active stake for the current round\\n     */\\n    function getTotalBonded() public view returns (uint256) {\\n        return currentRoundTotalActiveStake;\\n    }\\n\\n    /**\\n     * @notice Return whether a transcoder is active for the current round\\n     * @param _transcoder Transcoder address\\n     * @return true if transcoder is active\\n     */\\n    function isActiveTranscoder(address _transcoder) public view returns (bool) {\\n        Transcoder storage t = transcoders[_transcoder];\\n        uint256 currentRound = roundsManager().currentRound();\\n        return t.activationRound <= currentRound && currentRound < t.deactivationRound;\\n    }\\n\\n    /**\\n     * @notice Return whether a transcoder is registered\\n     * @param _transcoder Transcoder address\\n     * @return true if transcoder is self-bonded\\n     */\\n    function isRegisteredTranscoder(address _transcoder) public view returns (bool) {\\n        Delegator storage d = delegators[_transcoder];\\n        return d.delegateAddress == _transcoder && d.bondedAmount > 0;\\n    }\\n\\n    /**\\n     * @notice Return whether an unbonding lock for a delegator is valid\\n     * @param _delegator Address of delegator\\n     * @param _unbondingLockId ID of unbonding lock\\n     * @return true if unbondingLock for ID has a non-zero withdraw round\\n     */\\n    function isValidUnbondingLock(address _delegator, uint256 _unbondingLockId) public view returns (bool) {\\n        // A unbonding lock is only valid if it has a non-zero withdraw round (the default value is zero)\\n        return delegators[_delegator].unbondingLocks[_unbondingLockId].withdrawRound > 0;\\n    }\\n\\n    /**\\n     * @notice Return an EarningsPool.Data struct with cumulative factors for a given round that are rescaled if needed\\n     * @param _transcoder Storage pointer to a transcoder struct\\n     * @param _round The round to fetch the cumulative factors for\\n     */\\n    function cumulativeFactorsPool(Transcoder storage _transcoder, uint256 _round)\\n        internal\\n        view\\n        returns (EarningsPool.Data memory pool)\\n    {\\n        pool.cumulativeRewardFactor = _transcoder.earningsPoolPerRound[_round].cumulativeRewardFactor;\\n        pool.cumulativeFeeFactor = _transcoder.earningsPoolPerRound[_round].cumulativeFeeFactor;\\n\\n        return pool;\\n    }\\n\\n    /**\\n     * @notice Return an EarningsPool.Data struct with the latest cumulative factors for a given round\\n     * @param _transcoder Storage pointer to a transcoder struct\\n     * @param _round The round to fetch the latest cumulative factors for\\n     * @return pool An EarningsPool.Data populated with the latest cumulative factors for _round\\n     */\\n    function latestCumulativeFactorsPool(Transcoder storage _transcoder, uint256 _round)\\n        internal\\n        view\\n        returns (EarningsPool.Data memory pool)\\n    {\\n        pool = cumulativeFactorsPool(_transcoder, _round);\\n\\n        uint256 lastRewardRound = _transcoder.lastRewardRound;\\n        // Only use the cumulativeRewardFactor for lastRewardRound if lastRewardRound is before _round\\n        if (pool.cumulativeRewardFactor == 0 && lastRewardRound < _round) {\\n            pool.cumulativeRewardFactor = cumulativeFactorsPool(_transcoder, lastRewardRound).cumulativeRewardFactor;\\n        }\\n\\n        uint256 lastFeeRound = _transcoder.lastFeeRound;\\n        // Only use the cumulativeFeeFactor for lastFeeRound if lastFeeRound is before _round\\n        if (pool.cumulativeFeeFactor == 0 && lastFeeRound < _round) {\\n            pool.cumulativeFeeFactor = cumulativeFactorsPool(_transcoder, lastFeeRound).cumulativeFeeFactor;\\n        }\\n\\n        return pool;\\n    }\\n\\n    /**\\n     * @notice Return a delegator's cumulative stake and fees using the LIP-36 earnings claiming algorithm\\n     * @param _transcoder Storage pointer to a transcoder struct for a delegator's delegate\\n     * @param _startRound The round for the start cumulative factors\\n     * @param _endRound The round for the end cumulative factors. Normally this is the current round as historical\\n     * lookup is only supported through BondingVotes\\n     * @param _stake The delegator's initial stake before including earned rewards\\n     * @param _fees The delegator's initial fees before including earned fees\\n     * @return cStake , cFees where cStake is the delegator's cumulative stake including earned rewards and cFees is the delegator's cumulative fees including earned fees\\n     */\\n    function delegatorCumulativeStakeAndFees(\\n        Transcoder storage _transcoder,\\n        uint256 _startRound,\\n        uint256 _endRound,\\n        uint256 _stake,\\n        uint256 _fees\\n    ) internal view returns (uint256 cStake, uint256 cFees) {\\n        // Fetch start cumulative factors\\n        EarningsPool.Data memory startPool = cumulativeFactorsPool(_transcoder, _startRound);\\n        // Fetch end cumulative factors\\n        EarningsPool.Data memory endPool = latestCumulativeFactorsPool(_transcoder, _endRound);\\n\\n        return EarningsPoolLIP36.delegatorCumulativeStakeAndFees(startPool, endPool, _stake, _fees);\\n    }\\n\\n    /**\\n     * @notice Return the pending stake and fees for a delegator\\n     * @param _delegator Address of a delegator\\n     * @param _endRound The last round to claim earnings for when calculating the pending stake and fees\\n     * @return stake , fees where stake is the delegator's pending stake and fees is the delegator's pending fees\\n     */\\n    function pendingStakeAndFees(address _delegator, uint256 _endRound)\\n        internal\\n        view\\n        returns (uint256 stake, uint256 fees)\\n    {\\n        Delegator storage del = delegators[_delegator];\\n        Transcoder storage t = transcoders[del.delegateAddress];\\n\\n        fees = del.fees;\\n        stake = del.bondedAmount;\\n\\n        uint256 startRound = del.lastClaimRound.add(1);\\n        address delegateAddr = del.delegateAddress;\\n        bool isTranscoder = _delegator == delegateAddr;\\n\\n        // Make sure there is a round to claim i.e. end round - (start round - 1) > 0\\n        if (startRound <= _endRound) {\\n            (stake, fees) = delegatorCumulativeStakeAndFees(t, startRound.sub(1), _endRound, stake, fees);\\n        }\\n        // cumulativeRewards and cumulativeFees will track *all* rewards/fees earned by the transcoder\\n        // so it is important that this is only executed with the end round as the current round or else\\n        // the returned stake and fees will reflect rewards/fees earned in the future relative to the end round\\n        if (isTranscoder) {\\n            stake = stake.add(t.cumulativeRewards);\\n            fees = fees.add(t.cumulativeFees);\\n        }\\n\\n        return (stake, fees);\\n    }\\n\\n    /**\\n     * @dev Increase the total stake for a delegate and updates its 'lastActiveStakeUpdateRound'\\n     * @param _delegate The delegate to increase the stake for\\n     * @param _amount The amount to increase the stake for '_delegate' by\\n     */\\n    function increaseTotalStake(\\n        address _delegate,\\n        uint256 _amount,\\n        address _newPosPrev,\\n        address _newPosNext\\n    ) internal autoCheckpoint(_delegate) {\\n        return increaseTotalStakeUncheckpointed(_delegate, _amount, _newPosPrev, _newPosNext);\\n    }\\n\\n    /**\\n     * @dev Implementation of increaseTotalStake that does not checkpoint the caller, to be used by functions that\\n     * guarantee the checkpointing themselves.\\n     */\\n    function increaseTotalStakeUncheckpointed(\\n        address _delegate,\\n        uint256 _amount,\\n        address _newPosPrev,\\n        address _newPosNext\\n    ) internal {\\n        Transcoder storage t = transcoders[_delegate];\\n\\n        uint256 currStake = transcoderTotalStake(_delegate);\\n        uint256 newStake = currStake.add(_amount);\\n\\n        if (isRegisteredTranscoder(_delegate)) {\\n            uint256 currRound = roundsManager().currentRound();\\n            uint256 nextRound = currRound.add(1);\\n\\n            // If the transcoder is already in the active set update its stake and return\\n            if (transcoderPool.contains(_delegate)) {\\n                transcoderPool.updateKey(_delegate, newStake, _newPosPrev, _newPosNext);\\n                nextRoundTotalActiveStake = nextRoundTotalActiveStake.add(_amount);\\n\\n                // currStake (the transcoder's delegatedAmount field) will reflect the transcoder's stake from lastActiveStakeUpdateRound\\n                // because it is updated every time lastActiveStakeUpdateRound is updated\\n                // The current active total stake is set to currStake to ensure that the value can be used in updateTranscoderWithRewards()\\n                // and updateTranscoderWithFees() when lastActiveStakeUpdateRound > currentRound\\n                if (t.lastActiveStakeUpdateRound < currRound) {\\n                    t.earningsPoolPerRound[currRound].setStake(currStake);\\n                }\\n\\n                t.earningsPoolPerRound[nextRound].setStake(newStake);\\n                t.lastActiveStakeUpdateRound = nextRound;\\n            } else {\\n                // Check if the transcoder is eligible to join the active set in the update round\\n                tryToJoinActiveSet(_delegate, newStake, nextRound, _newPosPrev, _newPosNext);\\n            }\\n        }\\n\\n        // Increase delegate's delegated amount\\n        delegators[_delegate].delegatedAmount = newStake;\\n    }\\n\\n    /**\\n     * @dev Decrease the total stake for a delegate and updates its 'lastActiveStakeUpdateRound'\\n     * @param _delegate The transcoder to decrease the stake for\\n     * @param _amount The amount to decrease the stake for '_delegate' by\\n     */\\n    function decreaseTotalStake(\\n        address _delegate,\\n        uint256 _amount,\\n        address _newPosPrev,\\n        address _newPosNext\\n    ) internal autoCheckpoint(_delegate) {\\n        Transcoder storage t = transcoders[_delegate];\\n\\n        uint256 currStake = transcoderTotalStake(_delegate);\\n        uint256 newStake = currStake.sub(_amount);\\n\\n        if (transcoderPool.contains(_delegate)) {\\n            uint256 currRound = roundsManager().currentRound();\\n            uint256 nextRound = currRound.add(1);\\n\\n            transcoderPool.updateKey(_delegate, newStake, _newPosPrev, _newPosNext);\\n            nextRoundTotalActiveStake = nextRoundTotalActiveStake.sub(_amount);\\n\\n            // currStake (the transcoder's delegatedAmount field) will reflect the transcoder's stake from lastActiveStakeUpdateRound\\n            // because it is updated every time lastActiveStakeUpdateRound is updated\\n            // The current active total stake is set to currStake to ensure that the value can be used in updateTranscoderWithRewards()\\n            // and updateTranscoderWithFees() when lastActiveStakeUpdateRound > currentRound\\n            if (t.lastActiveStakeUpdateRound < currRound) {\\n                t.earningsPoolPerRound[currRound].setStake(currStake);\\n            }\\n\\n            t.lastActiveStakeUpdateRound = nextRound;\\n            t.earningsPoolPerRound[nextRound].setStake(newStake);\\n        }\\n\\n        // Decrease old delegate's delegated amount\\n        delegators[_delegate].delegatedAmount = newStake;\\n    }\\n\\n    /**\\n     * @dev Tries to add a transcoder to active transcoder pool, evicts the active transcoder with the lowest stake if the pool is full\\n     * @param _transcoder The transcoder to insert into the transcoder pool\\n     * @param _totalStake The total stake for '_transcoder'\\n     * @param _activationRound The round in which the transcoder should become active\\n     */\\n    function tryToJoinActiveSet(\\n        address _transcoder,\\n        uint256 _totalStake,\\n        uint256 _activationRound,\\n        address _newPosPrev,\\n        address _newPosNext\\n    ) internal {\\n        uint256 pendingNextRoundTotalActiveStake = nextRoundTotalActiveStake;\\n\\n        if (transcoderPool.isFull()) {\\n            address lastTranscoder = transcoderPool.getLast();\\n            uint256 lastStake = transcoderTotalStake(lastTranscoder);\\n\\n            // If the pool is full and the transcoder has less stake than the least stake transcoder in the pool\\n            // then the transcoder is unable to join the active set for the next round\\n            if (_totalStake <= lastStake) {\\n                return;\\n            }\\n\\n            // Evict the least stake transcoder from the active set for the next round\\n            // Not zeroing 'Transcoder.lastActiveStakeUpdateRound' saves gas (5k when transcoder is evicted and 20k when transcoder is reinserted)\\n            // There should be no side-effects as long as the value is properly updated on stake updates\\n            // Not zeroing the stake on the current round's 'EarningsPool' saves gas and should have no side effects as long as\\n            // 'EarningsPool.setStake()' is called whenever a transcoder becomes active again.\\n            transcoderPool.remove(lastTranscoder);\\n            transcoders[lastTranscoder].deactivationRound = _activationRound;\\n            pendingNextRoundTotalActiveStake = pendingNextRoundTotalActiveStake.sub(lastStake);\\n\\n            emit TranscoderDeactivated(lastTranscoder, _activationRound);\\n        }\\n\\n        transcoderPool.insert(_transcoder, _totalStake, _newPosPrev, _newPosNext);\\n        pendingNextRoundTotalActiveStake = pendingNextRoundTotalActiveStake.add(_totalStake);\\n        Transcoder storage t = transcoders[_transcoder];\\n        t.lastActiveStakeUpdateRound = _activationRound;\\n        t.activationRound = _activationRound;\\n        t.deactivationRound = MAX_FUTURE_ROUND;\\n        t.earningsPoolPerRound[_activationRound].setStake(_totalStake);\\n        nextRoundTotalActiveStake = pendingNextRoundTotalActiveStake;\\n        emit TranscoderActivated(_transcoder, _activationRound);\\n    }\\n\\n    /**\\n     * @dev Remove a transcoder from the pool and deactivate it\\n     */\\n    function resignTranscoder(address _transcoder) internal {\\n        // Not zeroing 'Transcoder.lastActiveStakeUpdateRound' saves gas (5k when transcoder is evicted and 20k when transcoder is reinserted)\\n        // There should be no side-effects as long as the value is properly updated on stake updates\\n        // Not zeroing the stake on the current round's 'EarningsPool' saves gas and should have no side effects as long as\\n        // 'EarningsPool.setStake()' is called whenever a transcoder becomes active again.\\n        transcoderPool.remove(_transcoder);\\n        nextRoundTotalActiveStake = nextRoundTotalActiveStake.sub(transcoderTotalStake(_transcoder));\\n        uint256 deactivationRound = roundsManager().currentRound().add(1);\\n        transcoders[_transcoder].deactivationRound = deactivationRound;\\n        emit TranscoderDeactivated(_transcoder, deactivationRound);\\n    }\\n\\n    /**\\n     * @dev Update a transcoder with rewards and update the transcoder pool with an optional list hint if needed.\\n     * See SortedDoublyLL.sol for details on list hints. This function updates the transcoder state but does not\\n     * checkpoint it as it assumes the caller will ensure that.\\n     * @param _transcoder Address of transcoder\\n     * @param _rewards Amount of rewards\\n     * @param _round Round that transcoder is updated\\n     * @param _newPosPrev Address of previous transcoder in pool if the transcoder is in the pool\\n     * @param _newPosNext Address of next transcoder in pool if the transcoder is in the pool\\n     */\\n    function updateTranscoderWithRewards(\\n        address _transcoder,\\n        uint256 _rewards,\\n        uint256 _round,\\n        address _newPosPrev,\\n        address _newPosNext\\n    ) internal {\\n        Transcoder storage t = transcoders[_transcoder];\\n        EarningsPool.Data storage earningsPool = t.earningsPoolPerRound[_round];\\n        EarningsPool.Data memory prevEarningsPool = cumulativeFactorsPool(t, t.lastRewardRound);\\n\\n        t.activeCumulativeRewards = t.cumulativeRewards;\\n\\n        uint256 transcoderCommissionRewards = MathUtils.percOf(_rewards, earningsPool.transcoderRewardCut);\\n        uint256 delegatorsRewards = _rewards.sub(transcoderCommissionRewards);\\n        // Calculate the rewards earned by the transcoder's earned rewards\\n        uint256 transcoderRewardStakeRewards = PreciseMathUtils.percOf(\\n            delegatorsRewards,\\n            t.activeCumulativeRewards,\\n            earningsPool.totalStake\\n        );\\n        // Track rewards earned by the transcoder based on its earned rewards and rewardCut\\n        t.cumulativeRewards = t.cumulativeRewards.add(transcoderRewardStakeRewards).add(transcoderCommissionRewards);\\n        // Update cumulative reward factor with new rewards\\n        // The cumulativeRewardFactor is used to calculate rewards for all delegators including the transcoder (self-delegated)\\n        // Note that delegatorsRewards includes transcoderRewardStakeRewards, but no delegator will claim that amount using\\n        // the earnings claiming algorithm and instead that amount is accounted for in the transcoder's cumulativeRewards field\\n        earningsPool.updateCumulativeRewardFactor(prevEarningsPool, delegatorsRewards);\\n        // Update transcoder's total stake with rewards\\n        increaseTotalStakeUncheckpointed(_transcoder, _rewards, _newPosPrev, _newPosNext);\\n    }\\n\\n    /**\\n     * @dev Update a delegator with token pools shares from its lastClaimRound through a given round\\n     *\\n     * Notice that this function udpates the delegator storage but does not checkpoint its state. Since it is internal\\n     * it assumes the top-level caller will checkpoint it instead.\\n     * @param _delegator Delegator address\\n     * @param _endRound The last round for which to update a delegator's stake with earnings pool shares\\n     * @param _lastClaimRound The round for which a delegator has last claimed earnings\\n     */\\n    function updateDelegatorWithEarnings(\\n        address _delegator,\\n        uint256 _endRound,\\n        uint256 _lastClaimRound\\n    ) internal {\\n        Delegator storage del = delegators[_delegator];\\n        uint256 startRound = _lastClaimRound.add(1);\\n        uint256 currentBondedAmount = del.bondedAmount;\\n        uint256 currentFees = del.fees;\\n\\n        // Only will have earnings to claim if you have a delegate\\n        // If not delegated, skip the earnings claim process\\n        if (del.delegateAddress != address(0)) {\\n            (currentBondedAmount, currentFees) = pendingStakeAndFees(_delegator, _endRound);\\n\\n            // Check whether the endEarningsPool is initialised\\n            // If it is not initialised set it's cumulative factors so that they can be used when a delegator\\n            // next claims earnings as the start cumulative factors (see delegatorCumulativeStakeAndFees())\\n            Transcoder storage t = transcoders[del.delegateAddress];\\n            EarningsPool.Data storage endEarningsPool = t.earningsPoolPerRound[_endRound];\\n            if (endEarningsPool.cumulativeRewardFactor == 0) {\\n                uint256 lastRewardRound = t.lastRewardRound;\\n                if (lastRewardRound < _endRound) {\\n                    endEarningsPool.cumulativeRewardFactor = cumulativeFactorsPool(t, lastRewardRound)\\n                        .cumulativeRewardFactor;\\n                }\\n            }\\n            if (endEarningsPool.cumulativeFeeFactor == 0) {\\n                uint256 lastFeeRound = t.lastFeeRound;\\n                if (lastFeeRound < _endRound) {\\n                    endEarningsPool.cumulativeFeeFactor = cumulativeFactorsPool(t, lastFeeRound).cumulativeFeeFactor;\\n                }\\n            }\\n\\n            if (del.delegateAddress == _delegator) {\\n                t.cumulativeFees = 0;\\n                t.cumulativeRewards = 0;\\n                // activeCumulativeRewards is not cleared here because the next reward() call will set it to cumulativeRewards\\n            }\\n        }\\n\\n        emit EarningsClaimed(\\n            del.delegateAddress,\\n            _delegator,\\n            currentBondedAmount.sub(del.bondedAmount),\\n            currentFees.sub(del.fees),\\n            startRound,\\n            _endRound\\n        );\\n\\n        del.lastClaimRound = _endRound;\\n        // Rewards are bonded by default\\n        del.bondedAmount = currentBondedAmount;\\n        del.fees = currentFees;\\n    }\\n\\n    /**\\n     * @dev Update the state of a delegator and its delegate by processing a rebond using an unbonding lock and update the transcoder pool with an optional\\n     * list hint if needed. See SortedDoublyLL.sol for details on list hints\\n     * @param _delegator Address of delegator\\n     * @param _unbondingLockId ID of unbonding lock to rebond with\\n     * @param _newPosPrev Address of previous transcoder in pool if the delegate is already in or joins the pool\\n     * @param _newPosNext Address of next transcoder in pool if the delegate is already in or joins the pool\\n     */\\n    function processRebond(\\n        address _delegator,\\n        uint256 _unbondingLockId,\\n        address _newPosPrev,\\n        address _newPosNext\\n    ) internal autoCheckpoint(_delegator) {\\n        Delegator storage del = delegators[_delegator];\\n        UnbondingLock storage lock = del.unbondingLocks[_unbondingLockId];\\n\\n        require(isValidUnbondingLock(_delegator, _unbondingLockId), \\\"invalid unbonding lock ID\\\");\\n\\n        uint256 amount = lock.amount;\\n        // Increase delegator's bonded amount\\n        del.bondedAmount = del.bondedAmount.add(amount);\\n\\n        // Delete lock\\n        delete del.unbondingLocks[_unbondingLockId];\\n\\n        increaseTotalStake(del.delegateAddress, amount, _newPosPrev, _newPosNext);\\n\\n        emit Rebond(del.delegateAddress, _delegator, _unbondingLockId, amount);\\n    }\\n\\n    /**\\n     * @dev Return LivepeerToken interface\\n     * @return Livepeer token contract registered with Controller\\n     */\\n    function livepeerToken() internal view returns (ILivepeerToken) {\\n        return ILivepeerToken(controller.getContract(keccak256(\\\"LivepeerToken\\\")));\\n    }\\n\\n    /**\\n     * @dev Return Minter interface\\n     * @return Minter contract registered with Controller\\n     */\\n    function minter() internal view returns (IMinter) {\\n        return IMinter(controller.getContract(keccak256(\\\"Minter\\\")));\\n    }\\n\\n    /**\\n     * @dev Return Address of L2Migrator\\n     * @return l2Migrator contract address registered with Controller\\n     */\\n    function l2Migrator() internal view returns (address) {\\n        return controller.getContract(keccak256(\\\"L2Migrator\\\"));\\n    }\\n\\n    /**\\n     * @dev Return RoundsManager interface\\n     * @return RoundsManager contract registered with Controller\\n     */\\n    function roundsManager() internal view returns (IRoundsManager) {\\n        return IRoundsManager(controller.getContract(keccak256(\\\"RoundsManager\\\")));\\n    }\\n\\n    function treasury() internal view returns (address) {\\n        return controller.getContract(keccak256(\\\"Treasury\\\"));\\n    }\\n\\n    function bondingVotes() internal view returns (IBondingVotes) {\\n        return IBondingVotes(controller.getContract(keccak256(\\\"BondingVotes\\\")));\\n    }\\n\\n    function _onlyTicketBroker() internal view {\\n        require(msg.sender == controller.getContract(keccak256(\\\"TicketBroker\\\")), \\\"caller must be TicketBroker\\\");\\n    }\\n\\n    function _onlyRoundsManager() internal view {\\n        require(msg.sender == controller.getContract(keccak256(\\\"RoundsManager\\\")), \\\"caller must be RoundsManager\\\");\\n    }\\n\\n    function _onlyVerifier() internal view {\\n        require(msg.sender == controller.getContract(keccak256(\\\"Verifier\\\")), \\\"caller must be Verifier\\\");\\n    }\\n\\n    function _currentRoundInitialized() internal view {\\n        require(roundsManager().currentRoundInitialized(), \\\"current round is not initialized\\\");\\n    }\\n\\n    function _autoClaimEarnings(address _delegator) internal {\\n        uint256 currentRound = roundsManager().currentRound();\\n        uint256 lastClaimRound = delegators[_delegator].lastClaimRound;\\n        if (lastClaimRound < currentRound) {\\n            updateDelegatorWithEarnings(_delegator, currentRound, lastClaimRound);\\n        }\\n    }\\n}\\n\",\"keccak256\":\"0x6371f5b170ed9bce67337652c811aad06d349d40ee2a25d39fb97b6264d27198\",\"license\":\"MIT\"},\"contracts/bonding/IBondingManager.sol\":{\"content\":\"// SPDX-License-Identifier: MIT\\npragma solidity 0.8.9;\\n\\n/**\\n * @title Interface for BondingManager\\n * TODO: switch to interface type\\n */\\ninterface IBondingManager {\\n    event TranscoderUpdate(address indexed transcoder, uint256 rewardCut, uint256 feeShare);\\n    event TranscoderActivated(address indexed transcoder, uint256 activationRound);\\n    event TranscoderDeactivated(address indexed transcoder, uint256 deactivationRound);\\n    event TranscoderSlashed(address indexed transcoder, address finder, uint256 penalty, uint256 finderReward);\\n    event Reward(address indexed transcoder, uint256 amount);\\n    event TreasuryReward(address indexed transcoder, address treasury, uint256 amount);\\n    event Bond(\\n        address indexed newDelegate,\\n        address indexed oldDelegate,\\n        address indexed delegator,\\n        uint256 additionalAmount,\\n        uint256 bondedAmount\\n    );\\n    event Unbond(\\n        address indexed delegate,\\n        address indexed delegator,\\n        uint256 unbondingLockId,\\n        uint256 amount,\\n        uint256 withdrawRound\\n    );\\n    event Rebond(address indexed delegate, address indexed delegator, uint256 unbondingLockId, uint256 amount);\\n    event TransferBond(\\n        address indexed oldDelegator,\\n        address indexed newDelegator,\\n        uint256 oldUnbondingLockId,\\n        uint256 newUnbondingLockId,\\n        uint256 amount\\n    );\\n    event WithdrawStake(address indexed delegator, uint256 unbondingLockId, uint256 amount, uint256 withdrawRound);\\n    event WithdrawFees(address indexed delegator, address recipient, uint256 amount);\\n    event EarningsClaimed(\\n        address indexed delegate,\\n        address indexed delegator,\\n        uint256 rewards,\\n        uint256 fees,\\n        uint256 startRound,\\n        uint256 endRound\\n    );\\n\\n    // Deprecated events\\n    // These event signatures can be used to construct the appropriate topic hashes to filter for past logs corresponding\\n    // to these deprecated events.\\n    // event Bond(address indexed delegate, address indexed delegator);\\n    // event Unbond(address indexed delegate, address indexed delegator);\\n    // event WithdrawStake(address indexed delegator);\\n    // event TranscoderUpdate(address indexed transcoder, uint256 pendingRewardCut, uint256 pendingFeeShare, uint256 pendingPricePerSegment, bool registered);\\n    // event TranscoderEvicted(address indexed transcoder);\\n    // event TranscoderResigned(address indexed transcoder);\\n\\n    // External functions\\n    function updateTranscoderWithFees(\\n        address _transcoder,\\n        uint256 _fees,\\n        uint256 _round\\n    ) external;\\n\\n    function slashTranscoder(\\n        address _transcoder,\\n        address _finder,\\n        uint256 _slashAmount,\\n        uint256 _finderFee\\n    ) external;\\n\\n    function setCurrentRoundTotalActiveStake() external;\\n\\n    // Public functions\\n    function getTranscoderPoolSize() external view returns (uint256);\\n\\n    function transcoderTotalStake(address _transcoder) external view returns (uint256);\\n\\n    function isActiveTranscoder(address _transcoder) external view returns (bool);\\n\\n    function getTotalBonded() external view returns (uint256);\\n}\\n\",\"keccak256\":\"0xd76b4f24be3a14f28353774cbf6471164d0279ca2bdaf155cafc92760b1c932c\",\"license\":\"MIT\"},\"contracts/bonding/IBondingVotes.sol\":{\"content\":\"// SPDX-License-Identifier: MIT\\npragma solidity ^0.8.9;\\n\\nimport \\\"@openzeppelin/contracts-upgradeable/interfaces/IERC6372Upgradeable.sol\\\";\\n\\nimport \\\"../treasury/IVotes.sol\\\";\\n\\n/**\\n * @title Interface for BondingVotes\\n */\\ninterface IBondingVotes is IERC6372Upgradeable, IVotes {\\n    error InvalidCaller(address caller, address required);\\n    error InvalidStartRound(uint256 checkpointRound, uint256 requiredRound);\\n    error FutureLastClaimRound(uint256 lastClaimRound, uint256 maxAllowed);\\n    error FutureTotalStakeCheckpoint(uint256 checkpointRound, uint256 maxAllowedRound);\\n\\n    error FutureLookup(uint256 queryRound, uint256 maxAllowed);\\n    error MissingEarningsPool(address transcoder, uint256 round);\\n\\n    // Indicates that the called function is not supported in this contract and should be performed through the\\n    // BondingManager instead. This is mostly used for IVotes delegation methods which must be bonds instead.\\n    error MustCallBondingManager(string bondingManagerFunction);\\n\\n    // BondingManager hooks\\n\\n    function checkpointBondingState(\\n        address _account,\\n        uint256 _startRound,\\n        uint256 _bondedAmount,\\n        address _delegateAddress,\\n        uint256 _delegatedAmount,\\n        uint256 _lastClaimRound,\\n        uint256 _lastRewardRound\\n    ) external;\\n\\n    function checkpointTotalActiveStake(uint256 _totalStake, uint256 _round) external;\\n\\n    // Historical stake access functions\\n\\n    function hasCheckpoint(address _account) external view returns (bool);\\n\\n    function getTotalActiveStakeAt(uint256 _round) external view returns (uint256);\\n\\n    function getBondingStateAt(address _account, uint256 _round)\\n        external\\n        view\\n        returns (uint256 amount, address delegateAddress);\\n}\\n\",\"keccak256\":\"0xc4402819402657c229e5276c6c2423d8c57a9ff250d27f2b9b396c721c1bf448\",\"license\":\"MIT\"},\"contracts/bonding/libraries/EarningsPool.sol\":{\"content\":\"// SPDX-License-Identifier: MIT\\npragma solidity 0.8.9;\\n\\nimport \\\"../../libraries/MathUtils.sol\\\";\\n\\nimport \\\"@openzeppelin/contracts/utils/math/SafeMath.sol\\\";\\n\\n/**\\n * @title EarningsPool\\n * @dev Manages reward and fee pools for delegators and transcoders\\n */\\nlibrary EarningsPool {\\n    using SafeMath for uint256;\\n\\n    struct Data {\\n        uint256 totalStake; // Transcoder's total stake during the earnings pool's round\\n        uint256 transcoderRewardCut; // Transcoder's reward cut during the earnings pool's round\\n        uint256 transcoderFeeShare; // Transcoder's fee share during the earnings pool's round\\n        // LIP-36 (https://github.com/livepeer/LIPs/blob/master/LIPs/LIP-36.md) fields\\n        // See EarningsPoolLIP36.sol\\n        uint256 cumulativeRewardFactor;\\n        uint256 cumulativeFeeFactor;\\n    }\\n\\n    /**\\n     * @dev Sets transcoderRewardCut and transcoderFeeshare for an EarningsPool\\n     * @param earningsPool Storage pointer to EarningsPool struct\\n     * @param _rewardCut Reward cut of transcoder during the earnings pool's round\\n     * @param _feeShare Fee share of transcoder during the earnings pool's round\\n     */\\n    function setCommission(\\n        EarningsPool.Data storage earningsPool,\\n        uint256 _rewardCut,\\n        uint256 _feeShare\\n    ) internal {\\n        earningsPool.transcoderRewardCut = _rewardCut;\\n        earningsPool.transcoderFeeShare = _feeShare;\\n    }\\n\\n    /**\\n     * @dev Sets totalStake for an EarningsPool\\n     * @param earningsPool Storage pointer to EarningsPool struct\\n     * @param _stake Total stake of the transcoder during the earnings pool's round\\n     */\\n    function setStake(EarningsPool.Data storage earningsPool, uint256 _stake) internal {\\n        earningsPool.totalStake = _stake;\\n    }\\n}\\n\",\"keccak256\":\"0x0a281920caf1429fc6afe7de303b8067c182190a450a190c8b9dc282aa7edfa0\",\"license\":\"MIT\"},\"contracts/bonding/libraries/EarningsPoolLIP36.sol\":{\"content\":\"// SPDX-License-Identifier: MIT\\npragma solidity 0.8.9;\\n\\nimport \\\"./EarningsPool.sol\\\";\\nimport \\\"../../libraries/PreciseMathUtils.sol\\\";\\n\\nimport \\\"@openzeppelin/contracts/utils/math/SafeMath.sol\\\";\\n\\nlibrary EarningsPoolLIP36 {\\n    using SafeMath for uint256;\\n\\n    /**\\n     * @notice Update the cumulative fee factor stored in an earnings pool with new fees\\n     * @param earningsPool Storage pointer to EarningsPools.Data struct\\n     * @param _prevEarningsPool In-memory EarningsPool.Data struct that stores the previous cumulative reward and fee factors\\n     * @param _fees Amount of new fees\\n     */\\n    function updateCumulativeFeeFactor(\\n        EarningsPool.Data storage earningsPool,\\n        EarningsPool.Data memory _prevEarningsPool,\\n        uint256 _fees\\n    ) internal {\\n        uint256 prevCumulativeFeeFactor = _prevEarningsPool.cumulativeFeeFactor;\\n        uint256 prevCumulativeRewardFactor = _prevEarningsPool.cumulativeRewardFactor != 0\\n            ? _prevEarningsPool.cumulativeRewardFactor\\n            : PreciseMathUtils.percPoints(1, 1);\\n\\n        // Initialize the cumulativeFeeFactor when adding fees for the first time\\n        if (earningsPool.cumulativeFeeFactor == 0) {\\n            earningsPool.cumulativeFeeFactor = prevCumulativeFeeFactor.add(\\n                PreciseMathUtils.percOf(prevCumulativeRewardFactor, _fees, earningsPool.totalStake)\\n            );\\n            return;\\n        }\\n\\n        earningsPool.cumulativeFeeFactor = earningsPool.cumulativeFeeFactor.add(\\n            PreciseMathUtils.percOf(prevCumulativeRewardFactor, _fees, earningsPool.totalStake)\\n        );\\n    }\\n\\n    /**\\n     * @notice Update the cumulative reward factor stored in an earnings pool with new rewards\\n     * @param earningsPool Storage pointer to EarningsPool.Data struct\\n     * @param _prevEarningsPool Storage pointer to EarningsPool.Data struct that stores the previous cumulative reward factor\\n     * @param _rewards Amount of new rewards\\n     */\\n    function updateCumulativeRewardFactor(\\n        EarningsPool.Data storage earningsPool,\\n        EarningsPool.Data memory _prevEarningsPool,\\n        uint256 _rewards\\n    ) internal {\\n        uint256 prevCumulativeRewardFactor = _prevEarningsPool.cumulativeRewardFactor != 0\\n            ? _prevEarningsPool.cumulativeRewardFactor\\n            : PreciseMathUtils.percPoints(1, 1);\\n\\n        earningsPool.cumulativeRewardFactor = prevCumulativeRewardFactor.add(\\n            PreciseMathUtils.percOf(prevCumulativeRewardFactor, _rewards, earningsPool.totalStake)\\n        );\\n    }\\n\\n    /**\\n     * @notice Calculates a delegator's cumulative stake and fees using the LIP-36 earnings claiming algorithm.\\n     * @param _startPool The earning pool from the start round for the start cumulative factors. Normally this is the\\n     * earning pool from the {Delegator-lastclaimRound}+1 round, as the round where `bondedAmount` was measured.\\n     * @param _endPool The earning pool from the end round for the end cumulative factors\\n     * @param _stake The delegator initial stake before including earned rewards. Normally the {Delegator-bondedAmount}\\n     * @param _fees The delegator's initial fees before including earned fees\\n     * @return cStake , cFees where cStake is the delegator's cumulative stake including earned rewards and cFees is the\\n     * delegator's cumulative fees including earned fees\\n     */\\n    function delegatorCumulativeStakeAndFees(\\n        EarningsPool.Data memory _startPool,\\n        EarningsPool.Data memory _endPool,\\n        uint256 _stake,\\n        uint256 _fees\\n    ) internal pure returns (uint256 cStake, uint256 cFees) {\\n        // If the start cumulativeRewardFactor is 0 set the default value to PreciseMathUtils.percPoints(1, 1)\\n        if (_startPool.cumulativeRewardFactor == 0) {\\n            _startPool.cumulativeRewardFactor = PreciseMathUtils.percPoints(1, 1);\\n        }\\n\\n        // If the end cumulativeRewardFactor is 0 set the default value to PreciseMathUtils.percPoints(1, 1)\\n        if (_endPool.cumulativeRewardFactor == 0) {\\n            _endPool.cumulativeRewardFactor = PreciseMathUtils.percPoints(1, 1);\\n        }\\n\\n        cFees = _fees.add(\\n            PreciseMathUtils.percOf(\\n                _stake,\\n                _endPool.cumulativeFeeFactor.sub(_startPool.cumulativeFeeFactor),\\n                _startPool.cumulativeRewardFactor\\n            )\\n        );\\n\\n        cStake = PreciseMathUtils.percOf(_stake, _endPool.cumulativeRewardFactor, _startPool.cumulativeRewardFactor);\\n\\n        return (cStake, cFees);\\n    }\\n}\\n\",\"keccak256\":\"0xe4d2f9754d7d0d2d4642f30f2ea6d6ed588e78ebd7bdfb665fcd85c211f726a4\",\"license\":\"MIT\"},\"contracts/libraries/MathUtils.sol\":{\"content\":\"// SPDX-License-Identifier: MIT\\npragma solidity 0.8.9;\\n\\nimport \\\"@openzeppelin/contracts/utils/math/SafeMath.sol\\\";\\n\\nlibrary MathUtils {\\n    using SafeMath for uint256;\\n\\n    // Divisor used for representing percentages\\n    uint256 public constant PERC_DIVISOR = 1000000;\\n\\n    /**\\n     * @dev Returns whether an amount is a valid percentage out of PERC_DIVISOR\\n     * @param _amount Amount that is supposed to be a percentage\\n     */\\n    function validPerc(uint256 _amount) internal pure returns (bool) {\\n        return _amount <= PERC_DIVISOR;\\n    }\\n\\n    /**\\n     * @dev Compute percentage of a value with the percentage represented by a fraction\\n     * @param _amount Amount to take the percentage of\\n     * @param _fracNum Numerator of fraction representing the percentage\\n     * @param _fracDenom Denominator of fraction representing the percentage\\n     */\\n    function percOf(\\n        uint256 _amount,\\n        uint256 _fracNum,\\n        uint256 _fracDenom\\n    ) internal pure returns (uint256) {\\n        return _amount.mul(percPoints(_fracNum, _fracDenom)).div(PERC_DIVISOR);\\n    }\\n\\n    /**\\n     * @dev Compute percentage of a value with the percentage represented by a fraction over PERC_DIVISOR\\n     * @param _amount Amount to take the percentage of\\n     * @param _fracNum Numerator of fraction representing the percentage with PERC_DIVISOR as the denominator\\n     */\\n    function percOf(uint256 _amount, uint256 _fracNum) internal pure returns (uint256) {\\n        return _amount.mul(_fracNum).div(PERC_DIVISOR);\\n    }\\n\\n    /**\\n     * @dev Compute percentage representation of a fraction\\n     * @param _fracNum Numerator of fraction represeting the percentage\\n     * @param _fracDenom Denominator of fraction represeting the percentage\\n     */\\n    function percPoints(uint256 _fracNum, uint256 _fracDenom) internal pure returns (uint256) {\\n        return _fracNum.mul(PERC_DIVISOR).div(_fracDenom);\\n    }\\n}\\n\",\"keccak256\":\"0x1df26c159dc63d804d3fda28e41b18487e8619009082c56e013aa6c9a58de253\",\"license\":\"MIT\"},\"contracts/libraries/PreciseMathUtils.sol\":{\"content\":\"// SPDX-License-Identifier: MIT\\npragma solidity 0.8.9;\\n\\nimport \\\"@openzeppelin/contracts/utils/math/SafeMath.sol\\\";\\n\\nlibrary PreciseMathUtils {\\n    using SafeMath for uint256;\\n\\n    // Divisor used for representing percentages\\n    uint256 public constant PERC_DIVISOR = 10**27;\\n\\n    /**\\n     * @dev Returns whether an amount is a valid percentage out of PERC_DIVISOR\\n     * @param _amount Amount that is supposed to be a percentage\\n     */\\n    function validPerc(uint256 _amount) internal pure returns (bool) {\\n        return _amount <= PERC_DIVISOR;\\n    }\\n\\n    /**\\n     * @dev Compute percentage of a value with the percentage represented by a fraction\\n     * @param _amount Amount to take the percentage of\\n     * @param _fracNum Numerator of fraction representing the percentage\\n     * @param _fracDenom Denominator of fraction representing the percentage\\n     */\\n    function percOf(\\n        uint256 _amount,\\n        uint256 _fracNum,\\n        uint256 _fracDenom\\n    ) internal pure returns (uint256) {\\n        return _amount.mul(percPoints(_fracNum, _fracDenom)).div(PERC_DIVISOR);\\n    }\\n\\n    /**\\n     * @dev Compute percentage of a value with the percentage represented by a fraction over PERC_DIVISOR\\n     * @param _amount Amount to take the percentage of\\n     * @param _fracNum Numerator of fraction representing the percentage with PERC_DIVISOR as the denominator\\n     */\\n    function percOf(uint256 _amount, uint256 _fracNum) internal pure returns (uint256) {\\n        return _amount.mul(_fracNum).div(PERC_DIVISOR);\\n    }\\n\\n    /**\\n     * @dev Compute percentage representation of a fraction\\n     * @param _fracNum Numerator of fraction represeting the percentage\\n     * @param _fracDenom Denominator of fraction represeting the percentage\\n     */\\n    function percPoints(uint256 _fracNum, uint256 _fracDenom) internal pure returns (uint256) {\\n        return _fracNum.mul(PERC_DIVISOR).div(_fracDenom);\\n    }\\n}\\n\",\"keccak256\":\"0x89ebb6e1db8b184d655c6c2726e3fd862a239767f8d249ca376b286ade675a9d\",\"license\":\"MIT\"},\"contracts/libraries/SortedDoublyLL.sol\":{\"content\":\"// SPDX-License-Identifier: MIT\\npragma solidity 0.8.9;\\n\\nimport \\\"@openzeppelin/contracts/utils/math/SafeMath.sol\\\";\\n\\n/**\\n * @title A sorted doubly linked list with nodes sorted in descending order. Optionally accepts insert position hints\\n *\\n * Given a new node with a `key`, a hint is of the form `(prevId, nextId)` s.t. `prevId` and `nextId` are adjacent in the list.\\n * `prevId` is a node with a key >= `key` and `nextId` is a node with a key <= `key`. If the sender provides a hint that is a valid insert position\\n * the insert operation is a constant time storage write. However, the provided hint in a given transaction might be a valid insert position, but if other transactions are included first, when\\n * the given transaction is executed the provided hint may no longer be a valid insert position. For example, one of the nodes referenced might be removed or their keys may\\n * be updated such that the the pair of nodes in the hint no longer represent a valid insert position. If one of the nodes in the hint becomes invalid, we still try to use the other\\n * valid node as a starting point for finding the appropriate insert position. If both nodes in the hint become invalid, we use the head of the list as a starting point\\n * to find the appropriate insert position.\\n */\\nlibrary SortedDoublyLL {\\n    using SafeMath for uint256;\\n\\n    // Information for a node in the list\\n    struct Node {\\n        uint256 key; // Node's key used for sorting\\n        address nextId; // Id of next node (smaller key) in the list\\n        address prevId; // Id of previous node (larger key) in the list\\n    }\\n\\n    // Information for the list\\n    struct Data {\\n        address head; // Head of the list. Also the node in the list with the largest key\\n        address tail; // Tail of the list. Also the node in the list with the smallest key\\n        uint256 maxSize; // Maximum size of the list\\n        uint256 size; // Current size of the list\\n        mapping(address => Node) nodes; // Track the corresponding ids for each node in the list\\n    }\\n\\n    /**\\n     * @dev Set the maximum size of the list\\n     * @param _size Maximum size\\n     */\\n    function setMaxSize(Data storage self, uint256 _size) public {\\n        require(_size > self.maxSize, \\\"new max size must be greater than old max size\\\");\\n\\n        self.maxSize = _size;\\n    }\\n\\n    /**\\n     * @dev Add a node to the list\\n     * @param _id Node's id\\n     * @param _key Node's key\\n     * @param _prevId Id of previous node for the insert position\\n     * @param _nextId Id of next node for the insert position\\n     */\\n    function insert(\\n        Data storage self,\\n        address _id,\\n        uint256 _key,\\n        address _prevId,\\n        address _nextId\\n    ) public {\\n        // List must not be full\\n        require(!isFull(self), \\\"list is full\\\");\\n        // List must not already contain node\\n        require(!contains(self, _id), \\\"node already in list\\\");\\n        // Node id must not be null\\n        require(_id != address(0), \\\"node id is null\\\");\\n        // Key must be non-zero\\n        require(_key > 0, \\\"key is zero\\\");\\n\\n        address prevId = _prevId;\\n        address nextId = _nextId;\\n\\n        if (!validInsertPosition(self, _key, prevId, nextId)) {\\n            // Sender's hint was not a valid insert position\\n            // Use sender's hint to find a valid insert position\\n            (prevId, nextId) = findInsertPosition(self, _key, prevId, nextId);\\n        }\\n\\n        self.nodes[_id].key = _key;\\n\\n        if (prevId == address(0) && nextId == address(0)) {\\n            // Insert as head and tail\\n            self.head = _id;\\n            self.tail = _id;\\n        } else if (prevId == address(0)) {\\n            // Insert before `prevId` as the head\\n            self.nodes[_id].nextId = self.head;\\n            self.nodes[self.head].prevId = _id;\\n            self.head = _id;\\n        } else if (nextId == address(0)) {\\n            // Insert after `nextId` as the tail\\n            self.nodes[_id].prevId = self.tail;\\n            self.nodes[self.tail].nextId = _id;\\n            self.tail = _id;\\n        } else {\\n            // Insert at insert position between `prevId` and `nextId`\\n            self.nodes[_id].nextId = nextId;\\n            self.nodes[_id].prevId = prevId;\\n            self.nodes[prevId].nextId = _id;\\n            self.nodes[nextId].prevId = _id;\\n        }\\n\\n        self.size = self.size.add(1);\\n    }\\n\\n    /**\\n     * @dev Remove a node from the list\\n     * @param _id Node's id\\n     */\\n    function remove(Data storage self, address _id) public {\\n        // List must contain the node\\n        require(contains(self, _id), \\\"node not in list\\\");\\n\\n        if (self.size > 1) {\\n            // List contains more than a single node\\n            if (_id == self.head) {\\n                // The removed node is the head\\n                // Set head to next node\\n                self.head = self.nodes[_id].nextId;\\n                // Set prev pointer of new head to null\\n                self.nodes[self.head].prevId = address(0);\\n            } else if (_id == self.tail) {\\n                // The removed node is the tail\\n                // Set tail to previous node\\n                self.tail = self.nodes[_id].prevId;\\n                // Set next pointer of new tail to null\\n                self.nodes[self.tail].nextId = address(0);\\n            } else {\\n                // The removed node is neither the head nor the tail\\n                // Set next pointer of previous node to the next node\\n                self.nodes[self.nodes[_id].prevId].nextId = self.nodes[_id].nextId;\\n                // Set prev pointer of next node to the previous node\\n                self.nodes[self.nodes[_id].nextId].prevId = self.nodes[_id].prevId;\\n            }\\n        } else {\\n            // List contains a single node\\n            // Set the head and tail to null\\n            self.head = address(0);\\n            self.tail = address(0);\\n        }\\n\\n        delete self.nodes[_id];\\n        self.size = self.size.sub(1);\\n    }\\n\\n    /**\\n     * @dev Update the key of a node in the list\\n     * @param _id Node's id\\n     * @param _newKey Node's new key\\n     * @param _prevId Id of previous node for the new insert position\\n     * @param _nextId Id of next node for the new insert position\\n     */\\n    function updateKey(\\n        Data storage self,\\n        address _id,\\n        uint256 _newKey,\\n        address _prevId,\\n        address _nextId\\n    ) public {\\n        // List must contain the node\\n        require(contains(self, _id), \\\"node not in list\\\");\\n\\n        // Remove node from the list\\n        remove(self, _id);\\n\\n        if (_newKey > 0) {\\n            // Insert node if it has a non-zero key\\n            insert(self, _id, _newKey, _prevId, _nextId);\\n        }\\n    }\\n\\n    /**\\n     * @dev Checks if the list contains a node\\n     * @param _id Address of transcoder\\n     * @return true if '_id' is in list\\n     */\\n    function contains(Data storage self, address _id) public view returns (bool) {\\n        // List only contains non-zero keys, so if key is non-zero the node exists\\n        return self.nodes[_id].key > 0;\\n    }\\n\\n    /**\\n     * @dev Checks if the list is full\\n     * @return true if list is full\\n     */\\n    function isFull(Data storage self) public view returns (bool) {\\n        return self.size == self.maxSize;\\n    }\\n\\n    /**\\n     * @dev Checks if the list is empty\\n     * @return true if list is empty\\n     */\\n    function isEmpty(Data storage self) public view returns (bool) {\\n        return self.size == 0;\\n    }\\n\\n    /**\\n     * @dev Returns the current size of the list\\n     * @return current size of the list\\n     */\\n    function getSize(Data storage self) public view returns (uint256) {\\n        return self.size;\\n    }\\n\\n    /**\\n     * @dev Returns the maximum size of the list\\n     */\\n    function getMaxSize(Data storage self) public view returns (uint256) {\\n        return self.maxSize;\\n    }\\n\\n    /**\\n     * @dev Returns the key of a node in the list\\n     * @param _id Node's id\\n     * @return key for node with '_id'\\n     */\\n    function getKey(Data storage self, address _id) public view returns (uint256) {\\n        return self.nodes[_id].key;\\n    }\\n\\n    /**\\n     * @dev Returns the first node in the list (node with the largest key)\\n     * @return address for the head of the list\\n     */\\n    function getFirst(Data storage self) public view returns (address) {\\n        return self.head;\\n    }\\n\\n    /**\\n     * @dev Returns the last node in the list (node with the smallest key)\\n     * @return address for the tail of the list\\n     */\\n    function getLast(Data storage self) public view returns (address) {\\n        return self.tail;\\n    }\\n\\n    /**\\n     * @dev Returns the next node (with a smaller key) in the list for a given node\\n     * @param _id Node's id\\n     * @return address for the node following node in list with '_id'\\n     */\\n    function getNext(Data storage self, address _id) public view returns (address) {\\n        return self.nodes[_id].nextId;\\n    }\\n\\n    /**\\n     * @dev Returns the previous node (with a larger key) in the list for a given node\\n     * @param _id Node's id\\n     * address for the node before node in list with '_id'\\n     */\\n    function getPrev(Data storage self, address _id) public view returns (address) {\\n        return self.nodes[_id].prevId;\\n    }\\n\\n    /**\\n     * @dev Check if a pair of nodes is a valid insertion point for a new node with the given key\\n     * @param _key Node's key\\n     * @param _prevId Id of previous node for the insert position\\n     * @param _nextId Id of next node for the insert position\\n     * @return if the insert position is valid\\n     */\\n    function validInsertPosition(\\n        Data storage self,\\n        uint256 _key,\\n        address _prevId,\\n        address _nextId\\n    ) public view returns (bool) {\\n        if (_prevId == address(0) && _nextId == address(0)) {\\n            // `(null, null)` is a valid insert position if the list is empty\\n            return isEmpty(self);\\n        } else if (_prevId == address(0)) {\\n            // `(null, _nextId)` is a valid insert position if `_nextId` is the head of the list\\n            return self.head == _nextId && _key >= self.nodes[_nextId].key;\\n        } else if (_nextId == address(0)) {\\n            // `(_prevId, null)` is a valid insert position if `_prevId` is the tail of the list\\n            return self.tail == _prevId && _key <= self.nodes[_prevId].key;\\n        } else {\\n            // `(_prevId, _nextId)` is a valid insert position if they are adjacent nodes and `_key` falls between the two nodes' keys\\n            return\\n                self.nodes[_prevId].nextId == _nextId &&\\n                self.nodes[_prevId].key >= _key &&\\n                _key >= self.nodes[_nextId].key;\\n        }\\n    }\\n\\n    /**\\n     * @dev Descend the list (larger keys to smaller keys) to find a valid insert position\\n     * @param _key Node's key\\n     * @param _startId Id of node to start ascending the list from\\n     */\\n    function descendList(\\n        Data storage self,\\n        uint256 _key,\\n        address _startId\\n    ) private view returns (address, address) {\\n        // If `_startId` is the head, check if the insert position is before the head\\n        if (self.head == _startId && _key >= self.nodes[_startId].key) {\\n            return (address(0), _startId);\\n        }\\n\\n        address prevId = _startId;\\n        address nextId = self.nodes[prevId].nextId;\\n\\n        // Descend the list until we reach the end or until we find a valid insert position\\n        while (prevId != address(0) && !validInsertPosition(self, _key, prevId, nextId)) {\\n            prevId = self.nodes[prevId].nextId;\\n            nextId = self.nodes[prevId].nextId;\\n        }\\n\\n        return (prevId, nextId);\\n    }\\n\\n    /**\\n     * @dev Ascend the list (smaller keys to larger keys) to find a valid insert position\\n     * @param _key Node's key\\n     * @param _startId Id of node to start descending the list from\\n     */\\n    function ascendList(\\n        Data storage self,\\n        uint256 _key,\\n        address _startId\\n    ) private view returns (address, address) {\\n        // If `_startId` is the tail, check if the insert position is after the tail\\n        if (self.tail == _startId && _key <= self.nodes[_startId].key) {\\n            return (_startId, address(0));\\n        }\\n\\n        address nextId = _startId;\\n        address prevId = self.nodes[nextId].prevId;\\n\\n        // Ascend the list until we reach the end or until we find a valid insertion point\\n        while (nextId != address(0) && !validInsertPosition(self, _key, prevId, nextId)) {\\n            nextId = self.nodes[nextId].prevId;\\n            prevId = self.nodes[nextId].prevId;\\n        }\\n\\n        return (prevId, nextId);\\n    }\\n\\n    /**\\n     * @dev Find the insert position for a new node with the given key\\n     * @param _key Node's key\\n     * @param _prevId Id of previous node for the insert position\\n     * @param _nextId Id of next node for the insert position\\n     */\\n    function findInsertPosition(\\n        Data storage self,\\n        uint256 _key,\\n        address _prevId,\\n        address _nextId\\n    ) private view returns (address, address) {\\n        address prevId = _prevId;\\n        address nextId = _nextId;\\n\\n        if (prevId != address(0)) {\\n            if (!contains(self, prevId) || _key > self.nodes[prevId].key) {\\n                // `prevId` does not exist anymore or now has a smaller key than the given key\\n                prevId = address(0);\\n            }\\n        }\\n\\n        if (nextId != address(0)) {\\n            if (!contains(self, nextId) || _key < self.nodes[nextId].key) {\\n                // `nextId` does not exist anymore or now has a larger key than the given key\\n                nextId = address(0);\\n            }\\n        }\\n\\n        if (prevId == address(0) && nextId == address(0)) {\\n            // No hint - descend list starting from head\\n            return descendList(self, _key, self.head);\\n        } else if (prevId == address(0)) {\\n            // No `prevId` for hint - ascend list starting from `nextId`\\n            return ascendList(self, _key, nextId);\\n        } else if (nextId == address(0)) {\\n            // No `nextId` for hint - descend list starting from `prevId`\\n            return descendList(self, _key, prevId);\\n        } else {\\n            // Descend list starting from `prevId`\\n            return descendList(self, _key, prevId);\\n        }\\n    }\\n}\\n\",\"keccak256\":\"0xdd26a77d6b76a7885f1a59c4b8cc6b8c1e21382012cbd9da136529160370e216\",\"license\":\"MIT\"},\"contracts/rounds/IRoundsManager.sol\":{\"content\":\"// SPDX-License-Identifier: MIT\\npragma solidity 0.8.9;\\n\\n/**\\n * @title RoundsManager interface\\n */\\ninterface IRoundsManager {\\n    // Events\\n    event NewRound(uint256 indexed round, bytes32 blockHash);\\n\\n    // Deprecated events\\n    // These event signatures can be used to construct the appropriate topic hashes to filter for past logs corresponding\\n    // to these deprecated events.\\n    // event NewRound(uint256 round)\\n\\n    // External functions\\n    function initializeRound() external;\\n\\n    function lipUpgradeRound(uint256 _lip) external view returns (uint256);\\n\\n    // Public functions\\n    function blockNum() external view returns (uint256);\\n\\n    function blockHash(uint256 _block) external view returns (bytes32);\\n\\n    function blockHashForRound(uint256 _round) external view returns (bytes32);\\n\\n    function currentRound() external view returns (uint256);\\n\\n    function currentRoundStartBlock() external view returns (uint256);\\n\\n    function currentRoundInitialized() external view returns (bool);\\n\\n    function currentRoundLocked() external view returns (bool);\\n}\\n\",\"keccak256\":\"0xfc453a476bb68b874c21678a128b46ffcad0af69008e0e3e857d46499214f75f\",\"license\":\"MIT\"},\"contracts/snapshots/IMerkleSnapshot.sol\":{\"content\":\"// SPDX-License-Identifier: MIT\\npragma solidity 0.8.9;\\n\\ninterface IMerkleSnapshot {\\n    function verify(\\n        bytes32 _id,\\n        bytes32[] calldata _proof,\\n        bytes32 _leaf\\n    ) external view returns (bool);\\n}\\n\",\"keccak256\":\"0xdc35b4faac2739b596a0773123dfe4dadfe3ecabc2ac48325b4732146cd90180\",\"license\":\"MIT\"},\"contracts/token/ILivepeerToken.sol\":{\"content\":\"// SPDX-License-Identifier: MIT\\npragma solidity 0.8.9;\\n\\nimport \\\"@openzeppelin/contracts/token/ERC20/IERC20.sol\\\";\\n\\ninterface ILivepeerToken is IERC20 {\\n    function mint(address _to, uint256 _amount) external;\\n\\n    function burn(uint256 _amount) external;\\n}\\n\",\"keccak256\":\"0xe9f35b4fd415a199993ac13e273149f9f8f2cf3d14c06927f05c40a9d6d048e1\",\"license\":\"MIT\"},\"contracts/token/IMinter.sol\":{\"content\":\"// SPDX-License-Identifier: MIT\\npragma solidity 0.8.9;\\n\\nimport \\\"../IController.sol\\\";\\n\\n/**\\n * @title Minter interface\\n */\\ninterface IMinter {\\n    // Events\\n    event SetCurrentRewardTokens(uint256 currentMintableTokens, uint256 currentInflation);\\n\\n    // External functions\\n    function createReward(uint256 _fracNum, uint256 _fracDenom) external returns (uint256);\\n\\n    function trustedTransferTokens(address _to, uint256 _amount) external;\\n\\n    function trustedBurnTokens(uint256 _amount) external;\\n\\n    function trustedWithdrawETH(address payable _to, uint256 _amount) external;\\n\\n    function depositETH() external payable returns (bool);\\n\\n    function setCurrentRewardTokens() external;\\n\\n    function currentMintableTokens() external view returns (uint256);\\n\\n    function currentMintedTokens() external view returns (uint256);\\n\\n    // Public functions\\n    function getController() external view returns (IController);\\n}\\n\",\"keccak256\":\"0x3fbb7a4239a8b5979fb4c45a41495e9694a9f454de82dca3cf6a14dfe71255c7\",\"license\":\"MIT\"},\"contracts/treasury/IVotes.sol\":{\"content\":\"// SPDX-License-Identifier: MIT\\npragma solidity 0.8.9;\\n\\nimport \\\"@openzeppelin/contracts-upgradeable/interfaces/IERC5805Upgradeable.sol\\\";\\n\\ninterface IVotes is IERC5805Upgradeable {\\n    /**\\n     * @dev Emitted when bonding change results in changes to a delegator's number of votes. This complements the events\\n     * from IERC5805 by also supporting voting power for the delegators themselves.\\n     */\\n    event DelegatorVotesChanged(address indexed delegate, uint256 previousBalance, uint256 newBalance);\\n\\n    function delegatedAt(address account, uint256 timepoint) external returns (address);\\n}\\n\",\"keccak256\":\"0xca0dcf84f2d79fabc12db5aa9ac0022c5de361e6f0d834bd56daf718979dcf5b\",\"license\":\"MIT\"},\"contracts/zeppelin/Ownable.sol\":{\"content\":\"// SPDX-License-Identifier: MIT\\npragma solidity 0.8.9;\\n\\n/**\\n * @title Ownable\\n * @dev The Ownable contract has an owner address, and provides basic authorization control\\n * functions, this simplifies the implementation of \\\"user permissions\\\".\\n */\\ncontract Ownable {\\n    address public owner;\\n\\n    event OwnershipTransferred(address indexed previousOwner, address indexed newOwner);\\n\\n    /**\\n     * @dev The Ownable constructor sets the original `owner` of the contract to the sender\\n     * account.\\n     */\\n    constructor() {\\n        owner = msg.sender;\\n    }\\n\\n    /**\\n     * @dev Throws if called by any account other than the owner.\\n     */\\n    modifier onlyOwner() {\\n        require(msg.sender == owner);\\n        _;\\n    }\\n\\n    /**\\n     * @dev Allows the current owner to transfer control of the contract to a newOwner.\\n     * @param newOwner The address to transfer ownership to.\\n     */\\n    function transferOwnership(address newOwner) public onlyOwner {\\n        require(newOwner != address(0));\\n        emit OwnershipTransferred(owner, newOwner);\\n        owner = newOwner;\\n    }\\n}\\n\",\"keccak256\":\"0x64f114689f2f161c4a4b8fc8442ab914436a33e6021bf17401eaeac73319a419\",\"license\":\"MIT\"},\"contracts/zeppelin/Pausable.sol\":{\"content\":\"// SPDX-License-Identifier: MIT\\npragma solidity 0.8.9;\\n\\nimport \\\"./Ownable.sol\\\";\\n\\n/**\\n * @title Pausable\\n * @dev Base contract which allows children to implement an emergency stop mechanism.\\n */\\ncontract Pausable is Ownable {\\n    event Pause();\\n    event Unpause();\\n\\n    bool public paused;\\n\\n    /**\\n     * @dev Modifier to make a function callable only when the contract is not paused.\\n     */\\n    modifier whenNotPaused() {\\n        require(!paused);\\n        _;\\n    }\\n\\n    /**\\n     * @dev Modifier to make a function callable only when the contract is paused.\\n     */\\n    modifier whenPaused() {\\n        require(paused);\\n        _;\\n    }\\n\\n    /**\\n     * @dev called by the owner to pause, triggers stopped state\\n     */\\n    function pause() public onlyOwner whenNotPaused {\\n        paused = true;\\n        emit Pause();\\n    }\\n\\n    /**\\n     * @dev called by the owner to unpause, returns to normal state\\n     */\\n    function unpause() public onlyOwner whenPaused {\\n        paused = false;\\n        emit Unpause();\\n    }\\n}\\n\",\"keccak256\":\"0xe9635fcac46c22547a08f6977a8c75e7341411f1201f60bdd4c79c26e6c286ef\",\"license\":\"MIT\"}},\"version\":1}",
  "bytecode": "0x60806040523480156200001157600080fd5b50604051620051cd380380620051cd83398101604081905262000034916200005a565b600080546001600160a01b0319166001600160a01b03929092169190911790556200008c565b6000602082840312156200006d57600080fd5b81516001600160a01b03811681146200008557600080fd5b9392505050565b615131806200009c6000396000f3fe608060405234801561001057600080fd5b50600436106102f15760003560e01c80635dce99481161019d5780639d0b2c7a116100e9578063cf33a0d5116100a2578063ee4e804a1161007c578063ee4e804a1461083d578063f10d1de114610850578063f595f1cc14610863578063f77c47911461087657600080fd5b8063cf33a0d514610804578063d52bd62b14610817578063eaffb3f91461082a57600080fd5b80639d0b2c7a146107115780639ef9df9414610724578063a576623114610737578063a64ad59514610740578063ad3b1b47146107de578063b78d27dc146107f157600080fd5b80637fc4606f1161015657806388a6c7491161013057806388a6c749146106c35780638b2f1652146106cb57806392eefe9b146106eb5780639500ed9b146106fe57600080fd5b80637fc4606f1461069457806381871056146106a757806384a16bbc146106ba57600080fd5b80635dce994814610574578063673a456b1461062657806368ba170c146106395780636bd9add41461064c5780636cf6d6751461065f578063713f22161461068c57600080fd5b80632a4e0d551161025c5780634196ee751161021557806351720b41116101ef57806351720b4114610552578063558f8f441461055b5780635a2a75a9146105645780635c50c3561461056c57600080fd5b80634196ee751461052d57806343d3461a14610536578063465501d31461054957600080fd5b80632a4e0d55146104745780633550aa101461048a5780633a080e931461049d5780633aeb512c146104b057806340e6f271146104c3578063412f83b6146104d657600080fd5b806322bf9d7c116102ae57806322bf9d7c14610381578063235c96031461039457806324454fc4146103bf57806324b1babf1461043b57806325d5971f1461044e57806327de9e321461046157600080fd5b80630584a373146102f6578063062e98b81461030b578063088023741461031e5780630fd02fc1146103465780631544fc6714610359578063228cb73314610379575b600080fd5b610309610304366004614bff565b610889565b005b610309610319366004614c52565b6109dc565b61033161032c366004614ccb565b610c65565b60405190151581526020015b60405180910390f35b610331610354366004614ce8565b610d17565b61036c610367366004614ccb565b610d48565b60405161033d9190614d2a565b610309610e04565b61030961038f366004614d44565b610e11565b6103a76103a2366004614ccb565b6111fb565b6040516001600160a01b03909116815260200161033d565b6104136103cd366004614ce8565b6001600160a01b03909116600090815260046020818152604080842094845260039485019091529091208054600182015460028301549483015492909301549094929392565b604080519586526020860194909452928401919091526060830152608082015260a00161033d565b610309610449366004614d8a565b611296565b61030961045c366004614d8a565b6112bd565b61030961046f366004614d8a565b611507565b61047c611516565b60405190815260200161033d565b610309610498366004614da3565b6115a2565b6103096104ab366004614ce8565b6119d6565b6103096104be366004614dd2565b6119e3565b6103096104d1366004614d8a565b611d07565b6105186104e4366004614ce8565b6001600160a01b03919091166000908152600360209081526040808320938352600790930190522080546001909101549091565b6040805192835260208301919091520161033d565b61047c60055481565b610309610544366004614e07565b611d66565b61047c60065481565b61047c60015481565b61047c600c5481565b61047c611d73565b60055461047c565b6105dc610582366004614ccb565b6001600160a01b031660009081526004602081905260409091208054600182015460028301549383015460058401546006850154600786015460088701546009880154600a90980154969995989794969395929491939092565b604080519a8b5260208b0199909952978901969096526060880194909452608087019290925260a086015260c085015260e08401526101008301526101208201526101400161033d565b610309610634366004614d8a565b611dae565b610331610647366004614ccb565b611e64565b61030961065a366004614e29565b611e9c565b6002546106739067ffffffffffffffff1681565b60405167ffffffffffffffff909116815260200161033d565b610309611eab565b6103096106a2366004614e64565b612002565b6103096106b5366004614ea6565b61208a565b61047c600e5481565b6103a76124e3565b6106de6106d9366004614ccb565b612569565b60405161033d9190614edf565b6103096106f9366004614ccb565b612589565b61030961070c366004614e64565b6125df565b61047c61071f366004614ce8565b61293f565b61047c610732366004614ccb565b6129d2565b61047c600d5481565b61079b61074e366004614ccb565b6001600160a01b0390811660009081526003602081905260409091208054600182015460028301549383015460048401546005850154600690950154939792969590951694909390929091565b6040805197885260208801969096526001600160a01b03909416948601949094526060850191909152608084015260a083019190915260c082015260e00161033d565b6103096107ec366004614ce8565b6129f1565b6103096107ff366004614ef3565b612b8b565b610309610812366004614d8a565b612b9b565b610309610825366004614ccb565b612bac565b610309610838366004614d8a565b612bda565b61030961084b366004614f18565b612be6565b61030961085e366004614fa5565b61305b565b61047c610871366004614ce8565b6130c2565b6000546103a7906001600160a01b031681565b610891613155565b610899613219565b336108a3816132dd565b60026108ae33610d48565b60028111156108bf576108bf614d14565b146109115760405162461bcd60e51b815260206004820152601760248201527f63616c6c6572206d75737420626520756e626f6e64656400000000000000000060448201526064015b60405180910390fd5b610994600161091e613389565b6001600160a01b0316638a19c8bc6040518163ffffffff1660e01b815260040160206040518083038186803b15801561095657600080fd5b505afa15801561096a573d6000803e3d6000fd5b505050506040513d601f19601f8201168201806040525081019061098e9190614fcf565b90613402565b3360008181526003602052604090206004810192909255600290910180546001600160a01b0319166001600160a01b0388161790556109d59085858561340e565b5050505050565b6109e4613155565b6109ec613219565b6109f5336132dd565b33600090815260036020526040902060028101546001600160a01b0316610a1d8787876125df565b6001600160a01b03881660009081526003602052604081206006840154909190610a48906001613524565b905060008460070160008381526020019081526020016000206001015490508460070160008381526020019081526020016000206000808201600090556001820160009055505060008360060154905060405180604001604052808c8152602001838152508460070160008381526020019081526020016000206000820151816000015560208201518160010155905050610af16001856006015461340290919063ffffffff16565b600685015560408051848152602081018390529081018c90526001600160a01b038d169033907ff136b986590e86cf1abd7b6600186a7a1178ad3cbbdf0f3312e79f6214a2a5679060600160405180910390a36000610b4e613389565b6001600160a01b0316638a19c8bc6040518163ffffffff1660e01b815260040160206040518083038186803b158015610b8657600080fd5b505afa158015610b9a573d6000803e3d6000fd5b505050506040513d601f19601f82011682018060405250810190610bbe9190614fcf565b600586015490915081811015610bd957610bd98e8383613530565b60028601546001600160a01b0316158015610bf357508554155b15610c16576002860180546001600160a01b0319166001600160a01b0389161790555b6002610c218f610d48565b6002811115610c3257610c32614d14565b1415610c4957610c43826001613402565b60048701555b610c558e848c8c61340e565b5050505050505050505050505050565b6001600160a01b038116600090815260046020526040812081610c86613389565b6001600160a01b0316638a19c8bc6040518163ffffffff1660e01b815260040160206040518083038186803b158015610cbe57600080fd5b505afa158015610cd2573d6000803e3d6000fd5b505050506040513d601f19601f82011682018060405250810190610cf69190614fcf565b905080826005015411158015610d0f5750816006015481105b949350505050565b6001600160a01b03919091166000908152600360209081526040808320938352600790930190522060010154151590565b6001600160a01b03811660009081526003602052604081208054610d6f5750600292915050565b610d77613389565b6001600160a01b0316638a19c8bc6040518163ffffffff1660e01b815260040160206040518083038186803b158015610daf57600080fd5b505afa158015610dc3573d6000803e3d6000fd5b505050506040513d601f19601f82011682018060405250810190610de79190614fcf565b81600401541115610dfb5750600092915050565b50600192915050565b610e0f60008061208a565b565b610e19613155565b610e216136bc565b83610e2b816132dd565b6001600160a01b038516600090815260036020526040902080548691901561119a576001600160a01b038716600090815260036020526040812054610e7090876137b7565b60405163b0138c4760e01b8152600760048201526001600160a01b038a1660248201529091507374A56BAeF90aF28Ed2DAc71664550f8C62c41f5e9063b0138c479060440160206040518083038186803b158015610ecd57600080fd5b505af4158015610ee1573d6000803e3d6000fd5b505050506040513d601f19601f82011682018060405250810190610f059190614fe8565b15610f1357610f13886137d0565b8154610f1f9082613524565b82556001610f2c89610d48565b6002811115610f3d57610f3d614d14565b1415610f905760028201546001600160a01b031660009081526003602081905260409091200154610f6e9082613524565b60028301546001600160a01b0316600090815260036020819052604090912001555b806001600160a01b038816156110df576000610fac83886137b7565b9050610fb66138c9565b60405163e7a49c2b60e01b81526001600160a01b038b8116600483015260248201849052919091169063e7a49c2b90604401600060405180830381600087803b15801561100257600080fd5b505af1158015611016573d6000803e3d6000fd5b505050506110226138c9565b6001600160a01b031663c7ee98c261103a8484613524565b6040518263ffffffff1660e01b815260040161105891815260200190565b600060405180830381600087803b15801561107257600080fd5b505af1158015611086573d6000803e3d6000fd5b5050604080516001600160a01b038d8116825260208201889052918101859052908d1692507ff4b71fed8e2c9a8c67c388bc6d35ad20b9368a24eed6d565459f2b277b6c0c22915060600160405180910390a250611193565b6110e76138c9565b6001600160a01b031663c7ee98c2826040518263ffffffff1660e01b815260040161111491815260200190565b600060405180830381600087803b15801561112e57600080fd5b505af1158015611142573d6000803e3d6000fd5b5050604080516000808252602082018790528183015290516001600160a01b038d1693507ff4b71fed8e2c9a8c67c388bc6d35ad20b9368a24eed6d565459f2b277b6c0c2292509081900360600190a25b50506111e9565b604080516001600160a01b038881168252600060208301819052828401529151918916917ff4b71fed8e2c9a8c67c388bc6d35ad20b9368a24eed6d565459f2b277b6c0c229181900360600190a25b506111f381612bac565b505050505050565b60405163e189dedb60e01b8152600760048201526001600160a01b03821660248201526000907374A56BAeF90aF28Ed2DAc71664550f8C62c41f5e9063e189dedb9060440160206040518083038186803b15801561125857600080fd5b505af415801561126c573d6000803e3d6000fd5b505050506040513d601f19601f82011682018060405250810190611290919061500a565b92915050565b61129e613155565b6112a6613219565b336112b0336132dd565b6112b981612bac565b5050565b6112c5613155565b6112cd613219565b3360008181526003602090815260408083208584526007810190925290912090916112f89084610d17565b6113405760405162461bcd60e51b81526020600482015260196024820152781a5b9d985b1a59081d5b989bdb991a5b99c81b1bd8dac81251603a1b6044820152606401610908565b611348613389565b6001600160a01b0316638a19c8bc6040518163ffffffff1660e01b815260040160206040518083038186803b15801561138057600080fd5b505afa158015611394573d6000803e3d6000fd5b505050506040513d601f19601f820116820180604052508101906113b89190614fcf565b816001015411156114315760405162461bcd60e51b815260206004820152603b60248201527f776974686472617720726f756e64206d757374206265206265666f7265206f7260448201527f20657175616c20746f207468652063757272656e7420726f756e6400000000006064820152608401610908565b8054600180830154600086815260078601602052604081208181559092019190915561145b6138c9565b60405163e7a49c2b60e01b8152336004820152602481018490526001600160a01b03919091169063e7a49c2b90604401600060405180830381600087803b1580156114a557600080fd5b505af11580156114b9573d6000803e3d6000fd5b505060408051888152602081018690529081018490523392507f1340f1a8f3d456a649e1a12071dfa15655e3d09252131d0f980c3b405cc8dd2e915060600160405180910390a25050505050565b611513816000806125df565b50565b604051631665d9cb60e31b8152600760048201526000907374A56BAeF90aF28Ed2DAc71664550f8C62c41f5e9063b32ece58906024015b60206040518083038186803b15801561156557600080fd5b505af4158015611579573d6000803e3d6000fd5b505050506040513d601f19601f8201168201806040525081019061159d9190614fcf565b905090565b6115aa613155565b6115b2613219565b6115ba613389565b6001600160a01b0316636841f2536040518163ffffffff1660e01b815260040160206040518083038186803b1580156115f257600080fd5b505afa158015611606573d6000803e3d6000fd5b505050506040513d601f19601f8201168201806040525081019061162a9190614fe8565b1561169d5760405162461bcd60e51b815260206004820152603760248201527f63616e277420757064617465207472616e73636f64657220706172616d732c2060448201527f63757272656e7420726f756e64206973206c6f636b65640000000000000000006064820152608401610908565b6116aa84620f4240101590565b6116f65760405162461bcd60e51b815260206004820152601c60248201527f696e76616c6964207265776172644375742070657263656e74616765000000006044820152606401610908565b61170383620f4240101590565b61174f5760405162461bcd60e51b815260206004820152601b60248201527f696e76616c69642066656553686172652070657263656e7461676500000000006044820152606401610908565b61175833611e64565b6117a45760405162461bcd60e51b815260206004820152601d60248201527f7472616e73636f646572206d75737420626520726567697374657265640000006044820152606401610908565b336000908152600460205260408120906117bc613389565b6001600160a01b0316638a19c8bc6040518163ffffffff1660e01b815260040160206040518083038186803b1580156117f457600080fd5b505afa158015611808573d6000803e3d6000fd5b505050506040513d601f19601f8201168201806040525081019061182c9190614fcf565b905061183733610c65565b15806118435750815481145b6118cd5760405162461bcd60e51b815260206004820152604f60248201527f63616c6c65722063616e277420626520616374697665206f72206d757374206860448201527f61766520616c72656164792063616c6c65642072657761726420666f7220746860648201526e194818dd5c9c995b9d081c9bdd5b99608a1b608482015260a401610908565b600182018690556002820185905560405163b0138c4760e01b8152600760048201523360248201527374A56BAeF90aF28Ed2DAc71664550f8C62c41f5e9063b0138c479060440160206040518083038186803b15801561192c57600080fd5b505af4158015611940573d6000803e3d6000fd5b505050506040513d601f19601f820116820180604052508101906119649190614fe8565b611993573360008181526003602081905260409091200154611993919061198c846001613402565b878761391a565b604080518781526020810187905233917f7346854431dbb3eb8e373c604abf89e90f4865b8447e1e2834d7b3e4677bf544910160405180910390a2505050505050565b6112b98282600080610889565b6119eb613155565b6119f3613c3d565b6119fc83611e64565b611a485760405162461bcd60e51b815260206004820152601d60248201527f7472616e73636f646572206d75737420626520726567697374657265640000006044820152606401610908565b6000611a52613389565b6001600160a01b0316638a19c8bc6040518163ffffffff1660e01b815260040160206040518083038186803b158015611a8a57600080fd5b505afa158015611a9e573d6000803e3d6000fd5b505050506040513d601f19601f82011682018060405250810190611ac29190614fcf565b6001600160a01b03851660009081526004602090815260408083208054600782015486865260038301909452918420949550939092611b0b85611b06886001613524565b613d38565b905083861115611b555760018581015460028088015492850191909155830155600485015486811015611b4c57600081815260038701602052604090205483555b85600801549350505b81546060820151158015611b6857508685145b15611c97576000611b776138c9565b90506000611c34611c2b836001600160a01b0316632de22cdb6040518163ffffffff1660e01b815260040160206040518083038186803b158015611bba57600080fd5b505afa158015611bce573d6000803e3d6000fd5b505050506040513d601f19601f82011682018060405250810190611bf29190614fcf565b846001600160a01b0316639ae6309a6040518163ffffffff1660e01b815260040160206040518083038186803b15801561095657600080fd5b84600554613ddd565b90506000611c4482600c546137b7565b9050611c508282613524565b91506000611c628388600101546137b7565b90506000611c708483613524565b6003890154909150611c8c9087611c878482613402565b613ddd565b606088015250505050505b6000611ca78a85600201546137b7565b90506000611cb58b83613524565b90506000611cc4838886613ddd565b9050611ce18261098e838c6009015461340290919063ffffffff16565b60098a0155611cf1868685613e03565b50505050600a9094019490945550505050505050565b611d0f613e7e565b600e8190556040516000805160206150dc83398151915290611d5b90602080825260169082015275747265617375727942616c616e63654365696c696e6760501b604082015260600190565b60405180910390a150565b6112b982826000806115a2565b6040516339ade16560e11b8152600760048201526000907374A56BAeF90aF28Ed2DAc71664550f8C62c41f5e9063735bc2ca9060240161154d565b611db6613e7e565b60405163a176adaf60e01b815260076004820152602481018290527374A56BAeF90aF28Ed2DAc71664550f8C62c41f5e9063a176adaf9060440160006040518083038186803b158015611e0857600080fd5b505af4158015611e1c573d6000803e3d6000fd5b505050506000805160206150dc833981519152604051611d5b906020808252601490820152736e756d4163746976655472616e73636f6465727360601b604082015260600190565b6001600160a01b0380821660008181526003602052604081206002810154919390929116148015611e955750805415155b9392505050565b6111f386338787878787612be6565b611eb3613f62565b600654600555600c54600d5414611f1957600d54600c556040516000805160206150dc83398151915290611f109060208082526015908201527474726561737572795265776172644375745261746560581b604082015260600190565b60405180910390a15b611f2161405d565b6001600160a01b031663ef105c91600554611f3a613389565b6001600160a01b0316638a19c8bc6040518163ffffffff1660e01b815260040160206040518083038186803b158015611f7257600080fd5b505afa158015611f86573d6000803e3d6000fd5b505050506040513d601f19601f82011682018060405250810190611faa9190614fcf565b6040516001600160e01b031960e085901b16815260048101929092526024820152604401600060405180830381600087803b158015611fe857600080fd5b505af1158015611ffc573d6000803e3d6000fd5b50505050565b61200a613155565b612012613219565b3361201c816132dd565b600261202733610d48565b600281111561203857612038614d14565b141561207e5760405162461bcd60e51b815260206004820152601560248201527418d85b1b195c881b5d5cdd08189948189bdb991959605a1b6044820152606401610908565b611ffc3385858561340e565b612092613155565b61209a613219565b3360006120a5613389565b6001600160a01b0316638a19c8bc6040518163ffffffff1660e01b815260040160206040518083038186803b1580156120dd57600080fd5b505afa1580156120f1573d6000803e3d6000fd5b505050506040513d601f19601f820116820180604052508101906121159190614fcf565b905061212033610c65565b6121785760405162461bcd60e51b815260206004820152602360248201527f63616c6c6572206d75737420626520616e20616374697665207472616e73636f6044820152623232b960e91b6064820152608401610908565b336000908152600460205260409020548114156121f65760405162461bcd60e51b815260206004820152603660248201527f63616c6c65722068617320616c72656164792063616c6c65642072657761726460448201527508199bdc881d1a194818dd5c9c995b9d081c9bdd5b9960521b6064820152608401610908565b336000908152600460209081526040808320848452600381019092529091206001808301546002808501549284019190915582015560048201548381101561224c57600081815260038401602052604090205482555b600e541561231257600061225e6140ae565b6001600160a01b03166370a082316122746140ff565b6040516001600160e01b031960e084901b1681526001600160a01b03909116600482015260240160206040518083038186803b1580156122b357600080fd5b505afa1580156122c7573d6000803e3d6000fd5b505050506040513d601f19601f820116820180604052508101906122eb9190614fcf565b9050600e54811015801561230157506000600d54115b15612310576123106000614150565b505b600061231c6138c9565b8354600554604051637dbedad560e01b81529293506000926001600160a01b03851692637dbedad59261235a92600401918252602082015260400190565b602060405180830381600087803b15801561237457600080fd5b505af1158015612388573d6000803e3d6000fd5b505050506040513d601f19601f820116820180604052508101906123ac9190614fcf565b905060006123bc82600c54614214565b9050801561247a5760006123ce6140ff565b60405163e7a49c2b60e01b81526001600160a01b038083166004830152602482018590529192509085169063e7a49c2b90604401600060405180830381600087803b15801561241c57600080fd5b505af1158015612430573d6000803e3d6000fd5b5050604080516001600160a01b0385168152602081018690523393507f40e200718fe552021167687e5491d09f5931275b6f88f14a462650f0effb523792500160405180910390a2505b60006124868383613524565b905061249533828a8e8e614230565b87875560405181815233907f619caafabdd75649b302ba8419e48cccf64f37f1983ac4727cfb38b57703ffc99060200160405180910390a250505050505050506124de81612bac565b505050565b604051632ebb2fed60e01b8152600760048201526000907374A56BAeF90aF28Ed2DAc71664550f8C62c41f5e90632ebb2fed9060240160206040518083038186803b15801561253157600080fd5b505af4158015612545573d6000803e3d6000fd5b505050506040513d601f19601f8201168201806040525081019061159d919061500a565b600061257482611e64565b1561258157506001919050565b506000919050565b6125916142f2565b600080546001600160a01b0319166001600160a01b0383169081179091556040519081527f4ff638452bbf33c012645d18ae6f05515ff5f2d1dfb0cece8cbf018c60903f7090602001611d5b565b6125e7613155565b6125ef613219565b336125f9816132dd565b33600161260533610d48565b600281111561261657612616614d14565b1461265b5760405162461bcd60e51b815260206004820152601560248201527418d85b1b195c881b5d5cdd08189948189bdb991959605a1b6044820152606401610908565b336000908152600360205260409020856126c35760405162461bcd60e51b8152602060048201526024808201527f756e626f6e6420616d6f756e74206d75737420626520677265617465722074686044820152630616e20360e41b6064820152608401610908565b80548611156127205760405162461bcd60e51b8152602060048201526024808201527f616d6f756e742069732067726561746572207468616e20626f6e64656420616d6044820152631bdd5b9d60e21b6064820152608401610908565b60028101546001600160a01b03166000612738613389565b6001600160a01b0316638a19c8bc6040518163ffffffff1660e01b815260040160206040518083038186803b15801561277057600080fd5b505afa158015612784573d6000803e3d6000fd5b505050506040513d601f19601f820116820180604052508101906127a89190614fcf565b6002549091506000906127c690839067ffffffffffffffff16613402565b60068501546040805180820182528c81526020808201858152600085815260078b0190925292902090518155905160019182015591925090612809908290613402565b6006860155845461281a908b613524565b8086556128d7576002850180546001600160a01b0319169055600060048087019190915560405163b0138c4760e01b81526007918101919091523360248201527374A56BAeF90aF28Ed2DAc71664550f8C62c41f5e9063b0138c479060440160206040518083038186803b15801561289157600080fd5b505af41580156128a5573d6000803e3d6000fd5b505050506040513d601f19601f820116820180604052508101906128c99190614fe8565b156128d7576128d7336137d0565b6128e3848b8b8b61434c565b60408051828152602081018c905290810183905233906001600160a01b038616907f2d5d98d189bee5496a08db2a5948cb7e5e786f09d17d0c3f228eb41776c24a069060600160405180910390a350505050506109d581612bac565b60008061294a613389565b6001600160a01b0316638a19c8bc6040518163ffffffff1660e01b815260040160206040518083038186803b15801561298257600080fd5b505afa158015612996573d6000803e3d6000fd5b505050506040513d601f19601f820116820180604052508101906129ba9190614fcf565b905060006129c88583614589565b5095945050505050565b6001600160a01b03166000908152600360208190526040909120015490565b6129f9613155565b612a01613219565b33612a0b816132dd565b6001600160a01b038316612a555760405162461bcd60e51b81526020600482015260116024820152701a5b9d985b1a59081c9958da5c1a595b9d607a1b6044820152606401610908565b3360009081526003602052604090206001015482811015612ab85760405162461bcd60e51b815260206004820152601d60248201527f696e73756666696369656e74206665657320746f2077697468647261770000006044820152606401610908565b612ac28184613524565b33600090815260036020526040902060010155612add6138c9565b6040516320283da960e01b81526001600160a01b0386811660048301526024820186905291909116906320283da990604401600060405180830381600087803b158015612b2957600080fd5b505af1158015612b3d573d6000803e3d6000fd5b5050604080516001600160a01b0388168152602081018790523393507f4f1b51dd7a2fcb861aa2670f668be66835c4ee12b4bbbf037e4d0018f39819e492500160405180910390a250505050565b6112b98282600080600080611e9c565b612ba3613e7e565b61151381614150565b6001600160a01b0381166000908152600360209081526040808320600490925290912061151391839161464e565b61151381600080612002565b612bee613155565b612bf6613219565b612bff866132dd565b6001600160a01b038616600090815260036020526040812090612c20613389565b6001600160a01b0316638a19c8bc6040518163ffffffff1660e01b815260040160206040518083038186803b158015612c5857600080fd5b505afa158015612c6c573d6000803e3d6000fd5b505050506040513d601f19601f82011682018060405250810190612c909190614fcf565b60028084015484549293508b926001600160a01b0390911691612cb28c610d48565b6002811115612cc357612cc3614d14565b1415612cde57612cd4846001613402565b6004860155612e15565b600081118015612d005750896001600160a01b0316826001600160a01b031614155b15612e1557336001600160a01b038c161480612d345750612d1f61477a565b6001600160a01b0316336001600160a01b0316145b612d715760405162461bcd60e51b815260206004820152600e60248201526d24a72b20a624a22fa1a0a62622a960911b6044820152606401610908565b612d7a8b611e64565b15612ded5760405162461bcd60e51b815260206004820152603d60248201527f72656769737465726564207472616e73636f646572732063616e27742064656c60448201527f656761746520746f7761726473206f74686572206164647265737365730000006064820152608401610908565b612df8846001613402565b6004860155612e078382613402565b9250612e1582828b8b61434c565b6001600160a01b038a1660009081526004602090815260408083208784526003808201909352922090810154612e5d57612e538283600001546147cb565b6060015160038201555b6004810154612e7e57612e748283600a01546147cb565b6080015160048201555b505060008311612ee15760405162461bcd60e51b815260206004820152602860248201527f64656c65676174696f6e20616d6f756e74206d75737420626520677265617465604482015267072207468616e20360c41b6064820152608401610908565b6002850180546001600160a01b0319166001600160a01b038c16179055612f08818d613402565b8555612f168a84898961482e565b8b15612fc457612f246140ae565b6001600160a01b03166323b872dd33612f3b6138c9565b6040516001600160e01b031960e085901b1681526001600160a01b03928316600482015291166024820152604481018f9052606401602060405180830381600087803b158015612f8a57600080fd5b505af1158015612f9e573d6000803e3d6000fd5b505050506040513d601f19601f82011682018060405250810190612fc29190614fe8565b505b8a6001600160a01b0316826001600160a01b03168b6001600160a01b03167fe5917769f276ddca9f2ee7c6b0b33e1d1e1b61008010ce622c632dd20d168a238f8960000154604051613020929190918252602082015260400190565b60405180910390a46001600160a01b038a16600090815260046020526040902061304d908c90879061464e565b505050505050505050505050565b613063613e7e565b6002805467ffffffffffffffff831667ffffffffffffffff199091161790556040516000805160206150dc83398151915290611d5b906020808252600f908201526e1d5b989bdb991a5b99d4195c9a5bd9608a1b604082015260600190565b6000806130cd613389565b6001600160a01b0316638a19c8bc6040518163ffffffff1660e01b815260040160206040518083038186803b15801561310557600080fd5b505afa158015613119573d6000803e3d6000fd5b505050506040513d601f19601f8201168201806040525081019061313d9190614fcf565b9050600061314b8583614589565b9695505050505050565b60008054906101000a90046001600160a01b03166001600160a01b0316635c975abb6040518163ffffffff1660e01b815260040160206040518083038186803b1580156131a157600080fd5b505afa1580156131b5573d6000803e3d6000fd5b505050506040513d601f19601f820116820180604052508101906131d99190614fe8565b15610e0f5760405162461bcd60e51b815260206004820152601060248201526f1cde5cdd195b481a5cc81c185d5cd95960821b6044820152606401610908565b613221613389565b6001600160a01b031663219bc76c6040518163ffffffff1660e01b815260040160206040518083038186803b15801561325957600080fd5b505afa15801561326d573d6000803e3d6000fd5b505050506040513d601f19601f820116820180604052508101906132919190614fe8565b610e0f5760405162461bcd60e51b815260206004820181905260248201527f63757272656e7420726f756e64206973206e6f7420696e697469616c697a65646044820152606401610908565b60006132e7613389565b6001600160a01b0316638a19c8bc6040518163ffffffff1660e01b815260040160206040518083038186803b15801561331f57600080fd5b505afa158015613333573d6000803e3d6000fd5b505050506040513d601f19601f820116820180604052508101906133579190614fcf565b6001600160a01b038316600090815260036020526040902060050154909150818110156124de576124de838383613530565b60008054604051631c2d8fb360e31b81527fe8438ea868df48e3fc21f2f087b993c9b1837dc0f6135064161ce7d7a1701fe860048201526001600160a01b039091169063e16c7d98906024015b60206040518083038186803b1580156133ee57600080fd5b505afa158015612545573d6000803e3d6000fd5b6000611e95828461503d565b6001600160a01b0384166000908152600360209081526040808320868452600781019092529091208591906134438387610d17565b61348b5760405162461bcd60e51b81526020600482015260196024820152781a5b9d985b1a59081d5b989bdb991a5b99c81b1bd8dac81251603a1b6044820152606401610908565b805482546134999082613402565b8355600087815260078401602052604081208181556001015560028301546134cc906001600160a01b031682888861482e565b600283015460408051898152602081018490526001600160a01b038b81169316917f9f5b64cc71e1e26ff178caaa7877a04d8ce66fde989251870e80e6fbee690c17910160405180910390a35050506109d581612bac565b6000611e958284615055565b6001600160a01b038316600090815260036020526040812090613554836001613402565b82546001840154600285015492935090916001600160a01b03161561362e5761357d8787614589565b60028601546001600160a01b031660009081526004602090815260408083208b84526003808201909352922090810154939550919350916135d8578154888110156135d6576135cc83826147cb565b6060015160038301555b505b600481015461360457600a82015488811015613602576135f883826147cb565b6080015160048301555b505b60028601546001600160a01b038a81169116141561362b5760006009830181905560088301555b50505b600284015484546001600160a01b03808a169216907fd7eab0765b772ea6ea859d5633baf737502198012e930f257f90013d9b21109490613670908690613524565b6001880154613680908690613524565b6040805192835260208301919091528101879052606081018a905260800160405180910390a36005840195909555825550600101919091555050565b600054604051631c2d8fb360e31b81527f121833d5ee4fda5e1a4034c2b7be8155c158142541dea26f39122c796649233f60048201526001600160a01b039091169063e16c7d989060240160206040518083038186803b15801561371f57600080fd5b505afa158015613733573d6000803e3d6000fd5b505050506040513d601f19601f82011682018060405250810190613757919061500a565b6001600160a01b0316336001600160a01b031614610e0f5760405162461bcd60e51b815260206004820152601760248201527f63616c6c6572206d7573742062652056657269666965720000000000000000006044820152606401610908565b6000611e95620f42406137ca8585614844565b90614850565b604051635d35e00760e01b8152600760048201526001600160a01b03821660248201527374A56BAeF90aF28Ed2DAc71664550f8C62c41f5e90635d35e0079060440160006040518083038186803b15801561382a57600080fd5b505af415801561383e573d6000803e3d6000fd5b5050505061385761384e826129d2565b60065490613524565b6006556000613869600161091e613389565b6001600160a01b0383166000818152600460205260409081902060060183905551919250907ffee3e693fc72d0a0a673805f3e606c551f4c677b9072444b90dd2d0406bc995c906138bd9084815260200190565b60405180910390a25050565b60008054604051631c2d8fb360e31b81527f6e58ad548d72b425ea94c15f453bf26caddb061d82b2551db7fdd3cefe0e994060048201526001600160a01b039091169063e16c7d98906024016133d6565b6006546040516304aa129960e41b8152600760048201527374A56BAeF90aF28Ed2DAc71664550f8C62c41f5e90634aa129909060240160206040518083038186803b15801561396857600080fd5b505af415801561397c573d6000803e3d6000fd5b505050506040513d601f19601f820116820180604052508101906139a09190614fe8565b15613b2b57604051633972059360e11b8152600760048201526000907374A56BAeF90aF28Ed2DAc71664550f8C62c41f5e906372e40b269060240160206040518083038186803b1580156139f357600080fd5b505af4158015613a07573d6000803e3d6000fd5b505050506040513d601f19601f82011682018060405250810190613a2b919061500a565b90506000613a38826129d2565b9050808711613a49575050506109d5565b604051635d35e00760e01b8152600760048201526001600160a01b03831660248201527374A56BAeF90aF28Ed2DAc71664550f8C62c41f5e90635d35e0079060440160006040518083038186803b158015613aa357600080fd5b505af4158015613ab7573d6000803e3d6000fd5b5050506001600160a01b038316600090815260046020526040902060060187905550613ae38382613524565b9250816001600160a01b03167ffee3e693fc72d0a0a673805f3e606c551f4c677b9072444b90dd2d0406bc995c87604051613b2091815260200190565b60405180910390a250505b6040516327dd54d360e11b81527374A56BAeF90aF28Ed2DAc71664550f8C62c41f5e90634fbaa9a690613b6b906007908a908a908990899060040161506c565b60006040518083038186803b158015613b8357600080fd5b505af4158015613b97573d6000803e3d6000fd5b50505050613bae858261340290919063ffffffff16565b6001600160a01b03871660009081526004602081815260408084209283018990556005830189905560001960068401558884526003830190915290912087905590915060068290556040518581526001600160a01b038816907f65d72d782835d64c3287844a829608d5abdc7e864cc9affe96d910ab3db665e99060200160405180910390a250505050505050565b600054604051631c2d8fb360e31b81527fbd1aa3e8d2464256d7fd3dcf645c16418d5d8c51d971f1ad7d57e7b1b5eee23960048201526001600160a01b039091169063e16c7d989060240160206040518083038186803b158015613ca057600080fd5b505afa158015613cb4573d6000803e3d6000fd5b505050506040513d601f19601f82011682018060405250810190613cd8919061500a565b6001600160a01b0316336001600160a01b031614610e0f5760405162461bcd60e51b815260206004820152601b60248201527f63616c6c6572206d757374206265205469636b657442726f6b657200000000006044820152606401610908565b613d6a6040518060a0016040528060008152602001600081526020016000815260200160008152602001600081525090565b613d7483836147cb565b8354606082015191925090158015613d8b57508281105b15613da557613d9a84826147cb565b606090810151908301525b600a8401546080830151158015613dbb57508381105b15613dd557613dca85826147cb565b608090810151908401525b505092915050565b6000610d0f6b033b2e3c9fd0803ce80000006137ca613dfc868661485c565b8790614844565b60808201516060830151600090613e2457613e1f60018061485c565b613e2a565b83606001515b9050846004015460001415613e6157613e52613e4b82858860000154613ddd565b8390613402565b85600401819055505050505050565b613e52613e7382858860000154613ddd565b600487015490613402565b60008054906101000a90046001600160a01b03166001600160a01b0316638da5cb5b6040518163ffffffff1660e01b815260040160206040518083038186803b158015613eca57600080fd5b505afa158015613ede573d6000803e3d6000fd5b505050506040513d601f19601f82011682018060405250810190613f02919061500a565b6001600160a01b0316336001600160a01b031614610e0f5760405162461bcd60e51b815260206004820152601f60248201527f63616c6c6572206d75737420626520436f6e74726f6c6c6572206f776e6572006044820152606401610908565b600054604051631c2d8fb360e31b81527fe8438ea868df48e3fc21f2f087b993c9b1837dc0f6135064161ce7d7a1701fe860048201526001600160a01b039091169063e16c7d989060240160206040518083038186803b158015613fc557600080fd5b505afa158015613fd9573d6000803e3d6000fd5b505050506040513d601f19601f82011682018060405250810190613ffd919061500a565b6001600160a01b0316336001600160a01b031614610e0f5760405162461bcd60e51b815260206004820152601c60248201527f63616c6c6572206d75737420626520526f756e64734d616e61676572000000006044820152606401610908565b60008054604051631c2d8fb360e31b81527f2a1b465fbcae519904f0fb11f93e73dfbeb47ec54530ec444279610af8cf06b260048201526001600160a01b039091169063e16c7d98906024016133d6565b60008054604051631c2d8fb360e31b81527f3443e257065fe41dd0e4d1f5a1b73a22a62e300962b57f30cddf41d0f8273ba760048201526001600160a01b039091169063e16c7d98906024016133d6565b60008054604051631c2d8fb360e31b81527f6efca2866b731ee4984990bacad4cde10f1ef764fb54a5206bdfd291695b1a9b60048201526001600160a01b039091169063e16c7d98906024016133d6565b614166816b033b2e3c9fd0803ce8000000101590565b6141c15760405162461bcd60e51b815260206004820152602660248201527f5f6375745261746520697320696e76616c696420707265636973652070657263604482015265656e7461676560d01b6064820152608401610908565b600d8190556040516000805160206150dc83398151915290611d5b906020808252601e908201527f6e657874526f756e645472656173757279526577617264437574526174650000604082015260600190565b6000611e956b033b2e3c9fd0803ce80000006137ca8585614844565b6001600160a01b03851660009081526004602090815260408083208684526003810190925282208154919290916142689084906147cb565b90508260080154836007018190555060006142878884600101546137b7565b905060006142958983613524565b905060006142ac8287600701548760000154613ddd565b90506142c98361098e83896008015461340290919063ffffffff16565b60088701556142d9858584614878565b6142e58b8b8a8a6148c6565b5050505050505050505050565b6000546001600160a01b03163314610e0f5760405162461bcd60e51b815260206004820152601960248201527f63616c6c6572206d75737420626520436f6e74726f6c6c6572000000000000006044820152606401610908565b6001600160a01b0384166000908152600460205260408120859161436f836129d2565b9050600061437d8288613524565b60405163b0138c4760e01b8152600760048201526001600160a01b038a1660248201529091507374A56BAeF90aF28Ed2DAc71664550f8C62c41f5e9063b0138c479060440160206040518083038186803b1580156143da57600080fd5b505af41580156143ee573d6000803e3d6000fd5b505050506040513d601f19601f820116820180604052508101906144129190614fe8565b15614560576000614421613389565b6001600160a01b0316638a19c8bc6040518163ffffffff1660e01b815260040160206040518083038186803b15801561445957600080fd5b505afa15801561446d573d6000803e3d6000fd5b505050506040513d601f19601f820116820180604052508101906144919190614fcf565b905060006144a0826001613402565b604051631c11bf7f60e11b81529091507374A56BAeF90aF28Ed2DAc71664550f8C62c41f5e906338237efe906144e3906007908e9088908e908e9060040161506c565b60006040518083038186803b1580156144fb57600080fd5b505af415801561450f573d6000803e3d6000fd5b5050600654614521925090508a613524565b600655600485015482111561454457600082815260038601602052604090208490555b6004850181905560009081526003850160205260409020829055505b6001600160a01b03881660009081526003602081905260409091200155506109d5905081612bac565b6001600160a01b038083166000908152600360209081526040808320600281015490941683526004909152812060018084015484546005860154909591949193926145d49190613402565b60028401549091506001600160a01b0390811690881681148783116146105761460a84614602856001613524565b8a8a8a614b21565b90975095505b8015614642576008840154614626908890613402565b965061463f84600901548761340290919063ffffffff16565b95505b50505050509250929050565b6000614658613389565b6001600160a01b0316638a19c8bc6040518163ffffffff1660e01b815260040160206040518083038186803b15801561469057600080fd5b505afa1580156146a4573d6000803e3d6000fd5b505050506040513d601f19601f820116820180604052508101906146c89190614fcf565b6146d390600161503d565b90506146dd61405d565b8354600285015460038601546005870154865460405163e35c3e4360e01b81526001600160a01b038b811660048301526024820189905260448201969096529385166064850152608484019290925260a483015260c482015291169063e35c3e439060e401600060405180830381600087803b15801561475c57600080fd5b505af1158015614770573d6000803e3d6000fd5b5050505050505050565b60008054604051631c2d8fb360e31b81527f74b6d21e0d4650f622c903126d418c1a52bcc99ea7acb0db0809fc0eeae6c7c360048201526001600160a01b039091169063e16c7d98906024016133d6565b6147fd6040518060a0016040528060008152602001600081526020016000815260200160008152602001600081525090565b6000828152600393840160208181526040832095860154606085015293909152909152600490910154608082015290565b8361483b858585856148c6565b6109d581612bac565b6000611e95828461509a565b6000611e9582846150b9565b6000611e95826137ca856b033b2e3c9fd0803ce8000000614844565b60008260600151600014156148975761489260018061485c565b61489d565b82606001515b90506148b86148b182848760000154613ddd565b8290613402565b846003018190555050505050565b6001600160a01b0384166000908152600460205260408120906148e8866129d2565b905060006148f68287613402565b905061490187611e64565b15614af9576000614910613389565b6001600160a01b0316638a19c8bc6040518163ffffffff1660e01b815260040160206040518083038186803b15801561494857600080fd5b505afa15801561495c573d6000803e3d6000fd5b505050506040513d601f19601f820116820180604052508101906149809190614fcf565b9050600061498f826001613402565b60405163b0138c4760e01b8152600760048201526001600160a01b038b1660248201529091507374A56BAeF90aF28Ed2DAc71664550f8C62c41f5e9063b0138c479060440160206040518083038186803b1580156149ec57600080fd5b505af4158015614a00573d6000803e3d6000fd5b505050506040513d601f19601f82011682018060405250810190614a249190614fe8565b15614ae957604051631c11bf7f60e11b81527374A56BAeF90aF28Ed2DAc71664550f8C62c41f5e906338237efe90614a69906007908d9088908d908d9060040161506c565b60006040518083038186803b158015614a8157600080fd5b505af4158015614a95573d6000803e3d6000fd5b5050600654614aa79250905089613402565b6006556004850154821115614aca57600082815260038601602052604090208490555b6000818152600386016020526040902083905560048501819055614af6565b614af68984838a8a61391a565b50505b6001600160a01b03909616600090815260036020819052604090912001959095555050505050565b6000806000614b3088886147cb565b90506000614b3e8988613d38565b9050614b4c82828888614b5c565b9350935050509550959350505050565b600080856060015160001415614b7d57614b7760018061485c565b60608701525b6060850151614b9757614b9160018061485c565b60608601525b614bca614bc385614bb98960800151896080015161352490919063ffffffff16565b8960600151613ddd565b8490613402565b9050614bdf8486606001518860600151613ddd565b915094509492505050565b6001600160a01b038116811461151357600080fd5b60008060008060808587031215614c1557600080fd5b8435614c2081614bea565b9350602085013592506040850135614c3781614bea565b91506060850135614c4781614bea565b939692955090935050565b60008060008060008060c08789031215614c6b57600080fd5b8635614c7681614bea565b9550602087013594506040870135614c8d81614bea565b93506060870135614c9d81614bea565b92506080870135614cad81614bea565b915060a0870135614cbd81614bea565b809150509295509295509295565b600060208284031215614cdd57600080fd5b8135611e9581614bea565b60008060408385031215614cfb57600080fd5b8235614d0681614bea565b946020939093013593505050565b634e487b7160e01b600052602160045260246000fd5b6020810160038310614d3e57614d3e614d14565b91905290565b60008060008060808587031215614d5a57600080fd5b8435614d6581614bea565b93506020850135614d7581614bea565b93969395505050506040820135916060013590565b600060208284031215614d9c57600080fd5b5035919050565b60008060008060808587031215614db957600080fd5b84359350602085013592506040850135614c3781614bea565b600080600060608486031215614de757600080fd5b8335614df281614bea565b95602085013595506040909401359392505050565b60008060408385031215614e1a57600080fd5b50508035926020909101359150565b60008060008060008060c08789031215614e4257600080fd5b863595506020870135614e5481614bea565b94506040870135614c8d81614bea565b600080600060608486031215614e7957600080fd5b833592506020840135614e8b81614bea565b91506040840135614e9b81614bea565b809150509250925092565b60008060408385031215614eb957600080fd5b8235614ec481614bea565b91506020830135614ed481614bea565b809150509250929050565b6020810160028310614d3e57614d3e614d14565b60008060408385031215614f0657600080fd5b823591506020830135614ed481614bea565b600080600080600080600060e0888a031215614f3357600080fd5b873596506020880135614f4581614bea565b95506040880135614f5581614bea565b94506060880135614f6581614bea565b93506080880135614f7581614bea565b925060a0880135614f8581614bea565b915060c0880135614f9581614bea565b8091505092959891949750929550565b600060208284031215614fb757600080fd5b813567ffffffffffffffff81168114611e9557600080fd5b600060208284031215614fe157600080fd5b5051919050565b600060208284031215614ffa57600080fd5b81518015158114611e9557600080fd5b60006020828403121561501c57600080fd5b8151611e9581614bea565b634e487b7160e01b600052601160045260246000fd5b6000821982111561505057615050615027565b500190565b60008282101561506757615067615027565b500390565b9485526001600160a01b03938416602086015260408501929092528216606084015216608082015260a00190565b60008160001904831182151516156150b4576150b4615027565b500290565b6000826150d657634e487b7160e01b600052601260045260246000fd5b50049056fe9f5033568d78ae30f29f01e944f97b2216493bd19d1b46d429673acff3dcd674a2646970667358221220ab2498faa69060ff6e97b3b2a7f0ffa5b2e02f17b4bd53359b26b93dd491f43264736f6c63430008090033",
  "deployedBytecode": "0x608060405234801561001057600080fd5b50600436106102f15760003560e01c80635dce99481161019d5780639d0b2c7a116100e9578063cf33a0d5116100a2578063ee4e804a1161007c578063ee4e804a1461083d578063f10d1de114610850578063f595f1cc14610863578063f77c47911461087657600080fd5b8063cf33a0d514610804578063d52bd62b14610817578063eaffb3f91461082a57600080fd5b80639d0b2c7a146107115780639ef9df9414610724578063a576623114610737578063a64ad59514610740578063ad3b1b47146107de578063b78d27dc146107f157600080fd5b80637fc4606f1161015657806388a6c7491161013057806388a6c749146106c35780638b2f1652146106cb57806392eefe9b146106eb5780639500ed9b146106fe57600080fd5b80637fc4606f1461069457806381871056146106a757806384a16bbc146106ba57600080fd5b80635dce994814610574578063673a456b1461062657806368ba170c146106395780636bd9add41461064c5780636cf6d6751461065f578063713f22161461068c57600080fd5b80632a4e0d551161025c5780634196ee751161021557806351720b41116101ef57806351720b4114610552578063558f8f441461055b5780635a2a75a9146105645780635c50c3561461056c57600080fd5b80634196ee751461052d57806343d3461a14610536578063465501d31461054957600080fd5b80632a4e0d55146104745780633550aa101461048a5780633a080e931461049d5780633aeb512c146104b057806340e6f271146104c3578063412f83b6146104d657600080fd5b806322bf9d7c116102ae57806322bf9d7c14610381578063235c96031461039457806324454fc4146103bf57806324b1babf1461043b57806325d5971f1461044e57806327de9e321461046157600080fd5b80630584a373146102f6578063062e98b81461030b578063088023741461031e5780630fd02fc1146103465780631544fc6714610359578063228cb73314610379575b600080fd5b610309610304366004614bff565b610889565b005b610309610319366004614c52565b6109dc565b61033161032c366004614ccb565b610c65565b60405190151581526020015b60405180910390f35b610331610354366004614ce8565b610d17565b61036c610367366004614ccb565b610d48565b60405161033d9190614d2a565b610309610e04565b61030961038f366004614d44565b610e11565b6103a76103a2366004614ccb565b6111fb565b6040516001600160a01b03909116815260200161033d565b6104136103cd366004614ce8565b6001600160a01b03909116600090815260046020818152604080842094845260039485019091529091208054600182015460028301549483015492909301549094929392565b604080519586526020860194909452928401919091526060830152608082015260a00161033d565b610309610449366004614d8a565b611296565b61030961045c366004614d8a565b6112bd565b61030961046f366004614d8a565b611507565b61047c611516565b60405190815260200161033d565b610309610498366004614da3565b6115a2565b6103096104ab366004614ce8565b6119d6565b6103096104be366004614dd2565b6119e3565b6103096104d1366004614d8a565b611d07565b6105186104e4366004614ce8565b6001600160a01b03919091166000908152600360209081526040808320938352600790930190522080546001909101549091565b6040805192835260208301919091520161033d565b61047c60055481565b610309610544366004614e07565b611d66565b61047c60065481565b61047c60015481565b61047c600c5481565b61047c611d73565b60055461047c565b6105dc610582366004614ccb565b6001600160a01b031660009081526004602081905260409091208054600182015460028301549383015460058401546006850154600786015460088701546009880154600a90980154969995989794969395929491939092565b604080519a8b5260208b0199909952978901969096526060880194909452608087019290925260a086015260c085015260e08401526101008301526101208201526101400161033d565b610309610634366004614d8a565b611dae565b610331610647366004614ccb565b611e64565b61030961065a366004614e29565b611e9c565b6002546106739067ffffffffffffffff1681565b60405167ffffffffffffffff909116815260200161033d565b610309611eab565b6103096106a2366004614e64565b612002565b6103096106b5366004614ea6565b61208a565b61047c600e5481565b6103a76124e3565b6106de6106d9366004614ccb565b612569565b60405161033d9190614edf565b6103096106f9366004614ccb565b612589565b61030961070c366004614e64565b6125df565b61047c61071f366004614ce8565b61293f565b61047c610732366004614ccb565b6129d2565b61047c600d5481565b61079b61074e366004614ccb565b6001600160a01b0390811660009081526003602081905260409091208054600182015460028301549383015460048401546005850154600690950154939792969590951694909390929091565b6040805197885260208801969096526001600160a01b03909416948601949094526060850191909152608084015260a083019190915260c082015260e00161033d565b6103096107ec366004614ce8565b6129f1565b6103096107ff366004614ef3565b612b8b565b610309610812366004614d8a565b612b9b565b610309610825366004614ccb565b612bac565b610309610838366004614d8a565b612bda565b61030961084b366004614f18565b612be6565b61030961085e366004614fa5565b61305b565b61047c610871366004614ce8565b6130c2565b6000546103a7906001600160a01b031681565b610891613155565b610899613219565b336108a3816132dd565b60026108ae33610d48565b60028111156108bf576108bf614d14565b146109115760405162461bcd60e51b815260206004820152601760248201527f63616c6c6572206d75737420626520756e626f6e64656400000000000000000060448201526064015b60405180910390fd5b610994600161091e613389565b6001600160a01b0316638a19c8bc6040518163ffffffff1660e01b815260040160206040518083038186803b15801561095657600080fd5b505afa15801561096a573d6000803e3d6000fd5b505050506040513d601f19601f8201168201806040525081019061098e9190614fcf565b90613402565b3360008181526003602052604090206004810192909255600290910180546001600160a01b0319166001600160a01b0388161790556109d59085858561340e565b5050505050565b6109e4613155565b6109ec613219565b6109f5336132dd565b33600090815260036020526040902060028101546001600160a01b0316610a1d8787876125df565b6001600160a01b03881660009081526003602052604081206006840154909190610a48906001613524565b905060008460070160008381526020019081526020016000206001015490508460070160008381526020019081526020016000206000808201600090556001820160009055505060008360060154905060405180604001604052808c8152602001838152508460070160008381526020019081526020016000206000820151816000015560208201518160010155905050610af16001856006015461340290919063ffffffff16565b600685015560408051848152602081018390529081018c90526001600160a01b038d169033907ff136b986590e86cf1abd7b6600186a7a1178ad3cbbdf0f3312e79f6214a2a5679060600160405180910390a36000610b4e613389565b6001600160a01b0316638a19c8bc6040518163ffffffff1660e01b815260040160206040518083038186803b158015610b8657600080fd5b505afa158015610b9a573d6000803e3d6000fd5b505050506040513d601f19601f82011682018060405250810190610bbe9190614fcf565b600586015490915081811015610bd957610bd98e8383613530565b60028601546001600160a01b0316158015610bf357508554155b15610c16576002860180546001600160a01b0319166001600160a01b0389161790555b6002610c218f610d48565b6002811115610c3257610c32614d14565b1415610c4957610c43826001613402565b60048701555b610c558e848c8c61340e565b5050505050505050505050505050565b6001600160a01b038116600090815260046020526040812081610c86613389565b6001600160a01b0316638a19c8bc6040518163ffffffff1660e01b815260040160206040518083038186803b158015610cbe57600080fd5b505afa158015610cd2573d6000803e3d6000fd5b505050506040513d601f19601f82011682018060405250810190610cf69190614fcf565b905080826005015411158015610d0f5750816006015481105b949350505050565b6001600160a01b03919091166000908152600360209081526040808320938352600790930190522060010154151590565b6001600160a01b03811660009081526003602052604081208054610d6f5750600292915050565b610d77613389565b6001600160a01b0316638a19c8bc6040518163ffffffff1660e01b815260040160206040518083038186803b158015610daf57600080fd5b505afa158015610dc3573d6000803e3d6000fd5b505050506040513d601f19601f82011682018060405250810190610de79190614fcf565b81600401541115610dfb5750600092915050565b50600192915050565b610e0f60008061208a565b565b610e19613155565b610e216136bc565b83610e2b816132dd565b6001600160a01b038516600090815260036020526040902080548691901561119a576001600160a01b038716600090815260036020526040812054610e7090876137b7565b60405163b0138c4760e01b8152600760048201526001600160a01b038a16602482015290915073__$d23c89be677d40ab24c636937040b6165f$__9063b0138c479060440160206040518083038186803b158015610ecd57600080fd5b505af4158015610ee1573d6000803e3d6000fd5b505050506040513d601f19601f82011682018060405250810190610f059190614fe8565b15610f1357610f13886137d0565b8154610f1f9082613524565b82556001610f2c89610d48565b6002811115610f3d57610f3d614d14565b1415610f905760028201546001600160a01b031660009081526003602081905260409091200154610f6e9082613524565b60028301546001600160a01b0316600090815260036020819052604090912001555b806001600160a01b038816156110df576000610fac83886137b7565b9050610fb66138c9565b60405163e7a49c2b60e01b81526001600160a01b038b8116600483015260248201849052919091169063e7a49c2b90604401600060405180830381600087803b15801561100257600080fd5b505af1158015611016573d6000803e3d6000fd5b505050506110226138c9565b6001600160a01b031663c7ee98c261103a8484613524565b6040518263ffffffff1660e01b815260040161105891815260200190565b600060405180830381600087803b15801561107257600080fd5b505af1158015611086573d6000803e3d6000fd5b5050604080516001600160a01b038d8116825260208201889052918101859052908d1692507ff4b71fed8e2c9a8c67c388bc6d35ad20b9368a24eed6d565459f2b277b6c0c22915060600160405180910390a250611193565b6110e76138c9565b6001600160a01b031663c7ee98c2826040518263ffffffff1660e01b815260040161111491815260200190565b600060405180830381600087803b15801561112e57600080fd5b505af1158015611142573d6000803e3d6000fd5b5050604080516000808252602082018790528183015290516001600160a01b038d1693507ff4b71fed8e2c9a8c67c388bc6d35ad20b9368a24eed6d565459f2b277b6c0c2292509081900360600190a25b50506111e9565b604080516001600160a01b038881168252600060208301819052828401529151918916917ff4b71fed8e2c9a8c67c388bc6d35ad20b9368a24eed6d565459f2b277b6c0c229181900360600190a25b506111f381612bac565b505050505050565b60405163e189dedb60e01b8152600760048201526001600160a01b038216602482015260009073__$d23c89be677d40ab24c636937040b6165f$__9063e189dedb9060440160206040518083038186803b15801561125857600080fd5b505af415801561126c573d6000803e3d6000fd5b505050506040513d601f19601f82011682018060405250810190611290919061500a565b92915050565b61129e613155565b6112a6613219565b336112b0336132dd565b6112b981612bac565b5050565b6112c5613155565b6112cd613219565b3360008181526003602090815260408083208584526007810190925290912090916112f89084610d17565b6113405760405162461bcd60e51b81526020600482015260196024820152781a5b9d985b1a59081d5b989bdb991a5b99c81b1bd8dac81251603a1b6044820152606401610908565b611348613389565b6001600160a01b0316638a19c8bc6040518163ffffffff1660e01b815260040160206040518083038186803b15801561138057600080fd5b505afa158015611394573d6000803e3d6000fd5b505050506040513d601f19601f820116820180604052508101906113b89190614fcf565b816001015411156114315760405162461bcd60e51b815260206004820152603b60248201527f776974686472617720726f756e64206d757374206265206265666f7265206f7260448201527f20657175616c20746f207468652063757272656e7420726f756e6400000000006064820152608401610908565b8054600180830154600086815260078601602052604081208181559092019190915561145b6138c9565b60405163e7a49c2b60e01b8152336004820152602481018490526001600160a01b03919091169063e7a49c2b90604401600060405180830381600087803b1580156114a557600080fd5b505af11580156114b9573d6000803e3d6000fd5b505060408051888152602081018690529081018490523392507f1340f1a8f3d456a649e1a12071dfa15655e3d09252131d0f980c3b405cc8dd2e915060600160405180910390a25050505050565b611513816000806125df565b50565b604051631665d9cb60e31b81526007600482015260009073__$d23c89be677d40ab24c636937040b6165f$__9063b32ece58906024015b60206040518083038186803b15801561156557600080fd5b505af4158015611579573d6000803e3d6000fd5b505050506040513d601f19601f8201168201806040525081019061159d9190614fcf565b905090565b6115aa613155565b6115b2613219565b6115ba613389565b6001600160a01b0316636841f2536040518163ffffffff1660e01b815260040160206040518083038186803b1580156115f257600080fd5b505afa158015611606573d6000803e3d6000fd5b505050506040513d601f19601f8201168201806040525081019061162a9190614fe8565b1561169d5760405162461bcd60e51b815260206004820152603760248201527f63616e277420757064617465207472616e73636f64657220706172616d732c2060448201527f63757272656e7420726f756e64206973206c6f636b65640000000000000000006064820152608401610908565b6116aa84620f4240101590565b6116f65760405162461bcd60e51b815260206004820152601c60248201527f696e76616c6964207265776172644375742070657263656e74616765000000006044820152606401610908565b61170383620f4240101590565b61174f5760405162461bcd60e51b815260206004820152601b60248201527f696e76616c69642066656553686172652070657263656e7461676500000000006044820152606401610908565b61175833611e64565b6117a45760405162461bcd60e51b815260206004820152601d60248201527f7472616e73636f646572206d75737420626520726567697374657265640000006044820152606401610908565b336000908152600460205260408120906117bc613389565b6001600160a01b0316638a19c8bc6040518163ffffffff1660e01b815260040160206040518083038186803b1580156117f457600080fd5b505afa158015611808573d6000803e3d6000fd5b505050506040513d601f19601f8201168201806040525081019061182c9190614fcf565b905061183733610c65565b15806118435750815481145b6118cd5760405162461bcd60e51b815260206004820152604f60248201527f63616c6c65722063616e277420626520616374697665206f72206d757374206860448201527f61766520616c72656164792063616c6c65642072657761726420666f7220746860648201526e194818dd5c9c995b9d081c9bdd5b99608a1b608482015260a401610908565b600182018690556002820185905560405163b0138c4760e01b81526007600482015233602482015273__$d23c89be677d40ab24c636937040b6165f$__9063b0138c479060440160206040518083038186803b15801561192c57600080fd5b505af4158015611940573d6000803e3d6000fd5b505050506040513d601f19601f820116820180604052508101906119649190614fe8565b611993573360008181526003602081905260409091200154611993919061198c846001613402565b878761391a565b604080518781526020810187905233917f7346854431dbb3eb8e373c604abf89e90f4865b8447e1e2834d7b3e4677bf544910160405180910390a2505050505050565b6112b98282600080610889565b6119eb613155565b6119f3613c3d565b6119fc83611e64565b611a485760405162461bcd60e51b815260206004820152601d60248201527f7472616e73636f646572206d75737420626520726567697374657265640000006044820152606401610908565b6000611a52613389565b6001600160a01b0316638a19c8bc6040518163ffffffff1660e01b815260040160206040518083038186803b158015611a8a57600080fd5b505afa158015611a9e573d6000803e3d6000fd5b505050506040513d601f19601f82011682018060405250810190611ac29190614fcf565b6001600160a01b03851660009081526004602090815260408083208054600782015486865260038301909452918420949550939092611b0b85611b06886001613524565b613d38565b905083861115611b555760018581015460028088015492850191909155830155600485015486811015611b4c57600081815260038701602052604090205483555b85600801549350505b81546060820151158015611b6857508685145b15611c97576000611b776138c9565b90506000611c34611c2b836001600160a01b0316632de22cdb6040518163ffffffff1660e01b815260040160206040518083038186803b158015611bba57600080fd5b505afa158015611bce573d6000803e3d6000fd5b505050506040513d601f19601f82011682018060405250810190611bf29190614fcf565b846001600160a01b0316639ae6309a6040518163ffffffff1660e01b815260040160206040518083038186803b15801561095657600080fd5b84600554613ddd565b90506000611c4482600c546137b7565b9050611c508282613524565b91506000611c628388600101546137b7565b90506000611c708483613524565b6003890154909150611c8c9087611c878482613402565b613ddd565b606088015250505050505b6000611ca78a85600201546137b7565b90506000611cb58b83613524565b90506000611cc4838886613ddd565b9050611ce18261098e838c6009015461340290919063ffffffff16565b60098a0155611cf1868685613e03565b50505050600a9094019490945550505050505050565b611d0f613e7e565b600e8190556040516000805160206150dc83398151915290611d5b90602080825260169082015275747265617375727942616c616e63654365696c696e6760501b604082015260600190565b60405180910390a150565b6112b982826000806115a2565b6040516339ade16560e11b81526007600482015260009073__$d23c89be677d40ab24c636937040b6165f$__9063735bc2ca9060240161154d565b611db6613e7e565b60405163a176adaf60e01b8152600760048201526024810182905273__$d23c89be677d40ab24c636937040b6165f$__9063a176adaf9060440160006040518083038186803b158015611e0857600080fd5b505af4158015611e1c573d6000803e3d6000fd5b505050506000805160206150dc833981519152604051611d5b906020808252601490820152736e756d4163746976655472616e73636f6465727360601b604082015260600190565b6001600160a01b0380821660008181526003602052604081206002810154919390929116148015611e955750805415155b9392505050565b6111f386338787878787612be6565b611eb3613f62565b600654600555600c54600d5414611f1957600d54600c556040516000805160206150dc83398151915290611f109060208082526015908201527474726561737572795265776172644375745261746560581b604082015260600190565b60405180910390a15b611f2161405d565b6001600160a01b031663ef105c91600554611f3a613389565b6001600160a01b0316638a19c8bc6040518163ffffffff1660e01b815260040160206040518083038186803b158015611f7257600080fd5b505afa158015611f86573d6000803e3d6000fd5b505050506040513d601f19601f82011682018060405250810190611faa9190614fcf565b6040516001600160e01b031960e085901b16815260048101929092526024820152604401600060405180830381600087803b158015611fe857600080fd5b505af1158015611ffc573d6000803e3d6000fd5b50505050565b61200a613155565b612012613219565b3361201c816132dd565b600261202733610d48565b600281111561203857612038614d14565b141561207e5760405162461bcd60e51b815260206004820152601560248201527418d85b1b195c881b5d5cdd08189948189bdb991959605a1b6044820152606401610908565b611ffc3385858561340e565b612092613155565b61209a613219565b3360006120a5613389565b6001600160a01b0316638a19c8bc6040518163ffffffff1660e01b815260040160206040518083038186803b1580156120dd57600080fd5b505afa1580156120f1573d6000803e3d6000fd5b505050506040513d601f19601f820116820180604052508101906121159190614fcf565b905061212033610c65565b6121785760405162461bcd60e51b815260206004820152602360248201527f63616c6c6572206d75737420626520616e20616374697665207472616e73636f6044820152623232b960e91b6064820152608401610908565b336000908152600460205260409020548114156121f65760405162461bcd60e51b815260206004820152603660248201527f63616c6c65722068617320616c72656164792063616c6c65642072657761726460448201527508199bdc881d1a194818dd5c9c995b9d081c9bdd5b9960521b6064820152608401610908565b336000908152600460209081526040808320848452600381019092529091206001808301546002808501549284019190915582015560048201548381101561224c57600081815260038401602052604090205482555b600e541561231257600061225e6140ae565b6001600160a01b03166370a082316122746140ff565b6040516001600160e01b031960e084901b1681526001600160a01b03909116600482015260240160206040518083038186803b1580156122b357600080fd5b505afa1580156122c7573d6000803e3d6000fd5b505050506040513d601f19601f820116820180604052508101906122eb9190614fcf565b9050600e54811015801561230157506000600d54115b15612310576123106000614150565b505b600061231c6138c9565b8354600554604051637dbedad560e01b81529293506000926001600160a01b03851692637dbedad59261235a92600401918252602082015260400190565b602060405180830381600087803b15801561237457600080fd5b505af1158015612388573d6000803e3d6000fd5b505050506040513d601f19601f820116820180604052508101906123ac9190614fcf565b905060006123bc82600c54614214565b9050801561247a5760006123ce6140ff565b60405163e7a49c2b60e01b81526001600160a01b038083166004830152602482018590529192509085169063e7a49c2b90604401600060405180830381600087803b15801561241c57600080fd5b505af1158015612430573d6000803e3d6000fd5b5050604080516001600160a01b0385168152602081018690523393507f40e200718fe552021167687e5491d09f5931275b6f88f14a462650f0effb523792500160405180910390a2505b60006124868383613524565b905061249533828a8e8e614230565b87875560405181815233907f619caafabdd75649b302ba8419e48cccf64f37f1983ac4727cfb38b57703ffc99060200160405180910390a250505050505050506124de81612bac565b505050565b604051632ebb2fed60e01b81526007600482015260009073__$d23c89be677d40ab24c636937040b6165f$__90632ebb2fed9060240160206040518083038186803b15801561253157600080fd5b505af4158015612545573d6000803e3d6000fd5b505050506040513d601f19601f8201168201806040525081019061159d919061500a565b600061257482611e64565b1561258157506001919050565b506000919050565b6125916142f2565b600080546001600160a01b0319166001600160a01b0383169081179091556040519081527f4ff638452bbf33c012645d18ae6f05515ff5f2d1dfb0cece8cbf018c60903f7090602001611d5b565b6125e7613155565b6125ef613219565b336125f9816132dd565b33600161260533610d48565b600281111561261657612616614d14565b1461265b5760405162461bcd60e51b815260206004820152601560248201527418d85b1b195c881b5d5cdd08189948189bdb991959605a1b6044820152606401610908565b336000908152600360205260409020856126c35760405162461bcd60e51b8152602060048201526024808201527f756e626f6e6420616d6f756e74206d75737420626520677265617465722074686044820152630616e20360e41b6064820152608401610908565b80548611156127205760405162461bcd60e51b8152602060048201526024808201527f616d6f756e742069732067726561746572207468616e20626f6e64656420616d6044820152631bdd5b9d60e21b6064820152608401610908565b60028101546001600160a01b03166000612738613389565b6001600160a01b0316638a19c8bc6040518163ffffffff1660e01b815260040160206040518083038186803b15801561277057600080fd5b505afa158015612784573d6000803e3d6000fd5b505050506040513d601f19601f820116820180604052508101906127a89190614fcf565b6002549091506000906127c690839067ffffffffffffffff16613402565b60068501546040805180820182528c81526020808201858152600085815260078b0190925292902090518155905160019182015591925090612809908290613402565b6006860155845461281a908b613524565b8086556128d7576002850180546001600160a01b0319169055600060048087019190915560405163b0138c4760e01b815260079181019190915233602482015273__$d23c89be677d40ab24c636937040b6165f$__9063b0138c479060440160206040518083038186803b15801561289157600080fd5b505af41580156128a5573d6000803e3d6000fd5b505050506040513d601f19601f820116820180604052508101906128c99190614fe8565b156128d7576128d7336137d0565b6128e3848b8b8b61434c565b60408051828152602081018c905290810183905233906001600160a01b038616907f2d5d98d189bee5496a08db2a5948cb7e5e786f09d17d0c3f228eb41776c24a069060600160405180910390a350505050506109d581612bac565b60008061294a613389565b6001600160a01b0316638a19c8bc6040518163ffffffff1660e01b815260040160206040518083038186803b15801561298257600080fd5b505afa158015612996573d6000803e3d6000fd5b505050506040513d601f19601f820116820180604052508101906129ba9190614fcf565b905060006129c88583614589565b5095945050505050565b6001600160a01b03166000908152600360208190526040909120015490565b6129f9613155565b612a01613219565b33612a0b816132dd565b6001600160a01b038316612a555760405162461bcd60e51b81526020600482015260116024820152701a5b9d985b1a59081c9958da5c1a595b9d607a1b6044820152606401610908565b3360009081526003602052604090206001015482811015612ab85760405162461bcd60e51b815260206004820152601d60248201527f696e73756666696369656e74206665657320746f2077697468647261770000006044820152606401610908565b612ac28184613524565b33600090815260036020526040902060010155612add6138c9565b6040516320283da960e01b81526001600160a01b0386811660048301526024820186905291909116906320283da990604401600060405180830381600087803b158015612b2957600080fd5b505af1158015612b3d573d6000803e3d6000fd5b5050604080516001600160a01b0388168152602081018790523393507f4f1b51dd7a2fcb861aa2670f668be66835c4ee12b4bbbf037e4d0018f39819e492500160405180910390a250505050565b6112b98282600080600080611e9c565b612ba3613e7e565b61151381614150565b6001600160a01b0381166000908152600360209081526040808320600490925290912061151391839161464e565b61151381600080612002565b612bee613155565b612bf6613219565b612bff866132dd565b6001600160a01b038616600090815260036020526040812090612c20613389565b6001600160a01b0316638a19c8bc6040518163ffffffff1660e01b815260040160206040518083038186803b158015612c5857600080fd5b505afa158015612c6c573d6000803e3d6000fd5b505050506040513d601f19601f82011682018060405250810190612c909190614fcf565b60028084015484549293508b926001600160a01b0390911691612cb28c610d48565b6002811115612cc357612cc3614d14565b1415612cde57612cd4846001613402565b6004860155612e15565b600081118015612d005750896001600160a01b0316826001600160a01b031614155b15612e1557336001600160a01b038c161480612d345750612d1f61477a565b6001600160a01b0316336001600160a01b0316145b612d715760405162461bcd60e51b815260206004820152600e60248201526d24a72b20a624a22fa1a0a62622a960911b6044820152606401610908565b612d7a8b611e64565b15612ded5760405162461bcd60e51b815260206004820152603d60248201527f72656769737465726564207472616e73636f646572732063616e27742064656c60448201527f656761746520746f7761726473206f74686572206164647265737365730000006064820152608401610908565b612df8846001613402565b6004860155612e078382613402565b9250612e1582828b8b61434c565b6001600160a01b038a1660009081526004602090815260408083208784526003808201909352922090810154612e5d57612e538283600001546147cb565b6060015160038201555b6004810154612e7e57612e748283600a01546147cb565b6080015160048201555b505060008311612ee15760405162461bcd60e51b815260206004820152602860248201527f64656c65676174696f6e20616d6f756e74206d75737420626520677265617465604482015267072207468616e20360c41b6064820152608401610908565b6002850180546001600160a01b0319166001600160a01b038c16179055612f08818d613402565b8555612f168a84898961482e565b8b15612fc457612f246140ae565b6001600160a01b03166323b872dd33612f3b6138c9565b6040516001600160e01b031960e085901b1681526001600160a01b03928316600482015291166024820152604481018f9052606401602060405180830381600087803b158015612f8a57600080fd5b505af1158015612f9e573d6000803e3d6000fd5b505050506040513d601f19601f82011682018060405250810190612fc29190614fe8565b505b8a6001600160a01b0316826001600160a01b03168b6001600160a01b03167fe5917769f276ddca9f2ee7c6b0b33e1d1e1b61008010ce622c632dd20d168a238f8960000154604051613020929190918252602082015260400190565b60405180910390a46001600160a01b038a16600090815260046020526040902061304d908c90879061464e565b505050505050505050505050565b613063613e7e565b6002805467ffffffffffffffff831667ffffffffffffffff199091161790556040516000805160206150dc83398151915290611d5b906020808252600f908201526e1d5b989bdb991a5b99d4195c9a5bd9608a1b604082015260600190565b6000806130cd613389565b6001600160a01b0316638a19c8bc6040518163ffffffff1660e01b815260040160206040518083038186803b15801561310557600080fd5b505afa158015613119573d6000803e3d6000fd5b505050506040513d601f19601f8201168201806040525081019061313d9190614fcf565b9050600061314b8583614589565b9695505050505050565b60008054906101000a90046001600160a01b03166001600160a01b0316635c975abb6040518163ffffffff1660e01b815260040160206040518083038186803b1580156131a157600080fd5b505afa1580156131b5573d6000803e3d6000fd5b505050506040513d601f19601f820116820180604052508101906131d99190614fe8565b15610e0f5760405162461bcd60e51b815260206004820152601060248201526f1cde5cdd195b481a5cc81c185d5cd95960821b6044820152606401610908565b613221613389565b6001600160a01b031663219bc76c6040518163ffffffff1660e01b815260040160206040518083038186803b15801561325957600080fd5b505afa15801561326d573d6000803e3d6000fd5b505050506040513d601f19601f820116820180604052508101906132919190614fe8565b610e0f5760405162461bcd60e51b815260206004820181905260248201527f63757272656e7420726f756e64206973206e6f7420696e697469616c697a65646044820152606401610908565b60006132e7613389565b6001600160a01b0316638a19c8bc6040518163ffffffff1660e01b815260040160206040518083038186803b15801561331f57600080fd5b505afa158015613333573d6000803e3d6000fd5b505050506040513d601f19601f820116820180604052508101906133579190614fcf565b6001600160a01b038316600090815260036020526040902060050154909150818110156124de576124de838383613530565b60008054604051631c2d8fb360e31b81527fe8438ea868df48e3fc21f2f087b993c9b1837dc0f6135064161ce7d7a1701fe860048201526001600160a01b039091169063e16c7d98906024015b60206040518083038186803b1580156133ee57600080fd5b505afa158015612545573d6000803e3d6000fd5b6000611e95828461503d565b6001600160a01b0384166000908152600360209081526040808320868452600781019092529091208591906134438387610d17565b61348b5760405162461bcd60e51b81526020600482015260196024820152781a5b9d985b1a59081d5b989bdb991a5b99c81b1bd8dac81251603a1b6044820152606401610908565b805482546134999082613402565b8355600087815260078401602052604081208181556001015560028301546134cc906001600160a01b031682888861482e565b600283015460408051898152602081018490526001600160a01b038b81169316917f9f5b64cc71e1e26ff178caaa7877a04d8ce66fde989251870e80e6fbee690c17910160405180910390a35050506109d581612bac565b6000611e958284615055565b6001600160a01b038316600090815260036020526040812090613554836001613402565b82546001840154600285015492935090916001600160a01b03161561362e5761357d8787614589565b60028601546001600160a01b031660009081526004602090815260408083208b84526003808201909352922090810154939550919350916135d8578154888110156135d6576135cc83826147cb565b6060015160038301555b505b600481015461360457600a82015488811015613602576135f883826147cb565b6080015160048301555b505b60028601546001600160a01b038a81169116141561362b5760006009830181905560088301555b50505b600284015484546001600160a01b03808a169216907fd7eab0765b772ea6ea859d5633baf737502198012e930f257f90013d9b21109490613670908690613524565b6001880154613680908690613524565b6040805192835260208301919091528101879052606081018a905260800160405180910390a36005840195909555825550600101919091555050565b600054604051631c2d8fb360e31b81527f121833d5ee4fda5e1a4034c2b7be8155c158142541dea26f39122c796649233f60048201526001600160a01b039091169063e16c7d989060240160206040518083038186803b15801561371f57600080fd5b505afa158015613733573d6000803e3d6000fd5b505050506040513d601f19601f82011682018060405250810190613757919061500a565b6001600160a01b0316336001600160a01b031614610e0f5760405162461bcd60e51b815260206004820152601760248201527f63616c6c6572206d7573742062652056657269666965720000000000000000006044820152606401610908565b6000611e95620f42406137ca8585614844565b90614850565b604051635d35e00760e01b8152600760048201526001600160a01b038216602482015273__$d23c89be677d40ab24c636937040b6165f$__90635d35e0079060440160006040518083038186803b15801561382a57600080fd5b505af415801561383e573d6000803e3d6000fd5b5050505061385761384e826129d2565b60065490613524565b6006556000613869600161091e613389565b6001600160a01b0383166000818152600460205260409081902060060183905551919250907ffee3e693fc72d0a0a673805f3e606c551f4c677b9072444b90dd2d0406bc995c906138bd9084815260200190565b60405180910390a25050565b60008054604051631c2d8fb360e31b81527f6e58ad548d72b425ea94c15f453bf26caddb061d82b2551db7fdd3cefe0e994060048201526001600160a01b039091169063e16c7d98906024016133d6565b6006546040516304aa129960e41b81526007600482015273__$d23c89be677d40ab24c636937040b6165f$__90634aa129909060240160206040518083038186803b15801561396857600080fd5b505af415801561397c573d6000803e3d6000fd5b505050506040513d601f19601f820116820180604052508101906139a09190614fe8565b15613b2b57604051633972059360e11b81526007600482015260009073__$d23c89be677d40ab24c636937040b6165f$__906372e40b269060240160206040518083038186803b1580156139f357600080fd5b505af4158015613a07573d6000803e3d6000fd5b505050506040513d601f19601f82011682018060405250810190613a2b919061500a565b90506000613a38826129d2565b9050808711613a49575050506109d5565b604051635d35e00760e01b8152600760048201526001600160a01b038316602482015273__$d23c89be677d40ab24c636937040b6165f$__90635d35e0079060440160006040518083038186803b158015613aa357600080fd5b505af4158015613ab7573d6000803e3d6000fd5b5050506001600160a01b038316600090815260046020526040902060060187905550613ae38382613524565b9250816001600160a01b03167ffee3e693fc72d0a0a673805f3e606c551f4c677b9072444b90dd2d0406bc995c87604051613b2091815260200190565b60405180910390a250505b6040516327dd54d360e11b815273__$d23c89be677d40ab24c636937040b6165f$__90634fbaa9a690613b6b906007908a908a908990899060040161506c565b60006040518083038186803b158015613b8357600080fd5b505af4158015613b97573d6000803e3d6000fd5b50505050613bae858261340290919063ffffffff16565b6001600160a01b03871660009081526004602081815260408084209283018990556005830189905560001960068401558884526003830190915290912087905590915060068290556040518581526001600160a01b038816907f65d72d782835d64c3287844a829608d5abdc7e864cc9affe96d910ab3db665e99060200160405180910390a250505050505050565b600054604051631c2d8fb360e31b81527fbd1aa3e8d2464256d7fd3dcf645c16418d5d8c51d971f1ad7d57e7b1b5eee23960048201526001600160a01b039091169063e16c7d989060240160206040518083038186803b158015613ca057600080fd5b505afa158015613cb4573d6000803e3d6000fd5b505050506040513d601f19601f82011682018060405250810190613cd8919061500a565b6001600160a01b0316336001600160a01b031614610e0f5760405162461bcd60e51b815260206004820152601b60248201527f63616c6c6572206d757374206265205469636b657442726f6b657200000000006044820152606401610908565b613d6a6040518060a0016040528060008152602001600081526020016000815260200160008152602001600081525090565b613d7483836147cb565b8354606082015191925090158015613d8b57508281105b15613da557613d9a84826147cb565b606090810151908301525b600a8401546080830151158015613dbb57508381105b15613dd557613dca85826147cb565b608090810151908401525b505092915050565b6000610d0f6b033b2e3c9fd0803ce80000006137ca613dfc868661485c565b8790614844565b60808201516060830151600090613e2457613e1f60018061485c565b613e2a565b83606001515b9050846004015460001415613e6157613e52613e4b82858860000154613ddd565b8390613402565b85600401819055505050505050565b613e52613e7382858860000154613ddd565b600487015490613402565b60008054906101000a90046001600160a01b03166001600160a01b0316638da5cb5b6040518163ffffffff1660e01b815260040160206040518083038186803b158015613eca57600080fd5b505afa158015613ede573d6000803e3d6000fd5b505050506040513d601f19601f82011682018060405250810190613f02919061500a565b6001600160a01b0316336001600160a01b031614610e0f5760405162461bcd60e51b815260206004820152601f60248201527f63616c6c6572206d75737420626520436f6e74726f6c6c6572206f776e6572006044820152606401610908565b600054604051631c2d8fb360e31b81527fe8438ea868df48e3fc21f2f087b993c9b1837dc0f6135064161ce7d7a1701fe860048201526001600160a01b039091169063e16c7d989060240160206040518083038186803b158015613fc557600080fd5b505afa158015613fd9573d6000803e3d6000fd5b505050506040513d601f19601f82011682018060405250810190613ffd919061500a565b6001600160a01b0316336001600160a01b031614610e0f5760405162461bcd60e51b815260206004820152601c60248201527f63616c6c6572206d75737420626520526f756e64734d616e61676572000000006044820152606401610908565b60008054604051631c2d8fb360e31b81527f2a1b465fbcae519904f0fb11f93e73dfbeb47ec54530ec444279610af8cf06b260048201526001600160a01b039091169063e16c7d98906024016133d6565b60008054604051631c2d8fb360e31b81527f3443e257065fe41dd0e4d1f5a1b73a22a62e300962b57f30cddf41d0f8273ba760048201526001600160a01b039091169063e16c7d98906024016133d6565b60008054604051631c2d8fb360e31b81527f6efca2866b731ee4984990bacad4cde10f1ef764fb54a5206bdfd291695b1a9b60048201526001600160a01b039091169063e16c7d98906024016133d6565b614166816b033b2e3c9fd0803ce8000000101590565b6141c15760405162461bcd60e51b815260206004820152602660248201527f5f6375745261746520697320696e76616c696420707265636973652070657263604482015265656e7461676560d01b6064820152608401610908565b600d8190556040516000805160206150dc83398151915290611d5b906020808252601e908201527f6e657874526f756e645472656173757279526577617264437574526174650000604082015260600190565b6000611e956b033b2e3c9fd0803ce80000006137ca8585614844565b6001600160a01b03851660009081526004602090815260408083208684526003810190925282208154919290916142689084906147cb565b90508260080154836007018190555060006142878884600101546137b7565b905060006142958983613524565b905060006142ac8287600701548760000154613ddd565b90506142c98361098e83896008015461340290919063ffffffff16565b60088701556142d9858584614878565b6142e58b8b8a8a6148c6565b5050505050505050505050565b6000546001600160a01b03163314610e0f5760405162461bcd60e51b815260206004820152601960248201527f63616c6c6572206d75737420626520436f6e74726f6c6c6572000000000000006044820152606401610908565b6001600160a01b0384166000908152600460205260408120859161436f836129d2565b9050600061437d8288613524565b60405163b0138c4760e01b8152600760048201526001600160a01b038a16602482015290915073__$d23c89be677d40ab24c636937040b6165f$__9063b0138c479060440160206040518083038186803b1580156143da57600080fd5b505af41580156143ee573d6000803e3d6000fd5b505050506040513d601f19601f820116820180604052508101906144129190614fe8565b15614560576000614421613389565b6001600160a01b0316638a19c8bc6040518163ffffffff1660e01b815260040160206040518083038186803b15801561445957600080fd5b505afa15801561446d573d6000803e3d6000fd5b505050506040513d601f19601f820116820180604052508101906144919190614fcf565b905060006144a0826001613402565b604051631c11bf7f60e11b815290915073__$d23c89be677d40ab24c636937040b6165f$__906338237efe906144e3906007908e9088908e908e9060040161506c565b60006040518083038186803b1580156144fb57600080fd5b505af415801561450f573d6000803e3d6000fd5b5050600654614521925090508a613524565b600655600485015482111561454457600082815260038601602052604090208490555b6004850181905560009081526003850160205260409020829055505b6001600160a01b03881660009081526003602081905260409091200155506109d5905081612bac565b6001600160a01b038083166000908152600360209081526040808320600281015490941683526004909152812060018084015484546005860154909591949193926145d49190613402565b60028401549091506001600160a01b0390811690881681148783116146105761460a84614602856001613524565b8a8a8a614b21565b90975095505b8015614642576008840154614626908890613402565b965061463f84600901548761340290919063ffffffff16565b95505b50505050509250929050565b6000614658613389565b6001600160a01b0316638a19c8bc6040518163ffffffff1660e01b815260040160206040518083038186803b15801561469057600080fd5b505afa1580156146a4573d6000803e3d6000fd5b505050506040513d601f19601f820116820180604052508101906146c89190614fcf565b6146d390600161503d565b90506146dd61405d565b8354600285015460038601546005870154865460405163e35c3e4360e01b81526001600160a01b038b811660048301526024820189905260448201969096529385166064850152608484019290925260a483015260c482015291169063e35c3e439060e401600060405180830381600087803b15801561475c57600080fd5b505af1158015614770573d6000803e3d6000fd5b5050505050505050565b60008054604051631c2d8fb360e31b81527f74b6d21e0d4650f622c903126d418c1a52bcc99ea7acb0db0809fc0eeae6c7c360048201526001600160a01b039091169063e16c7d98906024016133d6565b6147fd6040518060a0016040528060008152602001600081526020016000815260200160008152602001600081525090565b6000828152600393840160208181526040832095860154606085015293909152909152600490910154608082015290565b8361483b858585856148c6565b6109d581612bac565b6000611e95828461509a565b6000611e9582846150b9565b6000611e95826137ca856b033b2e3c9fd0803ce8000000614844565b60008260600151600014156148975761489260018061485c565b61489d565b82606001515b90506148b86148b182848760000154613ddd565b8290613402565b846003018190555050505050565b6001600160a01b0384166000908152600460205260408120906148e8866129d2565b905060006148f68287613402565b905061490187611e64565b15614af9576000614910613389565b6001600160a01b0316638a19c8bc6040518163ffffffff1660e01b815260040160206040518083038186803b15801561494857600080fd5b505afa15801561495c573d6000803e3d6000fd5b505050506040513d601f19601f820116820180604052508101906149809190614fcf565b9050600061498f826001613402565b60405163b0138c4760e01b8152600760048201526001600160a01b038b16602482015290915073__$d23c89be677d40ab24c636937040b6165f$__9063b0138c479060440160206040518083038186803b1580156149ec57600080fd5b505af4158015614a00573d6000803e3d6000fd5b505050506040513d601f19601f82011682018060405250810190614a249190614fe8565b15614ae957604051631c11bf7f60e11b815273__$d23c89be677d40ab24c636937040b6165f$__906338237efe90614a69906007908d9088908d908d9060040161506c565b60006040518083038186803b158015614a8157600080fd5b505af4158015614a95573d6000803e3d6000fd5b5050600654614aa79250905089613402565b6006556004850154821115614aca57600082815260038601602052604090208490555b6000818152600386016020526040902083905560048501819055614af6565b614af68984838a8a61391a565b50505b6001600160a01b03909616600090815260036020819052604090912001959095555050505050565b6000806000614b3088886147cb565b90506000614b3e8988613d38565b9050614b4c82828888614b5c565b9350935050509550959350505050565b600080856060015160001415614b7d57614b7760018061485c565b60608701525b6060850151614b9757614b9160018061485c565b60608601525b614bca614bc385614bb98960800151896080015161352490919063ffffffff16565b8960600151613ddd565b8490613402565b9050614bdf8486606001518860600151613ddd565b915094509492505050565b6001600160a01b038116811461151357600080fd5b60008060008060808587031215614c1557600080fd5b8435614c2081614bea565b9350602085013592506040850135614c3781614bea565b91506060850135614c4781614bea565b939692955090935050565b60008060008060008060c08789031215614c6b57600080fd5b8635614c7681614bea565b9550602087013594506040870135614c8d81614bea565b93506060870135614c9d81614bea565b92506080870135614cad81614bea565b915060a0870135614cbd81614bea565b809150509295509295509295565b600060208284031215614cdd57600080fd5b8135611e9581614bea565b60008060408385031215614cfb57600080fd5b8235614d0681614bea565b946020939093013593505050565b634e487b7160e01b600052602160045260246000fd5b6020810160038310614d3e57614d3e614d14565b91905290565b60008060008060808587031215614d5a57600080fd5b8435614d6581614bea565b93506020850135614d7581614bea565b93969395505050506040820135916060013590565b600060208284031215614d9c57600080fd5b5035919050565b60008060008060808587031215614db957600080fd5b84359350602085013592506040850135614c3781614bea565b600080600060608486031215614de757600080fd5b8335614df281614bea565b95602085013595506040909401359392505050565b60008060408385031215614e1a57600080fd5b50508035926020909101359150565b60008060008060008060c08789031215614e4257600080fd5b863595506020870135614e5481614bea565b94506040870135614c8d81614bea565b600080600060608486031215614e7957600080fd5b833592506020840135614e8b81614bea565b91506040840135614e9b81614bea565b809150509250925092565b60008060408385031215614eb957600080fd5b8235614ec481614bea565b91506020830135614ed481614bea565b809150509250929050565b6020810160028310614d3e57614d3e614d14565b60008060408385031215614f0657600080fd5b823591506020830135614ed481614bea565b600080600080600080600060e0888a031215614f3357600080fd5b873596506020880135614f4581614bea565b95506040880135614f5581614bea565b94506060880135614f6581614bea565b93506080880135614f7581614bea565b925060a0880135614f8581614bea565b915060c0880135614f9581614bea565b8091505092959891949750929550565b600060208284031215614fb757600080fd5b813567ffffffffffffffff81168114611e9557600080fd5b600060208284031215614fe157600080fd5b5051919050565b600060208284031215614ffa57600080fd5b81518015158114611e9557600080fd5b60006020828403121561501c57600080fd5b8151611e9581614bea565b634e487b7160e01b600052601160045260246000fd5b6000821982111561505057615050615027565b500190565b60008282101561506757615067615027565b500390565b9485526001600160a01b03938416602086015260408501929092528216606084015216608082015260a00190565b60008160001904831182151516156150b4576150b4615027565b500290565b6000826150d657634e487b7160e01b600052601260045260246000fd5b50049056fe9f5033568d78ae30f29f01e944f97b2216493bd19d1b46d429673acff3dcd674a2646970667358221220ab2498faa69060ff6e97b3b2a7f0ffa5b2e02f17b4bd53359b26b93dd491f43264736f6c63430008090033",
  "libraries": {
    "SortedDoublyLL": "0x74A56BAeF90aF28Ed2DAc71664550f8C62c41f5e"
  },
  "devdoc": {
    "kind": "dev",
    "methods": {
      "bond(uint256,address)": {
        "params": {
          "_amount": "The amount of tokens to stake",
          "_to": "The address of the transcoder to stake towards"
        }
      },
      "bondForWithHint(uint256,address,address,address,address,address,address)": {
        "details": "If the caller is decreasing the stake of its old delegate in the transcoder pool, the caller can provide an optional hint for the insertion position of the old delegate via the `_oldDelegateNewPosPrev` and `_oldDelegateNewPosNext` params. If the caller is delegating to a delegate that is in the transcoder pool, the caller can provide an optional hint for the insertion position of the delegate via the `_currDelegateNewPosPrev` and `_currDelegateNewPosNext` params. In both cases, a linear search will be executed starting at the hint to find the correct position. In the best case, the hint is the correct position so no search is executed. See SortedDoublyLL.sol for details on list hints",
        "params": {
          "_amount": "The amount of tokens to stake.",
          "_currDelegateNewPosNext": "The address of the next transcoder in the pool for the current delegate",
          "_currDelegateNewPosPrev": "The address of the previous transcoder in the pool for the current delegate",
          "_oldDelegateNewPosNext": "The address of the next transcoder in the pool for the old delegate",
          "_oldDelegateNewPosPrev": "The address of the previous transcoder in the pool for the old delegate",
          "_owner": "The address of the owner of the bond",
          "_to": "The address of the transcoder to stake towards"
        }
      },
      "bondWithHint(uint256,address,address,address,address,address)": {
        "details": "If the caller is decreasing the stake of its old delegate in the transcoder pool, the caller can provide an optional hint for the insertion position of the old delegate via the `_oldDelegateNewPosPrev` and `_oldDelegateNewPosNext` params. If the caller is delegating to a delegate that is in the transcoder pool, the caller can provide an optional hint for the insertion position of the delegate via the `_currDelegateNewPosPrev` and `_currDelegateNewPosNext` params. In both cases, a linear search will be executed starting at the hint to find the correct position. In the best case, the hint is the correct position so no search is executed. See SortedDoublyLL.sol for details on list hints",
        "params": {
          "_amount": "The amount of tokens to stake.",
          "_currDelegateNewPosNext": "The address of the next transcoder in the pool for the current delegate",
          "_currDelegateNewPosPrev": "The address of the previous transcoder in the pool for the current delegate",
          "_oldDelegateNewPosNext": "The address of the next transcoder in the pool for the old delegate",
          "_oldDelegateNewPosPrev": "The address of the previous transcoder in the pool for the old delegate",
          "_to": "The address of the transcoder to stake towards"
        }
      },
      "checkpointBondingState(address)": {
        "details": "This is to allow checkpointing an account that has an inconsistent checkpoint with its current state. Implemented as a deploy utility to checkpoint the existing state when deploying the BondingVotes contract.",
        "params": {
          "_account": "The account to initialize the bonding checkpoint for"
        }
      },
      "claimEarnings(uint256)": {
        "params": {
          "_endRound": "The last round for which to claim token pools shares for a delegator"
        }
      },
      "constructor": {
        "details": "This constructor will not initialize any state variables besides `controller`. The following setter functions should be used to initialize state variables post-deployment: - setUnbondingPeriod() - setNumActiveTranscoders() - setMaxEarningsClaimsRounds()",
        "params": {
          "_controller": "Address of Controller that this contract will be registered with"
        }
      },
      "delegatorStatus(address)": {
        "params": {
          "_delegator": "Address of delegator"
        },
        "returns": {
          "_0": "bonded, unbonded or pending delegator status"
        }
      },
      "getDelegator(address)": {
        "params": {
          "_delegator": "Address of delegator"
        },
        "returns": {
          "bondedAmount": "total amount bonded by '_delegator'",
          "delegateAddress": "address '_delegator' has bonded to",
          "delegatedAmount": "total amount delegated to '_delegator'",
          "fees": "amount of fees collected by '_delegator'",
          "lastClaimRound": "round for which '_delegator' has last claimed earnings",
          "nextUnbondingLockId": "ID for the next unbonding lock created for '_delegator'",
          "startRound": "round in which bond for '_delegator' became effective"
        }
      },
      "getDelegatorUnbondingLock(address,uint256)": {
        "params": {
          "_delegator": "Address of delegator",
          "_unbondingLockId": "ID of unbonding lock"
        },
        "returns": {
          "amount": "of stake locked up by unbonding lock",
          "withdrawRound": "round in which 'amount' becomes available for withdrawal"
        }
      },
      "getFirstTranscoderInPool()": {
        "returns": {
          "_0": "address for transcoder with highest stake in transcoder pool"
        }
      },
      "getNextTranscoderInPool(address)": {
        "params": {
          "_transcoder": "Address of a transcoder in the pool"
        },
        "returns": {
          "_0": "address for the transcoder after '_transcoder' in transcoder pool"
        }
      },
      "getTotalBonded()": {
        "returns": {
          "_0": "total active stake for the current round"
        }
      },
      "getTranscoder(address)": {
        "params": {
          "_transcoder": "Address of transcoder"
        },
        "returns": {
          "activationRound": "Round in which transcoder became active",
          "activeCumulativeRewards": "Transcoder's cumulative rewards that are currently active",
          "cumulativeFees": "Transcoder's cumulative fees (earned via its active staked rewards and its fee share)",
          "cumulativeRewards": "Transcoder's cumulative rewards (earned via its active staked rewards and its reward cut)",
          "deactivationRound": "Round in which transcoder will no longer be active",
          "feeShare": "Transcoder's fee share",
          "lastActiveStakeUpdateRound": "Round in which transcoder's stake was last updated while active",
          "lastFeeRound": "Latest round that the transcoder received fees",
          "lastRewardRound": "Trancoder's last reward round",
          "rewardCut": "Transcoder's reward cut"
        }
      },
      "getTranscoderEarningsPoolForRound(address,uint256)": {
        "params": {
          "_round": "Round number",
          "_transcoder": "Address of transcoder"
        },
        "returns": {
          "cumulativeFeeFactor": "The cumulative fee factor for delegator fees calculation (only used after LIP-36)",
          "cumulativeRewardFactor": "The cumulative reward factor for delegator rewards calculation (only used after LIP-36)",
          "totalStake": "Transcoder's total stake in '_round'",
          "transcoderFeeShare": "Transcoder's fee share for '_round'",
          "transcoderRewardCut": "Transcoder's reward cut for '_round'"
        }
      },
      "getTranscoderPoolMaxSize()": {
        "returns": {
          "_0": "transcoder pool max size"
        }
      },
      "getTranscoderPoolSize()": {
        "returns": {
          "_0": "transcoder pool current size"
        }
      },
      "isActiveTranscoder(address)": {
        "params": {
          "_transcoder": "Transcoder address"
        },
        "returns": {
          "_0": "true if transcoder is active"
        }
      },
      "isRegisteredTranscoder(address)": {
        "params": {
          "_transcoder": "Transcoder address"
        },
        "returns": {
          "_0": "true if transcoder is self-bonded"
        }
      },
      "isValidUnbondingLock(address,uint256)": {
        "params": {
          "_delegator": "Address of delegator",
          "_unbondingLockId": "ID of unbonding lock"
        },
        "returns": {
          "_0": "true if unbondingLock for ID has a non-zero withdraw round"
        }
      },
      "pendingFees(address,uint256)": {
        "params": {
          "_delegator": "Address of delegator",
          "_endRound": "The last round to compute pending fees from"
        },
        "returns": {
          "_0": "Pending fees for '_delegator' since last claiming fees"
        }
      },
      "pendingStake(address,uint256)": {
        "params": {
          "_delegator": "Address of delegator",
          "_endRound": "The last round to compute pending stake from"
        },
        "returns": {
          "_0": "Pending bonded stake for '_delegator' since last claiming rewards"
        }
      },
      "rebond(uint256)": {
        "params": {
          "_unbondingLockId": "ID of unbonding lock to rebond with"
        }
      },
      "rebondFromUnbonded(address,uint256)": {
        "params": {
          "_to": "Address of delegate",
          "_unbondingLockId": "ID of unbonding lock to rebond with"
        }
      },
      "rebondFromUnbondedWithHint(address,uint256,address,address)": {
        "details": "If the delegate joins the transcoder pool, the caller can provide an optional hint for the delegate's insertion position in the pool via the `_newPosPrev` and `_newPosNext` params. A linear search will be executed starting at the hint to find the correct position. In the best case, the hint is the correct position so no search is executed. See SortedDoublyLL.sol for details on list hints",
        "params": {
          "_newPosNext": "Address of next transcoder in pool if the delegate joins the pool",
          "_newPosPrev": "Address of previous transcoder in pool if the delegate joins the pool",
          "_to": "Address of delegate",
          "_unbondingLockId": "ID of unbonding lock to rebond with"
        }
      },
      "rebondWithHint(uint256,address,address)": {
        "details": "If the delegate is in the transcoder pool, the caller can provide an optional hint for the delegate's insertion position in the pool via the `_newPosPrev` and `_newPosNext` params. A linear search will be executed starting at the hint to find the correct position. In the best case, the hint is the correct position so no search is executed. See SortedDoublyLL.sol details on list hints",
        "params": {
          "_newPosNext": "Address of next transcoder in pool if the delegate is in the pool",
          "_newPosPrev": "Address of previous transcoder in pool if the delegate is in the pool",
          "_unbondingLockId": "ID of unbonding lock to rebond with"
        }
      },
      "rewardWithHint(address,address)": {
        "details": "If the caller is in the transcoder pool, the caller can provide an optional hint for its insertion position in the pool via the `_newPosPrev` and `_newPosNext` params. A linear search will be executed starting at the hint to find the correct position. In the best case, the hint is the correct position so no search is executed. See SortedDoublyLL.sol for details on list hints",
        "params": {
          "_newPosNext": "Address of next transcoder in pool if the caller is in the pool",
          "_newPosPrev": "Address of previous transcoder in pool if the caller is in the pool"
        }
      },
      "setController(address)": {
        "params": {
          "_controller": "Controller contract address"
        }
      },
      "setNumActiveTranscoders(uint256)": {
        "params": {
          "_numActiveTranscoders": "Number of active transcoders"
        }
      },
      "setTreasuryBalanceCeiling(uint256)": {
        "params": {
          "_ceiling": "Balance at which treasury reward contributions should halt. Specified in LPT fractional units (18-digit precision)."
        }
      },
      "setTreasuryRewardCutRate(uint256)": {
        "params": {
          "_cutRate": "Percentage of newly minted rewards to route to the treasury. Must be a valid PreciseMathUtils percentage (<100% specified with 27-digits precision)."
        }
      },
      "setUnbondingPeriod(uint64)": {
        "params": {
          "_unbondingPeriod": "Rounds between unbonding and possible withdrawal"
        }
      },
      "slashTranscoder(address,address,uint256,uint256)": {
        "params": {
          "_finder": "Finder that proved a transcoder violated a slashing condition. Null address if there is no finder",
          "_finderFee": "Percentage of penalty awarded to finder. Zero if there is no finder",
          "_slashAmount": "Percentage of transcoder bond to be slashed",
          "_transcoder": "Transcoder address"
        }
      },
      "transcoder(uint256,uint256)": {
        "details": "Percentages are represented as numerators of fractions over MathUtils.PERC_DIVISOR",
        "params": {
          "_feeShare": "% of fees paid to delegators by a transcoder",
          "_rewardCut": "% of reward paid to transcoder by a delegator"
        }
      },
      "transcoderStatus(address)": {
        "params": {
          "_transcoder": "Address of transcoder"
        },
        "returns": {
          "_0": "registered or not registered transcoder status"
        }
      },
      "transcoderTotalStake(address)": {
        "params": {
          "_transcoder": "Address of transcoder"
        },
        "returns": {
          "_0": "total bonded stake for a delegator"
        }
      },
      "transcoderWithHint(uint256,uint256,address,address)": {
        "details": "Percentages are represented as numerators of fractions over MathUtils.PERC_DIVISOR. If the caller is going to be added to the pool, the caller can provide an optional hint for the insertion position in the pool via the `_newPosPrev` and `_newPosNext` params. A linear search will be executed starting at the hint to find the correct position - in the best case, the hint is the correct position so no search is executed. See SortedDoublyLL.sol for details on list hints",
        "params": {
          "_feeShare": "% of fees paid to delegators by a transcoder",
          "_newPosNext": "Address of next transcoder in pool if the caller joins the pool",
          "_newPosPrev": "Address of previous transcoder in pool if the caller joins the pool",
          "_rewardCut": "% of reward paid to transcoder by a delegator"
        }
      },
      "transferBond(address,uint256,address,address,address,address)": {
        "details": "If the original delegate is in the transcoder pool, the caller can provide an optional hint for the insertion position of the delegate via the `_oldDelegateNewPosPrev` and `_oldDelegateNewPosNext` params. If the target delegate is in the transcoder pool, the caller can provide an optional hint for the insertion position of the delegate via the `_newDelegateNewPosPrev` and `_newDelegateNewPosNext` params. In both cases, a linear search will be executed starting at the hint to find the correct position. In the best case, the hint is the correct position so no search is executed. See SortedDoublyLL.sol for details on list hints",
        "params": {
          "_amount": "Portion of the bond to transfer to receiver",
          "_delegator": "Receiver of the bond",
          "_newDelegateNewPosNext": "Address of next transcoder in pool if the delegate is in the pool",
          "_newDelegateNewPosPrev": "Address of previous transcoder in pool if the delegate is in the pool",
          "_oldDelegateNewPosNext": "Address of next transcoder in pool if the delegate remains in the pool",
          "_oldDelegateNewPosPrev": "Address of previous transcoder in pool if the delegate remains in the pool"
        }
      },
      "unbond(uint256)": {
        "params": {
          "_amount": "Amount of tokens to unbond"
        }
      },
      "unbondWithHint(uint256,address,address)": {
        "details": "If the caller remains in the transcoder pool, the caller can provide an optional hint for its insertion position in the pool via the `_newPosPrev` and `_newPosNext` params. A linear search will be executed starting at the hint to find the correct position. In the best case, the hint is the correct position so no search is executed. See SortedDoublyLL.sol details on list hints",
        "params": {
          "_amount": "Amount of tokens to unbond",
          "_newPosNext": "Address of next transcoder in pool if the caller remains in the pool",
          "_newPosPrev": "Address of previous transcoder in pool if the caller remains in the pool"
        }
      },
      "updateTranscoderWithFees(address,uint256,uint256)": {
        "params": {
          "_fees": "Fees to be added to the fee pool",
          "_transcoder": "Transcoder address"
        }
      },
      "withdrawStake(uint256)": {
        "params": {
          "_unbondingLockId": "ID of unbonding lock to withdraw with"
        }
      }
    },
    "title": "BondingManager",
    "version": 1
  },
  "userdoc": {
    "kind": "user",
    "methods": {
      "bond(uint256,address)": {
        "notice": "Delegate stake towards a specific address"
      },
      "bondForWithHint(uint256,address,address,address,address,address,address)": {
        "notice": "Delegates stake \"on behalf of\" another address towards a specific address and updates the transcoder pool using optional list hints if needed"
      },
      "bondWithHint(uint256,address,address,address,address,address)": {
        "notice": "Delegates stake towards a specific address and updates the transcoder pool using optional list hints if needed"
      },
      "checkpointBondingState(address)": {
        "notice": "Checkpoints the bonding state for a given account."
      },
      "claimEarnings(uint256)": {
        "notice": "Claim token pools shares for a delegator from its lastClaimRound through the end round"
      },
      "constructor": {
        "notice": "BondingManager constructor. Only invokes constructor of base Manager contract with provided Controller address"
      },
      "delegatorStatus(address)": {
        "notice": "Computes delegator status"
      },
      "getDelegator(address)": {
        "notice": "Return delegator info"
      },
      "getDelegatorUnbondingLock(address,uint256)": {
        "notice": "Return delegator's unbonding lock info"
      },
      "getFirstTranscoderInPool()": {
        "notice": "Returns transcoder with most stake in pool"
      },
      "getNextTranscoderInPool(address)": {
        "notice": "Returns next transcoder in pool for a given transcoder"
      },
      "getTotalBonded()": {
        "notice": "Return total bonded tokens"
      },
      "getTranscoder(address)": {
        "notice": "Return transcoder information"
      },
      "getTranscoderEarningsPoolForRound(address,uint256)": {
        "notice": "Return transcoder's earnings pool for a given round"
      },
      "getTranscoderPoolMaxSize()": {
        "notice": "Returns max size of transcoder pool"
      },
      "getTranscoderPoolSize()": {
        "notice": "Returns size of transcoder pool"
      },
      "isActiveTranscoder(address)": {
        "notice": "Return whether a transcoder is active for the current round"
      },
      "isRegisteredTranscoder(address)": {
        "notice": "Return whether a transcoder is registered"
      },
      "isValidUnbondingLock(address,uint256)": {
        "notice": "Return whether an unbonding lock for a delegator is valid"
      },
      "pendingFees(address,uint256)": {
        "notice": "Returns pending fees for a delegator from its lastClaimRound through an end round"
      },
      "pendingStake(address,uint256)": {
        "notice": "Returns pending bonded stake for a delegator from its lastClaimRound through an end round"
      },
      "rebond(uint256)": {
        "notice": "Rebond tokens for an unbonding lock to a delegator's current delegate while a delegator is in the Bonded or Pending status"
      },
      "rebondFromUnbonded(address,uint256)": {
        "notice": "Rebond tokens for an unbonding lock to a delegate while a delegator is in the Unbonded status"
      },
      "rebondFromUnbondedWithHint(address,uint256,address,address)": {
        "notice": "Rebond tokens for an unbonding lock to a delegate while a delegator is in the Unbonded status and updates the transcoder pool using an optional list hint if needed"
      },
      "rebondWithHint(uint256,address,address)": {
        "notice": "Rebond tokens for an unbonding lock to a delegator's current delegate while a delegator is in the Bonded or Pending status and updates the transcoder pool using an optional list hint if needed"
      },
      "reward()": {
        "notice": "Mint token rewards for an active transcoder and its delegators"
      },
      "rewardWithHint(address,address)": {
        "notice": "Mint token rewards for an active transcoder and its delegators and update the transcoder pool using an optional list hint if needed"
      },
      "setController(address)": {
        "notice": "Set controller. Only callable by current controller"
      },
      "setCurrentRoundTotalActiveStake()": {
        "notice": "Called during round initialization to set the total active stake for the round. Only callable by the RoundsManager"
      },
      "setNumActiveTranscoders(uint256)": {
        "notice": "Set maximum number of active transcoders. Only callable by Controller owner"
      },
      "setTreasuryBalanceCeiling(uint256)": {
        "notice": "Set treasury balance ceiling. Only callable by Controller owner"
      },
      "setTreasuryRewardCutRate(uint256)": {
        "notice": "Set treasury reward cut rate. Only callable by Controller owner"
      },
      "setUnbondingPeriod(uint64)": {
        "notice": "Set unbonding period. Only callable by Controller owner"
      },
      "slashTranscoder(address,address,uint256,uint256)": {
        "notice": "Slash a transcoder. Only callable by the Verifier"
      },
      "transcoder(uint256,uint256)": {
        "notice": "Sets commission rates as a transcoder and if the caller is not in the transcoder pool tries to add it"
      },
      "transcoderStatus(address)": {
        "notice": "Computes transcoder status"
      },
      "transcoderTotalStake(address)": {
        "notice": "Returns total bonded stake for a transcoder"
      },
      "transcoderWithHint(uint256,uint256,address,address)": {
        "notice": "Sets commission rates as a transcoder and if the caller is not in the transcoder pool tries to add it using an optional list hint"
      },
      "transferBond(address,uint256,address,address,address,address)": {
        "notice": "Transfers ownership of a bond to a new delegator using optional hints if needed If the receiver is already bonded to a different delegate than the bond owner then the stake goes to the receiver's delegate otherwise the receiver's delegate is set as the owner's delegate"
      },
      "unbond(uint256)": {
        "notice": "Unbond an amount of the delegator's bonded stake"
      },
      "unbondWithHint(uint256,address,address)": {
        "notice": "Unbond an amount of the delegator's bonded stake and updates the transcoder pool using an optional list hint if needed"
      },
      "updateTranscoderWithFees(address,uint256,uint256)": {
        "notice": "Update transcoder's fee pool. Only callable by the TicketBroker"
      },
      "withdrawFees(address,uint256)": {
        "notice": "Withdraws fees to the caller"
      },
      "withdrawStake(uint256)": {
        "notice": "Withdraws tokens for an unbonding lock that has existed through an unbonding period"
      }
    },
    "notice": "Manages bonding, transcoder and rewards/fee accounting related operations of the Livepeer protocol",
    "version": 1
  },
  "storageLayout": {
    "storage": [
      {
        "astId": 18792,
        "contract": "contracts/bonding/BondingManager.sol:BondingManager",
        "label": "controller",
        "offset": 0,
        "slot": "0",
        "type": "t_contract(IController)18767"
      },
      {
        "astId": 18974,
        "contract": "contracts/bonding/BondingManager.sol:BondingManager",
        "label": "targetContractId",
        "offset": 0,
        "slot": "1",
        "type": "t_bytes32"
      },
      {
        "astId": 19085,
        "contract": "contracts/bonding/BondingManager.sol:BondingManager",
        "label": "unbondingPeriod",
        "offset": 0,
        "slot": "2",
        "type": "t_uint64"
      },
      {
        "astId": 19148,
        "contract": "contracts/bonding/BondingManager.sol:BondingManager",
        "label": "delegators",
        "offset": 0,
        "slot": "3",
        "type": "t_mapping(t_address,t_struct(Delegator)19134_storage)"
      },
      {
        "astId": 19153,
        "contract": "contracts/bonding/BondingManager.sol:BondingManager",
        "label": "transcoders",
        "offset": 0,
        "slot": "4",
        "type": "t_mapping(t_address,t_struct(Transcoder)19111_storage)"
      },
      {
        "astId": 19155,
        "contract": "contracts/bonding/BondingManager.sol:BondingManager",
        "label": "currentRoundTotalActiveStake",
        "offset": 0,
        "slot": "5",
        "type": "t_uint256"
      },
      {
        "astId": 19157,
        "contract": "contracts/bonding/BondingManager.sol:BondingManager",
        "label": "nextRoundTotalActiveStake",
        "offset": 0,
        "slot": "6",
        "type": "t_uint256"
      },
      {
        "astId": 19160,
        "contract": "contracts/bonding/BondingManager.sol:BondingManager",
        "label": "transcoderPool",
        "offset": 0,
        "slot": "7",
        "type": "t_struct(Data)25001_storage"
      },
      {
        "astId": 19162,
        "contract": "contracts/bonding/BondingManager.sol:BondingManager",
        "label": "treasuryRewardCutRate",
        "offset": 0,
        "slot": "12",
        "type": "t_uint256"
      },
      {
        "astId": 19164,
        "contract": "contracts/bonding/BondingManager.sol:BondingManager",
        "label": "nextRoundTreasuryRewardCutRate",
        "offset": 0,
        "slot": "13",
        "type": "t_uint256"
      },
      {
        "astId": 19166,
        "contract": "contracts/bonding/BondingManager.sol:BondingManager",
        "label": "treasuryBalanceCeiling",
        "offset": 0,
        "slot": "14",
        "type": "t_uint256"
      }
    ],
    "types": {
      "t_address": {
        "encoding": "inplace",
        "label": "address",
        "numberOfBytes": "20"
      },
      "t_bytes32": {
        "encoding": "inplace",
        "label": "bytes32",
        "numberOfBytes": "32"
      },
      "t_contract(IController)18767": {
        "encoding": "inplace",
        "label": "contract IController",
        "numberOfBytes": "20"
      },
      "t_mapping(t_address,t_struct(Delegator)19134_storage)": {
        "encoding": "mapping",
        "key": "t_address",
        "label": "mapping(address => struct BondingManager.Delegator)",
        "numberOfBytes": "32",
        "value": "t_struct(Delegator)19134_storage"
      },
      "t_mapping(t_address,t_struct(Node)24987_storage)": {
        "encoding": "mapping",
        "key": "t_address",
        "label": "mapping(address => struct SortedDoublyLL.Node)",
        "numberOfBytes": "32",
        "value": "t_struct(Node)24987_storage"
      },
      "t_mapping(t_address,t_struct(Transcoder)19111_storage)": {
        "encoding": "mapping",
        "key": "t_address",
        "label": "mapping(address => struct BondingManager.Transcoder)",
        "numberOfBytes": "32",
        "value": "t_struct(Transcoder)19111_storage"
      },
      "t_mapping(t_uint256,t_struct(Data)24028_storage)": {
        "encoding": "mapping",
        "key": "t_uint256",
        "label": "mapping(uint256 => struct EarningsPool.Data)",
        "numberOfBytes": "32",
        "value": "t_struct(Data)24028_storage"
      },
      "t_mapping(t_uint256,t_struct(UnbondingLock)19143_storage)": {
        "encoding": "mapping",
        "key": "t_uint256",
        "label": "mapping(uint256 => struct BondingManager.UnbondingLock)",
        "numberOfBytes": "32",
        "value": "t_struct(UnbondingLock)19143_storage"
      },
      "t_struct(Data)24028_storage": {
        "encoding": "inplace",
        "label": "struct EarningsPool.Data",
        "members": [
          {
            "astId": 24019,
            "contract": "contracts/bonding/BondingManager.sol:BondingManager",
            "label": "totalStake",
            "offset": 0,
            "slot": "0",
            "type": "t_uint256"
          },
          {
            "astId": 24021,
            "contract": "contracts/bonding/BondingManager.sol:BondingManager",
            "label": "transcoderRewardCut",
            "offset": 0,
            "slot": "1",
            "type": "t_uint256"
          },
          {
            "astId": 24023,
            "contract": "contracts/bonding/BondingManager.sol:BondingManager",
            "label": "transcoderFeeShare",
            "offset": 0,
            "slot": "2",
            "type": "t_uint256"
          },
          {
            "astId": 24025,
            "contract": "contracts/bonding/BondingManager.sol:BondingManager",
            "label": "cumulativeRewardFactor",
            "offset": 0,
            "slot": "3",
            "type": "t_uint256"
          },
          {
            "astId": 24027,
            "contract": "contracts/bonding/BondingManager.sol:BondingManager",
            "label": "cumulativeFeeFactor",
            "offset": 0,
            "slot": "4",
            "type": "t_uint256"
          }
        ],
        "numberOfBytes": "160"
      },
      "t_struct(Data)25001_storage": {
        "encoding": "inplace",
        "label": "struct SortedDoublyLL.Data",
        "members": [
          {
            "astId": 24989,
            "contract": "contracts/bonding/BondingManager.sol:BondingManager",
            "label": "head",
            "offset": 0,
            "slot": "0",
            "type": "t_address"
          },
          {
            "astId": 24991,
            "contract": "contracts/bonding/BondingManager.sol:BondingManager",
            "label": "tail",
            "offset": 0,
            "slot": "1",
            "type": "t_address"
          },
          {
            "astId": 24993,
            "contract": "contracts/bonding/BondingManager.sol:BondingManager",
            "label": "maxSize",
            "offset": 0,
            "slot": "2",
            "type": "t_uint256"
          },
          {
            "astId": 24995,
            "contract": "contracts/bonding/BondingManager.sol:BondingManager",
            "label": "size",
            "offset": 0,
            "slot": "3",
            "type": "t_uint256"
          },
          {
            "astId": 25000,
            "contract": "contracts/bonding/BondingManager.sol:BondingManager",
            "label": "nodes",
            "offset": 0,
            "slot": "4",
            "type": "t_mapping(t_address,t_struct(Node)24987_storage)"
          }
        ],
        "numberOfBytes": "160"
      },
      "t_struct(Delegator)19134_storage": {
        "encoding": "inplace",
        "label": "struct BondingManager.Delegator",
        "members": [
          {
            "astId": 19116,
            "contract": "contracts/bonding/BondingManager.sol:BondingManager",
            "label": "bondedAmount",
            "offset": 0,
            "slot": "0",
            "type": "t_uint256"
          },
          {
            "astId": 19118,
            "contract": "contracts/bonding/BondingManager.sol:BondingManager",
            "label": "fees",
            "offset": 0,
            "slot": "1",
            "type": "t_uint256"
          },
          {
            "astId": 19120,
            "contract": "contracts/bonding/BondingManager.sol:BondingManager",
            "label": "delegateAddress",
            "offset": 0,
            "slot": "2",
            "type": "t_address"
          },
          {
            "astId": 19122,
            "contract": "contracts/bonding/BondingManager.sol:BondingManager",
            "label": "delegatedAmount",
            "offset": 0,
            "slot": "3",
            "type": "t_uint256"
          },
          {
            "astId": 19124,
            "contract": "contracts/bonding/BondingManager.sol:BondingManager",
            "label": "startRound",
            "offset": 0,
            "slot": "4",
            "type": "t_uint256"
          },
          {
            "astId": 19126,
            "contract": "contracts/bonding/BondingManager.sol:BondingManager",
            "label": "lastClaimRound",
            "offset": 0,
            "slot": "5",
            "type": "t_uint256"
          },
          {
            "astId": 19128,
            "contract": "contracts/bonding/BondingManager.sol:BondingManager",
            "label": "nextUnbondingLockId",
            "offset": 0,
            "slot": "6",
            "type": "t_uint256"
          },
          {
            "astId": 19133,
            "contract": "contracts/bonding/BondingManager.sol:BondingManager",
            "label": "unbondingLocks",
            "offset": 0,
            "slot": "7",
            "type": "t_mapping(t_uint256,t_struct(UnbondingLock)19143_storage)"
          }
        ],
        "numberOfBytes": "256"
      },
      "t_struct(Node)24987_storage": {
        "encoding": "inplace",
        "label": "struct SortedDoublyLL.Node",
        "members": [
          {
            "astId": 24982,
            "contract": "contracts/bonding/BondingManager.sol:BondingManager",
            "label": "key",
            "offset": 0,
            "slot": "0",
            "type": "t_uint256"
          },
          {
            "astId": 24984,
            "contract": "contracts/bonding/BondingManager.sol:BondingManager",
            "label": "nextId",
            "offset": 0,
            "slot": "1",
            "type": "t_address"
          },
          {
            "astId": 24986,
            "contract": "contracts/bonding/BondingManager.sol:BondingManager",
            "label": "prevId",
            "offset": 0,
            "slot": "2",
            "type": "t_address"
          }
        ],
        "numberOfBytes": "96"
      },
      "t_struct(Transcoder)19111_storage": {
        "encoding": "inplace",
        "label": "struct BondingManager.Transcoder",
        "members": [
          {
            "astId": 19087,
            "contract": "contracts/bonding/BondingManager.sol:BondingManager",
            "label": "lastRewardRound",
            "offset": 0,
            "slot": "0",
            "type": "t_uint256"
          },
          {
            "astId": 19089,
            "contract": "contracts/bonding/BondingManager.sol:BondingManager",
            "label": "rewardCut",
            "offset": 0,
            "slot": "1",
            "type": "t_uint256"
          },
          {
            "astId": 19091,
            "contract": "contracts/bonding/BondingManager.sol:BondingManager",
            "label": "feeShare",
            "offset": 0,
            "slot": "2",
            "type": "t_uint256"
          },
          {
            "astId": 19096,
            "contract": "contracts/bonding/BondingManager.sol:BondingManager",
            "label": "earningsPoolPerRound",
            "offset": 0,
            "slot": "3",
            "type": "t_mapping(t_uint256,t_struct(Data)24028_storage)"
          },
          {
            "astId": 19098,
            "contract": "contracts/bonding/BondingManager.sol:BondingManager",
            "label": "lastActiveStakeUpdateRound",
            "offset": 0,
            "slot": "4",
            "type": "t_uint256"
          },
          {
            "astId": 19100,
            "contract": "contracts/bonding/BondingManager.sol:BondingManager",
            "label": "activationRound",
            "offset": 0,
            "slot": "5",
            "type": "t_uint256"
          },
          {
            "astId": 19102,
            "contract": "contracts/bonding/BondingManager.sol:BondingManager",
            "label": "deactivationRound",
            "offset": 0,
            "slot": "6",
            "type": "t_uint256"
          },
          {
            "astId": 19104,
            "contract": "contracts/bonding/BondingManager.sol:BondingManager",
            "label": "activeCumulativeRewards",
            "offset": 0,
            "slot": "7",
            "type": "t_uint256"
          },
          {
            "astId": 19106,
            "contract": "contracts/bonding/BondingManager.sol:BondingManager",
            "label": "cumulativeRewards",
            "offset": 0,
            "slot": "8",
            "type": "t_uint256"
          },
          {
            "astId": 19108,
            "contract": "contracts/bonding/BondingManager.sol:BondingManager",
            "label": "cumulativeFees",
            "offset": 0,
            "slot": "9",
            "type": "t_uint256"
          },
          {
            "astId": 19110,
            "contract": "contracts/bonding/BondingManager.sol:BondingManager",
            "label": "lastFeeRound",
            "offset": 0,
            "slot": "10",
            "type": "t_uint256"
          }
        ],
        "numberOfBytes": "352"
      },
      "t_struct(UnbondingLock)19143_storage": {
        "encoding": "inplace",
        "label": "struct BondingManager.UnbondingLock",
        "members": [
          {
            "astId": 19140,
            "contract": "contracts/bonding/BondingManager.sol:BondingManager",
            "label": "amount",
            "offset": 0,
            "slot": "0",
            "type": "t_uint256"
          },
          {
            "astId": 19142,
            "contract": "contracts/bonding/BondingManager.sol:BondingManager",
            "label": "withdrawRound",
            "offset": 0,
            "slot": "1",
            "type": "t_uint256"
          }
        ],
        "numberOfBytes": "64"
      },
      "t_uint256": {
        "encoding": "inplace",
        "label": "uint256",
        "numberOfBytes": "32"
      },
      "t_uint64": {
        "encoding": "inplace",
        "label": "uint64",
        "numberOfBytes": "8"
      }
    }
  }
}