{
  "address": "0x53ebC58f6D5c326fa29c6ce58B16997E7A0b95D1",
  "abi": [
    {
      "constant": false,
      "inputs": [
        {
          "internalType": "address",
          "name": "_to",
          "type": "address"
        },
        {
          "internalType": "uint256",
          "name": "_unbondingLockId",
          "type": "uint256"
        },
        {
          "internalType": "address",
          "name": "_newPosPrev",
          "type": "address"
        },
        {
          "internalType": "address",
          "name": "_newPosNext",
          "type": "address"
        }
      ],
      "name": "rebondFromUnbondedWithHint",
      "outputs": [],
      "payable": false,
      "stateMutability": "nonpayable",
      "type": "function"
    },
    {
      "constant": false,
      "inputs": [
        {
          "internalType": "address",
          "name": "_delegator",
          "type": "address"
        },
        {
          "internalType": "uint256",
          "name": "_amount",
          "type": "uint256"
        },
        {
          "internalType": "address",
          "name": "_oldDelegateNewPosPrev",
          "type": "address"
        },
        {
          "internalType": "address",
          "name": "_oldDelegateNewPosNext",
          "type": "address"
        },
        {
          "internalType": "address",
          "name": "_newDelegateNewPosPrev",
          "type": "address"
        },
        {
          "internalType": "address",
          "name": "_newDelegateNewPosNext",
          "type": "address"
        }
      ],
      "name": "transferBond",
      "outputs": [],
      "payable": false,
      "stateMutability": "nonpayable",
      "type": "function"
    },
    {
      "constant": true,
      "inputs": [
        {
          "internalType": "address",
          "name": "_transcoder",
          "type": "address"
        }
      ],
      "name": "isActiveTranscoder",
      "outputs": [
        {
          "internalType": "bool",
          "name": "",
          "type": "bool"
        }
      ],
      "payable": false,
      "stateMutability": "view",
      "type": "function"
    },
    {
      "constant": true,
      "inputs": [
        {
          "internalType": "address",
          "name": "_delegator",
          "type": "address"
        },
        {
          "internalType": "uint256",
          "name": "_unbondingLockId",
          "type": "uint256"
        }
      ],
      "name": "isValidUnbondingLock",
      "outputs": [
        {
          "internalType": "bool",
          "name": "",
          "type": "bool"
        }
      ],
      "payable": false,
      "stateMutability": "view",
      "type": "function"
    },
    {
      "constant": true,
      "inputs": [
        {
          "internalType": "address",
          "name": "_delegator",
          "type": "address"
        }
      ],
      "name": "delegatorStatus",
      "outputs": [
        {
          "internalType": "enum BondingManager.DelegatorStatus",
          "name": "",
          "type": "uint8"
        }
      ],
      "payable": false,
      "stateMutability": "view",
      "type": "function"
    },
    {
      "constant": false,
      "inputs": [],
      "name": "reward",
      "outputs": [],
      "payable": false,
      "stateMutability": "nonpayable",
      "type": "function"
    },
    {
      "constant": false,
      "inputs": [
        {
          "internalType": "address",
          "name": "_transcoder",
          "type": "address"
        },
        {
          "internalType": "address",
          "name": "_finder",
          "type": "address"
        },
        {
          "internalType": "uint256",
          "name": "_slashAmount",
          "type": "uint256"
        },
        {
          "internalType": "uint256",
          "name": "_finderFee",
          "type": "uint256"
        }
      ],
      "name": "slashTranscoder",
      "outputs": [],
      "payable": false,
      "stateMutability": "nonpayable",
      "type": "function"
    },
    {
      "constant": true,
      "inputs": [
        {
          "internalType": "address",
          "name": "_transcoder",
          "type": "address"
        }
      ],
      "name": "getNextTranscoderInPool",
      "outputs": [
        {
          "internalType": "address",
          "name": "",
          "type": "address"
        }
      ],
      "payable": false,
      "stateMutability": "view",
      "type": "function"
    },
    {
      "constant": true,
      "inputs": [
        {
          "internalType": "address",
          "name": "_transcoder",
          "type": "address"
        },
        {
          "internalType": "uint256",
          "name": "_round",
          "type": "uint256"
        }
      ],
      "name": "getTranscoderEarningsPoolForRound",
      "outputs": [
        {
          "internalType": "uint256",
          "name": "totalStake",
          "type": "uint256"
        },
        {
          "internalType": "uint256",
          "name": "transcoderRewardCut",
          "type": "uint256"
        },
        {
          "internalType": "uint256",
          "name": "transcoderFeeShare",
          "type": "uint256"
        },
        {
          "internalType": "uint256",
          "name": "cumulativeRewardFactor",
          "type": "uint256"
        },
        {
          "internalType": "uint256",
          "name": "cumulativeFeeFactor",
          "type": "uint256"
        }
      ],
      "payable": false,
      "stateMutability": "view",
      "type": "function"
    },
    {
      "constant": false,
      "inputs": [
        {
          "internalType": "uint256",
          "name": "_endRound",
          "type": "uint256"
        }
      ],
      "name": "claimEarnings",
      "outputs": [],
      "payable": false,
      "stateMutability": "nonpayable",
      "type": "function"
    },
    {
      "constant": false,
      "inputs": [
        {
          "internalType": "uint256",
          "name": "_unbondingLockId",
          "type": "uint256"
        }
      ],
      "name": "withdrawStake",
      "outputs": [],
      "payable": false,
      "stateMutability": "nonpayable",
      "type": "function"
    },
    {
      "constant": false,
      "inputs": [
        {
          "internalType": "uint256",
          "name": "_amount",
          "type": "uint256"
        }
      ],
      "name": "unbond",
      "outputs": [],
      "payable": false,
      "stateMutability": "nonpayable",
      "type": "function"
    },
    {
      "constant": true,
      "inputs": [],
      "name": "getTranscoderPoolSize",
      "outputs": [
        {
          "internalType": "uint256",
          "name": "",
          "type": "uint256"
        }
      ],
      "payable": false,
      "stateMutability": "view",
      "type": "function"
    },
    {
      "constant": false,
      "inputs": [
        {
          "internalType": "uint256",
          "name": "_rewardCut",
          "type": "uint256"
        },
        {
          "internalType": "uint256",
          "name": "_feeShare",
          "type": "uint256"
        },
        {
          "internalType": "address",
          "name": "_newPosPrev",
          "type": "address"
        },
        {
          "internalType": "address",
          "name": "_newPosNext",
          "type": "address"
        }
      ],
      "name": "transcoderWithHint",
      "outputs": [],
      "payable": false,
      "stateMutability": "nonpayable",
      "type": "function"
    },
    {
      "constant": false,
      "inputs": [
        {
          "internalType": "address",
          "name": "_to",
          "type": "address"
        },
        {
          "internalType": "uint256",
          "name": "_unbondingLockId",
          "type": "uint256"
        }
      ],
      "name": "rebondFromUnbonded",
      "outputs": [],
      "payable": false,
      "stateMutability": "nonpayable",
      "type": "function"
    },
    {
      "constant": false,
      "inputs": [
        {
          "internalType": "address",
          "name": "_transcoder",
          "type": "address"
        },
        {
          "internalType": "uint256",
          "name": "_fees",
          "type": "uint256"
        },
        {
          "internalType": "uint256",
          "name": "_round",
          "type": "uint256"
        }
      ],
      "name": "updateTranscoderWithFees",
      "outputs": [],
      "payable": false,
      "stateMutability": "nonpayable",
      "type": "function"
    },
    {
      "constant": true,
      "inputs": [
        {
          "internalType": "address",
          "name": "_delegator",
          "type": "address"
        },
        {
          "internalType": "uint256",
          "name": "_unbondingLockId",
          "type": "uint256"
        }
      ],
      "name": "getDelegatorUnbondingLock",
      "outputs": [
        {
          "internalType": "uint256",
          "name": "amount",
          "type": "uint256"
        },
        {
          "internalType": "uint256",
          "name": "withdrawRound",
          "type": "uint256"
        }
      ],
      "payable": false,
      "stateMutability": "view",
      "type": "function"
    },
    {
      "constant": true,
      "inputs": [],
      "name": "currentRoundTotalActiveStake",
      "outputs": [
        {
          "internalType": "uint256",
          "name": "",
          "type": "uint256"
        }
      ],
      "payable": false,
      "stateMutability": "view",
      "type": "function"
    },
    {
      "constant": false,
      "inputs": [
        {
          "internalType": "uint256",
          "name": "_rewardCut",
          "type": "uint256"
        },
        {
          "internalType": "uint256",
          "name": "_feeShare",
          "type": "uint256"
        }
      ],
      "name": "transcoder",
      "outputs": [],
      "payable": false,
      "stateMutability": "nonpayable",
      "type": "function"
    },
    {
      "constant": true,
      "inputs": [],
      "name": "nextRoundTotalActiveStake",
      "outputs": [
        {
          "internalType": "uint256",
          "name": "",
          "type": "uint256"
        }
      ],
      "payable": false,
      "stateMutability": "view",
      "type": "function"
    },
    {
      "constant": true,
      "inputs": [],
      "name": "targetContractId",
      "outputs": [
        {
          "internalType": "bytes32",
          "name": "",
          "type": "bytes32"
        }
      ],
      "payable": false,
      "stateMutability": "view",
      "type": "function"
    },
    {
      "constant": true,
      "inputs": [],
      "name": "getTranscoderPoolMaxSize",
      "outputs": [
        {
          "internalType": "uint256",
          "name": "",
          "type": "uint256"
        }
      ],
      "payable": false,
      "stateMutability": "view",
      "type": "function"
    },
    {
      "constant": true,
      "inputs": [],
      "name": "getTotalBonded",
      "outputs": [
        {
          "internalType": "uint256",
          "name": "",
          "type": "uint256"
        }
      ],
      "payable": false,
      "stateMutability": "view",
      "type": "function"
    },
    {
      "constant": true,
      "inputs": [
        {
          "internalType": "address",
          "name": "_transcoder",
          "type": "address"
        }
      ],
      "name": "getTranscoder",
      "outputs": [
        {
          "internalType": "uint256",
          "name": "lastRewardRound",
          "type": "uint256"
        },
        {
          "internalType": "uint256",
          "name": "rewardCut",
          "type": "uint256"
        },
        {
          "internalType": "uint256",
          "name": "feeShare",
          "type": "uint256"
        },
        {
          "internalType": "uint256",
          "name": "lastActiveStakeUpdateRound",
          "type": "uint256"
        },
        {
          "internalType": "uint256",
          "name": "activationRound",
          "type": "uint256"
        },
        {
          "internalType": "uint256",
          "name": "deactivationRound",
          "type": "uint256"
        },
        {
          "internalType": "uint256",
          "name": "activeCumulativeRewards",
          "type": "uint256"
        },
        {
          "internalType": "uint256",
          "name": "cumulativeRewards",
          "type": "uint256"
        },
        {
          "internalType": "uint256",
          "name": "cumulativeFees",
          "type": "uint256"
        },
        {
          "internalType": "uint256",
          "name": "lastFeeRound",
          "type": "uint256"
        }
      ],
      "payable": false,
      "stateMutability": "view",
      "type": "function"
    },
    {
      "constant": false,
      "inputs": [
        {
          "internalType": "uint256",
          "name": "_numActiveTranscoders",
          "type": "uint256"
        }
      ],
      "name": "setNumActiveTranscoders",
      "outputs": [],
      "payable": false,
      "stateMutability": "nonpayable",
      "type": "function"
    },
    {
      "constant": true,
      "inputs": [
        {
          "internalType": "address",
          "name": "_transcoder",
          "type": "address"
        }
      ],
      "name": "isRegisteredTranscoder",
      "outputs": [
        {
          "internalType": "bool",
          "name": "",
          "type": "bool"
        }
      ],
      "payable": false,
      "stateMutability": "view",
      "type": "function"
    },
    {
      "constant": false,
      "inputs": [
        {
          "internalType": "uint256",
          "name": "_amount",
          "type": "uint256"
        },
        {
          "internalType": "address",
          "name": "_to",
          "type": "address"
        },
        {
          "internalType": "address",
          "name": "_oldDelegateNewPosPrev",
          "type": "address"
        },
        {
          "internalType": "address",
          "name": "_oldDelegateNewPosNext",
          "type": "address"
        },
        {
          "internalType": "address",
          "name": "_currDelegateNewPosPrev",
          "type": "address"
        },
        {
          "internalType": "address",
          "name": "_currDelegateNewPosNext",
          "type": "address"
        }
      ],
      "name": "bondWithHint",
      "outputs": [],
      "payable": false,
      "stateMutability": "nonpayable",
      "type": "function"
    },
    {
      "constant": true,
      "inputs": [],
      "name": "unbondingPeriod",
      "outputs": [
        {
          "internalType": "uint64",
          "name": "",
          "type": "uint64"
        }
      ],
      "payable": false,
      "stateMutability": "view",
      "type": "function"
    },
    {
      "constant": false,
      "inputs": [],
      "name": "setCurrentRoundTotalActiveStake",
      "outputs": [],
      "payable": false,
      "stateMutability": "nonpayable",
      "type": "function"
    },
    {
      "constant": false,
      "inputs": [
        {
          "internalType": "uint256",
          "name": "_unbondingLockId",
          "type": "uint256"
        },
        {
          "internalType": "address",
          "name": "_newPosPrev",
          "type": "address"
        },
        {
          "internalType": "address",
          "name": "_newPosNext",
          "type": "address"
        }
      ],
      "name": "rebondWithHint",
      "outputs": [],
      "payable": false,
      "stateMutability": "nonpayable",
      "type": "function"
    },
    {
      "constant": false,
      "inputs": [
        {
          "internalType": "address",
          "name": "_newPosPrev",
          "type": "address"
        },
        {
          "internalType": "address",
          "name": "_newPosNext",
          "type": "address"
        }
      ],
      "name": "rewardWithHint",
      "outputs": [],
      "payable": false,
      "stateMutability": "nonpayable",
      "type": "function"
    },
    {
      "constant": true,
      "inputs": [],
      "name": "getFirstTranscoderInPool",
      "outputs": [
        {
          "internalType": "address",
          "name": "",
          "type": "address"
        }
      ],
      "payable": false,
      "stateMutability": "view",
      "type": "function"
    },
    {
      "constant": true,
      "inputs": [
        {
          "internalType": "address",
          "name": "_transcoder",
          "type": "address"
        }
      ],
      "name": "transcoderStatus",
      "outputs": [
        {
          "internalType": "enum BondingManager.TranscoderStatus",
          "name": "",
          "type": "uint8"
        }
      ],
      "payable": false,
      "stateMutability": "view",
      "type": "function"
    },
    {
      "constant": false,
      "inputs": [
        {
          "internalType": "address",
          "name": "_controller",
          "type": "address"
        }
      ],
      "name": "setController",
      "outputs": [],
      "payable": false,
      "stateMutability": "nonpayable",
      "type": "function"
    },
    {
      "constant": false,
      "inputs": [
        {
          "internalType": "uint256",
          "name": "_amount",
          "type": "uint256"
        },
        {
          "internalType": "address",
          "name": "_newPosPrev",
          "type": "address"
        },
        {
          "internalType": "address",
          "name": "_newPosNext",
          "type": "address"
        }
      ],
      "name": "unbondWithHint",
      "outputs": [],
      "payable": false,
      "stateMutability": "nonpayable",
      "type": "function"
    },
    {
      "constant": true,
      "inputs": [
        {
          "internalType": "address",
          "name": "_delegator",
          "type": "address"
        },
        {
          "internalType": "uint256",
          "name": "_endRound",
          "type": "uint256"
        }
      ],
      "name": "pendingStake",
      "outputs": [
        {
          "internalType": "uint256",
          "name": "",
          "type": "uint256"
        }
      ],
      "payable": false,
      "stateMutability": "view",
      "type": "function"
    },
    {
      "constant": true,
      "inputs": [
        {
          "internalType": "address",
          "name": "_transcoder",
          "type": "address"
        }
      ],
      "name": "transcoderTotalStake",
      "outputs": [
        {
          "internalType": "uint256",
          "name": "",
          "type": "uint256"
        }
      ],
      "payable": false,
      "stateMutability": "view",
      "type": "function"
    },
    {
      "constant": true,
      "inputs": [
        {
          "internalType": "address",
          "name": "_delegator",
          "type": "address"
        }
      ],
      "name": "getDelegator",
      "outputs": [
        {
          "internalType": "uint256",
          "name": "bondedAmount",
          "type": "uint256"
        },
        {
          "internalType": "uint256",
          "name": "fees",
          "type": "uint256"
        },
        {
          "internalType": "address",
          "name": "delegateAddress",
          "type": "address"
        },
        {
          "internalType": "uint256",
          "name": "delegatedAmount",
          "type": "uint256"
        },
        {
          "internalType": "uint256",
          "name": "startRound",
          "type": "uint256"
        },
        {
          "internalType": "uint256",
          "name": "lastClaimRound",
          "type": "uint256"
        },
        {
          "internalType": "uint256",
          "name": "nextUnbondingLockId",
          "type": "uint256"
        }
      ],
      "payable": false,
      "stateMutability": "view",
      "type": "function"
    },
    {
      "constant": false,
      "inputs": [
        {
          "internalType": "address payable",
          "name": "_recipient",
          "type": "address"
        },
        {
          "internalType": "uint256",
          "name": "_amount",
          "type": "uint256"
        }
      ],
      "name": "withdrawFees",
      "outputs": [],
      "payable": false,
      "stateMutability": "nonpayable",
      "type": "function"
    },
    {
      "constant": false,
      "inputs": [
        {
          "internalType": "uint256",
          "name": "_amount",
          "type": "uint256"
        },
        {
          "internalType": "address",
          "name": "_to",
          "type": "address"
        }
      ],
      "name": "bond",
      "outputs": [],
      "payable": false,
      "stateMutability": "nonpayable",
      "type": "function"
    },
    {
      "constant": false,
      "inputs": [
        {
          "internalType": "uint256",
          "name": "_unbondingLockId",
          "type": "uint256"
        }
      ],
      "name": "rebond",
      "outputs": [],
      "payable": false,
      "stateMutability": "nonpayable",
      "type": "function"
    },
    {
      "constant": false,
      "inputs": [
        {
          "internalType": "uint256",
          "name": "_amount",
          "type": "uint256"
        },
        {
          "internalType": "address",
          "name": "_owner",
          "type": "address"
        },
        {
          "internalType": "address",
          "name": "_to",
          "type": "address"
        },
        {
          "internalType": "address",
          "name": "_oldDelegateNewPosPrev",
          "type": "address"
        },
        {
          "internalType": "address",
          "name": "_oldDelegateNewPosNext",
          "type": "address"
        },
        {
          "internalType": "address",
          "name": "_currDelegateNewPosPrev",
          "type": "address"
        },
        {
          "internalType": "address",
          "name": "_currDelegateNewPosNext",
          "type": "address"
        }
      ],
      "name": "bondForWithHint",
      "outputs": [],
      "payable": false,
      "stateMutability": "nonpayable",
      "type": "function"
    },
    {
      "constant": false,
      "inputs": [
        {
          "internalType": "uint64",
          "name": "_unbondingPeriod",
          "type": "uint64"
        }
      ],
      "name": "setUnbondingPeriod",
      "outputs": [],
      "payable": false,
      "stateMutability": "nonpayable",
      "type": "function"
    },
    {
      "constant": true,
      "inputs": [
        {
          "internalType": "address",
          "name": "_delegator",
          "type": "address"
        },
        {
          "internalType": "uint256",
          "name": "_endRound",
          "type": "uint256"
        }
      ],
      "name": "pendingFees",
      "outputs": [
        {
          "internalType": "uint256",
          "name": "",
          "type": "uint256"
        }
      ],
      "payable": false,
      "stateMutability": "view",
      "type": "function"
    },
    {
      "constant": true,
      "inputs": [],
      "name": "controller",
      "outputs": [
        {
          "internalType": "contract IController",
          "name": "",
          "type": "address"
        }
      ],
      "payable": false,
      "stateMutability": "view",
      "type": "function"
    },
    {
      "inputs": [
        {
          "internalType": "address",
          "name": "_controller",
          "type": "address"
        }
      ],
      "payable": false,
      "stateMutability": "nonpayable",
      "type": "constructor"
    },
    {
      "anonymous": false,
      "inputs": [
        {
          "indexed": true,
          "internalType": "address",
          "name": "transcoder",
          "type": "address"
        },
        {
          "indexed": false,
          "internalType": "uint256",
          "name": "rewardCut",
          "type": "uint256"
        },
        {
          "indexed": false,
          "internalType": "uint256",
          "name": "feeShare",
          "type": "uint256"
        }
      ],
      "name": "TranscoderUpdate",
      "type": "event"
    },
    {
      "anonymous": false,
      "inputs": [
        {
          "indexed": true,
          "internalType": "address",
          "name": "transcoder",
          "type": "address"
        },
        {
          "indexed": false,
          "internalType": "uint256",
          "name": "activationRound",
          "type": "uint256"
        }
      ],
      "name": "TranscoderActivated",
      "type": "event"
    },
    {
      "anonymous": false,
      "inputs": [
        {
          "indexed": true,
          "internalType": "address",
          "name": "transcoder",
          "type": "address"
        },
        {
          "indexed": false,
          "internalType": "uint256",
          "name": "deactivationRound",
          "type": "uint256"
        }
      ],
      "name": "TranscoderDeactivated",
      "type": "event"
    },
    {
      "anonymous": false,
      "inputs": [
        {
          "indexed": true,
          "internalType": "address",
          "name": "transcoder",
          "type": "address"
        },
        {
          "indexed": false,
          "internalType": "address",
          "name": "finder",
          "type": "address"
        },
        {
          "indexed": false,
          "internalType": "uint256",
          "name": "penalty",
          "type": "uint256"
        },
        {
          "indexed": false,
          "internalType": "uint256",
          "name": "finderReward",
          "type": "uint256"
        }
      ],
      "name": "TranscoderSlashed",
      "type": "event"
    },
    {
      "anonymous": false,
      "inputs": [
        {
          "indexed": true,
          "internalType": "address",
          "name": "transcoder",
          "type": "address"
        },
        {
          "indexed": false,
          "internalType": "uint256",
          "name": "amount",
          "type": "uint256"
        }
      ],
      "name": "Reward",
      "type": "event"
    },
    {
      "anonymous": false,
      "inputs": [
        {
          "indexed": true,
          "internalType": "address",
          "name": "newDelegate",
          "type": "address"
        },
        {
          "indexed": true,
          "internalType": "address",
          "name": "oldDelegate",
          "type": "address"
        },
        {
          "indexed": true,
          "internalType": "address",
          "name": "delegator",
          "type": "address"
        },
        {
          "indexed": false,
          "internalType": "uint256",
          "name": "additionalAmount",
          "type": "uint256"
        },
        {
          "indexed": false,
          "internalType": "uint256",
          "name": "bondedAmount",
          "type": "uint256"
        }
      ],
      "name": "Bond",
      "type": "event"
    },
    {
      "anonymous": false,
      "inputs": [
        {
          "indexed": true,
          "internalType": "address",
          "name": "delegate",
          "type": "address"
        },
        {
          "indexed": true,
          "internalType": "address",
          "name": "delegator",
          "type": "address"
        },
        {
          "indexed": false,
          "internalType": "uint256",
          "name": "unbondingLockId",
          "type": "uint256"
        },
        {
          "indexed": false,
          "internalType": "uint256",
          "name": "amount",
          "type": "uint256"
        },
        {
          "indexed": false,
          "internalType": "uint256",
          "name": "withdrawRound",
          "type": "uint256"
        }
      ],
      "name": "Unbond",
      "type": "event"
    },
    {
      "anonymous": false,
      "inputs": [
        {
          "indexed": true,
          "internalType": "address",
          "name": "delegate",
          "type": "address"
        },
        {
          "indexed": true,
          "internalType": "address",
          "name": "delegator",
          "type": "address"
        },
        {
          "indexed": false,
          "internalType": "uint256",
          "name": "unbondingLockId",
          "type": "uint256"
        },
        {
          "indexed": false,
          "internalType": "uint256",
          "name": "amount",
          "type": "uint256"
        }
      ],
      "name": "Rebond",
      "type": "event"
    },
    {
      "anonymous": false,
      "inputs": [
        {
          "indexed": true,
          "internalType": "address",
          "name": "delegator",
          "type": "address"
        },
        {
          "indexed": false,
          "internalType": "uint256",
          "name": "unbondingLockId",
          "type": "uint256"
        },
        {
          "indexed": false,
          "internalType": "uint256",
          "name": "amount",
          "type": "uint256"
        },
        {
          "indexed": false,
          "internalType": "uint256",
          "name": "withdrawRound",
          "type": "uint256"
        }
      ],
      "name": "WithdrawStake",
      "type": "event"
    },
    {
      "anonymous": false,
      "inputs": [
        {
          "indexed": true,
          "internalType": "address",
          "name": "delegator",
          "type": "address"
        },
        {
          "indexed": false,
          "internalType": "address",
          "name": "recipient",
          "type": "address"
        },
        {
          "indexed": false,
          "internalType": "uint256",
          "name": "amount",
          "type": "uint256"
        }
      ],
      "name": "WithdrawFees",
      "type": "event"
    },
    {
      "anonymous": false,
      "inputs": [
        {
          "indexed": true,
          "internalType": "address",
          "name": "delegate",
          "type": "address"
        },
        {
          "indexed": true,
          "internalType": "address",
          "name": "delegator",
          "type": "address"
        },
        {
          "indexed": false,
          "internalType": "uint256",
          "name": "rewards",
          "type": "uint256"
        },
        {
          "indexed": false,
          "internalType": "uint256",
          "name": "fees",
          "type": "uint256"
        },
        {
          "indexed": false,
          "internalType": "uint256",
          "name": "startRound",
          "type": "uint256"
        },
        {
          "indexed": false,
          "internalType": "uint256",
          "name": "endRound",
          "type": "uint256"
        }
      ],
      "name": "EarningsClaimed",
      "type": "event"
    },
    {
      "anonymous": false,
      "inputs": [
        {
          "indexed": false,
          "internalType": "address",
          "name": "controller",
          "type": "address"
        }
      ],
      "name": "SetController",
      "type": "event"
    },
    {
      "anonymous": false,
      "inputs": [
        {
          "indexed": false,
          "internalType": "string",
          "name": "param",
          "type": "string"
        }
      ],
      "name": "ParameterUpdate",
      "type": "event"
    }
  ],
  "transactionHash": "0xb80a789ed26a6d3a5b10d68ffd1c6591012938f560820782ea0ca11eac138a4f",
  "receipt": {
    "to": null,
    "from": "0xB5Af4138f0f33be0D6414Eb25271B9C2Dc245fb5",
    "contractAddress": "0x53ebC58f6D5c326fa29c6ce58B16997E7A0b95D1",
    "transactionIndex": 0,
    "gasUsed": "64626320",
    "logsBloom": "0x00000000000000000000000000000000000000000000000000000000000000000000000000000000000000000000000000000000000000000000000000000000000000000000000000000000000000000000000000000000000000000000000000000000000000000000000000000000000000000000000000000000000000000000000000000000000000000000000000000000000000000000000000000000000000000000000000000000000000000000000000000000000000000000000000000000000000000000000000000000000000000000000000000000000000000000000000000000000000000000000000000000000000000000000000000000",
    "blockHash": "0x090b58b5ff22223fbac70565b0b1c799794dd6c8e1f2a9037b9febd778366ef4",
    "transactionHash": "0xb80a789ed26a6d3a5b10d68ffd1c6591012938f560820782ea0ca11eac138a4f",
    "logs": [],
    "blockNumber": 8912011,
    "cumulativeGasUsed": "30038458",
    "status": 1,
    "byzantium": true
  },
  "args": [
    "0x9ceC649179e2C7Ab91688271bcD09fb707b3E574"
  ],
  "numDeployments": 1,
  "solcInputHash": "cd771027a406633e1258619751cc7c14",
  "metadata": "{\"compiler\":{\"version\":\"0.5.11+commit.22be8592\"},\"language\":\"Solidity\",\"output\":{\"abi\":[{\"constant\":false,\"inputs\":[{\"internalType\":\"address\",\"name\":\"_to\",\"type\":\"address\"},{\"internalType\":\"uint256\",\"name\":\"_unbondingLockId\",\"type\":\"uint256\"},{\"internalType\":\"address\",\"name\":\"_newPosPrev\",\"type\":\"address\"},{\"internalType\":\"address\",\"name\":\"_newPosNext\",\"type\":\"address\"}],\"name\":\"rebondFromUnbondedWithHint\",\"outputs\":[],\"payable\":false,\"stateMutability\":\"nonpayable\",\"type\":\"function\"},{\"constant\":false,\"inputs\":[{\"internalType\":\"address\",\"name\":\"_delegator\",\"type\":\"address\"},{\"internalType\":\"uint256\",\"name\":\"_amount\",\"type\":\"uint256\"},{\"internalType\":\"address\",\"name\":\"_oldDelegateNewPosPrev\",\"type\":\"address\"},{\"internalType\":\"address\",\"name\":\"_oldDelegateNewPosNext\",\"type\":\"address\"},{\"internalType\":\"address\",\"name\":\"_newDelegateNewPosPrev\",\"type\":\"address\"},{\"internalType\":\"address\",\"name\":\"_newDelegateNewPosNext\",\"type\":\"address\"}],\"name\":\"transferBond\",\"outputs\":[],\"payable\":false,\"stateMutability\":\"nonpayable\",\"type\":\"function\"},{\"constant\":true,\"inputs\":[{\"internalType\":\"address\",\"name\":\"_transcoder\",\"type\":\"address\"}],\"name\":\"isActiveTranscoder\",\"outputs\":[{\"internalType\":\"bool\",\"name\":\"\",\"type\":\"bool\"}],\"payable\":false,\"stateMutability\":\"view\",\"type\":\"function\"},{\"constant\":true,\"inputs\":[{\"internalType\":\"address\",\"name\":\"_delegator\",\"type\":\"address\"},{\"internalType\":\"uint256\",\"name\":\"_unbondingLockId\",\"type\":\"uint256\"}],\"name\":\"isValidUnbondingLock\",\"outputs\":[{\"internalType\":\"bool\",\"name\":\"\",\"type\":\"bool\"}],\"payable\":false,\"stateMutability\":\"view\",\"type\":\"function\"},{\"constant\":true,\"inputs\":[{\"internalType\":\"address\",\"name\":\"_delegator\",\"type\":\"address\"}],\"name\":\"delegatorStatus\",\"outputs\":[{\"internalType\":\"enum BondingManager.DelegatorStatus\",\"name\":\"\",\"type\":\"uint8\"}],\"payable\":false,\"stateMutability\":\"view\",\"type\":\"function\"},{\"constant\":false,\"inputs\":[],\"name\":\"reward\",\"outputs\":[],\"payable\":false,\"stateMutability\":\"nonpayable\",\"type\":\"function\"},{\"constant\":false,\"inputs\":[{\"internalType\":\"address\",\"name\":\"_transcoder\",\"type\":\"address\"},{\"internalType\":\"address\",\"name\":\"_finder\",\"type\":\"address\"},{\"internalType\":\"uint256\",\"name\":\"_slashAmount\",\"type\":\"uint256\"},{\"internalType\":\"uint256\",\"name\":\"_finderFee\",\"type\":\"uint256\"}],\"name\":\"slashTranscoder\",\"outputs\":[],\"payable\":false,\"stateMutability\":\"nonpayable\",\"type\":\"function\"},{\"constant\":true,\"inputs\":[{\"internalType\":\"address\",\"name\":\"_transcoder\",\"type\":\"address\"}],\"name\":\"getNextTranscoderInPool\",\"outputs\":[{\"internalType\":\"address\",\"name\":\"\",\"type\":\"address\"}],\"payable\":false,\"stateMutability\":\"view\",\"type\":\"function\"},{\"constant\":true,\"inputs\":[{\"internalType\":\"address\",\"name\":\"_transcoder\",\"type\":\"address\"},{\"internalType\":\"uint256\",\"name\":\"_round\",\"type\":\"uint256\"}],\"name\":\"getTranscoderEarningsPoolForRound\",\"outputs\":[{\"internalType\":\"uint256\",\"name\":\"totalStake\",\"type\":\"uint256\"},{\"internalType\":\"uint256\",\"name\":\"transcoderRewardCut\",\"type\":\"uint256\"},{\"internalType\":\"uint256\",\"name\":\"transcoderFeeShare\",\"type\":\"uint256\"},{\"internalType\":\"uint256\",\"name\":\"cumulativeRewardFactor\",\"type\":\"uint256\"},{\"internalType\":\"uint256\",\"name\":\"cumulativeFeeFactor\",\"type\":\"uint256\"}],\"payable\":false,\"stateMutability\":\"view\",\"type\":\"function\"},{\"constant\":false,\"inputs\":[{\"internalType\":\"uint256\",\"name\":\"_endRound\",\"type\":\"uint256\"}],\"name\":\"claimEarnings\",\"outputs\":[],\"payable\":false,\"stateMutability\":\"nonpayable\",\"type\":\"function\"},{\"constant\":false,\"inputs\":[{\"internalType\":\"uint256\",\"name\":\"_unbondingLockId\",\"type\":\"uint256\"}],\"name\":\"withdrawStake\",\"outputs\":[],\"payable\":false,\"stateMutability\":\"nonpayable\",\"type\":\"function\"},{\"constant\":false,\"inputs\":[{\"internalType\":\"uint256\",\"name\":\"_amount\",\"type\":\"uint256\"}],\"name\":\"unbond\",\"outputs\":[],\"payable\":false,\"stateMutability\":\"nonpayable\",\"type\":\"function\"},{\"constant\":true,\"inputs\":[],\"name\":\"getTranscoderPoolSize\",\"outputs\":[{\"internalType\":\"uint256\",\"name\":\"\",\"type\":\"uint256\"}],\"payable\":false,\"stateMutability\":\"view\",\"type\":\"function\"},{\"constant\":false,\"inputs\":[{\"internalType\":\"uint256\",\"name\":\"_rewardCut\",\"type\":\"uint256\"},{\"internalType\":\"uint256\",\"name\":\"_feeShare\",\"type\":\"uint256\"},{\"internalType\":\"address\",\"name\":\"_newPosPrev\",\"type\":\"address\"},{\"internalType\":\"address\",\"name\":\"_newPosNext\",\"type\":\"address\"}],\"name\":\"transcoderWithHint\",\"outputs\":[],\"payable\":false,\"stateMutability\":\"nonpayable\",\"type\":\"function\"},{\"constant\":false,\"inputs\":[{\"internalType\":\"address\",\"name\":\"_to\",\"type\":\"address\"},{\"internalType\":\"uint256\",\"name\":\"_unbondingLockId\",\"type\":\"uint256\"}],\"name\":\"rebondFromUnbonded\",\"outputs\":[],\"payable\":false,\"stateMutability\":\"nonpayable\",\"type\":\"function\"},{\"constant\":false,\"inputs\":[{\"internalType\":\"address\",\"name\":\"_transcoder\",\"type\":\"address\"},{\"internalType\":\"uint256\",\"name\":\"_fees\",\"type\":\"uint256\"},{\"internalType\":\"uint256\",\"name\":\"_round\",\"type\":\"uint256\"}],\"name\":\"updateTranscoderWithFees\",\"outputs\":[],\"payable\":false,\"stateMutability\":\"nonpayable\",\"type\":\"function\"},{\"constant\":true,\"inputs\":[{\"internalType\":\"address\",\"name\":\"_delegator\",\"type\":\"address\"},{\"internalType\":\"uint256\",\"name\":\"_unbondingLockId\",\"type\":\"uint256\"}],\"name\":\"getDelegatorUnbondingLock\",\"outputs\":[{\"internalType\":\"uint256\",\"name\":\"amount\",\"type\":\"uint256\"},{\"internalType\":\"uint256\",\"name\":\"withdrawRound\",\"type\":\"uint256\"}],\"payable\":false,\"stateMutability\":\"view\",\"type\":\"function\"},{\"constant\":true,\"inputs\":[],\"name\":\"currentRoundTotalActiveStake\",\"outputs\":[{\"internalType\":\"uint256\",\"name\":\"\",\"type\":\"uint256\"}],\"payable\":false,\"stateMutability\":\"view\",\"type\":\"function\"},{\"constant\":false,\"inputs\":[{\"internalType\":\"uint256\",\"name\":\"_rewardCut\",\"type\":\"uint256\"},{\"internalType\":\"uint256\",\"name\":\"_feeShare\",\"type\":\"uint256\"}],\"name\":\"transcoder\",\"outputs\":[],\"payable\":false,\"stateMutability\":\"nonpayable\",\"type\":\"function\"},{\"constant\":true,\"inputs\":[],\"name\":\"nextRoundTotalActiveStake\",\"outputs\":[{\"internalType\":\"uint256\",\"name\":\"\",\"type\":\"uint256\"}],\"payable\":false,\"stateMutability\":\"view\",\"type\":\"function\"},{\"constant\":true,\"inputs\":[],\"name\":\"targetContractId\",\"outputs\":[{\"internalType\":\"bytes32\",\"name\":\"\",\"type\":\"bytes32\"}],\"payable\":false,\"stateMutability\":\"view\",\"type\":\"function\"},{\"constant\":true,\"inputs\":[],\"name\":\"getTranscoderPoolMaxSize\",\"outputs\":[{\"internalType\":\"uint256\",\"name\":\"\",\"type\":\"uint256\"}],\"payable\":false,\"stateMutability\":\"view\",\"type\":\"function\"},{\"constant\":true,\"inputs\":[],\"name\":\"getTotalBonded\",\"outputs\":[{\"internalType\":\"uint256\",\"name\":\"\",\"type\":\"uint256\"}],\"payable\":false,\"stateMutability\":\"view\",\"type\":\"function\"},{\"constant\":true,\"inputs\":[{\"internalType\":\"address\",\"name\":\"_transcoder\",\"type\":\"address\"}],\"name\":\"getTranscoder\",\"outputs\":[{\"internalType\":\"uint256\",\"name\":\"lastRewardRound\",\"type\":\"uint256\"},{\"internalType\":\"uint256\",\"name\":\"rewardCut\",\"type\":\"uint256\"},{\"internalType\":\"uint256\",\"name\":\"feeShare\",\"type\":\"uint256\"},{\"internalType\":\"uint256\",\"name\":\"lastActiveStakeUpdateRound\",\"type\":\"uint256\"},{\"internalType\":\"uint256\",\"name\":\"activationRound\",\"type\":\"uint256\"},{\"internalType\":\"uint256\",\"name\":\"deactivationRound\",\"type\":\"uint256\"},{\"internalType\":\"uint256\",\"name\":\"activeCumulativeRewards\",\"type\":\"uint256\"},{\"internalType\":\"uint256\",\"name\":\"cumulativeRewards\",\"type\":\"uint256\"},{\"internalType\":\"uint256\",\"name\":\"cumulativeFees\",\"type\":\"uint256\"},{\"internalType\":\"uint256\",\"name\":\"lastFeeRound\",\"type\":\"uint256\"}],\"payable\":false,\"stateMutability\":\"view\",\"type\":\"function\"},{\"constant\":false,\"inputs\":[{\"internalType\":\"uint256\",\"name\":\"_numActiveTranscoders\",\"type\":\"uint256\"}],\"name\":\"setNumActiveTranscoders\",\"outputs\":[],\"payable\":false,\"stateMutability\":\"nonpayable\",\"type\":\"function\"},{\"constant\":true,\"inputs\":[{\"internalType\":\"address\",\"name\":\"_transcoder\",\"type\":\"address\"}],\"name\":\"isRegisteredTranscoder\",\"outputs\":[{\"internalType\":\"bool\",\"name\":\"\",\"type\":\"bool\"}],\"payable\":false,\"stateMutability\":\"view\",\"type\":\"function\"},{\"constant\":false,\"inputs\":[{\"internalType\":\"uint256\",\"name\":\"_amount\",\"type\":\"uint256\"},{\"internalType\":\"address\",\"name\":\"_to\",\"type\":\"address\"},{\"internalType\":\"address\",\"name\":\"_oldDelegateNewPosPrev\",\"type\":\"address\"},{\"internalType\":\"address\",\"name\":\"_oldDelegateNewPosNext\",\"type\":\"address\"},{\"internalType\":\"address\",\"name\":\"_currDelegateNewPosPrev\",\"type\":\"address\"},{\"internalType\":\"address\",\"name\":\"_currDelegateNewPosNext\",\"type\":\"address\"}],\"name\":\"bondWithHint\",\"outputs\":[],\"payable\":false,\"stateMutability\":\"nonpayable\",\"type\":\"function\"},{\"constant\":true,\"inputs\":[],\"name\":\"unbondingPeriod\",\"outputs\":[{\"internalType\":\"uint64\",\"name\":\"\",\"type\":\"uint64\"}],\"payable\":false,\"stateMutability\":\"view\",\"type\":\"function\"},{\"constant\":false,\"inputs\":[],\"name\":\"setCurrentRoundTotalActiveStake\",\"outputs\":[],\"payable\":false,\"stateMutability\":\"nonpayable\",\"type\":\"function\"},{\"constant\":false,\"inputs\":[{\"internalType\":\"uint256\",\"name\":\"_unbondingLockId\",\"type\":\"uint256\"},{\"internalType\":\"address\",\"name\":\"_newPosPrev\",\"type\":\"address\"},{\"internalType\":\"address\",\"name\":\"_newPosNext\",\"type\":\"address\"}],\"name\":\"rebondWithHint\",\"outputs\":[],\"payable\":false,\"stateMutability\":\"nonpayable\",\"type\":\"function\"},{\"constant\":false,\"inputs\":[{\"internalType\":\"address\",\"name\":\"_newPosPrev\",\"type\":\"address\"},{\"internalType\":\"address\",\"name\":\"_newPosNext\",\"type\":\"address\"}],\"name\":\"rewardWithHint\",\"outputs\":[],\"payable\":false,\"stateMutability\":\"nonpayable\",\"type\":\"function\"},{\"constant\":true,\"inputs\":[],\"name\":\"getFirstTranscoderInPool\",\"outputs\":[{\"internalType\":\"address\",\"name\":\"\",\"type\":\"address\"}],\"payable\":false,\"stateMutability\":\"view\",\"type\":\"function\"},{\"constant\":true,\"inputs\":[{\"internalType\":\"address\",\"name\":\"_transcoder\",\"type\":\"address\"}],\"name\":\"transcoderStatus\",\"outputs\":[{\"internalType\":\"enum BondingManager.TranscoderStatus\",\"name\":\"\",\"type\":\"uint8\"}],\"payable\":false,\"stateMutability\":\"view\",\"type\":\"function\"},{\"constant\":false,\"inputs\":[{\"internalType\":\"address\",\"name\":\"_controller\",\"type\":\"address\"}],\"name\":\"setController\",\"outputs\":[],\"payable\":false,\"stateMutability\":\"nonpayable\",\"type\":\"function\"},{\"constant\":false,\"inputs\":[{\"internalType\":\"uint256\",\"name\":\"_amount\",\"type\":\"uint256\"},{\"internalType\":\"address\",\"name\":\"_newPosPrev\",\"type\":\"address\"},{\"internalType\":\"address\",\"name\":\"_newPosNext\",\"type\":\"address\"}],\"name\":\"unbondWithHint\",\"outputs\":[],\"payable\":false,\"stateMutability\":\"nonpayable\",\"type\":\"function\"},{\"constant\":true,\"inputs\":[{\"internalType\":\"address\",\"name\":\"_delegator\",\"type\":\"address\"},{\"internalType\":\"uint256\",\"name\":\"_endRound\",\"type\":\"uint256\"}],\"name\":\"pendingStake\",\"outputs\":[{\"internalType\":\"uint256\",\"name\":\"\",\"type\":\"uint256\"}],\"payable\":false,\"stateMutability\":\"view\",\"type\":\"function\"},{\"constant\":true,\"inputs\":[{\"internalType\":\"address\",\"name\":\"_transcoder\",\"type\":\"address\"}],\"name\":\"transcoderTotalStake\",\"outputs\":[{\"internalType\":\"uint256\",\"name\":\"\",\"type\":\"uint256\"}],\"payable\":false,\"stateMutability\":\"view\",\"type\":\"function\"},{\"constant\":true,\"inputs\":[{\"internalType\":\"address\",\"name\":\"_delegator\",\"type\":\"address\"}],\"name\":\"getDelegator\",\"outputs\":[{\"internalType\":\"uint256\",\"name\":\"bondedAmount\",\"type\":\"uint256\"},{\"internalType\":\"uint256\",\"name\":\"fees\",\"type\":\"uint256\"},{\"internalType\":\"address\",\"name\":\"delegateAddress\",\"type\":\"address\"},{\"internalType\":\"uint256\",\"name\":\"delegatedAmount\",\"type\":\"uint256\"},{\"internalType\":\"uint256\",\"name\":\"startRound\",\"type\":\"uint256\"},{\"internalType\":\"uint256\",\"name\":\"lastClaimRound\",\"type\":\"uint256\"},{\"internalType\":\"uint256\",\"name\":\"nextUnbondingLockId\",\"type\":\"uint256\"}],\"payable\":false,\"stateMutability\":\"view\",\"type\":\"function\"},{\"constant\":false,\"inputs\":[{\"internalType\":\"address payable\",\"name\":\"_recipient\",\"type\":\"address\"},{\"internalType\":\"uint256\",\"name\":\"_amount\",\"type\":\"uint256\"}],\"name\":\"withdrawFees\",\"outputs\":[],\"payable\":false,\"stateMutability\":\"nonpayable\",\"type\":\"function\"},{\"constant\":false,\"inputs\":[{\"internalType\":\"uint256\",\"name\":\"_amount\",\"type\":\"uint256\"},{\"internalType\":\"address\",\"name\":\"_to\",\"type\":\"address\"}],\"name\":\"bond\",\"outputs\":[],\"payable\":false,\"stateMutability\":\"nonpayable\",\"type\":\"function\"},{\"constant\":false,\"inputs\":[{\"internalType\":\"uint256\",\"name\":\"_unbondingLockId\",\"type\":\"uint256\"}],\"name\":\"rebond\",\"outputs\":[],\"payable\":false,\"stateMutability\":\"nonpayable\",\"type\":\"function\"},{\"constant\":false,\"inputs\":[{\"internalType\":\"uint256\",\"name\":\"_amount\",\"type\":\"uint256\"},{\"internalType\":\"address\",\"name\":\"_owner\",\"type\":\"address\"},{\"internalType\":\"address\",\"name\":\"_to\",\"type\":\"address\"},{\"internalType\":\"address\",\"name\":\"_oldDelegateNewPosPrev\",\"type\":\"address\"},{\"internalType\":\"address\",\"name\":\"_oldDelegateNewPosNext\",\"type\":\"address\"},{\"internalType\":\"address\",\"name\":\"_currDelegateNewPosPrev\",\"type\":\"address\"},{\"internalType\":\"address\",\"name\":\"_currDelegateNewPosNext\",\"type\":\"address\"}],\"name\":\"bondForWithHint\",\"outputs\":[],\"payable\":false,\"stateMutability\":\"nonpayable\",\"type\":\"function\"},{\"constant\":false,\"inputs\":[{\"internalType\":\"uint64\",\"name\":\"_unbondingPeriod\",\"type\":\"uint64\"}],\"name\":\"setUnbondingPeriod\",\"outputs\":[],\"payable\":false,\"stateMutability\":\"nonpayable\",\"type\":\"function\"},{\"constant\":true,\"inputs\":[{\"internalType\":\"address\",\"name\":\"_delegator\",\"type\":\"address\"},{\"internalType\":\"uint256\",\"name\":\"_endRound\",\"type\":\"uint256\"}],\"name\":\"pendingFees\",\"outputs\":[{\"internalType\":\"uint256\",\"name\":\"\",\"type\":\"uint256\"}],\"payable\":false,\"stateMutability\":\"view\",\"type\":\"function\"},{\"constant\":true,\"inputs\":[],\"name\":\"controller\",\"outputs\":[{\"internalType\":\"contract IController\",\"name\":\"\",\"type\":\"address\"}],\"payable\":false,\"stateMutability\":\"view\",\"type\":\"function\"},{\"inputs\":[{\"internalType\":\"address\",\"name\":\"_controller\",\"type\":\"address\"}],\"payable\":false,\"stateMutability\":\"nonpayable\",\"type\":\"constructor\"},{\"anonymous\":false,\"inputs\":[{\"indexed\":true,\"internalType\":\"address\",\"name\":\"transcoder\",\"type\":\"address\"},{\"indexed\":false,\"internalType\":\"uint256\",\"name\":\"rewardCut\",\"type\":\"uint256\"},{\"indexed\":false,\"internalType\":\"uint256\",\"name\":\"feeShare\",\"type\":\"uint256\"}],\"name\":\"TranscoderUpdate\",\"type\":\"event\"},{\"anonymous\":false,\"inputs\":[{\"indexed\":true,\"internalType\":\"address\",\"name\":\"transcoder\",\"type\":\"address\"},{\"indexed\":false,\"internalType\":\"uint256\",\"name\":\"activationRound\",\"type\":\"uint256\"}],\"name\":\"TranscoderActivated\",\"type\":\"event\"},{\"anonymous\":false,\"inputs\":[{\"indexed\":true,\"internalType\":\"address\",\"name\":\"transcoder\",\"type\":\"address\"},{\"indexed\":false,\"internalType\":\"uint256\",\"name\":\"deactivationRound\",\"type\":\"uint256\"}],\"name\":\"TranscoderDeactivated\",\"type\":\"event\"},{\"anonymous\":false,\"inputs\":[{\"indexed\":true,\"internalType\":\"address\",\"name\":\"transcoder\",\"type\":\"address\"},{\"indexed\":false,\"internalType\":\"address\",\"name\":\"finder\",\"type\":\"address\"},{\"indexed\":false,\"internalType\":\"uint256\",\"name\":\"penalty\",\"type\":\"uint256\"},{\"indexed\":false,\"internalType\":\"uint256\",\"name\":\"finderReward\",\"type\":\"uint256\"}],\"name\":\"TranscoderSlashed\",\"type\":\"event\"},{\"anonymous\":false,\"inputs\":[{\"indexed\":true,\"internalType\":\"address\",\"name\":\"transcoder\",\"type\":\"address\"},{\"indexed\":false,\"internalType\":\"uint256\",\"name\":\"amount\",\"type\":\"uint256\"}],\"name\":\"Reward\",\"type\":\"event\"},{\"anonymous\":false,\"inputs\":[{\"indexed\":true,\"internalType\":\"address\",\"name\":\"newDelegate\",\"type\":\"address\"},{\"indexed\":true,\"internalType\":\"address\",\"name\":\"oldDelegate\",\"type\":\"address\"},{\"indexed\":true,\"internalType\":\"address\",\"name\":\"delegator\",\"type\":\"address\"},{\"indexed\":false,\"internalType\":\"uint256\",\"name\":\"additionalAmount\",\"type\":\"uint256\"},{\"indexed\":false,\"internalType\":\"uint256\",\"name\":\"bondedAmount\",\"type\":\"uint256\"}],\"name\":\"Bond\",\"type\":\"event\"},{\"anonymous\":false,\"inputs\":[{\"indexed\":true,\"internalType\":\"address\",\"name\":\"delegate\",\"type\":\"address\"},{\"indexed\":true,\"internalType\":\"address\",\"name\":\"delegator\",\"type\":\"address\"},{\"indexed\":false,\"internalType\":\"uint256\",\"name\":\"unbondingLockId\",\"type\":\"uint256\"},{\"indexed\":false,\"internalType\":\"uint256\",\"name\":\"amount\",\"type\":\"uint256\"},{\"indexed\":false,\"internalType\":\"uint256\",\"name\":\"withdrawRound\",\"type\":\"uint256\"}],\"name\":\"Unbond\",\"type\":\"event\"},{\"anonymous\":false,\"inputs\":[{\"indexed\":true,\"internalType\":\"address\",\"name\":\"delegate\",\"type\":\"address\"},{\"indexed\":true,\"internalType\":\"address\",\"name\":\"delegator\",\"type\":\"address\"},{\"indexed\":false,\"internalType\":\"uint256\",\"name\":\"unbondingLockId\",\"type\":\"uint256\"},{\"indexed\":false,\"internalType\":\"uint256\",\"name\":\"amount\",\"type\":\"uint256\"}],\"name\":\"Rebond\",\"type\":\"event\"},{\"anonymous\":false,\"inputs\":[{\"indexed\":true,\"internalType\":\"address\",\"name\":\"delegator\",\"type\":\"address\"},{\"indexed\":false,\"internalType\":\"uint256\",\"name\":\"unbondingLockId\",\"type\":\"uint256\"},{\"indexed\":false,\"internalType\":\"uint256\",\"name\":\"amount\",\"type\":\"uint256\"},{\"indexed\":false,\"internalType\":\"uint256\",\"name\":\"withdrawRound\",\"type\":\"uint256\"}],\"name\":\"WithdrawStake\",\"type\":\"event\"},{\"anonymous\":false,\"inputs\":[{\"indexed\":true,\"internalType\":\"address\",\"name\":\"delegator\",\"type\":\"address\"},{\"indexed\":false,\"internalType\":\"address\",\"name\":\"recipient\",\"type\":\"address\"},{\"indexed\":false,\"internalType\":\"uint256\",\"name\":\"amount\",\"type\":\"uint256\"}],\"name\":\"WithdrawFees\",\"type\":\"event\"},{\"anonymous\":false,\"inputs\":[{\"indexed\":true,\"internalType\":\"address\",\"name\":\"delegate\",\"type\":\"address\"},{\"indexed\":true,\"internalType\":\"address\",\"name\":\"delegator\",\"type\":\"address\"},{\"indexed\":false,\"internalType\":\"uint256\",\"name\":\"rewards\",\"type\":\"uint256\"},{\"indexed\":false,\"internalType\":\"uint256\",\"name\":\"fees\",\"type\":\"uint256\"},{\"indexed\":false,\"internalType\":\"uint256\",\"name\":\"startRound\",\"type\":\"uint256\"},{\"indexed\":false,\"internalType\":\"uint256\",\"name\":\"endRound\",\"type\":\"uint256\"}],\"name\":\"EarningsClaimed\",\"type\":\"event\"},{\"anonymous\":false,\"inputs\":[{\"indexed\":false,\"internalType\":\"address\",\"name\":\"controller\",\"type\":\"address\"}],\"name\":\"SetController\",\"type\":\"event\"},{\"anonymous\":false,\"inputs\":[{\"indexed\":false,\"internalType\":\"string\",\"name\":\"param\",\"type\":\"string\"}],\"name\":\"ParameterUpdate\",\"type\":\"event\"}],\"devdoc\":{\"methods\":{\"bond(uint256,address)\":{\"params\":{\"_amount\":\"The amount of tokens to stake\",\"_to\":\"The address of the transcoder to stake towards\"}},\"bondForWithHint(uint256,address,address,address,address,address,address)\":{\"details\":\"If the caller is decreasing the stake of its old delegate in the transcoder pool, the caller can provide an optional hint for the insertion position of the old delegate via the `_oldDelegateNewPosPrev` and `_oldDelegateNewPosNext` params. If the caller is delegating to a delegate that is in the transcoder pool, the caller can provide an optional hint for the insertion position of the delegate via the `_currDelegateNewPosPrev` and `_currDelegateNewPosNext` params. In both cases, a linear search will be executed starting at the hint to find the correct position. In the best case, the hint is the correct position so no search is executed. See SortedDoublyLL.sol for details on list hints\",\"params\":{\"_amount\":\"The amount of tokens to stake.\",\"_currDelegateNewPosNext\":\"The address of the next transcoder in the pool for the current delegate\",\"_currDelegateNewPosPrev\":\"The address of the previous transcoder in the pool for the current delegate\",\"_oldDelegateNewPosNext\":\"The address of the next transcoder in the pool for the old delegate\",\"_oldDelegateNewPosPrev\":\"The address of the previous transcoder in the pool for the old delegate\",\"_owner\":\"The address of the owner of the bond\",\"_to\":\"The address of the transcoder to stake towards\"}},\"bondWithHint(uint256,address,address,address,address,address)\":{\"details\":\"If the caller is decreasing the stake of its old delegate in the transcoder pool, the caller can provide an optional hint for the insertion position of the old delegate via the `_oldDelegateNewPosPrev` and `_oldDelegateNewPosNext` params. If the caller is delegating to a delegate that is in the transcoder pool, the caller can provide an optional hint for the insertion position of the delegate via the `_currDelegateNewPosPrev` and `_currDelegateNewPosNext` params. In both cases, a linear search will be executed starting at the hint to find the correct position. In the best case, the hint is the correct position so no search is executed. See SortedDoublyLL.sol for details on list hints\",\"params\":{\"_amount\":\"The amount of tokens to stake.\",\"_currDelegateNewPosNext\":\"The address of the next transcoder in the pool for the current delegate\",\"_currDelegateNewPosPrev\":\"The address of the previous transcoder in the pool for the current delegate\",\"_oldDelegateNewPosNext\":\"The address of the next transcoder in the pool for the old delegate\",\"_oldDelegateNewPosPrev\":\"The address of the previous transcoder in the pool for the old delegate\",\"_to\":\"The address of the transcoder to stake towards\"}},\"claimEarnings(uint256)\":{\"params\":{\"_endRound\":\"The last round for which to claim token pools shares for a delegator\"}},\"constructor\":{\"details\":\"This constructor will not initialize any state variables besides `controller`. The following setter functions should be used to initialize state variables post-deployment: - setUnbondingPeriod() - setNumActiveTranscoders() - setMaxEarningsClaimsRounds()\",\"params\":{\"_controller\":\"Address of Controller that this contract will be registered with\"}},\"delegatorStatus(address)\":{\"params\":{\"_delegator\":\"Address of delegator\"},\"return\":\"bonded, unbonded or pending delegator status\"},\"getDelegator(address)\":{\"params\":{\"_delegator\":\"Address of delegator\"},\"return\":\"total amount bonded by '_delegator'amount of fees collected by '_delegator'address '_delegator' has bonded tototal amount delegated to '_delegator'round in which bond for '_delegator' became effectiveround for which '_delegator' has last claimed earningsID for the next unbonding lock created for '_delegator'\"},\"getDelegatorUnbondingLock(address,uint256)\":{\"params\":{\"_delegator\":\"Address of delegator\",\"_unbondingLockId\":\"ID of unbonding lock\"},\"return\":\"amount of stake locked up by unbonding lockround in which 'amount' becomes available for withdrawal\"},\"getFirstTranscoderInPool()\":{\"return\":\"address for transcoder with highest stake in transcoder pool\"},\"getNextTranscoderInPool(address)\":{\"params\":{\"_transcoder\":\"Address of a transcoder in the pool\"},\"return\":\"address for the transcoder after '_transcoder' in transcoder pool\"},\"getTotalBonded()\":{\"return\":\"total active stake for the current round\"},\"getTranscoder(address)\":{\"params\":{\"_transcoder\":\"Address of transcoder\"},\"return\":\"lastRewardRound Trancoder's last reward roundrewardCut Transcoder's reward cutfeeShare Transcoder's fee sharelastActiveStakeUpdateRound Round in which transcoder's stake was last updated while activeactivationRound Round in which transcoder became activedeactivationRound Round in which transcoder will no longer be activeactiveCumulativeRewards Transcoder's cumulative rewards that are currently activecumulativeRewards Transcoder's cumulative rewards (earned via its active staked rewards and its reward cut)cumulativeFees Transcoder's cumulative fees (earned via its active staked rewards and its fee share)lastFeeRound Latest round that the transcoder received fees\"},\"getTranscoderEarningsPoolForRound(address,uint256)\":{\"params\":{\"_round\":\"Round number\",\"_transcoder\":\"Address of transcoder\"},\"return\":\"totalStake Transcoder's total stake in '_round'transcoderRewardCut Transcoder's reward cut for '_round'transcoderFeeShare Transcoder's fee share for '_round'cumulativeRewardFactor The cumulative reward factor for delegator rewards calculation (only used after LIP-36)cumulativeFeeFactor The cumulative fee factor for delegator fees calculation (only used after LIP-36)\"},\"getTranscoderPoolMaxSize()\":{\"return\":\"transcoder pool max size\"},\"getTranscoderPoolSize()\":{\"return\":\"transcoder pool current size\"},\"isActiveTranscoder(address)\":{\"params\":{\"_transcoder\":\"Transcoder address\"},\"return\":\"true if transcoder is active\"},\"isRegisteredTranscoder(address)\":{\"params\":{\"_transcoder\":\"Transcoder address\"},\"return\":\"true if transcoder is self-bonded\"},\"isValidUnbondingLock(address,uint256)\":{\"params\":{\"_delegator\":\"Address of delegator\",\"_unbondingLockId\":\"ID of unbonding lock\"},\"return\":\"true if unbondingLock for ID has a non-zero withdraw round\"},\"pendingFees(address,uint256)\":{\"params\":{\"_delegator\":\"Address of delegator\",\"_endRound\":\"The last round to compute pending fees from\"},\"return\":\"Pending fees for '_delegator' since last claiming fees\"},\"pendingStake(address,uint256)\":{\"params\":{\"_delegator\":\"Address of delegator\",\"_endRound\":\"The last round to compute pending stake from\"},\"return\":\"Pending bonded stake for '_delegator' since last claiming rewards\"},\"rebond(uint256)\":{\"params\":{\"_unbondingLockId\":\"ID of unbonding lock to rebond with\"}},\"rebondFromUnbonded(address,uint256)\":{\"params\":{\"_to\":\"Address of delegate\",\"_unbondingLockId\":\"ID of unbonding lock to rebond with\"}},\"rebondFromUnbondedWithHint(address,uint256,address,address)\":{\"details\":\"If the delegate joins the transcoder pool, the caller can provide an optional hint for the delegate's insertion position in the pool via the `_newPosPrev` and `_newPosNext` params. A linear search will be executed starting at the hint to find the correct position. In the best case, the hint is the correct position so no search is executed. See SortedDoublyLL.sol for details on list hints\",\"params\":{\"_newPosNext\":\"Address of next transcoder in pool if the delegate joins the pool\",\"_newPosPrev\":\"Address of previous transcoder in pool if the delegate joins the pool\",\"_to\":\"Address of delegate\",\"_unbondingLockId\":\"ID of unbonding lock to rebond with\"}},\"rebondWithHint(uint256,address,address)\":{\"details\":\"If the delegate is in the transcoder pool, the caller can provide an optional hint for the delegate's insertion position in the pool via the `_newPosPrev` and `_newPosNext` params. A linear search will be executed starting at the hint to find the correct position. In the best case, the hint is the correct position so no search is executed. See SortedDoublyLL.sol details on list hints\",\"params\":{\"_newPosNext\":\"Address of next transcoder in pool if the delegate is in the pool\",\"_newPosPrev\":\"Address of previous transcoder in pool if the delegate is in the pool\",\"_unbondingLockId\":\"ID of unbonding lock to rebond with\"}},\"rewardWithHint(address,address)\":{\"details\":\"If the caller is in the transcoder pool, the caller can provide an optional hint for its insertion position in the pool via the `_newPosPrev` and `_newPosNext` params. A linear search will be executed starting at the hint to find the correct position. In the best case, the hint is the correct position so no search is executed. See SortedDoublyLL.sol for details on list hints\",\"params\":{\"_newPosNext\":\"Address of next transcoder in pool if the caller is in the pool\",\"_newPosPrev\":\"Address of previous transcoder in pool if the caller is in the pool\"}},\"setController(address)\":{\"params\":{\"_controller\":\"Controller contract address\"}},\"setNumActiveTranscoders(uint256)\":{\"params\":{\"_numActiveTranscoders\":\"Number of active transcoders\"}},\"setUnbondingPeriod(uint64)\":{\"params\":{\"_unbondingPeriod\":\"Rounds between unbonding and possible withdrawal\"}},\"slashTranscoder(address,address,uint256,uint256)\":{\"params\":{\"_finder\":\"Finder that proved a transcoder violated a slashing condition. Null address if there is no finder\",\"_finderFee\":\"Percentage of penalty awarded to finder. Zero if there is no finder\",\"_slashAmount\":\"Percentage of transcoder bond to be slashed\",\"_transcoder\":\"Transcoder address\"}},\"transcoder(uint256,uint256)\":{\"details\":\"Percentages are represented as numerators of fractions over MathUtils.PERC_DIVISOR\",\"params\":{\"_feeShare\":\"% of fees paid to delegators by a transcoder\",\"_rewardCut\":\"% of reward paid to transcoder by a delegator\"}},\"transcoderStatus(address)\":{\"params\":{\"_transcoder\":\"Address of transcoder\"},\"return\":\"registered or not registered transcoder status\"},\"transcoderTotalStake(address)\":{\"params\":{\"_transcoder\":\"Address of transcoder\"},\"return\":\"total bonded stake for a delegator\"},\"transcoderWithHint(uint256,uint256,address,address)\":{\"details\":\"Percentages are represented as numerators of fractions over MathUtils.PERC_DIVISOR. If the caller is going to be added to the pool, the caller can provide an optional hint for the insertion position in the pool via the `_newPosPrev` and `_newPosNext` params. A linear search will be executed starting at the hint to find the correct position - in the best case, the hint is the correct position so no search is executed. See SortedDoublyLL.sol for details on list hints\",\"params\":{\"_feeShare\":\"% of fees paid to delegators by a transcoder\",\"_newPosNext\":\"Address of next transcoder in pool if the caller joins the pool\",\"_newPosPrev\":\"Address of previous transcoder in pool if the caller joins the pool\",\"_rewardCut\":\"% of reward paid to transcoder by a delegator\"}},\"transferBond(address,uint256,address,address,address,address)\":{\"details\":\"If the original delegate is in the transcoder pool, the caller can provide an optional hint for the insertion position of the delegate via the `_oldDelegateNewPosPrev` and `_oldDelegateNewPosNext` params. If the target delegate is in the transcoder pool, the caller can provide an optional hint for the insertion position of the delegate via the `_newDelegateNewPosPrev` and `_newDelegateNewPosNext` params.     * In both cases, a linear search will be executed starting at the hint to find the correct position. In the best case, the hint is the correct position so no search is executed. See SortedDoublyLL.sol for details on list hints\",\"params\":{\"_amount\":\"Portion of the bond to transfer to receiver\",\"_delegator\":\"Receiver of the bond\",\"_newDelegateNewPosNext\":\"Address of next transcoder in pool if the delegate is in the pool\",\"_newDelegateNewPosPrev\":\"Address of previous transcoder in pool if the delegate is in the pool\",\"_oldDelegateNewPosNext\":\"Address of next transcoder in pool if the delegate remains in the pool\",\"_oldDelegateNewPosPrev\":\"Address of previous transcoder in pool if the delegate remains in the pool\"}},\"unbond(uint256)\":{\"params\":{\"_amount\":\"Amount of tokens to unbond\"}},\"unbondWithHint(uint256,address,address)\":{\"details\":\"If the caller remains in the transcoder pool, the caller can provide an optional hint for its insertion position in the pool via the `_newPosPrev` and `_newPosNext` params. A linear search will be executed starting at the hint to find the correct position. In the best case, the hint is the correct position so no search is executed. See SortedDoublyLL.sol details on list hints\",\"params\":{\"_amount\":\"Amount of tokens to unbond\",\"_newPosNext\":\"Address of next transcoder in pool if the caller remains in the pool\",\"_newPosPrev\":\"Address of previous transcoder in pool if the caller remains in the pool\"}},\"updateTranscoderWithFees(address,uint256,uint256)\":{\"params\":{\"_fees\":\"Fees to be added to the fee pool\",\"_transcoder\":\"Transcoder address\"}},\"withdrawStake(uint256)\":{\"params\":{\"_unbondingLockId\":\"ID of unbonding lock to withdraw with\"}}},\"title\":\"BondingManager\"},\"userdoc\":{\"methods\":{\"bond(uint256,address)\":{\"notice\":\"Delegate stake towards a specific address\"},\"bondForWithHint(uint256,address,address,address,address,address,address)\":{\"notice\":\"Delegates stake \\\"on behalf of\\\" another address towards a specific address and updates the transcoder pool using optional list hints if needed\"},\"bondWithHint(uint256,address,address,address,address,address)\":{\"notice\":\"Delegates stake towards a specific address and updates the transcoder pool using optional list hints if needed\"},\"claimEarnings(uint256)\":{\"notice\":\"Claim token pools shares for a delegator from its lastClaimRound through the end round\"},\"constructor\":\"BondingManager constructor. Only invokes constructor of base Manager contract with provided Controller address\",\"delegatorStatus(address)\":{\"notice\":\"Computes delegator status\"},\"getDelegator(address)\":{\"notice\":\"Return delegator info\"},\"getDelegatorUnbondingLock(address,uint256)\":{\"notice\":\"Return delegator's unbonding lock info\"},\"getFirstTranscoderInPool()\":{\"notice\":\"Returns transcoder with most stake in pool\"},\"getNextTranscoderInPool(address)\":{\"notice\":\"Returns next transcoder in pool for a given transcoder\"},\"getTotalBonded()\":{\"notice\":\"Return total bonded tokens\"},\"getTranscoder(address)\":{\"notice\":\"Return transcoder information\"},\"getTranscoderEarningsPoolForRound(address,uint256)\":{\"notice\":\"Return transcoder's earnings pool for a given round\"},\"getTranscoderPoolMaxSize()\":{\"notice\":\"Returns max size of transcoder pool\"},\"getTranscoderPoolSize()\":{\"notice\":\"Returns size of transcoder pool\"},\"isActiveTranscoder(address)\":{\"notice\":\"Return whether a transcoder is active for the current round\"},\"isRegisteredTranscoder(address)\":{\"notice\":\"Return whether a transcoder is registered\"},\"isValidUnbondingLock(address,uint256)\":{\"notice\":\"Return whether an unbonding lock for a delegator is valid\"},\"pendingFees(address,uint256)\":{\"notice\":\"Returns pending fees for a delegator from its lastClaimRound through an end round\"},\"pendingStake(address,uint256)\":{\"notice\":\"Returns pending bonded stake for a delegator from its lastClaimRound through an end round\"},\"rebond(uint256)\":{\"notice\":\"Rebond tokens for an unbonding lock to a delegator's current delegate while a delegator is in the Bonded or Pending status\"},\"rebondFromUnbonded(address,uint256)\":{\"notice\":\"Rebond tokens for an unbonding lock to a delegate while a delegator is in the Unbonded status\"},\"rebondFromUnbondedWithHint(address,uint256,address,address)\":{\"notice\":\"Rebond tokens for an unbonding lock to a delegate while a delegator is in the Unbonded status and updates the transcoder pool using an optional list hint if needed\"},\"rebondWithHint(uint256,address,address)\":{\"notice\":\"Rebond tokens for an unbonding lock to a delegator's current delegate while a delegator is in the Bonded or Pending status and updates the transcoder pool using an optional list hint if needed\"},\"reward()\":{\"notice\":\"Mint token rewards for an active transcoder and its delegators\"},\"rewardWithHint(address,address)\":{\"notice\":\"Mint token rewards for an active transcoder and its delegators and update the transcoder pool using an optional list hint if needed\"},\"setController(address)\":{\"notice\":\"Set controller. Only callable by current controller\"},\"setCurrentRoundTotalActiveStake()\":{\"notice\":\"Called during round initialization to set the total active stake for the round. Only callable by the RoundsManager\"},\"setNumActiveTranscoders(uint256)\":{\"notice\":\"Set maximum number of active transcoders. Only callable by Controller owner\"},\"setUnbondingPeriod(uint64)\":{\"notice\":\"Set unbonding period. Only callable by Controller owner\"},\"slashTranscoder(address,address,uint256,uint256)\":{\"notice\":\"Slash a transcoder. Only callable by the Verifier\"},\"transcoder(uint256,uint256)\":{\"notice\":\"Sets commission rates as a transcoder and if the caller is not in the transcoder pool tries to add it\"},\"transcoderStatus(address)\":{\"notice\":\"Computes transcoder status\"},\"transcoderTotalStake(address)\":{\"notice\":\"Returns total bonded stake for a transcoder\"},\"transcoderWithHint(uint256,uint256,address,address)\":{\"notice\":\"Sets commission rates as a transcoder and if the caller is not in the transcoder pool tries to add it using an optional list hint\"},\"transferBond(address,uint256,address,address,address,address)\":{\"notice\":\"Transfers ownership of a bond to a new delegator using optional hints if needed     * If the receiver is already bonded to a different delegate than the bond owner then the stake goes to the receiver's delegate otherwise the receiver's delegate is set as the owner's delegate\"},\"unbond(uint256)\":{\"notice\":\"Unbond an amount of the delegator's bonded stake\"},\"unbondWithHint(uint256,address,address)\":{\"notice\":\"Unbond an amount of the delegator's bonded stake and updates the transcoder pool using an optional list hint if needed\"},\"updateTranscoderWithFees(address,uint256,uint256)\":{\"notice\":\"Update transcoder's fee pool. Only callable by the TicketBroker\"},\"withdrawFees(address,uint256)\":{\"notice\":\"Withdraws fees to the caller\"},\"withdrawStake(uint256)\":{\"notice\":\"Withdraws tokens for an unbonding lock that has existed through an unbonding period\"}},\"notice\":\"Manages bonding, transcoder and rewards/fee accounting related operations of the Livepeer protocol\"}},\"settings\":{\"compilationTarget\":{\"contracts/bonding/BondingManager.sol\":\"BondingManager\"},\"evmVersion\":\"petersburg\",\"libraries\":{},\"metadata\":{\"useLiteralContent\":true},\"optimizer\":{\"enabled\":true,\"runs\":200},\"remappings\":[]},\"sources\":{\"contracts/IController.sol\":{\"content\":\"pragma solidity ^0.5.11;\\n\\nimport \\\"./zeppelin/Pausable.sol\\\";\\n\\ncontract IController is Pausable {\\n    event SetContractInfo(bytes32 id, address contractAddress, bytes20 gitCommitHash);\\n\\n    function setContractInfo(\\n        bytes32 _id,\\n        address _contractAddress,\\n        bytes20 _gitCommitHash\\n    ) external;\\n\\n    function updateController(bytes32 _id, address _controller) external;\\n\\n    function getContract(bytes32 _id) public view returns (address);\\n}\\n\",\"keccak256\":\"0x591fcbcadc9cfee2d453ef4d5d71eaffb3132aba8f8c226c7d7fe557e12f6354\"},\"contracts/IManager.sol\":{\"content\":\"pragma solidity ^0.5.11;\\n\\ncontract IManager {\\n    event SetController(address controller);\\n    event ParameterUpdate(string param);\\n\\n    function setController(address _controller) external;\\n}\\n\",\"keccak256\":\"0xf9da2c6ac6b67f9e89831c6fbdf0855290681f2b9508df60f25540b07b8786ae\"},\"contracts/Manager.sol\":{\"content\":\"pragma solidity ^0.5.11;\\n\\nimport \\\"./IManager.sol\\\";\\nimport \\\"./IController.sol\\\";\\n\\ncontract Manager is IManager {\\n    // Controller that contract is registered with\\n    IController public controller;\\n\\n    // Check if sender is controller\\n    modifier onlyController() {\\n        _onlyController();\\n        _;\\n    }\\n\\n    // Check if sender is controller owner\\n    modifier onlyControllerOwner() {\\n        _onlyControllerOwner();\\n        _;\\n    }\\n\\n    // Check if controller is not paused\\n    modifier whenSystemNotPaused() {\\n        _whenSystemNotPaused();\\n        _;\\n    }\\n\\n    // Check if controller is paused\\n    modifier whenSystemPaused() {\\n        _whenSystemPaused();\\n        _;\\n    }\\n\\n    constructor(address _controller) public {\\n        controller = IController(_controller);\\n    }\\n\\n    /**\\n     * @notice Set controller. Only callable by current controller\\n     * @param _controller Controller contract address\\n     */\\n    function setController(address _controller) external onlyController {\\n        controller = IController(_controller);\\n\\n        emit SetController(_controller);\\n    }\\n\\n    function _onlyController() internal view {\\n        require(msg.sender == address(controller), \\\"caller must be Controller\\\");\\n    }\\n\\n    function _onlyControllerOwner() internal view {\\n        require(msg.sender == controller.owner(), \\\"caller must be Controller owner\\\");\\n    }\\n\\n    function _whenSystemNotPaused() internal view {\\n        require(!controller.paused(), \\\"system is paused\\\");\\n    }\\n\\n    function _whenSystemPaused() internal view {\\n        require(controller.paused(), \\\"system is not paused\\\");\\n    }\\n}\\n\",\"keccak256\":\"0xed96efae1e97d487666ec13d31f7ab7fff92345a7a4fe457056703603aa59b4e\"},\"contracts/ManagerProxyTarget.sol\":{\"content\":\"pragma solidity ^0.5.11;\\n\\nimport \\\"./Manager.sol\\\";\\n\\n/**\\n * @title ManagerProxyTarget\\n * @notice The base contract that target contracts used by a proxy contract should inherit from\\n * @dev Both the target contract and the proxy contract (implemented as ManagerProxy) MUST inherit from ManagerProxyTarget in order to guarantee\\n that both contracts have the same storage layout. Differing storage layouts in a proxy contract and target contract can\\n potentially break the delegate proxy upgradeability mechanism\\n */\\ncontract ManagerProxyTarget is Manager {\\n    // Used to look up target contract address in controller's registry\\n    bytes32 public targetContractId;\\n}\\n\",\"keccak256\":\"0xb47e47494032c5739dda5f83561cf0517fdf0fb94d2e2e4ba910c8ff63e0cb1d\"},\"contracts/bonding/BondingManager.sol\":{\"content\":\"pragma solidity 0.5.11;\\n\\nimport \\\"../ManagerProxyTarget.sol\\\";\\nimport \\\"./IBondingManager.sol\\\";\\nimport \\\"../libraries/SortedDoublyLL.sol\\\";\\nimport \\\"../libraries/MathUtils.sol\\\";\\nimport \\\"../libraries/PreciseMathUtils.sol\\\";\\nimport \\\"./libraries/EarningsPool.sol\\\";\\nimport \\\"./libraries/EarningsPoolLIP36.sol\\\";\\nimport \\\"../token/ILivepeerToken.sol\\\";\\nimport \\\"../token/IMinter.sol\\\";\\nimport \\\"../rounds/IRoundsManager.sol\\\";\\nimport \\\"../snapshots/IMerkleSnapshot.sol\\\";\\n\\nimport \\\"openzeppelin-solidity/contracts/math/SafeMath.sol\\\";\\n\\n/**\\n * @title BondingManager\\n * @notice Manages bonding, transcoder and rewards/fee accounting related operations of the Livepeer protocol\\n */\\ncontract BondingManager is ManagerProxyTarget, IBondingManager {\\n    using SafeMath for uint256;\\n    using SortedDoublyLL for SortedDoublyLL.Data;\\n    using EarningsPool for EarningsPool.Data;\\n    using EarningsPoolLIP36 for EarningsPool.Data;\\n\\n    // Constants\\n    // Occurances are replaced at compile time\\n    // and computed to a single value if possible by the optimizer\\n    uint256 constant MAX_FUTURE_ROUND = 2**256 - 1;\\n\\n    // Time between unbonding and possible withdrawl in rounds\\n    uint64 public unbondingPeriod;\\n\\n    // Represents a transcoder's current state\\n    struct Transcoder {\\n        uint256 lastRewardRound; // Last round that the transcoder called reward\\n        uint256 rewardCut; // % of reward paid to transcoder by a delegator\\n        uint256 feeShare; // % of fees paid to delegators by transcoder\\n        mapping(uint256 => EarningsPool.Data) earningsPoolPerRound; // Mapping of round => earnings pool for the round\\n        uint256 lastActiveStakeUpdateRound; // Round for which the stake was last updated while the transcoder is active\\n        uint256 activationRound; // Round in which the transcoder became active - 0 if inactive\\n        uint256 deactivationRound; // Round in which the transcoder will become inactive\\n        uint256 activeCumulativeRewards; // The transcoder's cumulative rewards that are active in the current round\\n        uint256 cumulativeRewards; // The transcoder's cumulative rewards (earned via the its active staked rewards and its reward cut).\\n        uint256 cumulativeFees; // The transcoder's cumulative fees (earned via the its active staked rewards and its fee share)\\n        uint256 lastFeeRound; // Latest round in which the transcoder received fees\\n    }\\n\\n    // The various states a transcoder can be in\\n    enum TranscoderStatus {\\n        NotRegistered,\\n        Registered\\n    }\\n\\n    // Represents a delegator's current state\\n    struct Delegator {\\n        uint256 bondedAmount; // The amount of bonded tokens\\n        uint256 fees; // The amount of fees collected\\n        address delegateAddress; // The address delegated to\\n        uint256 delegatedAmount; // The amount of tokens delegated to the delegator\\n        uint256 startRound; // The round the delegator transitions to bonded phase and is delegated to someone\\n        uint256 lastClaimRound; // The last round during which the delegator claimed its earnings\\n        uint256 nextUnbondingLockId; // ID for the next unbonding lock created\\n        mapping(uint256 => UnbondingLock) unbondingLocks; // Mapping of unbonding lock ID => unbonding lock\\n    }\\n\\n    // The various states a delegator can be in\\n    enum DelegatorStatus {\\n        Pending,\\n        Bonded,\\n        Unbonded\\n    }\\n\\n    // Represents an amount of tokens that are being unbonded\\n    struct UnbondingLock {\\n        uint256 amount; // Amount of tokens being unbonded\\n        uint256 withdrawRound; // Round at which unbonding period is over and tokens can be withdrawn\\n    }\\n\\n    // Keep track of the known transcoders and delegators\\n    mapping(address => Delegator) private delegators;\\n    mapping(address => Transcoder) private transcoders;\\n\\n    // The total active stake (sum of the stake of active set members) for the current round\\n    uint256 public currentRoundTotalActiveStake;\\n    // The total active stake (sum of the stake of active set members) for the next round\\n    uint256 public nextRoundTotalActiveStake;\\n\\n    // The transcoder pool is used to keep track of the transcoders that are eligible for activation.\\n    // The pool keeps track of the pending active set in round N and the start of round N + 1 transcoders\\n    // in the pool are locked into the active set for round N + 1\\n    SortedDoublyLL.Data private transcoderPool;\\n\\n    // Check if sender is TicketBroker\\n    modifier onlyTicketBroker() {\\n        _onlyTicketBroker();\\n        _;\\n    }\\n\\n    // Check if sender is RoundsManager\\n    modifier onlyRoundsManager() {\\n        _onlyRoundsManager();\\n        _;\\n    }\\n\\n    // Check if sender is Verifier\\n    modifier onlyVerifier() {\\n        _onlyVerifier();\\n        _;\\n    }\\n\\n    // Check if current round is initialized\\n    modifier currentRoundInitialized() {\\n        _currentRoundInitialized();\\n        _;\\n    }\\n\\n    // Automatically claim earnings from lastClaimRound through the current round\\n    modifier autoClaimEarnings() {\\n        _autoClaimEarnings();\\n        _;\\n    }\\n\\n    /**\\n     * @notice BondingManager constructor. Only invokes constructor of base Manager contract with provided Controller address\\n     * @dev This constructor will not initialize any state variables besides `controller`. The following setter functions\\n     * should be used to initialize state variables post-deployment:\\n     * - setUnbondingPeriod()\\n     * - setNumActiveTranscoders()\\n     * - setMaxEarningsClaimsRounds()\\n     * @param _controller Address of Controller that this contract will be registered with\\n     */\\n    constructor(address _controller) public Manager(_controller) {}\\n\\n    /**\\n     * @notice Set unbonding period. Only callable by Controller owner\\n     * @param _unbondingPeriod Rounds between unbonding and possible withdrawal\\n     */\\n    function setUnbondingPeriod(uint64 _unbondingPeriod) external onlyControllerOwner {\\n        unbondingPeriod = _unbondingPeriod;\\n\\n        emit ParameterUpdate(\\\"unbondingPeriod\\\");\\n    }\\n\\n    /**\\n     * @notice Set maximum number of active transcoders. Only callable by Controller owner\\n     * @param _numActiveTranscoders Number of active transcoders\\n     */\\n    function setNumActiveTranscoders(uint256 _numActiveTranscoders) external onlyControllerOwner {\\n        transcoderPool.setMaxSize(_numActiveTranscoders);\\n\\n        emit ParameterUpdate(\\\"numActiveTranscoders\\\");\\n    }\\n\\n    /**\\n     * @notice Sets commission rates as a transcoder and if the caller is not in the transcoder pool tries to add it\\n     * @dev Percentages are represented as numerators of fractions over MathUtils.PERC_DIVISOR\\n     * @param _rewardCut % of reward paid to transcoder by a delegator\\n     * @param _feeShare % of fees paid to delegators by a transcoder\\n     */\\n    function transcoder(uint256 _rewardCut, uint256 _feeShare) external {\\n        transcoderWithHint(_rewardCut, _feeShare, address(0), address(0));\\n    }\\n\\n    /**\\n     * @notice Delegate stake towards a specific address\\n     * @param _amount The amount of tokens to stake\\n     * @param _to The address of the transcoder to stake towards\\n     */\\n    function bond(uint256 _amount, address _to) external {\\n        bondWithHint(_amount, _to, address(0), address(0), address(0), address(0));\\n    }\\n\\n    /**\\n     * @notice Unbond an amount of the delegator's bonded stake\\n     * @param _amount Amount of tokens to unbond\\n     */\\n    function unbond(uint256 _amount) external {\\n        unbondWithHint(_amount, address(0), address(0));\\n    }\\n\\n    /**\\n     * @notice Rebond tokens for an unbonding lock to a delegator's current delegate while a delegator is in the Bonded or Pending status\\n     * @param _unbondingLockId ID of unbonding lock to rebond with\\n     */\\n    function rebond(uint256 _unbondingLockId) external {\\n        rebondWithHint(_unbondingLockId, address(0), address(0));\\n    }\\n\\n    /**\\n     * @notice Rebond tokens for an unbonding lock to a delegate while a delegator is in the Unbonded status\\n     * @param _to Address of delegate\\n     * @param _unbondingLockId ID of unbonding lock to rebond with\\n     */\\n    function rebondFromUnbonded(address _to, uint256 _unbondingLockId) external {\\n        rebondFromUnbondedWithHint(_to, _unbondingLockId, address(0), address(0));\\n    }\\n\\n    /**\\n     * @notice Withdraws tokens for an unbonding lock that has existed through an unbonding period\\n     * @param _unbondingLockId ID of unbonding lock to withdraw with\\n     */\\n    function withdrawStake(uint256 _unbondingLockId) external whenSystemNotPaused currentRoundInitialized {\\n        Delegator storage del = delegators[msg.sender];\\n        UnbondingLock storage lock = del.unbondingLocks[_unbondingLockId];\\n\\n        require(isValidUnbondingLock(msg.sender, _unbondingLockId), \\\"invalid unbonding lock ID\\\");\\n        require(\\n            lock.withdrawRound <= roundsManager().currentRound(),\\n            \\\"withdraw round must be before or equal to the current round\\\"\\n        );\\n\\n        uint256 amount = lock.amount;\\n        uint256 withdrawRound = lock.withdrawRound;\\n        // Delete unbonding lock\\n        delete del.unbondingLocks[_unbondingLockId];\\n\\n        // Tell Minter to transfer stake (LPT) to the delegator\\n        minter().trustedTransferTokens(msg.sender, amount);\\n\\n        emit WithdrawStake(msg.sender, _unbondingLockId, amount, withdrawRound);\\n    }\\n\\n    /**\\n     * @notice Withdraws fees to the caller\\n     */\\n    function withdrawFees(address payable _recipient, uint256 _amount)\\n        external\\n        whenSystemNotPaused\\n        currentRoundInitialized\\n        autoClaimEarnings\\n    {\\n        require(_recipient != address(0), \\\"invalid recipient\\\");\\n        uint256 fees = delegators[msg.sender].fees;\\n        require(fees >= _amount, \\\"insufficient fees to withdraw\\\");\\n        delegators[msg.sender].fees = fees.sub(_amount);\\n\\n        // Tell Minter to transfer fees (ETH) to the address\\n        minter().trustedWithdrawETH(_recipient, _amount);\\n\\n        emit WithdrawFees(msg.sender, _recipient, _amount);\\n    }\\n\\n    /**\\n     * @notice Mint token rewards for an active transcoder and its delegators\\n     */\\n    function reward() external {\\n        rewardWithHint(address(0), address(0));\\n    }\\n\\n    /**\\n     * @notice Update transcoder's fee pool. Only callable by the TicketBroker\\n     * @param _transcoder Transcoder address\\n     * @param _fees Fees to be added to the fee pool\\n     */\\n    function updateTranscoderWithFees(\\n        address _transcoder,\\n        uint256 _fees,\\n        uint256 _round\\n    ) external whenSystemNotPaused onlyTicketBroker {\\n        // Silence unused param compiler warning\\n        _round;\\n\\n        require(isRegisteredTranscoder(_transcoder), \\\"transcoder must be registered\\\");\\n\\n        uint256 currentRound = roundsManager().currentRound();\\n\\n        Transcoder storage t = transcoders[_transcoder];\\n\\n        uint256 lastRewardRound = t.lastRewardRound;\\n        uint256 activeCumulativeRewards = t.activeCumulativeRewards;\\n\\n        // LIP-36: Add fees for the current round instead of '_round'\\n        // https://github.com/livepeer/LIPs/issues/35#issuecomment-673659199\\n        EarningsPool.Data storage earningsPool = t.earningsPoolPerRound[currentRound];\\n        EarningsPool.Data memory prevEarningsPool = latestCumulativeFactorsPool(t, currentRound.sub(1));\\n\\n        // if transcoder hasn't called 'reward()' for '_round' its 'transcoderFeeShare', 'transcoderRewardCut' and 'totalStake'\\n        // on the 'EarningsPool' for '_round' would not be initialized and the fee distribution wouldn't happen as expected\\n        // for cumulative fee calculation this would result in division by zero.\\n        if (currentRound > lastRewardRound) {\\n            earningsPool.setCommission(t.rewardCut, t.feeShare);\\n\\n            uint256 lastUpdateRound = t.lastActiveStakeUpdateRound;\\n            if (lastUpdateRound < currentRound) {\\n                earningsPool.setStake(t.earningsPoolPerRound[lastUpdateRound].totalStake);\\n            }\\n\\n            // If reward() has not been called yet in the current round, then the transcoder's activeCumulativeRewards has not\\n            // yet been set in for the round. When the transcoder calls reward() its activeCumulativeRewards will be set to its\\n            // current cumulativeRewards. So, we can just use the transcoder's cumulativeRewards here because this will become\\n            // the transcoder's activeCumulativeRewards if it calls reward() later on in the current round\\n            activeCumulativeRewards = t.cumulativeRewards;\\n        }\\n\\n        uint256 totalStake = earningsPool.totalStake;\\n        if (prevEarningsPool.cumulativeRewardFactor == 0 && lastRewardRound == currentRound) {\\n            // if transcoder called reward for 'currentRound' but not for 'currentRound - 1' (missed reward call)\\n            // retroactively calculate what its cumulativeRewardFactor would have been for 'currentRound - 1' (cfr. previous lastRewardRound for transcoder)\\n            // based on rewards for currentRound\\n            IMinter mtr = minter();\\n            uint256 rewards = PreciseMathUtils.percOf(\\n                mtr.currentMintableTokens().add(mtr.currentMintedTokens()),\\n                totalStake,\\n                currentRoundTotalActiveStake\\n            );\\n            uint256 transcoderCommissionRewards = MathUtils.percOf(rewards, earningsPool.transcoderRewardCut);\\n            uint256 delegatorsRewards = rewards.sub(transcoderCommissionRewards);\\n\\n            prevEarningsPool.cumulativeRewardFactor = PreciseMathUtils.percOf(\\n                earningsPool.cumulativeRewardFactor,\\n                totalStake,\\n                delegatorsRewards.add(totalStake)\\n            );\\n        }\\n\\n        uint256 delegatorsFees = MathUtils.percOf(_fees, earningsPool.transcoderFeeShare);\\n        uint256 transcoderCommissionFees = _fees.sub(delegatorsFees);\\n        // Calculate the fees earned by the transcoder's earned rewards\\n        uint256 transcoderRewardStakeFees = PreciseMathUtils.percOf(\\n            delegatorsFees,\\n            activeCumulativeRewards,\\n            totalStake\\n        );\\n        // Track fees earned by the transcoder based on its earned rewards and feeShare\\n        t.cumulativeFees = t.cumulativeFees.add(transcoderRewardStakeFees).add(transcoderCommissionFees);\\n        // Update cumulative fee factor with new fees\\n        // The cumulativeFeeFactor is used to calculate fees for all delegators including the transcoder (self-delegated)\\n        // Note that delegatorsFees includes transcoderRewardStakeFees, but no delegator will claim that amount using\\n        // the earnings claiming algorithm and instead that amount is accounted for in the transcoder's cumulativeFees field\\n        earningsPool.updateCumulativeFeeFactor(prevEarningsPool, delegatorsFees);\\n\\n        t.lastFeeRound = currentRound;\\n    }\\n\\n    /**\\n     * @notice Slash a transcoder. Only callable by the Verifier\\n     * @param _transcoder Transcoder address\\n     * @param _finder Finder that proved a transcoder violated a slashing condition. Null address if there is no finder\\n     * @param _slashAmount Percentage of transcoder bond to be slashed\\n     * @param _finderFee Percentage of penalty awarded to finder. Zero if there is no finder\\n     */\\n    function slashTranscoder(\\n        address _transcoder,\\n        address _finder,\\n        uint256 _slashAmount,\\n        uint256 _finderFee\\n    ) external whenSystemNotPaused onlyVerifier {\\n        Delegator storage del = delegators[_transcoder];\\n\\n        if (del.bondedAmount > 0) {\\n            uint256 penalty = MathUtils.percOf(delegators[_transcoder].bondedAmount, _slashAmount);\\n\\n            // If active transcoder, resign it\\n            if (transcoderPool.contains(_transcoder)) {\\n                resignTranscoder(_transcoder);\\n            }\\n\\n            // Decrease bonded stake\\n            del.bondedAmount = del.bondedAmount.sub(penalty);\\n\\n            // If still bonded decrease delegate's delegated amount\\n            if (delegatorStatus(_transcoder) == DelegatorStatus.Bonded) {\\n                delegators[del.delegateAddress].delegatedAmount = delegators[del.delegateAddress].delegatedAmount.sub(\\n                    penalty\\n                );\\n            }\\n\\n            // Account for penalty\\n            uint256 burnAmount = penalty;\\n\\n            // Award finder fee if there is a finder address\\n            if (_finder != address(0)) {\\n                uint256 finderAmount = MathUtils.percOf(penalty, _finderFee);\\n                minter().trustedTransferTokens(_finder, finderAmount);\\n\\n                // Minter burns the slashed funds - finder reward\\n                minter().trustedBurnTokens(burnAmount.sub(finderAmount));\\n\\n                emit TranscoderSlashed(_transcoder, _finder, penalty, finderAmount);\\n            } else {\\n                // Minter burns the slashed funds\\n                minter().trustedBurnTokens(burnAmount);\\n\\n                emit TranscoderSlashed(_transcoder, address(0), penalty, 0);\\n            }\\n        } else {\\n            emit TranscoderSlashed(_transcoder, _finder, 0, 0);\\n        }\\n    }\\n\\n    /**\\n     * @notice Claim token pools shares for a delegator from its lastClaimRound through the end round\\n     * @param _endRound The last round for which to claim token pools shares for a delegator\\n     */\\n    function claimEarnings(uint256 _endRound) external whenSystemNotPaused currentRoundInitialized {\\n        // Silence unused param compiler warning\\n        _endRound;\\n\\n        _autoClaimEarnings();\\n    }\\n\\n    /**\\n     * @notice Called during round initialization to set the total active stake for the round. Only callable by the RoundsManager\\n     */\\n    function setCurrentRoundTotalActiveStake() external onlyRoundsManager {\\n        currentRoundTotalActiveStake = nextRoundTotalActiveStake;\\n    }\\n\\n    /**\\n     * @notice Sets commission rates as a transcoder and if the caller is not in the transcoder pool tries to add it using an optional list hint\\n     * @dev Percentages are represented as numerators of fractions over MathUtils.PERC_DIVISOR. If the caller is going to be added to the pool, the\\n     * caller can provide an optional hint for the insertion position in the pool via the `_newPosPrev` and `_newPosNext` params. A linear search will\\n     * be executed starting at the hint to find the correct position - in the best case, the hint is the correct position so no search is executed.\\n     * See SortedDoublyLL.sol for details on list hints\\n     * @param _rewardCut % of reward paid to transcoder by a delegator\\n     * @param _feeShare % of fees paid to delegators by a transcoder\\n     * @param _newPosPrev Address of previous transcoder in pool if the caller joins the pool\\n     * @param _newPosNext Address of next transcoder in pool if the caller joins the pool\\n     */\\n    function transcoderWithHint(\\n        uint256 _rewardCut,\\n        uint256 _feeShare,\\n        address _newPosPrev,\\n        address _newPosNext\\n    ) public whenSystemNotPaused currentRoundInitialized {\\n        require(!roundsManager().currentRoundLocked(), \\\"can't update transcoder params, current round is locked\\\");\\n        require(MathUtils.validPerc(_rewardCut), \\\"invalid rewardCut percentage\\\");\\n        require(MathUtils.validPerc(_feeShare), \\\"invalid feeShare percentage\\\");\\n        require(isRegisteredTranscoder(msg.sender), \\\"transcoder must be registered\\\");\\n\\n        Transcoder storage t = transcoders[msg.sender];\\n        uint256 currentRound = roundsManager().currentRound();\\n\\n        require(\\n            !isActiveTranscoder(msg.sender) || t.lastRewardRound == currentRound,\\n            \\\"caller can't be active or must have already called reward for the current round\\\"\\n        );\\n\\n        t.rewardCut = _rewardCut;\\n        t.feeShare = _feeShare;\\n\\n        if (!transcoderPool.contains(msg.sender)) {\\n            tryToJoinActiveSet(\\n                msg.sender,\\n                delegators[msg.sender].delegatedAmount,\\n                currentRound.add(1),\\n                _newPosPrev,\\n                _newPosNext\\n            );\\n        }\\n\\n        emit TranscoderUpdate(msg.sender, _rewardCut, _feeShare);\\n    }\\n\\n    /**\\n     * @notice Delegates stake \\\"on behalf of\\\" another address towards a specific address\\n     * and updates the transcoder pool using optional list hints if needed\\n     * @dev If the caller is decreasing the stake of its old delegate in the transcoder pool, the caller can provide an optional hint\\n     * for the insertion position of the old delegate via the `_oldDelegateNewPosPrev` and `_oldDelegateNewPosNext` params.\\n     * If the caller is delegating to a delegate that is in the transcoder pool, the caller can provide an optional hint for the\\n     * insertion position of the delegate via the `_currDelegateNewPosPrev` and `_currDelegateNewPosNext` params.\\n     * In both cases, a linear search will be executed starting at the hint to find the correct position. In the best case, the hint\\n     * is the correct position so no search is executed. See SortedDoublyLL.sol for details on list hints\\n     * @param _amount The amount of tokens to stake.\\n     * @param _owner The address of the owner of the bond\\n     * @param _to The address of the transcoder to stake towards\\n     * @param _oldDelegateNewPosPrev The address of the previous transcoder in the pool for the old delegate\\n     * @param _oldDelegateNewPosNext The address of the next transcoder in the pool for the old delegate\\n     * @param _currDelegateNewPosPrev The address of the previous transcoder in the pool for the current delegate\\n     * @param _currDelegateNewPosNext The address of the next transcoder in the pool for the current delegate\\n     */\\n    function bondForWithHint(\\n        uint256 _amount,\\n        address _owner,\\n        address _to,\\n        address _oldDelegateNewPosPrev,\\n        address _oldDelegateNewPosNext,\\n        address _currDelegateNewPosPrev,\\n        address _currDelegateNewPosNext\\n    ) public whenSystemNotPaused currentRoundInitialized autoClaimEarnings {\\n        Delegator storage del = delegators[_owner];\\n\\n        uint256 currentRound = roundsManager().currentRound();\\n        // Amount to delegate\\n        uint256 delegationAmount = _amount;\\n        // Current delegate\\n        address currentDelegate = del.delegateAddress;\\n\\n        if (delegatorStatus(_owner) == DelegatorStatus.Unbonded) {\\n            // New delegate\\n            // Set start round\\n            // Don't set start round if delegator is in pending state because the start round would not change\\n            del.startRound = currentRound.add(1);\\n            // Unbonded state = no existing delegate and no bonded stake\\n            // Thus, delegation amount = provided amount\\n        } else if (currentDelegate != address(0) && currentDelegate != _to) {\\n            // A registered transcoder cannot delegate its bonded stake toward another address\\n            // because it can only be delegated toward itself\\n            // In the future, if delegation towards another registered transcoder as an already\\n            // registered transcoder becomes useful (i.e. for transitive delegation), this restriction\\n            // could be removed\\n            require(!isRegisteredTranscoder(_owner), \\\"registered transcoders can't delegate towards other addresses\\\");\\n            // Changing delegate\\n            // Set start round\\n            del.startRound = currentRound.add(1);\\n            // Update amount to delegate with previous delegation amount\\n            delegationAmount = delegationAmount.add(del.bondedAmount);\\n\\n            decreaseTotalStake(currentDelegate, del.bondedAmount, _oldDelegateNewPosPrev, _oldDelegateNewPosNext);\\n        }\\n\\n        {\\n            Transcoder storage newDelegate = transcoders[_to];\\n            EarningsPool.Data storage currPool = newDelegate.earningsPoolPerRound[currentRound];\\n            if (currPool.cumulativeRewardFactor == 0) {\\n                currPool.cumulativeRewardFactor = cumulativeFactorsPool(newDelegate, newDelegate.lastRewardRound)\\n                    .cumulativeRewardFactor;\\n            }\\n            if (currPool.cumulativeFeeFactor == 0) {\\n                currPool.cumulativeFeeFactor = cumulativeFactorsPool(newDelegate, newDelegate.lastFeeRound)\\n                    .cumulativeFeeFactor;\\n            }\\n        }\\n\\n        // cannot delegate to someone without having bonded stake\\n        require(delegationAmount > 0, \\\"delegation amount must be greater than 0\\\");\\n        // Update delegate\\n        del.delegateAddress = _to;\\n        // Update bonded amount\\n        del.bondedAmount = del.bondedAmount.add(_amount);\\n\\n        increaseTotalStake(_to, delegationAmount, _currDelegateNewPosPrev, _currDelegateNewPosNext);\\n\\n        if (_amount > 0) {\\n            // Transfer the LPT to the Minter\\n            livepeerToken().transferFrom(msg.sender, address(minter()), _amount);\\n        }\\n\\n        emit Bond(_to, currentDelegate, _owner, _amount, del.bondedAmount);\\n    }\\n\\n    /**\\n     * @notice Delegates stake towards a specific address and updates the transcoder pool using optional list hints if needed\\n     * @dev If the caller is decreasing the stake of its old delegate in the transcoder pool, the caller can provide an optional hint\\n     * for the insertion position of the old delegate via the `_oldDelegateNewPosPrev` and `_oldDelegateNewPosNext` params.\\n     * If the caller is delegating to a delegate that is in the transcoder pool, the caller can provide an optional hint for the\\n     * insertion position of the delegate via the `_currDelegateNewPosPrev` and `_currDelegateNewPosNext` params.\\n     * In both cases, a linear search will be executed starting at the hint to find the correct position. In the best case, the hint\\n     * is the correct position so no search is executed. See SortedDoublyLL.sol for details on list hints\\n     * @param _amount The amount of tokens to stake.\\n     * @param _to The address of the transcoder to stake towards\\n     * @param _oldDelegateNewPosPrev The address of the previous transcoder in the pool for the old delegate\\n     * @param _oldDelegateNewPosNext The address of the next transcoder in the pool for the old delegate\\n     * @param _currDelegateNewPosPrev The address of the previous transcoder in the pool for the current delegate\\n     * @param _currDelegateNewPosNext The address of the next transcoder in the pool for the current delegate\\n     */\\n    function bondWithHint(\\n        uint256 _amount,\\n        address _to,\\n        address _oldDelegateNewPosPrev,\\n        address _oldDelegateNewPosNext,\\n        address _currDelegateNewPosPrev,\\n        address _currDelegateNewPosNext\\n    ) public {\\n        bondForWithHint(\\n            _amount,\\n            msg.sender,\\n            _to,\\n            _oldDelegateNewPosPrev,\\n            _oldDelegateNewPosNext,\\n            _currDelegateNewPosPrev,\\n            _currDelegateNewPosNext\\n        );\\n    }\\n\\n    /**\\n     * @notice Transfers ownership of a bond to a new delegator using optional hints if needed\\n     *\\n     * If the receiver is already bonded to a different delegate than the bond owner then the stake goes\\n     * to the receiver's delegate otherwise the receiver's delegate is set as the owner's delegate\\n     *\\n     * @dev If the original delegate is in the transcoder pool, the caller can provide an optional hint for the\\n     * insertion position of the delegate via the `_oldDelegateNewPosPrev` and `_oldDelegateNewPosNext` params.\\n     * If the target delegate is in the transcoder pool, the caller can provide an optional hint for the\\n     * insertion position of the delegate via the `_newDelegateNewPosPrev` and `_newDelegateNewPosNext` params.\\n     *\\n     * In both cases, a linear search will be executed starting at the hint to find the correct position. In the best case, the hint\\n     * is the correct position so no search is executed. See SortedDoublyLL.sol for details on list hints\\n     * @param _delegator Receiver of the bond\\n     * @param _amount Portion of the bond to transfer to receiver\\n     * @param _oldDelegateNewPosPrev Address of previous transcoder in pool if the delegate remains in the pool\\n     * @param _oldDelegateNewPosNext Address of next transcoder in pool if the delegate remains in the pool\\n     * @param _newDelegateNewPosPrev Address of previous transcoder in pool if the delegate is in the pool\\n     * @param _newDelegateNewPosNext Address of next transcoder in pool if the delegate is in the pool\\n     */\\n    function transferBond(\\n        address _delegator,\\n        uint256 _amount,\\n        address _oldDelegateNewPosPrev,\\n        address _oldDelegateNewPosNext,\\n        address _newDelegateNewPosPrev,\\n        address _newDelegateNewPosNext\\n    ) public whenSystemNotPaused currentRoundInitialized autoClaimEarnings {\\n        unbondWithHint(_amount, _oldDelegateNewPosPrev, _oldDelegateNewPosNext);\\n\\n        Delegator storage oldDel = delegators[msg.sender];\\n        Delegator storage newDel = delegators[_delegator];\\n\\n        uint256 oldDelUnbondingLockId = oldDel.nextUnbondingLockId.sub(1);\\n        uint256 withdrawRound = oldDel.unbondingLocks[oldDelUnbondingLockId].withdrawRound;\\n\\n        // Burn lock for current owner\\n        delete oldDel.unbondingLocks[oldDelUnbondingLockId];\\n\\n        // Create lock for new owner\\n        uint256 newDelUnbondingLockId = newDel.nextUnbondingLockId;\\n\\n        newDel.unbondingLocks[newDelUnbondingLockId] = UnbondingLock({ amount: _amount, withdrawRound: withdrawRound });\\n        newDel.nextUnbondingLockId.add(1);\\n\\n        // Rebond lock for new owner\\n        if (newDel.delegateAddress == address(0)) {\\n            newDel.delegateAddress = oldDel.delegateAddress;\\n        }\\n\\n        // Process rebond using unbonding lock\\n        processRebond(_delegator, newDelUnbondingLockId, _newDelegateNewPosPrev, _newDelegateNewPosNext);\\n    }\\n\\n    /**\\n     * @notice Unbond an amount of the delegator's bonded stake and updates the transcoder pool using an optional list hint if needed\\n     * @dev If the caller remains in the transcoder pool, the caller can provide an optional hint for its insertion position in the\\n     * pool via the `_newPosPrev` and `_newPosNext` params. A linear search will be executed starting at the hint to find the correct position.\\n     * In the best case, the hint is the correct position so no search is executed. See SortedDoublyLL.sol details on list hints\\n     * @param _amount Amount of tokens to unbond\\n     * @param _newPosPrev Address of previous transcoder in pool if the caller remains in the pool\\n     * @param _newPosNext Address of next transcoder in pool if the caller remains in the pool\\n     */\\n    function unbondWithHint(\\n        uint256 _amount,\\n        address _newPosPrev,\\n        address _newPosNext\\n    ) public whenSystemNotPaused currentRoundInitialized autoClaimEarnings {\\n        require(delegatorStatus(msg.sender) == DelegatorStatus.Bonded, \\\"caller must be bonded\\\");\\n\\n        Delegator storage del = delegators[msg.sender];\\n\\n        require(_amount > 0, \\\"unbond amount must be greater than 0\\\");\\n        require(_amount <= del.bondedAmount, \\\"amount is greater than bonded amount\\\");\\n\\n        address currentDelegate = del.delegateAddress;\\n        uint256 currentRound = roundsManager().currentRound();\\n        uint256 withdrawRound = currentRound.add(unbondingPeriod);\\n        uint256 unbondingLockId = del.nextUnbondingLockId;\\n\\n        // Create new unbonding lock\\n        del.unbondingLocks[unbondingLockId] = UnbondingLock({ amount: _amount, withdrawRound: withdrawRound });\\n        // Increment ID for next unbonding lock\\n        del.nextUnbondingLockId = unbondingLockId.add(1);\\n        // Decrease delegator's bonded amount\\n        del.bondedAmount = del.bondedAmount.sub(_amount);\\n\\n        if (del.bondedAmount == 0) {\\n            // Delegator no longer delegated to anyone if it does not have a bonded amount\\n            del.delegateAddress = address(0);\\n            // Delegator does not have a start round if it is no longer delegated to anyone\\n            del.startRound = 0;\\n\\n            if (transcoderPool.contains(msg.sender)) {\\n                resignTranscoder(msg.sender);\\n            }\\n        }\\n\\n        // If msg.sender was resigned this statement will only decrease delegators[currentDelegate].delegatedAmount\\n        decreaseTotalStake(currentDelegate, _amount, _newPosPrev, _newPosNext);\\n\\n        emit Unbond(currentDelegate, msg.sender, unbondingLockId, _amount, withdrawRound);\\n    }\\n\\n    /**\\n     * @notice Rebond tokens for an unbonding lock to a delegator's current delegate while a delegator is in the Bonded or Pending status and updates\\n     * the transcoder pool using an optional list hint if needed\\n     * @dev If the delegate is in the transcoder pool, the caller can provide an optional hint for the delegate's insertion position in the\\n     * pool via the `_newPosPrev` and `_newPosNext` params. A linear search will be executed starting at the hint to find the correct position.\\n     * In the best case, the hint is the correct position so no search is executed. See SortedDoublyLL.sol details on list hints\\n     * @param _unbondingLockId ID of unbonding lock to rebond with\\n     * @param _newPosPrev Address of previous transcoder in pool if the delegate is in the pool\\n     * @param _newPosNext Address of next transcoder in pool if the delegate is in the pool\\n     */\\n    function rebondWithHint(\\n        uint256 _unbondingLockId,\\n        address _newPosPrev,\\n        address _newPosNext\\n    ) public whenSystemNotPaused currentRoundInitialized autoClaimEarnings {\\n        require(delegatorStatus(msg.sender) != DelegatorStatus.Unbonded, \\\"caller must be bonded\\\");\\n\\n        // Process rebond using unbonding lock\\n        processRebond(msg.sender, _unbondingLockId, _newPosPrev, _newPosNext);\\n    }\\n\\n    /**\\n     * @notice Rebond tokens for an unbonding lock to a delegate while a delegator is in the Unbonded status and updates the transcoder pool using\\n     * an optional list hint if needed\\n     * @dev If the delegate joins the transcoder pool, the caller can provide an optional hint for the delegate's insertion position in the\\n     * pool via the `_newPosPrev` and `_newPosNext` params. A linear search will be executed starting at the hint to find the correct position.\\n     * In the best case, the hint is the correct position so no search is executed. See SortedDoublyLL.sol for details on list hints\\n     * @param _to Address of delegate\\n     * @param _unbondingLockId ID of unbonding lock to rebond with\\n     * @param _newPosPrev Address of previous transcoder in pool if the delegate joins the pool\\n     * @param _newPosNext Address of next transcoder in pool if the delegate joins the pool\\n     */\\n    function rebondFromUnbondedWithHint(\\n        address _to,\\n        uint256 _unbondingLockId,\\n        address _newPosPrev,\\n        address _newPosNext\\n    ) public whenSystemNotPaused currentRoundInitialized autoClaimEarnings {\\n        require(delegatorStatus(msg.sender) == DelegatorStatus.Unbonded, \\\"caller must be unbonded\\\");\\n\\n        // Set delegator's start round and transition into Pending state\\n        delegators[msg.sender].startRound = roundsManager().currentRound().add(1);\\n        // Set delegator's delegate\\n        delegators[msg.sender].delegateAddress = _to;\\n        // Process rebond using unbonding lock\\n        processRebond(msg.sender, _unbondingLockId, _newPosPrev, _newPosNext);\\n    }\\n\\n    /**\\n     * @notice Mint token rewards for an active transcoder and its delegators and update the transcoder pool using an optional list hint if needed\\n     * @dev If the caller is in the transcoder pool, the caller can provide an optional hint for its insertion position in the\\n     * pool via the `_newPosPrev` and `_newPosNext` params. A linear search will be executed starting at the hint to find the correct position.\\n     * In the best case, the hint is the correct position so no search is executed. See SortedDoublyLL.sol for details on list hints\\n     * @param _newPosPrev Address of previous transcoder in pool if the caller is in the pool\\n     * @param _newPosNext Address of next transcoder in pool if the caller is in the pool\\n     */\\n    function rewardWithHint(address _newPosPrev, address _newPosNext)\\n        public\\n        whenSystemNotPaused\\n        currentRoundInitialized\\n    {\\n        uint256 currentRound = roundsManager().currentRound();\\n\\n        require(isActiveTranscoder(msg.sender), \\\"caller must be an active transcoder\\\");\\n        require(\\n            transcoders[msg.sender].lastRewardRound != currentRound,\\n            \\\"caller has already called reward for the current round\\\"\\n        );\\n\\n        Transcoder storage t = transcoders[msg.sender];\\n        EarningsPool.Data storage earningsPool = t.earningsPoolPerRound[currentRound];\\n\\n        // Set last round that transcoder called reward\\n        earningsPool.setCommission(t.rewardCut, t.feeShare);\\n\\n        // If transcoder didn't receive stake updates during the previous round and hasn't called reward for > 1 round\\n        // the 'totalStake' on its 'EarningsPool' for the current round wouldn't be initialized\\n        // Thus we sync the the transcoder's stake to when it was last updated\\n        // 'updateTrancoderWithRewards()' will set the update round to 'currentRound +1' so this synchronization shouldn't occur frequently\\n        uint256 lastUpdateRound = t.lastActiveStakeUpdateRound;\\n        if (lastUpdateRound < currentRound) {\\n            earningsPool.setStake(t.earningsPoolPerRound[lastUpdateRound].totalStake);\\n        }\\n\\n        // Create reward based on active transcoder's stake relative to the total active stake\\n        // rewardTokens = (current mintable tokens for the round * active transcoder stake) / total active stake\\n        uint256 rewardTokens = minter().createReward(earningsPool.totalStake, currentRoundTotalActiveStake);\\n\\n        updateTranscoderWithRewards(msg.sender, rewardTokens, currentRound, _newPosPrev, _newPosNext);\\n\\n        // Set last round that transcoder called reward\\n        t.lastRewardRound = currentRound;\\n\\n        emit Reward(msg.sender, rewardTokens);\\n    }\\n\\n    /**\\n     * @notice Returns pending bonded stake for a delegator from its lastClaimRound through an end round\\n     * @param _delegator Address of delegator\\n     * @param _endRound The last round to compute pending stake from\\n     * @return Pending bonded stake for '_delegator' since last claiming rewards\\n     */\\n    function pendingStake(address _delegator, uint256 _endRound) public view returns (uint256) {\\n        // Silence unused param compiler warning\\n        _endRound;\\n\\n        uint256 endRound = roundsManager().currentRound();\\n        (uint256 stake, ) = pendingStakeAndFees(_delegator, endRound);\\n        return stake;\\n    }\\n\\n    /**\\n     * @notice Returns pending fees for a delegator from its lastClaimRound through an end round\\n     * @param _delegator Address of delegator\\n     * @param _endRound The last round to compute pending fees from\\n     * @return Pending fees for '_delegator' since last claiming fees\\n     */\\n    function pendingFees(address _delegator, uint256 _endRound) public view returns (uint256) {\\n        // Silence unused param compiler warning\\n        _endRound;\\n\\n        uint256 endRound = roundsManager().currentRound();\\n        (, uint256 fees) = pendingStakeAndFees(_delegator, endRound);\\n        return fees;\\n    }\\n\\n    /**\\n     * @notice Returns total bonded stake for a transcoder\\n     * @param _transcoder Address of transcoder\\n     * @return total bonded stake for a delegator\\n     */\\n    function transcoderTotalStake(address _transcoder) public view returns (uint256) {\\n        return delegators[_transcoder].delegatedAmount;\\n    }\\n\\n    /**\\n     * @notice Computes transcoder status\\n     * @param _transcoder Address of transcoder\\n     * @return registered or not registered transcoder status\\n     */\\n    function transcoderStatus(address _transcoder) public view returns (TranscoderStatus) {\\n        if (isRegisteredTranscoder(_transcoder)) return TranscoderStatus.Registered;\\n        return TranscoderStatus.NotRegistered;\\n    }\\n\\n    /**\\n     * @notice Computes delegator status\\n     * @param _delegator Address of delegator\\n     * @return bonded, unbonded or pending delegator status\\n     */\\n    function delegatorStatus(address _delegator) public view returns (DelegatorStatus) {\\n        Delegator storage del = delegators[_delegator];\\n\\n        if (del.bondedAmount == 0) {\\n            // Delegator unbonded all its tokens\\n            return DelegatorStatus.Unbonded;\\n        } else if (del.startRound > roundsManager().currentRound()) {\\n            // Delegator round start is in the future\\n            return DelegatorStatus.Pending;\\n        } else {\\n            // Delegator round start is now or in the past\\n            // del.startRound != 0 here because if del.startRound = 0 then del.bondedAmount = 0 which\\n            // would trigger the first if clause\\n            return DelegatorStatus.Bonded;\\n        }\\n    }\\n\\n    /**\\n     * @notice Return transcoder information\\n     * @param _transcoder Address of transcoder\\n     * @return lastRewardRound Trancoder's last reward round\\n     * @return rewardCut Transcoder's reward cut\\n     * @return feeShare Transcoder's fee share\\n     * @return lastActiveStakeUpdateRound Round in which transcoder's stake was last updated while active\\n     * @return activationRound Round in which transcoder became active\\n     * @return deactivationRound Round in which transcoder will no longer be active\\n     * @return activeCumulativeRewards Transcoder's cumulative rewards that are currently active\\n     * @return cumulativeRewards Transcoder's cumulative rewards (earned via its active staked rewards and its reward cut)\\n     * @return cumulativeFees Transcoder's cumulative fees (earned via its active staked rewards and its fee share)\\n     * @return lastFeeRound Latest round that the transcoder received fees\\n     */\\n    function getTranscoder(address _transcoder)\\n        public\\n        view\\n        returns (\\n            uint256 lastRewardRound,\\n            uint256 rewardCut,\\n            uint256 feeShare,\\n            uint256 lastActiveStakeUpdateRound,\\n            uint256 activationRound,\\n            uint256 deactivationRound,\\n            uint256 activeCumulativeRewards,\\n            uint256 cumulativeRewards,\\n            uint256 cumulativeFees,\\n            uint256 lastFeeRound\\n        )\\n    {\\n        Transcoder storage t = transcoders[_transcoder];\\n\\n        lastRewardRound = t.lastRewardRound;\\n        rewardCut = t.rewardCut;\\n        feeShare = t.feeShare;\\n        lastActiveStakeUpdateRound = t.lastActiveStakeUpdateRound;\\n        activationRound = t.activationRound;\\n        deactivationRound = t.deactivationRound;\\n        activeCumulativeRewards = t.activeCumulativeRewards;\\n        cumulativeRewards = t.cumulativeRewards;\\n        cumulativeFees = t.cumulativeFees;\\n        lastFeeRound = t.lastFeeRound;\\n    }\\n\\n    /**\\n     * @notice Return transcoder's earnings pool for a given round\\n     * @param _transcoder Address of transcoder\\n     * @param _round Round number\\n     * @return totalStake Transcoder's total stake in '_round'\\n     * @return transcoderRewardCut Transcoder's reward cut for '_round'\\n     * @return transcoderFeeShare Transcoder's fee share for '_round'\\n     * @return cumulativeRewardFactor The cumulative reward factor for delegator rewards calculation (only used after LIP-36)\\n     * @return cumulativeFeeFactor The cumulative fee factor for delegator fees calculation (only used after LIP-36)\\n     */\\n    function getTranscoderEarningsPoolForRound(address _transcoder, uint256 _round)\\n        public\\n        view\\n        returns (\\n            uint256 totalStake,\\n            uint256 transcoderRewardCut,\\n            uint256 transcoderFeeShare,\\n            uint256 cumulativeRewardFactor,\\n            uint256 cumulativeFeeFactor\\n        )\\n    {\\n        EarningsPool.Data storage earningsPool = transcoders[_transcoder].earningsPoolPerRound[_round];\\n\\n        totalStake = earningsPool.totalStake;\\n        transcoderRewardCut = earningsPool.transcoderRewardCut;\\n        transcoderFeeShare = earningsPool.transcoderFeeShare;\\n        cumulativeRewardFactor = earningsPool.cumulativeRewardFactor;\\n        cumulativeFeeFactor = earningsPool.cumulativeFeeFactor;\\n    }\\n\\n    /**\\n     * @notice Return delegator info\\n     * @param _delegator Address of delegator\\n     * @return total amount bonded by '_delegator'\\n     * @return amount of fees collected by '_delegator'\\n     * @return address '_delegator' has bonded to\\n     * @return total amount delegated to '_delegator'\\n     * @return round in which bond for '_delegator' became effective\\n     * @return round for which '_delegator' has last claimed earnings\\n     * @return ID for the next unbonding lock created for '_delegator'\\n     */\\n    function getDelegator(address _delegator)\\n        public\\n        view\\n        returns (\\n            uint256 bondedAmount,\\n            uint256 fees,\\n            address delegateAddress,\\n            uint256 delegatedAmount,\\n            uint256 startRound,\\n            uint256 lastClaimRound,\\n            uint256 nextUnbondingLockId\\n        )\\n    {\\n        Delegator storage del = delegators[_delegator];\\n\\n        bondedAmount = del.bondedAmount;\\n        fees = del.fees;\\n        delegateAddress = del.delegateAddress;\\n        delegatedAmount = del.delegatedAmount;\\n        startRound = del.startRound;\\n        lastClaimRound = del.lastClaimRound;\\n        nextUnbondingLockId = del.nextUnbondingLockId;\\n    }\\n\\n    /**\\n     * @notice Return delegator's unbonding lock info\\n     * @param _delegator Address of delegator\\n     * @param _unbondingLockId ID of unbonding lock\\n     * @return amount of stake locked up by unbonding lock\\n     * @return round in which 'amount' becomes available for withdrawal\\n     */\\n    function getDelegatorUnbondingLock(address _delegator, uint256 _unbondingLockId)\\n        public\\n        view\\n        returns (uint256 amount, uint256 withdrawRound)\\n    {\\n        UnbondingLock storage lock = delegators[_delegator].unbondingLocks[_unbondingLockId];\\n\\n        return (lock.amount, lock.withdrawRound);\\n    }\\n\\n    /**\\n     * @notice Returns max size of transcoder pool\\n     * @return transcoder pool max size\\n     */\\n    function getTranscoderPoolMaxSize() public view returns (uint256) {\\n        return transcoderPool.getMaxSize();\\n    }\\n\\n    /**\\n     * @notice Returns size of transcoder pool\\n     * @return transcoder pool current size\\n     */\\n    function getTranscoderPoolSize() public view returns (uint256) {\\n        return transcoderPool.getSize();\\n    }\\n\\n    /**\\n     * @notice Returns transcoder with most stake in pool\\n     * @return address for transcoder with highest stake in transcoder pool\\n     */\\n    function getFirstTranscoderInPool() public view returns (address) {\\n        return transcoderPool.getFirst();\\n    }\\n\\n    /**\\n     * @notice Returns next transcoder in pool for a given transcoder\\n     * @param _transcoder Address of a transcoder in the pool\\n     * @return address for the transcoder after '_transcoder' in transcoder pool\\n     */\\n    function getNextTranscoderInPool(address _transcoder) public view returns (address) {\\n        return transcoderPool.getNext(_transcoder);\\n    }\\n\\n    /**\\n     * @notice Return total bonded tokens\\n     * @return total active stake for the current round\\n     */\\n    function getTotalBonded() public view returns (uint256) {\\n        return currentRoundTotalActiveStake;\\n    }\\n\\n    /**\\n     * @notice Return whether a transcoder is active for the current round\\n     * @param _transcoder Transcoder address\\n     * @return true if transcoder is active\\n     */\\n    function isActiveTranscoder(address _transcoder) public view returns (bool) {\\n        Transcoder storage t = transcoders[_transcoder];\\n        uint256 currentRound = roundsManager().currentRound();\\n        return t.activationRound <= currentRound && currentRound < t.deactivationRound;\\n    }\\n\\n    /**\\n     * @notice Return whether a transcoder is registered\\n     * @param _transcoder Transcoder address\\n     * @return true if transcoder is self-bonded\\n     */\\n    function isRegisteredTranscoder(address _transcoder) public view returns (bool) {\\n        Delegator storage d = delegators[_transcoder];\\n        return d.delegateAddress == _transcoder && d.bondedAmount > 0;\\n    }\\n\\n    /**\\n     * @notice Return whether an unbonding lock for a delegator is valid\\n     * @param _delegator Address of delegator\\n     * @param _unbondingLockId ID of unbonding lock\\n     * @return true if unbondingLock for ID has a non-zero withdraw round\\n     */\\n    function isValidUnbondingLock(address _delegator, uint256 _unbondingLockId) public view returns (bool) {\\n        // A unbonding lock is only valid if it has a non-zero withdraw round (the default value is zero)\\n        return delegators[_delegator].unbondingLocks[_unbondingLockId].withdrawRound > 0;\\n    }\\n\\n    /**\\n     * @notice Return an EarningsPool.Data struct with cumulative factors for a given round that are rescaled if needed\\n     * @param _transcoder Storage pointer to a transcoder struct\\n     * @param _round The round to fetch the cumulative factors for\\n     */\\n    function cumulativeFactorsPool(Transcoder storage _transcoder, uint256 _round)\\n        internal\\n        view\\n        returns (EarningsPool.Data memory pool)\\n    {\\n        pool.cumulativeRewardFactor = _transcoder.earningsPoolPerRound[_round].cumulativeRewardFactor;\\n        pool.cumulativeFeeFactor = _transcoder.earningsPoolPerRound[_round].cumulativeFeeFactor;\\n\\n        return pool;\\n    }\\n\\n    /**\\n     * @notice Return an EarningsPool.Data struct with the latest cumulative factors for a given round\\n     * @param _transcoder Storage pointer to a transcoder struct\\n     * @param _round The round to fetch the latest cumulative factors for\\n     * @return pool An EarningsPool.Data populated with the latest cumulative factors for _round\\n     */\\n    function latestCumulativeFactorsPool(Transcoder storage _transcoder, uint256 _round)\\n        internal\\n        view\\n        returns (EarningsPool.Data memory pool)\\n    {\\n        pool = cumulativeFactorsPool(_transcoder, _round);\\n\\n        uint256 lastRewardRound = _transcoder.lastRewardRound;\\n        // Only use the cumulativeRewardFactor for lastRewardRound if lastRewardRound is before _round\\n        if (pool.cumulativeRewardFactor == 0 && lastRewardRound < _round) {\\n            pool.cumulativeRewardFactor = cumulativeFactorsPool(_transcoder, lastRewardRound).cumulativeRewardFactor;\\n        }\\n\\n        uint256 lastFeeRound = _transcoder.lastFeeRound;\\n        // Only use the cumulativeFeeFactor for lastFeeRound if lastFeeRound is before _round\\n        if (pool.cumulativeFeeFactor == 0 && lastFeeRound < _round) {\\n            pool.cumulativeFeeFactor = cumulativeFactorsPool(_transcoder, lastFeeRound).cumulativeFeeFactor;\\n        }\\n\\n        return pool;\\n    }\\n\\n    /**\\n     * @notice Return a delegator's cumulative stake and fees using the LIP-36 earnings claiming algorithm\\n     * @param _transcoder Storage pointer to a transcoder struct for a delegator's delegate\\n     * @param _startRound The round for the start cumulative factors\\n     * @param _endRound The round for the end cumulative factors\\n     * @param _stake The delegator's initial stake before including earned rewards\\n     * @param _fees The delegator's initial fees before including earned fees\\n     * @return (cStake, cFees) where cStake is the delegator's cumulative stake including earned rewards and cFees is the delegator's cumulative fees including earned fees\\n     */\\n    function delegatorCumulativeStakeAndFees(\\n        Transcoder storage _transcoder,\\n        uint256 _startRound,\\n        uint256 _endRound,\\n        uint256 _stake,\\n        uint256 _fees\\n    ) internal view returns (uint256 cStake, uint256 cFees) {\\n        // Fetch start cumulative factors\\n        EarningsPool.Data memory startPool = cumulativeFactorsPool(_transcoder, _startRound);\\n\\n        // If the start cumulativeRewardFactor is 0 set the default value to PreciseMathUtils.percPoints(1, 1)\\n        if (startPool.cumulativeRewardFactor == 0) {\\n            startPool.cumulativeRewardFactor = PreciseMathUtils.percPoints(1, 1);\\n        }\\n\\n        // Fetch end cumulative factors\\n        EarningsPool.Data memory endPool = latestCumulativeFactorsPool(_transcoder, _endRound);\\n\\n        // If the end cumulativeRewardFactor is 0 set the default value to PreciseMathUtils.percPoints(1, 1)\\n        if (endPool.cumulativeRewardFactor == 0) {\\n            endPool.cumulativeRewardFactor = PreciseMathUtils.percPoints(1, 1);\\n        }\\n\\n        cFees = _fees.add(\\n            PreciseMathUtils.percOf(\\n                _stake,\\n                endPool.cumulativeFeeFactor.sub(startPool.cumulativeFeeFactor),\\n                startPool.cumulativeRewardFactor\\n            )\\n        );\\n\\n        cStake = PreciseMathUtils.percOf(_stake, endPool.cumulativeRewardFactor, startPool.cumulativeRewardFactor);\\n\\n        return (cStake, cFees);\\n    }\\n\\n    /**\\n     * @notice Return the pending stake and fees for a delegator\\n     * @param _delegator Address of a delegator\\n     * @param _endRound The last round to claim earnings for when calculating the pending stake and fees\\n     * @return (stake, fees) where stake is the delegator's pending stake and fees is the delegator's pending fees\\n     */\\n    function pendingStakeAndFees(address _delegator, uint256 _endRound)\\n        internal\\n        view\\n        returns (uint256 stake, uint256 fees)\\n    {\\n        Delegator storage del = delegators[_delegator];\\n        Transcoder storage t = transcoders[del.delegateAddress];\\n\\n        fees = del.fees;\\n        stake = del.bondedAmount;\\n\\n        uint256 startRound = del.lastClaimRound.add(1);\\n        address delegateAddr = del.delegateAddress;\\n        bool isTranscoder = _delegator == delegateAddr;\\n\\n        // Make sure there is a round to claim i.e. end round - (start round - 1) > 0\\n        if (startRound <= _endRound) {\\n            (stake, fees) = delegatorCumulativeStakeAndFees(t, startRound.sub(1), _endRound, stake, fees);\\n        }\\n        // cumulativeRewards and cumulativeFees will track *all* rewards/fees earned by the transcoder\\n        // so it is important that this is only executed with the end round as the current round or else\\n        // the returned stake and fees will reflect rewards/fees earned in the future relative to the end round\\n        if (isTranscoder) {\\n            stake = stake.add(t.cumulativeRewards);\\n            fees = fees.add(t.cumulativeFees);\\n        }\\n\\n        return (stake, fees);\\n    }\\n\\n    /**\\n     * @dev Increase the total stake for a delegate and updates its 'lastActiveStakeUpdateRound'\\n     * @param _delegate The delegate to increase the stake for\\n     * @param _amount The amount to increase the stake for '_delegate' by\\n     */\\n    function increaseTotalStake(\\n        address _delegate,\\n        uint256 _amount,\\n        address _newPosPrev,\\n        address _newPosNext\\n    ) internal {\\n        if (isRegisteredTranscoder(_delegate)) {\\n            uint256 currStake = transcoderTotalStake(_delegate);\\n            uint256 newStake = currStake.add(_amount);\\n            uint256 currRound = roundsManager().currentRound();\\n            uint256 nextRound = currRound.add(1);\\n\\n            // If the transcoder is already in the active set update its stake and return\\n            if (transcoderPool.contains(_delegate)) {\\n                transcoderPool.updateKey(_delegate, newStake, _newPosPrev, _newPosNext);\\n                nextRoundTotalActiveStake = nextRoundTotalActiveStake.add(_amount);\\n                Transcoder storage t = transcoders[_delegate];\\n\\n                // currStake (the transcoder's delegatedAmount field) will reflect the transcoder's stake from lastActiveStakeUpdateRound\\n                // because it is updated every time lastActiveStakeUpdateRound is updated\\n                // The current active total stake is set to currStake to ensure that the value can be used in updateTranscoderWithRewards()\\n                // and updateTranscoderWithFees() when lastActiveStakeUpdateRound > currentRound\\n                if (t.lastActiveStakeUpdateRound < currRound) {\\n                    t.earningsPoolPerRound[currRound].setStake(currStake);\\n                }\\n\\n                t.earningsPoolPerRound[nextRound].setStake(newStake);\\n                t.lastActiveStakeUpdateRound = nextRound;\\n            } else {\\n                // Check if the transcoder is eligible to join the active set in the update round\\n                tryToJoinActiveSet(_delegate, newStake, nextRound, _newPosPrev, _newPosNext);\\n            }\\n        }\\n\\n        // Increase delegate's delegated amount\\n        delegators[_delegate].delegatedAmount = delegators[_delegate].delegatedAmount.add(_amount);\\n    }\\n\\n    /**\\n     * @dev Decrease the total stake for a delegate and updates its 'lastActiveStakeUpdateRound'\\n     * @param _delegate The transcoder to decrease the stake for\\n     * @param _amount The amount to decrease the stake for '_delegate' by\\n     */\\n    function decreaseTotalStake(\\n        address _delegate,\\n        uint256 _amount,\\n        address _newPosPrev,\\n        address _newPosNext\\n    ) internal {\\n        if (transcoderPool.contains(_delegate)) {\\n            uint256 currStake = transcoderTotalStake(_delegate);\\n            uint256 newStake = currStake.sub(_amount);\\n            uint256 currRound = roundsManager().currentRound();\\n            uint256 nextRound = currRound.add(1);\\n\\n            transcoderPool.updateKey(_delegate, newStake, _newPosPrev, _newPosNext);\\n            nextRoundTotalActiveStake = nextRoundTotalActiveStake.sub(_amount);\\n            Transcoder storage t = transcoders[_delegate];\\n\\n            // currStake (the transcoder's delegatedAmount field) will reflect the transcoder's stake from lastActiveStakeUpdateRound\\n            // because it is updated every time lastActiveStakeUpdateRound is updated\\n            // The current active total stake is set to currStake to ensure that the value can be used in updateTranscoderWithRewards()\\n            // and updateTranscoderWithFees() when lastActiveStakeUpdateRound > currentRound\\n            if (t.lastActiveStakeUpdateRound < currRound) {\\n                t.earningsPoolPerRound[currRound].setStake(currStake);\\n            }\\n\\n            t.lastActiveStakeUpdateRound = nextRound;\\n            t.earningsPoolPerRound[nextRound].setStake(newStake);\\n        }\\n\\n        // Decrease old delegate's delegated amount\\n        delegators[_delegate].delegatedAmount = delegators[_delegate].delegatedAmount.sub(_amount);\\n    }\\n\\n    /**\\n     * @dev Tries to add a transcoder to active transcoder pool, evicts the active transcoder with the lowest stake if the pool is full\\n     * @param _transcoder The transcoder to insert into the transcoder pool\\n     * @param _totalStake The total stake for '_transcoder'\\n     * @param _activationRound The round in which the transcoder should become active\\n     */\\n    function tryToJoinActiveSet(\\n        address _transcoder,\\n        uint256 _totalStake,\\n        uint256 _activationRound,\\n        address _newPosPrev,\\n        address _newPosNext\\n    ) internal {\\n        uint256 pendingNextRoundTotalActiveStake = nextRoundTotalActiveStake;\\n\\n        if (transcoderPool.isFull()) {\\n            address lastTranscoder = transcoderPool.getLast();\\n            uint256 lastStake = transcoderTotalStake(lastTranscoder);\\n\\n            // If the pool is full and the transcoder has less stake than the least stake transcoder in the pool\\n            // then the transcoder is unable to join the active set for the next round\\n            if (_totalStake <= lastStake) {\\n                return;\\n            }\\n\\n            // Evict the least stake transcoder from the active set for the next round\\n            // Not zeroing 'Transcoder.lastActiveStakeUpdateRound' saves gas (5k when transcoder is evicted and 20k when transcoder is reinserted)\\n            // There should be no side-effects as long as the value is properly updated on stake updates\\n            // Not zeroing the stake on the current round's 'EarningsPool' saves gas and should have no side effects as long as\\n            // 'EarningsPool.setStake()' is called whenever a transcoder becomes active again.\\n            transcoderPool.remove(lastTranscoder);\\n            transcoders[lastTranscoder].deactivationRound = _activationRound;\\n            pendingNextRoundTotalActiveStake = pendingNextRoundTotalActiveStake.sub(lastStake);\\n\\n            emit TranscoderDeactivated(lastTranscoder, _activationRound);\\n        }\\n\\n        transcoderPool.insert(_transcoder, _totalStake, _newPosPrev, _newPosNext);\\n        pendingNextRoundTotalActiveStake = pendingNextRoundTotalActiveStake.add(_totalStake);\\n        Transcoder storage t = transcoders[_transcoder];\\n        t.lastActiveStakeUpdateRound = _activationRound;\\n        t.activationRound = _activationRound;\\n        t.deactivationRound = MAX_FUTURE_ROUND;\\n        t.earningsPoolPerRound[_activationRound].setStake(_totalStake);\\n        nextRoundTotalActiveStake = pendingNextRoundTotalActiveStake;\\n        emit TranscoderActivated(_transcoder, _activationRound);\\n    }\\n\\n    /**\\n     * @dev Remove a transcoder from the pool and deactivate it\\n     */\\n    function resignTranscoder(address _transcoder) internal {\\n        // Not zeroing 'Transcoder.lastActiveStakeUpdateRound' saves gas (5k when transcoder is evicted and 20k when transcoder is reinserted)\\n        // There should be no side-effects as long as the value is properly updated on stake updates\\n        // Not zeroing the stake on the current round's 'EarningsPool' saves gas and should have no side effects as long as\\n        // 'EarningsPool.setStake()' is called whenever a transcoder becomes active again.\\n        transcoderPool.remove(_transcoder);\\n        nextRoundTotalActiveStake = nextRoundTotalActiveStake.sub(transcoderTotalStake(_transcoder));\\n        uint256 deactivationRound = roundsManager().currentRound().add(1);\\n        transcoders[_transcoder].deactivationRound = deactivationRound;\\n        emit TranscoderDeactivated(_transcoder, deactivationRound);\\n    }\\n\\n    /**\\n     * @dev Update a transcoder with rewards and update the transcoder pool with an optional list hint if needed.\\n     * See SortedDoublyLL.sol for details on list hints\\n     * @param _transcoder Address of transcoder\\n     * @param _rewards Amount of rewards\\n     * @param _round Round that transcoder is updated\\n     * @param _newPosPrev Address of previous transcoder in pool if the transcoder is in the pool\\n     * @param _newPosNext Address of next transcoder in pool if the transcoder is in the pool\\n     */\\n    function updateTranscoderWithRewards(\\n        address _transcoder,\\n        uint256 _rewards,\\n        uint256 _round,\\n        address _newPosPrev,\\n        address _newPosNext\\n    ) internal {\\n        Transcoder storage t = transcoders[_transcoder];\\n        EarningsPool.Data storage earningsPool = t.earningsPoolPerRound[_round];\\n        EarningsPool.Data memory prevEarningsPool = cumulativeFactorsPool(t, t.lastRewardRound);\\n\\n        t.activeCumulativeRewards = t.cumulativeRewards;\\n\\n        uint256 transcoderCommissionRewards = MathUtils.percOf(_rewards, earningsPool.transcoderRewardCut);\\n        uint256 delegatorsRewards = _rewards.sub(transcoderCommissionRewards);\\n        // Calculate the rewards earned by the transcoder's earned rewards\\n        uint256 transcoderRewardStakeRewards = PreciseMathUtils.percOf(\\n            delegatorsRewards,\\n            t.activeCumulativeRewards,\\n            earningsPool.totalStake\\n        );\\n        // Track rewards earned by the transcoder based on its earned rewards and rewardCut\\n        t.cumulativeRewards = t.cumulativeRewards.add(transcoderRewardStakeRewards).add(transcoderCommissionRewards);\\n        // Update cumulative reward factor with new rewards\\n        // The cumulativeRewardFactor is used to calculate rewards for all delegators including the transcoder (self-delegated)\\n        // Note that delegatorsRewards includes transcoderRewardStakeRewards, but no delegator will claim that amount using\\n        // the earnings claiming algorithm and instead that amount is accounted for in the transcoder's cumulativeRewards field\\n        earningsPool.updateCumulativeRewardFactor(prevEarningsPool, delegatorsRewards);\\n        // Update transcoder's total stake with rewards\\n        increaseTotalStake(_transcoder, _rewards, _newPosPrev, _newPosNext);\\n    }\\n\\n    /**\\n     * @dev Update a delegator with token pools shares from its lastClaimRound through a given round\\n     * @param _delegator Delegator address\\n     * @param _endRound The last round for which to update a delegator's stake with earnings pool shares\\n     * @param _lastClaimRound The round for which a delegator has last claimed earnings\\n     */\\n    function updateDelegatorWithEarnings(\\n        address _delegator,\\n        uint256 _endRound,\\n        uint256 _lastClaimRound\\n    ) internal {\\n        Delegator storage del = delegators[_delegator];\\n        uint256 startRound = _lastClaimRound.add(1);\\n        uint256 currentBondedAmount = del.bondedAmount;\\n        uint256 currentFees = del.fees;\\n\\n        // Only will have earnings to claim if you have a delegate\\n        // If not delegated, skip the earnings claim process\\n        if (del.delegateAddress != address(0)) {\\n            (currentBondedAmount, currentFees) = pendingStakeAndFees(_delegator, _endRound);\\n\\n            // Check whether the endEarningsPool is initialised\\n            // If it is not initialised set it's cumulative factors so that they can be used when a delegator\\n            // next claims earnings as the start cumulative factors (see delegatorCumulativeStakeAndFees())\\n            Transcoder storage t = transcoders[del.delegateAddress];\\n            EarningsPool.Data storage endEarningsPool = t.earningsPoolPerRound[_endRound];\\n            if (endEarningsPool.cumulativeRewardFactor == 0) {\\n                uint256 lastRewardRound = t.lastRewardRound;\\n                if (lastRewardRound < _endRound) {\\n                    endEarningsPool.cumulativeRewardFactor = cumulativeFactorsPool(t, lastRewardRound)\\n                        .cumulativeRewardFactor;\\n                }\\n            }\\n            if (endEarningsPool.cumulativeFeeFactor == 0) {\\n                uint256 lastFeeRound = t.lastFeeRound;\\n                if (lastFeeRound < _endRound) {\\n                    endEarningsPool.cumulativeFeeFactor = cumulativeFactorsPool(t, lastFeeRound).cumulativeFeeFactor;\\n                }\\n            }\\n\\n            if (del.delegateAddress == _delegator) {\\n                t.cumulativeFees = 0;\\n                t.cumulativeRewards = 0;\\n                // activeCumulativeRewards is not cleared here because the next reward() call will set it to cumulativeRewards\\n            }\\n        }\\n\\n        emit EarningsClaimed(\\n            del.delegateAddress,\\n            _delegator,\\n            currentBondedAmount.sub(del.bondedAmount),\\n            currentFees.sub(del.fees),\\n            startRound,\\n            _endRound\\n        );\\n\\n        del.lastClaimRound = _endRound;\\n        // Rewards are bonded by default\\n        del.bondedAmount = currentBondedAmount;\\n        del.fees = currentFees;\\n    }\\n\\n    /**\\n     * @dev Update the state of a delegator and its delegate by processing a rebond using an unbonding lock and update the transcoder pool with an optional\\n     * list hint if needed. See SortedDoublyLL.sol for details on list hints\\n     * @param _delegator Address of delegator\\n     * @param _unbondingLockId ID of unbonding lock to rebond with\\n     * @param _newPosPrev Address of previous transcoder in pool if the delegate is already in or joins the pool\\n     * @param _newPosNext Address of next transcoder in pool if the delegate is already in or joins the pool\\n     */\\n    function processRebond(\\n        address _delegator,\\n        uint256 _unbondingLockId,\\n        address _newPosPrev,\\n        address _newPosNext\\n    ) internal {\\n        Delegator storage del = delegators[_delegator];\\n        UnbondingLock storage lock = del.unbondingLocks[_unbondingLockId];\\n\\n        require(isValidUnbondingLock(_delegator, _unbondingLockId), \\\"invalid unbonding lock ID\\\");\\n\\n        uint256 amount = lock.amount;\\n        // Increase delegator's bonded amount\\n        del.bondedAmount = del.bondedAmount.add(amount);\\n\\n        // Delete lock\\n        delete del.unbondingLocks[_unbondingLockId];\\n\\n        increaseTotalStake(del.delegateAddress, amount, _newPosPrev, _newPosNext);\\n\\n        emit Rebond(del.delegateAddress, _delegator, _unbondingLockId, amount);\\n    }\\n\\n    /**\\n     * @dev Return LivepeerToken interface\\n     * @return Livepeer token contract registered with Controller\\n     */\\n    function livepeerToken() internal view returns (ILivepeerToken) {\\n        return ILivepeerToken(controller.getContract(keccak256(\\\"LivepeerToken\\\")));\\n    }\\n\\n    /**\\n     * @dev Return Minter interface\\n     * @return Minter contract registered with Controller\\n     */\\n    function minter() internal view returns (IMinter) {\\n        return IMinter(controller.getContract(keccak256(\\\"Minter\\\")));\\n    }\\n\\n    /**\\n     * @dev Return RoundsManager interface\\n     * @return RoundsManager contract registered with Controller\\n     */\\n    function roundsManager() internal view returns (IRoundsManager) {\\n        return IRoundsManager(controller.getContract(keccak256(\\\"RoundsManager\\\")));\\n    }\\n\\n    function _onlyTicketBroker() internal view {\\n        require(msg.sender == controller.getContract(keccak256(\\\"TicketBroker\\\")), \\\"caller must be TicketBroker\\\");\\n    }\\n\\n    function _onlyRoundsManager() internal view {\\n        require(msg.sender == controller.getContract(keccak256(\\\"RoundsManager\\\")), \\\"caller must be RoundsManager\\\");\\n    }\\n\\n    function _onlyVerifier() internal view {\\n        require(msg.sender == controller.getContract(keccak256(\\\"Verifier\\\")), \\\"caller must be Verifier\\\");\\n    }\\n\\n    function _currentRoundInitialized() internal view {\\n        require(roundsManager().currentRoundInitialized(), \\\"current round is not initialized\\\");\\n    }\\n\\n    function _autoClaimEarnings() internal {\\n        uint256 currentRound = roundsManager().currentRound();\\n        uint256 lastClaimRound = delegators[msg.sender].lastClaimRound;\\n        if (lastClaimRound < currentRound) {\\n            updateDelegatorWithEarnings(msg.sender, currentRound, lastClaimRound);\\n        }\\n    }\\n}\\n\",\"keccak256\":\"0x806ebb4317d51eb1d8317f570fddb4b1132715d1504e8cb64066c3620dc08b37\"},\"contracts/bonding/IBondingManager.sol\":{\"content\":\"pragma solidity ^0.5.11;\\n\\n/**\\n * @title Interface for BondingManager\\n * TODO: switch to interface type\\n */\\ncontract IBondingManager {\\n    event TranscoderUpdate(address indexed transcoder, uint256 rewardCut, uint256 feeShare);\\n    event TranscoderActivated(address indexed transcoder, uint256 activationRound);\\n    event TranscoderDeactivated(address indexed transcoder, uint256 deactivationRound);\\n    event TranscoderSlashed(address indexed transcoder, address finder, uint256 penalty, uint256 finderReward);\\n    event Reward(address indexed transcoder, uint256 amount);\\n    event Bond(\\n        address indexed newDelegate,\\n        address indexed oldDelegate,\\n        address indexed delegator,\\n        uint256 additionalAmount,\\n        uint256 bondedAmount\\n    );\\n    event Unbond(\\n        address indexed delegate,\\n        address indexed delegator,\\n        uint256 unbondingLockId,\\n        uint256 amount,\\n        uint256 withdrawRound\\n    );\\n    event Rebond(address indexed delegate, address indexed delegator, uint256 unbondingLockId, uint256 amount);\\n    event WithdrawStake(address indexed delegator, uint256 unbondingLockId, uint256 amount, uint256 withdrawRound);\\n    event WithdrawFees(address indexed delegator, address recipient, uint256 amount);\\n    event EarningsClaimed(\\n        address indexed delegate,\\n        address indexed delegator,\\n        uint256 rewards,\\n        uint256 fees,\\n        uint256 startRound,\\n        uint256 endRound\\n    );\\n\\n    // Deprecated events\\n    // These event signatures can be used to construct the appropriate topic hashes to filter for past logs corresponding\\n    // to these deprecated events.\\n    // event Bond(address indexed delegate, address indexed delegator);\\n    // event Unbond(address indexed delegate, address indexed delegator);\\n    // event WithdrawStake(address indexed delegator);\\n    // event TranscoderUpdate(address indexed transcoder, uint256 pendingRewardCut, uint256 pendingFeeShare, uint256 pendingPricePerSegment, bool registered);\\n    // event TranscoderEvicted(address indexed transcoder);\\n    // event TranscoderResigned(address indexed transcoder);\\n\\n    // External functions\\n    function updateTranscoderWithFees(\\n        address _transcoder,\\n        uint256 _fees,\\n        uint256 _round\\n    ) external;\\n\\n    function slashTranscoder(\\n        address _transcoder,\\n        address _finder,\\n        uint256 _slashAmount,\\n        uint256 _finderFee\\n    ) external;\\n\\n    function setCurrentRoundTotalActiveStake() external;\\n\\n    // Public functions\\n    function getTranscoderPoolSize() public view returns (uint256);\\n\\n    function transcoderTotalStake(address _transcoder) public view returns (uint256);\\n\\n    function isActiveTranscoder(address _transcoder) public view returns (bool);\\n\\n    function getTotalBonded() public view returns (uint256);\\n}\\n\",\"keccak256\":\"0x41fbf1bc0ec78a101210233630bae3c7333e4c4cba0cbbecdb4a860fb576bbdf\"},\"contracts/bonding/libraries/EarningsPool.sol\":{\"content\":\"pragma solidity ^0.5.11;\\n\\nimport \\\"../../libraries/MathUtils.sol\\\";\\n\\nimport \\\"openzeppelin-solidity/contracts/math/SafeMath.sol\\\";\\n\\n/**\\n * @title EarningsPool\\n * @dev Manages reward and fee pools for delegators and transcoders\\n */\\nlibrary EarningsPool {\\n    using SafeMath for uint256;\\n\\n    struct Data {\\n        uint256 totalStake; // Transcoder's total stake during the earnings pool's round\\n        uint256 transcoderRewardCut; // Transcoder's reward cut during the earnings pool's round\\n        uint256 transcoderFeeShare; // Transcoder's fee share during the earnings pool's round\\n        // LIP-36 (https://github.com/livepeer/LIPs/blob/master/LIPs/LIP-36.md) fields\\n        // See EarningsPoolLIP36.sol\\n        uint256 cumulativeRewardFactor;\\n        uint256 cumulativeFeeFactor;\\n    }\\n\\n    /**\\n     * @dev Sets transcoderRewardCut and transcoderFeeshare for an EarningsPool\\n     * @param earningsPool Storage pointer to EarningsPool struct\\n     * @param _rewardCut Reward cut of transcoder during the earnings pool's round\\n     * @param _feeShare Fee share of transcoder during the earnings pool's round\\n     */\\n    function setCommission(\\n        EarningsPool.Data storage earningsPool,\\n        uint256 _rewardCut,\\n        uint256 _feeShare\\n    ) internal {\\n        earningsPool.transcoderRewardCut = _rewardCut;\\n        earningsPool.transcoderFeeShare = _feeShare;\\n    }\\n\\n    /**\\n     * @dev Sets totalStake for an EarningsPool\\n     * @param earningsPool Storage pointer to EarningsPool struct\\n     * @param _stake Total stake of the transcoder during the earnings pool's round\\n     */\\n    function setStake(EarningsPool.Data storage earningsPool, uint256 _stake) internal {\\n        earningsPool.totalStake = _stake;\\n    }\\n}\\n\",\"keccak256\":\"0x0e5f8e1fd2ec422552acc536342c991398bc5989eff1c52106fbf665a82b1de3\"},\"contracts/bonding/libraries/EarningsPoolLIP36.sol\":{\"content\":\"pragma solidity ^0.5.11;\\n\\nimport \\\"./EarningsPool.sol\\\";\\nimport \\\"../../libraries/PreciseMathUtils.sol\\\";\\n\\nimport \\\"openzeppelin-solidity/contracts/math/SafeMath.sol\\\";\\n\\nlibrary EarningsPoolLIP36 {\\n    using SafeMath for uint256;\\n\\n    /**\\n     * @notice Update the cumulative fee factor stored in an earnings pool with new fees\\n     * @param earningsPool Storage pointer to EarningsPools.Data struct\\n     * @param _prevEarningsPool In-memory EarningsPool.Data struct that stores the previous cumulative reward and fee factors\\n     * @param _fees Amount of new fees\\n     */\\n    function updateCumulativeFeeFactor(\\n        EarningsPool.Data storage earningsPool,\\n        EarningsPool.Data memory _prevEarningsPool,\\n        uint256 _fees\\n    ) internal {\\n        uint256 prevCumulativeFeeFactor = _prevEarningsPool.cumulativeFeeFactor;\\n        uint256 prevCumulativeRewardFactor = _prevEarningsPool.cumulativeRewardFactor != 0\\n            ? _prevEarningsPool.cumulativeRewardFactor\\n            : PreciseMathUtils.percPoints(1, 1);\\n\\n        // Initialize the cumulativeFeeFactor when adding fees for the first time\\n        if (earningsPool.cumulativeFeeFactor == 0) {\\n            earningsPool.cumulativeFeeFactor = prevCumulativeFeeFactor.add(\\n                PreciseMathUtils.percOf(prevCumulativeRewardFactor, _fees, earningsPool.totalStake)\\n            );\\n            return;\\n        }\\n\\n        earningsPool.cumulativeFeeFactor = earningsPool.cumulativeFeeFactor.add(\\n            PreciseMathUtils.percOf(prevCumulativeRewardFactor, _fees, earningsPool.totalStake)\\n        );\\n    }\\n\\n    /**\\n     * @notice Update the cumulative reward factor stored in an earnings pool with new rewards\\n     * @param earningsPool Storage pointer to EarningsPool.Data struct\\n     * @param _prevEarningsPool Storage pointer to EarningsPool.Data struct that stores the previous cumulative reward factor\\n     * @param _rewards Amount of new rewards\\n     */\\n    function updateCumulativeRewardFactor(\\n        EarningsPool.Data storage earningsPool,\\n        EarningsPool.Data memory _prevEarningsPool,\\n        uint256 _rewards\\n    ) internal {\\n        uint256 prevCumulativeRewardFactor = _prevEarningsPool.cumulativeRewardFactor != 0\\n            ? _prevEarningsPool.cumulativeRewardFactor\\n            : PreciseMathUtils.percPoints(1, 1);\\n\\n        earningsPool.cumulativeRewardFactor = prevCumulativeRewardFactor.add(\\n            PreciseMathUtils.percOf(prevCumulativeRewardFactor, _rewards, earningsPool.totalStake)\\n        );\\n    }\\n}\\n\",\"keccak256\":\"0xeedae8f3c5f83afc93f230a2e88301f055e749838de821482deda03f121c8bde\"},\"contracts/libraries/MathUtils.sol\":{\"content\":\"pragma solidity ^0.5.11;\\n\\nimport \\\"openzeppelin-solidity/contracts/math/SafeMath.sol\\\";\\n\\nlibrary MathUtils {\\n    using SafeMath for uint256;\\n\\n    // Divisor used for representing percentages\\n    uint256 public constant PERC_DIVISOR = 1000000;\\n\\n    /**\\n     * @dev Returns whether an amount is a valid percentage out of PERC_DIVISOR\\n     * @param _amount Amount that is supposed to be a percentage\\n     */\\n    function validPerc(uint256 _amount) internal pure returns (bool) {\\n        return _amount <= PERC_DIVISOR;\\n    }\\n\\n    /**\\n     * @dev Compute percentage of a value with the percentage represented by a fraction\\n     * @param _amount Amount to take the percentage of\\n     * @param _fracNum Numerator of fraction representing the percentage\\n     * @param _fracDenom Denominator of fraction representing the percentage\\n     */\\n    function percOf(\\n        uint256 _amount,\\n        uint256 _fracNum,\\n        uint256 _fracDenom\\n    ) internal pure returns (uint256) {\\n        return _amount.mul(percPoints(_fracNum, _fracDenom)).div(PERC_DIVISOR);\\n    }\\n\\n    /**\\n     * @dev Compute percentage of a value with the percentage represented by a fraction over PERC_DIVISOR\\n     * @param _amount Amount to take the percentage of\\n     * @param _fracNum Numerator of fraction representing the percentage with PERC_DIVISOR as the denominator\\n     */\\n    function percOf(uint256 _amount, uint256 _fracNum) internal pure returns (uint256) {\\n        return _amount.mul(_fracNum).div(PERC_DIVISOR);\\n    }\\n\\n    /**\\n     * @dev Compute percentage representation of a fraction\\n     * @param _fracNum Numerator of fraction represeting the percentage\\n     * @param _fracDenom Denominator of fraction represeting the percentage\\n     */\\n    function percPoints(uint256 _fracNum, uint256 _fracDenom) internal pure returns (uint256) {\\n        return _fracNum.mul(PERC_DIVISOR).div(_fracDenom);\\n    }\\n}\\n\",\"keccak256\":\"0x6ab4d4fd557e70e5d769fdaa51560c1884abcf89ca353f2363e7a86d1be2c44b\"},\"contracts/libraries/PreciseMathUtils.sol\":{\"content\":\"pragma solidity ^0.5.11;\\n\\nimport \\\"openzeppelin-solidity/contracts/math/SafeMath.sol\\\";\\n\\nlibrary PreciseMathUtils {\\n    using SafeMath for uint256;\\n\\n    // Divisor used for representing percentages\\n    uint256 public constant PERC_DIVISOR = 10**27;\\n\\n    /**\\n     * @dev Returns whether an amount is a valid percentage out of PERC_DIVISOR\\n     * @param _amount Amount that is supposed to be a percentage\\n     */\\n    function validPerc(uint256 _amount) internal pure returns (bool) {\\n        return _amount <= PERC_DIVISOR;\\n    }\\n\\n    /**\\n     * @dev Compute percentage of a value with the percentage represented by a fraction\\n     * @param _amount Amount to take the percentage of\\n     * @param _fracNum Numerator of fraction representing the percentage\\n     * @param _fracDenom Denominator of fraction representing the percentage\\n     */\\n    function percOf(\\n        uint256 _amount,\\n        uint256 _fracNum,\\n        uint256 _fracDenom\\n    ) internal pure returns (uint256) {\\n        return _amount.mul(percPoints(_fracNum, _fracDenom)).div(PERC_DIVISOR);\\n    }\\n\\n    /**\\n     * @dev Compute percentage of a value with the percentage represented by a fraction over PERC_DIVISOR\\n     * @param _amount Amount to take the percentage of\\n     * @param _fracNum Numerator of fraction representing the percentage with PERC_DIVISOR as the denominator\\n     */\\n    function percOf(uint256 _amount, uint256 _fracNum) internal pure returns (uint256) {\\n        return _amount.mul(_fracNum).div(PERC_DIVISOR);\\n    }\\n\\n    /**\\n     * @dev Compute percentage representation of a fraction\\n     * @param _fracNum Numerator of fraction represeting the percentage\\n     * @param _fracDenom Denominator of fraction represeting the percentage\\n     */\\n    function percPoints(uint256 _fracNum, uint256 _fracDenom) internal pure returns (uint256) {\\n        return _fracNum.mul(PERC_DIVISOR).div(_fracDenom);\\n    }\\n}\\n\",\"keccak256\":\"0x92083b13a0225df73ddb04d5eb394d9c9e8c4d2c306a2d2b3237d37db192bd61\"},\"contracts/libraries/SortedDoublyLL.sol\":{\"content\":\"pragma solidity ^0.5.11;\\n\\nimport \\\"openzeppelin-solidity/contracts/math/SafeMath.sol\\\";\\n\\n/**\\n * @title A sorted doubly linked list with nodes sorted in descending order. Optionally accepts insert position hints\\n *\\n * Given a new node with a `key`, a hint is of the form `(prevId, nextId)` s.t. `prevId` and `nextId` are adjacent in the list.\\n * `prevId` is a node with a key >= `key` and `nextId` is a node with a key <= `key`. If the sender provides a hint that is a valid insert position\\n * the insert operation is a constant time storage write. However, the provided hint in a given transaction might be a valid insert position, but if other transactions are included first, when\\n * the given transaction is executed the provided hint may no longer be a valid insert position. For example, one of the nodes referenced might be removed or their keys may\\n * be updated such that the the pair of nodes in the hint no longer represent a valid insert position. If one of the nodes in the hint becomes invalid, we still try to use the other\\n * valid node as a starting point for finding the appropriate insert position. If both nodes in the hint become invalid, we use the head of the list as a starting point\\n * to find the appropriate insert position.\\n */\\nlibrary SortedDoublyLL {\\n    using SafeMath for uint256;\\n\\n    // Information for a node in the list\\n    struct Node {\\n        uint256 key; // Node's key used for sorting\\n        address nextId; // Id of next node (smaller key) in the list\\n        address prevId; // Id of previous node (larger key) in the list\\n    }\\n\\n    // Information for the list\\n    struct Data {\\n        address head; // Head of the list. Also the node in the list with the largest key\\n        address tail; // Tail of the list. Also the node in the list with the smallest key\\n        uint256 maxSize; // Maximum size of the list\\n        uint256 size; // Current size of the list\\n        mapping(address => Node) nodes; // Track the corresponding ids for each node in the list\\n    }\\n\\n    /**\\n     * @dev Set the maximum size of the list\\n     * @param _size Maximum size\\n     */\\n    function setMaxSize(Data storage self, uint256 _size) public {\\n        require(_size > self.maxSize, \\\"new max size must be greater than old max size\\\");\\n\\n        self.maxSize = _size;\\n    }\\n\\n    /**\\n     * @dev Add a node to the list\\n     * @param _id Node's id\\n     * @param _key Node's key\\n     * @param _prevId Id of previous node for the insert position\\n     * @param _nextId Id of next node for the insert position\\n     */\\n    function insert(\\n        Data storage self,\\n        address _id,\\n        uint256 _key,\\n        address _prevId,\\n        address _nextId\\n    ) public {\\n        // List must not be full\\n        require(!isFull(self), \\\"list is full\\\");\\n        // List must not already contain node\\n        require(!contains(self, _id), \\\"node already in list\\\");\\n        // Node id must not be null\\n        require(_id != address(0), \\\"node id is null\\\");\\n        // Key must be non-zero\\n        require(_key > 0, \\\"key is zero\\\");\\n\\n        address prevId = _prevId;\\n        address nextId = _nextId;\\n\\n        if (!validInsertPosition(self, _key, prevId, nextId)) {\\n            // Sender's hint was not a valid insert position\\n            // Use sender's hint to find a valid insert position\\n            (prevId, nextId) = findInsertPosition(self, _key, prevId, nextId);\\n        }\\n\\n        self.nodes[_id].key = _key;\\n\\n        if (prevId == address(0) && nextId == address(0)) {\\n            // Insert as head and tail\\n            self.head = _id;\\n            self.tail = _id;\\n        } else if (prevId == address(0)) {\\n            // Insert before `prevId` as the head\\n            self.nodes[_id].nextId = self.head;\\n            self.nodes[self.head].prevId = _id;\\n            self.head = _id;\\n        } else if (nextId == address(0)) {\\n            // Insert after `nextId` as the tail\\n            self.nodes[_id].prevId = self.tail;\\n            self.nodes[self.tail].nextId = _id;\\n            self.tail = _id;\\n        } else {\\n            // Insert at insert position between `prevId` and `nextId`\\n            self.nodes[_id].nextId = nextId;\\n            self.nodes[_id].prevId = prevId;\\n            self.nodes[prevId].nextId = _id;\\n            self.nodes[nextId].prevId = _id;\\n        }\\n\\n        self.size = self.size.add(1);\\n    }\\n\\n    /**\\n     * @dev Remove a node from the list\\n     * @param _id Node's id\\n     */\\n    function remove(Data storage self, address _id) public {\\n        // List must contain the node\\n        require(contains(self, _id), \\\"node not in list\\\");\\n\\n        if (self.size > 1) {\\n            // List contains more than a single node\\n            if (_id == self.head) {\\n                // The removed node is the head\\n                // Set head to next node\\n                self.head = self.nodes[_id].nextId;\\n                // Set prev pointer of new head to null\\n                self.nodes[self.head].prevId = address(0);\\n            } else if (_id == self.tail) {\\n                // The removed node is the tail\\n                // Set tail to previous node\\n                self.tail = self.nodes[_id].prevId;\\n                // Set next pointer of new tail to null\\n                self.nodes[self.tail].nextId = address(0);\\n            } else {\\n                // The removed node is neither the head nor the tail\\n                // Set next pointer of previous node to the next node\\n                self.nodes[self.nodes[_id].prevId].nextId = self.nodes[_id].nextId;\\n                // Set prev pointer of next node to the previous node\\n                self.nodes[self.nodes[_id].nextId].prevId = self.nodes[_id].prevId;\\n            }\\n        } else {\\n            // List contains a single node\\n            // Set the head and tail to null\\n            self.head = address(0);\\n            self.tail = address(0);\\n        }\\n\\n        delete self.nodes[_id];\\n        self.size = self.size.sub(1);\\n    }\\n\\n    /**\\n     * @dev Update the key of a node in the list\\n     * @param _id Node's id\\n     * @param _newKey Node's new key\\n     * @param _prevId Id of previous node for the new insert position\\n     * @param _nextId Id of next node for the new insert position\\n     */\\n    function updateKey(\\n        Data storage self,\\n        address _id,\\n        uint256 _newKey,\\n        address _prevId,\\n        address _nextId\\n    ) public {\\n        // List must contain the node\\n        require(contains(self, _id), \\\"node not in list\\\");\\n\\n        // Remove node from the list\\n        remove(self, _id);\\n\\n        if (_newKey > 0) {\\n            // Insert node if it has a non-zero key\\n            insert(self, _id, _newKey, _prevId, _nextId);\\n        }\\n    }\\n\\n    /**\\n     * @dev Checks if the list contains a node\\n     * @param _id Address of transcoder\\n     * @return true if '_id' is in list\\n     */\\n    function contains(Data storage self, address _id) public view returns (bool) {\\n        // List only contains non-zero keys, so if key is non-zero the node exists\\n        return self.nodes[_id].key > 0;\\n    }\\n\\n    /**\\n     * @dev Checks if the list is full\\n     * @return true if list is full\\n     */\\n    function isFull(Data storage self) public view returns (bool) {\\n        return self.size == self.maxSize;\\n    }\\n\\n    /**\\n     * @dev Checks if the list is empty\\n     * @return true if list is empty\\n     */\\n    function isEmpty(Data storage self) public view returns (bool) {\\n        return self.size == 0;\\n    }\\n\\n    /**\\n     * @dev Returns the current size of the list\\n     * @return current size of the list\\n     */\\n    function getSize(Data storage self) public view returns (uint256) {\\n        return self.size;\\n    }\\n\\n    /**\\n     * @dev Returns the maximum size of the list\\n     */\\n    function getMaxSize(Data storage self) public view returns (uint256) {\\n        return self.maxSize;\\n    }\\n\\n    /**\\n     * @dev Returns the key of a node in the list\\n     * @param _id Node's id\\n     * @return key for node with '_id'\\n     */\\n    function getKey(Data storage self, address _id) public view returns (uint256) {\\n        return self.nodes[_id].key;\\n    }\\n\\n    /**\\n     * @dev Returns the first node in the list (node with the largest key)\\n     * @return address for the head of the list\\n     */\\n    function getFirst(Data storage self) public view returns (address) {\\n        return self.head;\\n    }\\n\\n    /**\\n     * @dev Returns the last node in the list (node with the smallest key)\\n     * @return address for the tail of the list\\n     */\\n    function getLast(Data storage self) public view returns (address) {\\n        return self.tail;\\n    }\\n\\n    /**\\n     * @dev Returns the next node (with a smaller key) in the list for a given node\\n     * @param _id Node's id\\n     * @return address for the node following node in list with '_id'\\n     */\\n    function getNext(Data storage self, address _id) public view returns (address) {\\n        return self.nodes[_id].nextId;\\n    }\\n\\n    /**\\n     * @dev Returns the previous node (with a larger key) in the list for a given node\\n     * @param _id Node's id\\n     * address for the node before node in list with '_id'\\n     */\\n    function getPrev(Data storage self, address _id) public view returns (address) {\\n        return self.nodes[_id].prevId;\\n    }\\n\\n    /**\\n     * @dev Check if a pair of nodes is a valid insertion point for a new node with the given key\\n     * @param _key Node's key\\n     * @param _prevId Id of previous node for the insert position\\n     * @param _nextId Id of next node for the insert position\\n     * @return if the insert position is valid\\n     */\\n    function validInsertPosition(\\n        Data storage self,\\n        uint256 _key,\\n        address _prevId,\\n        address _nextId\\n    ) public view returns (bool) {\\n        if (_prevId == address(0) && _nextId == address(0)) {\\n            // `(null, null)` is a valid insert position if the list is empty\\n            return isEmpty(self);\\n        } else if (_prevId == address(0)) {\\n            // `(null, _nextId)` is a valid insert position if `_nextId` is the head of the list\\n            return self.head == _nextId && _key >= self.nodes[_nextId].key;\\n        } else if (_nextId == address(0)) {\\n            // `(_prevId, null)` is a valid insert position if `_prevId` is the tail of the list\\n            return self.tail == _prevId && _key <= self.nodes[_prevId].key;\\n        } else {\\n            // `(_prevId, _nextId)` is a valid insert position if they are adjacent nodes and `_key` falls between the two nodes' keys\\n            return\\n                self.nodes[_prevId].nextId == _nextId &&\\n                self.nodes[_prevId].key >= _key &&\\n                _key >= self.nodes[_nextId].key;\\n        }\\n    }\\n\\n    /**\\n     * @dev Descend the list (larger keys to smaller keys) to find a valid insert position\\n     * @param _key Node's key\\n     * @param _startId Id of node to start ascending the list from\\n     */\\n    function descendList(\\n        Data storage self,\\n        uint256 _key,\\n        address _startId\\n    ) private view returns (address, address) {\\n        // If `_startId` is the head, check if the insert position is before the head\\n        if (self.head == _startId && _key >= self.nodes[_startId].key) {\\n            return (address(0), _startId);\\n        }\\n\\n        address prevId = _startId;\\n        address nextId = self.nodes[prevId].nextId;\\n\\n        // Descend the list until we reach the end or until we find a valid insert position\\n        while (prevId != address(0) && !validInsertPosition(self, _key, prevId, nextId)) {\\n            prevId = self.nodes[prevId].nextId;\\n            nextId = self.nodes[prevId].nextId;\\n        }\\n\\n        return (prevId, nextId);\\n    }\\n\\n    /**\\n     * @dev Ascend the list (smaller keys to larger keys) to find a valid insert position\\n     * @param _key Node's key\\n     * @param _startId Id of node to start descending the list from\\n     */\\n    function ascendList(\\n        Data storage self,\\n        uint256 _key,\\n        address _startId\\n    ) private view returns (address, address) {\\n        // If `_startId` is the tail, check if the insert position is after the tail\\n        if (self.tail == _startId && _key <= self.nodes[_startId].key) {\\n            return (_startId, address(0));\\n        }\\n\\n        address nextId = _startId;\\n        address prevId = self.nodes[nextId].prevId;\\n\\n        // Ascend the list until we reach the end or until we find a valid insertion point\\n        while (nextId != address(0) && !validInsertPosition(self, _key, prevId, nextId)) {\\n            nextId = self.nodes[nextId].prevId;\\n            prevId = self.nodes[nextId].prevId;\\n        }\\n\\n        return (prevId, nextId);\\n    }\\n\\n    /**\\n     * @dev Find the insert position for a new node with the given key\\n     * @param _key Node's key\\n     * @param _prevId Id of previous node for the insert position\\n     * @param _nextId Id of next node for the insert position\\n     */\\n    function findInsertPosition(\\n        Data storage self,\\n        uint256 _key,\\n        address _prevId,\\n        address _nextId\\n    ) private view returns (address, address) {\\n        address prevId = _prevId;\\n        address nextId = _nextId;\\n\\n        if (prevId != address(0)) {\\n            if (!contains(self, prevId) || _key > self.nodes[prevId].key) {\\n                // `prevId` does not exist anymore or now has a smaller key than the given key\\n                prevId = address(0);\\n            }\\n        }\\n\\n        if (nextId != address(0)) {\\n            if (!contains(self, nextId) || _key < self.nodes[nextId].key) {\\n                // `nextId` does not exist anymore or now has a larger key than the given key\\n                nextId = address(0);\\n            }\\n        }\\n\\n        if (prevId == address(0) && nextId == address(0)) {\\n            // No hint - descend list starting from head\\n            return descendList(self, _key, self.head);\\n        } else if (prevId == address(0)) {\\n            // No `prevId` for hint - ascend list starting from `nextId`\\n            return ascendList(self, _key, nextId);\\n        } else if (nextId == address(0)) {\\n            // No `nextId` for hint - descend list starting from `prevId`\\n            return descendList(self, _key, prevId);\\n        } else {\\n            // Descend list starting from `prevId`\\n            return descendList(self, _key, prevId);\\n        }\\n    }\\n}\\n\",\"keccak256\":\"0x5c679fb0b542620e38d9cf96501de68b98a057bbb8f2f2022d55a7b63d921f8d\"},\"contracts/rounds/IRoundsManager.sol\":{\"content\":\"pragma solidity ^0.5.11;\\n\\n/**\\n * @title RoundsManager interface\\n */\\ncontract IRoundsManager {\\n    // Events\\n    event NewRound(uint256 indexed round, bytes32 blockHash);\\n\\n    // Deprecated events\\n    // These event signatures can be used to construct the appropriate topic hashes to filter for past logs corresponding\\n    // to these deprecated events.\\n    // event NewRound(uint256 round)\\n\\n    // External functions\\n    function initializeRound() external;\\n\\n    function lipUpgradeRound(uint256 _lip) external view returns (uint256);\\n\\n    // Public functions\\n    function blockNum() public view returns (uint256);\\n\\n    function blockHash(uint256 _block) public view returns (bytes32);\\n\\n    function blockHashForRound(uint256 _round) public view returns (bytes32);\\n\\n    function currentRound() public view returns (uint256);\\n\\n    function currentRoundStartBlock() public view returns (uint256);\\n\\n    function currentRoundInitialized() public view returns (bool);\\n\\n    function currentRoundLocked() public view returns (bool);\\n}\\n\",\"keccak256\":\"0xad97406674e411fa618c6e48f99ab01b0301c7212622426ea6ef72510c0d8e3d\"},\"contracts/snapshots/IMerkleSnapshot.sol\":{\"content\":\"pragma solidity ^0.5.11;\\n\\ncontract IMerkleSnapshot {\\n    function verify(\\n        bytes32 _id,\\n        bytes32[] calldata _proof,\\n        bytes32 _leaf\\n    ) external view returns (bool);\\n}\\n\",\"keccak256\":\"0xc3a57bda398518b5301f27f813167cc6ad97e78e781469722eaaf2ec5ca7ae92\"},\"contracts/token/ILivepeerToken.sol\":{\"content\":\"pragma solidity ^0.5.11;\\n\\nimport \\\"openzeppelin-solidity/contracts/token/ERC20/ERC20.sol\\\";\\nimport \\\"../zeppelin/Ownable.sol\\\";\\n\\ncontract ILivepeerToken is ERC20, Ownable {\\n    function mint(address _to, uint256 _amount) public returns (bool);\\n\\n    function burn(address _from, uint256 _amount) public;\\n}\\n\",\"keccak256\":\"0x97b4652e1f3e40019232e97b92e321298e309d360a778f757801a8fd1a2c5fea\"},\"contracts/token/IMinter.sol\":{\"content\":\"pragma solidity ^0.5.11;\\n\\nimport \\\"../IController.sol\\\";\\n\\n/**\\n * @title Minter interface\\n */\\ncontract IMinter {\\n    // Events\\n    event SetCurrentRewardTokens(uint256 currentMintableTokens, uint256 currentInflation);\\n\\n    // External functions\\n    function createReward(uint256 _fracNum, uint256 _fracDenom) external returns (uint256);\\n\\n    function trustedTransferTokens(address _to, uint256 _amount) external;\\n\\n    function trustedBurnTokens(uint256 _amount) external;\\n\\n    function trustedWithdrawETH(address payable _to, uint256 _amount) external;\\n\\n    function depositETH() external payable returns (bool);\\n\\n    function setCurrentRewardTokens() external;\\n\\n    function currentMintableTokens() external view returns (uint256);\\n\\n    function currentMintedTokens() external view returns (uint256);\\n\\n    // Public functions\\n    function getController() public view returns (IController);\\n}\\n\",\"keccak256\":\"0x1f1029f1ec069a31694e991f4e7f5c555b9e2eec14946242893bf4f25c4d0467\"},\"contracts/zeppelin/Ownable.sol\":{\"content\":\"pragma solidity ^0.5.11;\\n\\n/**\\n * @title Ownable\\n * @dev The Ownable contract has an owner address, and provides basic authorization control\\n * functions, this simplifies the implementation of \\\"user permissions\\\".\\n */\\ncontract Ownable {\\n    address public owner;\\n\\n    event OwnershipTransferred(address indexed previousOwner, address indexed newOwner);\\n\\n    /**\\n     * @dev The Ownable constructor sets the original `owner` of the contract to the sender\\n     * account.\\n     */\\n    constructor() public {\\n        owner = msg.sender;\\n    }\\n\\n    /**\\n     * @dev Throws if called by any account other than the owner.\\n     */\\n    modifier onlyOwner() {\\n        require(msg.sender == owner);\\n        _;\\n    }\\n\\n    /**\\n     * @dev Allows the current owner to transfer control of the contract to a newOwner.\\n     * @param newOwner The address to transfer ownership to.\\n     */\\n    function transferOwnership(address newOwner) public onlyOwner {\\n        require(newOwner != address(0));\\n        emit OwnershipTransferred(owner, newOwner);\\n        owner = newOwner;\\n    }\\n}\\n\",\"keccak256\":\"0x3689b5ecbe68f236d23bdc4e045274debc31e00bad129042d25185a4f7ee7675\"},\"contracts/zeppelin/Pausable.sol\":{\"content\":\"pragma solidity ^0.5.11;\\n\\nimport \\\"./Ownable.sol\\\";\\n\\n/**\\n * @title Pausable\\n * @dev Base contract which allows children to implement an emergency stop mechanism.\\n */\\ncontract Pausable is Ownable {\\n    event Pause();\\n    event Unpause();\\n\\n    bool public paused = false;\\n\\n    /**\\n     * @dev Modifier to make a function callable only when the contract is not paused.\\n     */\\n    modifier whenNotPaused() {\\n        require(!paused);\\n        _;\\n    }\\n\\n    /**\\n     * @dev Modifier to make a function callable only when the contract is paused.\\n     */\\n    modifier whenPaused() {\\n        require(paused);\\n        _;\\n    }\\n\\n    /**\\n     * @dev called by the owner to pause, triggers stopped state\\n     */\\n    function pause() public onlyOwner whenNotPaused {\\n        paused = true;\\n        emit Pause();\\n    }\\n\\n    /**\\n     * @dev called by the owner to unpause, returns to normal state\\n     */\\n    function unpause() public onlyOwner whenPaused {\\n        paused = false;\\n        emit Unpause();\\n    }\\n}\\n\",\"keccak256\":\"0x434f6e0c3521748aa10467786650458449a844a13eaa9dc9c60452a02b77034e\"},\"openzeppelin-solidity/contracts/math/SafeMath.sol\":{\"content\":\"pragma solidity ^0.5.0;\\n\\n/**\\n * @dev Wrappers over Solidity's arithmetic operations with added overflow\\n * checks.\\n *\\n * Arithmetic operations in Solidity wrap on overflow. This can easily result\\n * in bugs, because programmers usually assume that an overflow raises an\\n * error, which is the standard behavior in high level programming languages.\\n * `SafeMath` restores this intuition by reverting the transaction when an\\n * operation overflows.\\n *\\n * Using this library instead of the unchecked operations eliminates an entire\\n * class of bugs, so it's recommended to use it always.\\n */\\nlibrary SafeMath {\\n    /**\\n     * @dev Returns the addition of two unsigned integers, reverting on\\n     * overflow.\\n     *\\n     * Counterpart to Solidity's `+` operator.\\n     *\\n     * Requirements:\\n     * - Addition cannot overflow.\\n     */\\n    function add(uint256 a, uint256 b) internal pure returns (uint256) {\\n        uint256 c = a + b;\\n        require(c >= a, \\\"SafeMath: addition overflow\\\");\\n\\n        return c;\\n    }\\n\\n    /**\\n     * @dev Returns the subtraction of two unsigned integers, reverting on\\n     * overflow (when the result is negative).\\n     *\\n     * Counterpart to Solidity's `-` operator.\\n     *\\n     * Requirements:\\n     * - Subtraction cannot overflow.\\n     */\\n    function sub(uint256 a, uint256 b) internal pure returns (uint256) {\\n        require(b <= a, \\\"SafeMath: subtraction overflow\\\");\\n        uint256 c = a - b;\\n\\n        return c;\\n    }\\n\\n    /**\\n     * @dev Returns the multiplication of two unsigned integers, reverting on\\n     * overflow.\\n     *\\n     * Counterpart to Solidity's `*` operator.\\n     *\\n     * Requirements:\\n     * - Multiplication cannot overflow.\\n     */\\n    function mul(uint256 a, uint256 b) internal pure returns (uint256) {\\n        // Gas optimization: this is cheaper than requiring 'a' not being zero, but the\\n        // benefit is lost if 'b' is also tested.\\n        // See: https://github.com/OpenZeppelin/openzeppelin-solidity/pull/522\\n        if (a == 0) {\\n            return 0;\\n        }\\n\\n        uint256 c = a * b;\\n        require(c / a == b, \\\"SafeMath: multiplication overflow\\\");\\n\\n        return c;\\n    }\\n\\n    /**\\n     * @dev Returns the integer division of two unsigned integers. Reverts on\\n     * division by zero. The result is rounded towards zero.\\n     *\\n     * Counterpart to Solidity's `/` operator. Note: this function uses a\\n     * `revert` opcode (which leaves remaining gas untouched) while Solidity\\n     * uses an invalid opcode to revert (consuming all remaining gas).\\n     *\\n     * Requirements:\\n     * - The divisor cannot be zero.\\n     */\\n    function div(uint256 a, uint256 b) internal pure returns (uint256) {\\n        // Solidity only automatically asserts when dividing by 0\\n        require(b > 0, \\\"SafeMath: division by zero\\\");\\n        uint256 c = a / b;\\n        // assert(a == b * c + a % b); // There is no case in which this doesn't hold\\n\\n        return c;\\n    }\\n\\n    /**\\n     * @dev Returns the remainder of dividing two unsigned integers. (unsigned integer modulo),\\n     * Reverts when dividing by zero.\\n     *\\n     * Counterpart to Solidity's `%` operator. This function uses a `revert`\\n     * opcode (which leaves remaining gas untouched) while Solidity uses an\\n     * invalid opcode to revert (consuming all remaining gas).\\n     *\\n     * Requirements:\\n     * - The divisor cannot be zero.\\n     */\\n    function mod(uint256 a, uint256 b) internal pure returns (uint256) {\\n        require(b != 0, \\\"SafeMath: modulo by zero\\\");\\n        return a % b;\\n    }\\n}\\n\",\"keccak256\":\"0x4ccf2d7b51873db1ccfd54ca2adae5eac3b184f9699911ed4490438419f1c690\"},\"openzeppelin-solidity/contracts/token/ERC20/ERC20.sol\":{\"content\":\"pragma solidity ^0.5.0;\\n\\nimport \\\"./IERC20.sol\\\";\\nimport \\\"../../math/SafeMath.sol\\\";\\n\\n/**\\n * @dev Implementation of the `IERC20` interface.\\n *\\n * This implementation is agnostic to the way tokens are created. This means\\n * that a supply mechanism has to be added in a derived contract using `_mint`.\\n * For a generic mechanism see `ERC20Mintable`.\\n *\\n * *For a detailed writeup see our guide [How to implement supply\\n * mechanisms](https://forum.zeppelin.solutions/t/how-to-implement-erc20-supply-mechanisms/226).*\\n *\\n * We have followed general OpenZeppelin guidelines: functions revert instead\\n * of returning `false` on failure. This behavior is nonetheless conventional\\n * and does not conflict with the expectations of ERC20 applications.\\n *\\n * Additionally, an `Approval` event is emitted on calls to `transferFrom`.\\n * This allows applications to reconstruct the allowance for all accounts just\\n * by listening to said events. Other implementations of the EIP may not emit\\n * these events, as it isn't required by the specification.\\n *\\n * Finally, the non-standard `decreaseAllowance` and `increaseAllowance`\\n * functions have been added to mitigate the well-known issues around setting\\n * allowances. See `IERC20.approve`.\\n */\\ncontract ERC20 is IERC20 {\\n    using SafeMath for uint256;\\n\\n    mapping (address => uint256) private _balances;\\n\\n    mapping (address => mapping (address => uint256)) private _allowances;\\n\\n    uint256 private _totalSupply;\\n\\n    /**\\n     * @dev See `IERC20.totalSupply`.\\n     */\\n    function totalSupply() public view returns (uint256) {\\n        return _totalSupply;\\n    }\\n\\n    /**\\n     * @dev See `IERC20.balanceOf`.\\n     */\\n    function balanceOf(address account) public view returns (uint256) {\\n        return _balances[account];\\n    }\\n\\n    /**\\n     * @dev See `IERC20.transfer`.\\n     *\\n     * Requirements:\\n     *\\n     * - `recipient` cannot be the zero address.\\n     * - the caller must have a balance of at least `amount`.\\n     */\\n    function transfer(address recipient, uint256 amount) public returns (bool) {\\n        _transfer(msg.sender, recipient, amount);\\n        return true;\\n    }\\n\\n    /**\\n     * @dev See `IERC20.allowance`.\\n     */\\n    function allowance(address owner, address spender) public view returns (uint256) {\\n        return _allowances[owner][spender];\\n    }\\n\\n    /**\\n     * @dev See `IERC20.approve`.\\n     *\\n     * Requirements:\\n     *\\n     * - `spender` cannot be the zero address.\\n     */\\n    function approve(address spender, uint256 value) public returns (bool) {\\n        _approve(msg.sender, spender, value);\\n        return true;\\n    }\\n\\n    /**\\n     * @dev See `IERC20.transferFrom`.\\n     *\\n     * Emits an `Approval` event indicating the updated allowance. This is not\\n     * required by the EIP. See the note at the beginning of `ERC20`;\\n     *\\n     * Requirements:\\n     * - `sender` and `recipient` cannot be the zero address.\\n     * - `sender` must have a balance of at least `value`.\\n     * - the caller must have allowance for `sender`'s tokens of at least\\n     * `amount`.\\n     */\\n    function transferFrom(address sender, address recipient, uint256 amount) public returns (bool) {\\n        _transfer(sender, recipient, amount);\\n        _approve(sender, msg.sender, _allowances[sender][msg.sender].sub(amount));\\n        return true;\\n    }\\n\\n    /**\\n     * @dev Atomically increases the allowance granted to `spender` by the caller.\\n     *\\n     * This is an alternative to `approve` that can be used as a mitigation for\\n     * problems described in `IERC20.approve`.\\n     *\\n     * Emits an `Approval` event indicating the updated allowance.\\n     *\\n     * Requirements:\\n     *\\n     * - `spender` cannot be the zero address.\\n     */\\n    function increaseAllowance(address spender, uint256 addedValue) public returns (bool) {\\n        _approve(msg.sender, spender, _allowances[msg.sender][spender].add(addedValue));\\n        return true;\\n    }\\n\\n    /**\\n     * @dev Atomically decreases the allowance granted to `spender` by the caller.\\n     *\\n     * This is an alternative to `approve` that can be used as a mitigation for\\n     * problems described in `IERC20.approve`.\\n     *\\n     * Emits an `Approval` event indicating the updated allowance.\\n     *\\n     * Requirements:\\n     *\\n     * - `spender` cannot be the zero address.\\n     * - `spender` must have allowance for the caller of at least\\n     * `subtractedValue`.\\n     */\\n    function decreaseAllowance(address spender, uint256 subtractedValue) public returns (bool) {\\n        _approve(msg.sender, spender, _allowances[msg.sender][spender].sub(subtractedValue));\\n        return true;\\n    }\\n\\n    /**\\n     * @dev Moves tokens `amount` from `sender` to `recipient`.\\n     *\\n     * This is internal function is equivalent to `transfer`, and can be used to\\n     * e.g. implement automatic token fees, slashing mechanisms, etc.\\n     *\\n     * Emits a `Transfer` event.\\n     *\\n     * Requirements:\\n     *\\n     * - `sender` cannot be the zero address.\\n     * - `recipient` cannot be the zero address.\\n     * - `sender` must have a balance of at least `amount`.\\n     */\\n    function _transfer(address sender, address recipient, uint256 amount) internal {\\n        require(sender != address(0), \\\"ERC20: transfer from the zero address\\\");\\n        require(recipient != address(0), \\\"ERC20: transfer to the zero address\\\");\\n\\n        _balances[sender] = _balances[sender].sub(amount);\\n        _balances[recipient] = _balances[recipient].add(amount);\\n        emit Transfer(sender, recipient, amount);\\n    }\\n\\n    /** @dev Creates `amount` tokens and assigns them to `account`, increasing\\n     * the total supply.\\n     *\\n     * Emits a `Transfer` event with `from` set to the zero address.\\n     *\\n     * Requirements\\n     *\\n     * - `to` cannot be the zero address.\\n     */\\n    function _mint(address account, uint256 amount) internal {\\n        require(account != address(0), \\\"ERC20: mint to the zero address\\\");\\n\\n        _totalSupply = _totalSupply.add(amount);\\n        _balances[account] = _balances[account].add(amount);\\n        emit Transfer(address(0), account, amount);\\n    }\\n\\n     /**\\n     * @dev Destoys `amount` tokens from `account`, reducing the\\n     * total supply.\\n     *\\n     * Emits a `Transfer` event with `to` set to the zero address.\\n     *\\n     * Requirements\\n     *\\n     * - `account` cannot be the zero address.\\n     * - `account` must have at least `amount` tokens.\\n     */\\n    function _burn(address account, uint256 value) internal {\\n        require(account != address(0), \\\"ERC20: burn from the zero address\\\");\\n\\n        _totalSupply = _totalSupply.sub(value);\\n        _balances[account] = _balances[account].sub(value);\\n        emit Transfer(account, address(0), value);\\n    }\\n\\n    /**\\n     * @dev Sets `amount` as the allowance of `spender` over the `owner`s tokens.\\n     *\\n     * This is internal function is equivalent to `approve`, and can be used to\\n     * e.g. set automatic allowances for certain subsystems, etc.\\n     *\\n     * Emits an `Approval` event.\\n     *\\n     * Requirements:\\n     *\\n     * - `owner` cannot be the zero address.\\n     * - `spender` cannot be the zero address.\\n     */\\n    function _approve(address owner, address spender, uint256 value) internal {\\n        require(owner != address(0), \\\"ERC20: approve from the zero address\\\");\\n        require(spender != address(0), \\\"ERC20: approve to the zero address\\\");\\n\\n        _allowances[owner][spender] = value;\\n        emit Approval(owner, spender, value);\\n    }\\n\\n    /**\\n     * @dev Destoys `amount` tokens from `account`.`amount` is then deducted\\n     * from the caller's allowance.\\n     *\\n     * See `_burn` and `_approve`.\\n     */\\n    function _burnFrom(address account, uint256 amount) internal {\\n        _burn(account, amount);\\n        _approve(account, msg.sender, _allowances[account][msg.sender].sub(amount));\\n    }\\n}\\n\",\"keccak256\":\"0x852793a3c2f86d336a683b30d688ec3dcfc57451af5a2bf5975cda3b7191a901\"},\"openzeppelin-solidity/contracts/token/ERC20/IERC20.sol\":{\"content\":\"pragma solidity ^0.5.0;\\n\\n/**\\n * @dev Interface of the ERC20 standard as defined in the EIP. Does not include\\n * the optional functions; to access them see `ERC20Detailed`.\\n */\\ninterface IERC20 {\\n    /**\\n     * @dev Returns the amount of tokens in existence.\\n     */\\n    function totalSupply() external view returns (uint256);\\n\\n    /**\\n     * @dev Returns the amount of tokens owned by `account`.\\n     */\\n    function balanceOf(address account) external view returns (uint256);\\n\\n    /**\\n     * @dev Moves `amount` tokens from the caller's account to `recipient`.\\n     *\\n     * Returns a boolean value indicating whether the operation succeeded.\\n     *\\n     * Emits a `Transfer` event.\\n     */\\n    function transfer(address recipient, uint256 amount) external returns (bool);\\n\\n    /**\\n     * @dev Returns the remaining number of tokens that `spender` will be\\n     * allowed to spend on behalf of `owner` through `transferFrom`. This is\\n     * zero by default.\\n     *\\n     * This value changes when `approve` or `transferFrom` are called.\\n     */\\n    function allowance(address owner, address spender) external view returns (uint256);\\n\\n    /**\\n     * @dev Sets `amount` as the allowance of `spender` over the caller's tokens.\\n     *\\n     * Returns a boolean value indicating whether the operation succeeded.\\n     *\\n     * > Beware that changing an allowance with this method brings the risk\\n     * that someone may use both the old and the new allowance by unfortunate\\n     * transaction ordering. One possible solution to mitigate this race\\n     * condition is to first reduce the spender's allowance to 0 and set the\\n     * desired value afterwards:\\n     * https://github.com/ethereum/EIPs/issues/20#issuecomment-263524729\\n     *\\n     * Emits an `Approval` event.\\n     */\\n    function approve(address spender, uint256 amount) external returns (bool);\\n\\n    /**\\n     * @dev Moves `amount` tokens from `sender` to `recipient` using the\\n     * allowance mechanism. `amount` is then deducted from the caller's\\n     * allowance.\\n     *\\n     * Returns a boolean value indicating whether the operation succeeded.\\n     *\\n     * Emits a `Transfer` event.\\n     */\\n    function transferFrom(address sender, address recipient, uint256 amount) external returns (bool);\\n\\n    /**\\n     * @dev Emitted when `value` tokens are moved from one account (`from`) to\\n     * another (`to`).\\n     *\\n     * Note that `value` may be zero.\\n     */\\n    event Transfer(address indexed from, address indexed to, uint256 value);\\n\\n    /**\\n     * @dev Emitted when the allowance of a `spender` for an `owner` is set by\\n     * a call to `approve`. `value` is the new allowance.\\n     */\\n    event Approval(address indexed owner, address indexed spender, uint256 value);\\n}\\n\",\"keccak256\":\"0x90e8c2521653bbb1768b05889c5760031e688d9cd361f167489b89215e201b95\"}},\"version\":1}",
  "bytecode": "0x608060405234801561001057600080fd5b50604051620049f1380380620049f18339818101604052602081101561003557600080fd5b5051600080546001600160a01b039092166001600160a01b031990921691909117905561498980620000686000396000f3fe608060405234801561001057600080fd5b506004361061027f5760003560e01c80635c50c3561161015c57806392eefe9b116100ce578063b78d27dc11610087578063b78d27dc14610946578063eaffb3f914610972578063ee4e804a1461098f578063f10d1de1146109e3578063f595f1cc14610a0a578063f77c479114610a365761027f565b806392eefe9b146108085780639500ed9b1461082e5780639d0b2c7a146108625780639ef9df941461088e578063a64ad595146108b4578063ad3b1b471461091a5761027f565b80636cf6d675116101205780636cf6d6751461073b578063713f2216146107605780637fc4606f14610768578063818710561461079c57806388a6c749146107ca5780638b2f1652146107d25761027f565b80635c50c3561461062c5780635dce994814610634578063673a456b146106aa57806368ba170c146106c75780636bd9add4146106ed5761027f565b806327de9e32116101f5578063412f83b6116101b9578063412f83b6146105a45780634196ee75146105e957806343d3461a146105f1578063465501d31461061457806351720b411461061c5780635a2a75a9146106245761027f565b806327de9e32146104d55780632a4e0d55146104f25780633550aa101461050c5780633a080e93146105465780633aeb512c146105725761027f565b8063228cb73311610247578063228cb733146103be57806322bf9d7c146103c6578063235c96031461040257806324454fc41461044457806324b1babf1461049b57806325d5971f146104b85761027f565b80630584a37314610284578063062e98b8146102c2578063088023741461030e5780630fd02fc1146103485780631544fc6714610374575b600080fd5b6102c06004803603608081101561029a57600080fd5b506001600160a01b03813581169160208101359160408201358116916060013516610a3e565b005b6102c0600480360360c08110156102d857600080fd5b506001600160a01b03813581169160208101359160408201358116916060810135821691608082013581169160a0013516610b82565b6103346004803603602081101561032457600080fd5b50356001600160a01b0316610cda565b604080519115158252519081900360200190f35b6103346004803603604081101561035e57600080fd5b506001600160a01b038135169060200135610d83565b61039a6004803603602081101561038a57600080fd5b50356001600160a01b0316610db6565b604051808260028111156103aa57fe5b60ff16815260200191505060405180910390f35b6102c0610e69565b6102c0600480360360808110156103dc57600080fd5b506001600160a01b03813581169160208101359091169060408101359060600135610e76565b6104286004803603602081101561041857600080fd5b50356001600160a01b031661125e565b604080516001600160a01b039092168252519081900360200190f35b6104706004803603604081101561045a57600080fd5b506001600160a01b0381351690602001356112f5565b6040805195865260208601949094528484019290925260608401526080830152519081900360a00190f35b6102c0600480360360208110156104b157600080fd5b503561133b565b6102c0600480360360208110156104ce57600080fd5b5035611356565b6102c0600480360360208110156104eb57600080fd5b5035611577565b6104fa611583565b60408051918252519081900360200190f35b6102c06004803603608081101561052257600080fd5b508035906020810135906001600160a01b0360408201358116916060013516611608565b6102c06004803603604081101561055c57600080fd5b506001600160a01b0381351690602001356119a5565b6102c06004803603606081101561058857600080fd5b506001600160a01b0381351690602081013590604001356119b6565b6105d0600480360360408110156105ba57600080fd5b506001600160a01b038135169060200135611cf6565b6040805192835260208301919091528051918290030190f35b6104fa611d2a565b6102c06004803603604081101561060757600080fd5b5080359060200135611d30565b6104fa611d3d565b6104fa611d43565b6104fa611d49565b6104fa611d9d565b61065a6004803603602081101561064a57600080fd5b50356001600160a01b0316611da3565b604080519a8b5260208b0199909952898901979097526060890195909552608088019390935260a087019190915260c086015260e085015261010084015261012083015251908190036101400190f35b6102c0600480360360208110156106c057600080fd5b5035611dfd565b610334600480360360208110156106dd57600080fd5b50356001600160a01b0316611ed1565b6102c0600480360360c081101561070357600080fd5b508035906001600160a01b03602082013581169160408101358216916060820135811691608081013582169160a09091013516611f09565b610743611f20565b6040805167ffffffffffffffff9092168252519081900360200190f35b6102c0611f30565b6102c06004803603606081101561077e57600080fd5b508035906001600160a01b0360208201358116916040013516611f40565b6102c0600480360360408110156107b257600080fd5b506001600160a01b0381358116916020013516611fca565b61042861221f565b6107f8600480360360208110156107e857600080fd5b50356001600160a01b0316612273565b604051808260018111156103aa57fe5b6102c06004803603602081101561081e57600080fd5b50356001600160a01b0316612293565b6102c06004803603606081101561084457600080fd5b508035906001600160a01b03602082013581169160400135166122ef565b6104fa6004803603604081101561087857600080fd5b506001600160a01b03813516906020013561260c565b6104fa600480360360208110156108a457600080fd5b50356001600160a01b0316612693565b6108da600480360360208110156108ca57600080fd5b50356001600160a01b03166126b2565b6040805197885260208801969096526001600160a01b03909416868601526060860192909252608085015260a084015260c0830152519081900360e00190f35b6102c06004803603604081101561093057600080fd5b506001600160a01b0381351690602001356126ff565b6102c06004803603604081101561095c57600080fd5b50803590602001356001600160a01b03166128bb565b6102c06004803603602081101561098857600080fd5b50356128cb565b6102c0600480360360e08110156109a557600080fd5b508035906001600160a01b03602082013581169160408101358216916060820135811691608081013582169160a082013581169160c00135166128d7565b6102c0600480360360208110156109f957600080fd5b503567ffffffffffffffff16612c77565b6104fa60048036036040811015610a2057600080fd5b506001600160a01b038135169060200135612cf2565b610428612d79565b610a46612d88565b610a4e612e46565b610a56612f03565b6002610a6133610db6565b6002811115610a6c57fe5b14610abe576040805162461bcd60e51b815260206004820152601760248201527f63616c6c6572206d75737420626520756e626f6e646564000000000000000000604482015290519081900360640190fd5b610b3b6001610acb612f9a565b6001600160a01b0316638a19c8bc6040518163ffffffff1660e01b815260040160206040518083038186803b158015610b0357600080fd5b505afa158015610b17573d6000803e3d6000fd5b505050506040513d6020811015610b2d57600080fd5b50519063ffffffff61301716565b3360008181526003602052604090206004810192909255600290910180546001600160a01b0319166001600160a01b038716179055610b7c90848484613071565b50505050565b610b8a612d88565b610b92612e46565b610b9a612f03565b610ba58585856122ef565b336000908152600360205260408082206001600160a01b0389168352908220600682015491929091610bde90600163ffffffff61318b16565b905060008360070160008381526020019081526020016000206001015490508360070160008381526020019081526020016000206000808201600090556001820160009055505060008360060154905060405180604001604052808b8152602001838152508460070160008381526020019081526020016000206000820151816000015560208201518160010155905050610c876001856006015461301790919063ffffffff16565b5060028401546001600160a01b0316610cc15760028086015490850180546001600160a01b0319166001600160a01b039092169190911790555b610ccd8b828989613071565b5050505050505050505050565b6001600160a01b038116600090815260046020526040812081610cfb612f9a565b6001600160a01b0316638a19c8bc6040518163ffffffff1660e01b815260040160206040518083038186803b158015610d3357600080fd5b505afa158015610d47573d6000803e3d6000fd5b505050506040513d6020811015610d5d57600080fd5b505160058301549091508110801590610d795750816006015481105b925050505b919050565b6001600160a01b038216600090815260036020908152604080832084845260070190915290206001015415155b92915050565b6001600160a01b03811660009081526003602052604081208054610dde576002915050610d7e565b610de6612f9a565b6001600160a01b0316638a19c8bc6040518163ffffffff1660e01b815260040160206040518083038186803b158015610e1e57600080fd5b505afa158015610e32573d6000803e3d6000fd5b505050506040513d6020811015610e4857600080fd5b505160048201541115610e5f576000915050610d7e565b6001915050610d7e565b610e74600080611fca565b565b610e7e612d88565b610e866131e8565b6001600160a01b0384166000908152600360205260409020805415611208576001600160a01b038516600090815260036020526040812054610ec890856132d3565b6040805163b0138c4760e01b8152600760048201526001600160a01b03891660248201529051919250738b2cd2D3363ED88701AFe2b31a30f6F6E4AA2C839163b0138c4791604480820192602092909190829003018186803b158015610f2d57600080fd5b505af4158015610f41573d6000803e3d6000fd5b505050506040513d6020811015610f5757600080fd5b505115610f6757610f67866132f8565b8154610f79908263ffffffff61318b16565b82556001610f8687610db6565b6002811115610f9157fe5b1415610fea5760028201546001600160a01b031660009081526003602081905260409091200154610fc8908263ffffffff61318b16565b60028301546001600160a01b0316600090815260036020819052604090912001555b806001600160a01b0386161561114f57600061100683866132d3565b90506110106133fb565b6001600160a01b031663e7a49c2b88836040518363ffffffff1660e01b815260040180836001600160a01b03166001600160a01b0316815260200182815260200192505050600060405180830381600087803b15801561106f57600080fd5b505af1158015611083573d6000803e3d6000fd5b5050505061108f6133fb565b6001600160a01b031663c7ee98c26110ad848463ffffffff61318b16565b6040518263ffffffff1660e01b815260040180828152602001915050600060405180830381600087803b1580156110e357600080fd5b505af11580156110f7573d6000803e3d6000fd5b5050604080516001600160a01b038b81168252602082018890528183018690529151918c1693507ff4b71fed8e2c9a8c67c388bc6d35ad20b9368a24eed6d565459f2b277b6c0c22925081900360600190a250611201565b6111576133fb565b6001600160a01b031663c7ee98c2826040518263ffffffff1660e01b815260040180828152602001915050600060405180830381600087803b15801561119c57600080fd5b505af11580156111b0573d6000803e3d6000fd5b5050604080516000808252602082018790528183015290516001600160a01b038b1693507ff4b71fed8e2c9a8c67c388bc6d35ad20b9368a24eed6d565459f2b277b6c0c2292509081900360600190a25b5050611257565b604080516001600160a01b038681168252600060208301819052828401529151918716917ff4b71fed8e2c9a8c67c388bc6d35ad20b9368a24eed6d565459f2b277b6c0c229181900360600190a25b5050505050565b6040805163e189dedb60e01b8152600760048201526001600160a01b03831660248201529051600091738b2cd2D3363ED88701AFe2b31a30f6F6E4AA2C839163e189dedb91604480820192602092909190829003018186803b1580156112c357600080fd5b505af41580156112d7573d6000803e3d6000fd5b505050506040513d60208110156112ed57600080fd5b505192915050565b6001600160a01b03909116600090815260046020818152604080842094845260039485019091529091208054600182015460028301549483015492909301549094929392565b611343612d88565b61134b612e46565b611353612f03565b50565b61135e612d88565b611366612e46565b3360008181526003602090815260408083208584526007810190925290912090916113919084610d83565b6113de576040805162461bcd60e51b81526020600482015260196024820152781a5b9d985b1a59081d5b989bdb991a5b99c81b1bd8dac81251603a1b604482015290519081900360640190fd5b6113e6612f9a565b6001600160a01b0316638a19c8bc6040518163ffffffff1660e01b815260040160206040518083038186803b15801561141e57600080fd5b505afa158015611432573d6000803e3d6000fd5b505050506040513d602081101561144857600080fd5b50516001820154111561148c5760405162461bcd60e51b815260040180806020018281038252603b815260200180614883603b913960400191505060405180910390fd5b805460018083015460008681526007860160205260408120818155909201919091556114b66133fb565b6001600160a01b031663e7a49c2b33846040518363ffffffff1660e01b815260040180836001600160a01b03166001600160a01b0316815260200182815260200192505050600060405180830381600087803b15801561151557600080fd5b505af1158015611529573d6000803e3d6000fd5b5050604080518881526020810186905280820185905290513393507f1340f1a8f3d456a649e1a12071dfa15655e3d09252131d0f980c3b405cc8dd2e92509081900360600190a25050505050565b611353816000806122ef565b60006007738b2cd2D3363ED88701AFe2b31a30f6F6E4AA2C8363b32ece5890916040518263ffffffff1660e01b81526004018082815260200191505060206040518083038186803b1580156115d757600080fd5b505af41580156115eb573d6000803e3d6000fd5b505050506040513d602081101561160157600080fd5b5051905090565b611610612d88565b611618612e46565b611620612f9a565b6001600160a01b0316636841f2536040518163ffffffff1660e01b815260040160206040518083038186803b15801561165857600080fd5b505afa15801561166c573d6000803e3d6000fd5b505050506040513d602081101561168257600080fd5b5051156116c05760405162461bcd60e51b815260040180806020018281038252603781526020018061491e6037913960400191505060405180910390fd5b6116c98461345d565b61171a576040805162461bcd60e51b815260206004820152601c60248201527f696e76616c6964207265776172644375742070657263656e7461676500000000604482015290519081900360640190fd5b6117238361345d565b611774576040805162461bcd60e51b815260206004820152601b60248201527f696e76616c69642066656553686172652070657263656e746167650000000000604482015290519081900360640190fd5b61177d33611ed1565b6117ce576040805162461bcd60e51b815260206004820152601d60248201527f7472616e73636f646572206d7573742062652072656769737465726564000000604482015290519081900360640190fd5b336000908152600460205260408120906117e6612f9a565b6001600160a01b0316638a19c8bc6040518163ffffffff1660e01b815260040160206040518083038186803b15801561181e57600080fd5b505afa158015611832573d6000803e3d6000fd5b505050506040513d602081101561184857600080fd5b5051905061185533610cda565b15806118615750815481145b61189c5760405162461bcd60e51b815260040180806020018281038252604f815260200180614791604f913960600191505060405180910390fd5b60018201869055600282018590556040805163b0138c4760e01b8152600760048201523360248201529051738b2cd2D3363ED88701AFe2b31a30f6F6E4AA2C839163b0138c47916044808301926020929190829003018186803b15801561190257600080fd5b505af4158015611916573d6000803e3d6000fd5b505050506040513d602081101561192c57600080fd5b5051611963573360008181526003602081905260409091200154611963919061195c84600163ffffffff61301716565b8787613466565b6040805187815260208101879052815133927f7346854431dbb3eb8e373c604abf89e90f4865b8447e1e2834d7b3e4677bf544928290030190a2505050505050565b6119b28282600080610a3e565b5050565b6119be612d88565b6119c66137b6565b6119cf83611ed1565b611a20576040805162461bcd60e51b815260206004820152601d60248201527f7472616e73636f646572206d7573742062652072656769737465726564000000604482015290519081900360640190fd5b6000611a2a612f9a565b6001600160a01b0316638a19c8bc6040518163ffffffff1660e01b815260040160206040518083038186803b158015611a6257600080fd5b505afa158015611a76573d6000803e3d6000fd5b505050506040513d6020811015611a8c57600080fd5b50516001600160a01b03851660009081526004602090815260408083208054600782015486865260038301909452919093209394509192611acb61473d565b611ae585611ae088600163ffffffff61318b16565b6138a5565b905083861115611b425760018501546002860154611b0a91849163ffffffff61392016565b600485015486811015611b39576000818152600387016020526040902054611b3990849063ffffffff61393016565b85600801549350505b81546060820151158015611b5557508685145b15611c6e576000611b646133fb565b90506000611c1c611c13836001600160a01b0316632de22cdb6040518163ffffffff1660e01b815260040160206040518083038186803b158015611ba757600080fd5b505afa158015611bbb573d6000803e3d6000fd5b505050506040513d6020811015611bd157600080fd5b505160408051634d73184d60e11b815290516001600160a01b03871691639ae6309a916004808301926020929190829003018186803b158015610b0357600080fd5b84600554613934565b90506000611c2e8287600101546132d3565b90506000611c42838363ffffffff61318b16565b6003880154909150611c649086611c5f848263ffffffff61301716565b613934565b6060870152505050505b6000611c7e8a85600201546132d3565b90506000611c928b8363ffffffff61318b16565b90506000611ca1838886613934565b9050611cca82611cbe838c6009015461301790919063ffffffff16565b9063ffffffff61301716565b60098a0155611ce086868563ffffffff61396816565b50505050600a9094019490945550505050505050565b6001600160a01b03919091166000908152600360209081526040808320938352600790930190522080546001909101549091565b60055481565b6119b28282600080611608565b60065481565b60015481565b60006007738b2cd2D3363ED88701AFe2b31a30f6F6E4AA2C8363735bc2ca90916040518263ffffffff1660e01b81526004018082815260200191505060206040518083038186803b1580156115d757600080fd5b60055490565b6001600160a01b031660009081526004602081905260409091208054600182015460028301549383015460058401546006850154600786015460088701546009880154600a90980154969995989794969395929491939092565b611e056139f9565b6040805163a176adaf60e01b815260076004820152602481018390529051738b2cd2D3363ED88701AFe2b31a30f6F6E4AA2C839163a176adaf916044808301926000929190829003018186803b158015611e5e57600080fd5b505af4158015611e72573d6000803e3d6000fd5b5050604080516020808252601490820152736e756d4163746976655472616e73636f6465727360601b8183015290517f9f5033568d78ae30f29f01e944f97b2216493bd19d1b46d429673acff3dcd6749350908190036060019150a150565b6001600160a01b0380821660008181526003602052604081206002810154919390929116148015611f025750805415155b9392505050565b611f18863387878787876128d7565b505050505050565b60025467ffffffffffffffff1681565b611f38613ace565b600654600555565b611f48612d88565b611f50612e46565b611f58612f03565b6002611f6333610db6565b6002811115611f6e57fe5b1415611fb9576040805162461bcd60e51b815260206004820152601560248201527418d85b1b195c881b5d5cdd08189948189bdb991959605a1b604482015290519081900360640190fd5b611fc533848484613071565b505050565b611fd2612d88565b611fda612e46565b6000611fe4612f9a565b6001600160a01b0316638a19c8bc6040518163ffffffff1660e01b815260040160206040518083038186803b15801561201c57600080fd5b505afa158015612030573d6000803e3d6000fd5b505050506040513d602081101561204657600080fd5b5051905061205333610cda565b61208e5760405162461bcd60e51b81526004018080602001828103825260238152602001806148fb6023913960400191505060405180910390fd5b336000908152600460205260409020548114156120dc5760405162461bcd60e51b81526004018080602001828103825260368152602001806148046036913960400191505060405180910390fd5b336000908152600460209081526040808320848452600381019092529091206001820154600283015461211691839163ffffffff61392016565b60048201548381101561214557600081815260038401602052604090205461214590839063ffffffff61393016565b600061214f6133fb565b6001600160a01b0316637dbedad584600001546005546040518363ffffffff1660e01b81526004018083815260200182815260200192505050602060405180830381600087803b1580156121a257600080fd5b505af11580156121b6573d6000803e3d6000fd5b505050506040513d60208110156121cc57600080fd5b505190506121dd3382878a8a613bbe565b84845560408051828152905133917f619caafabdd75649b302ba8419e48cccf64f37f1983ac4727cfb38b57703ffc9919081900360200190a250505050505050565b60006007738b2cd2D3363ED88701AFe2b31a30f6F6E4AA2C83632ebb2fed90916040518263ffffffff1660e01b81526004018082815260200191505060206040518083038186803b1580156115d757600080fd5b600061227e82611ed1565b1561228b57506001610d7e565b506000919050565b61229b613c85565b600080546001600160a01b0383166001600160a01b0319909116811790915560408051918252517f4ff638452bbf33c012645d18ae6f05515ff5f2d1dfb0cece8cbf018c60903f709181900360200190a150565b6122f7612d88565b6122ff612e46565b612307612f03565b600161231233610db6565b600281111561231d57fe5b14612367576040805162461bcd60e51b815260206004820152601560248201527418d85b1b195c881b5d5cdd08189948189bdb991959605a1b604482015290519081900360640190fd5b336000908152600360205260409020836123b25760405162461bcd60e51b815260040180806020018281038252602481526020018061476d6024913960400191505060405180910390fd5b80548411156123f25760405162461bcd60e51b81526004018080602001828103825260248152602001806147e06024913960400191505060405180910390fd5b60028101546001600160a01b0316600061240a612f9a565b6001600160a01b0316638a19c8bc6040518163ffffffff1660e01b815260040160206040518083038186803b15801561244257600080fd5b505afa158015612456573d6000803e3d6000fd5b505050506040513d602081101561246c57600080fd5b505160025490915060009061249290839067ffffffffffffffff1663ffffffff61301716565b60068501546040805180820182528a81526020808201858152600085815260078b01909252929020905181559051600191820155919250906124db90829063ffffffff61301716565b600686015584546124f2908963ffffffff61318b16565b8086556125a9576002850180546001600160a01b031916905560006004808701919091556040805163b0138c4760e01b815260079281019290925233602483015251738b2cd2D3363ED88701AFe2b31a30f6F6E4AA2C839163b0138c47916044808301926020929190829003018186803b15801561256f57600080fd5b505af4158015612583573d6000803e3d6000fd5b505050506040513d602081101561259957600080fd5b5051156125a9576125a9336132f8565b6125b584898989613ce4565b60408051828152602081018a9052808201849052905133916001600160a01b038716917f2d5d98d189bee5496a08db2a5948cb7e5e786f09d17d0c3f228eb41776c24a069181900360600190a35050505050505050565b600080612617612f9a565b6001600160a01b0316638a19c8bc6040518163ffffffff1660e01b815260040160206040518083038186803b15801561264f57600080fd5b505afa158015612663573d6000803e3d6000fd5b505050506040513d602081101561267957600080fd5b5051905060006126898583613f8b565b5095945050505050565b6001600160a01b03166000908152600360208190526040909120015490565b6001600160a01b0390811660009081526003602081905260409091208054600182015460028301549383015460048401546005850154600690950154939792969590951694909390929091565b612707612d88565b61270f612e46565b612717612f03565b6001600160a01b038216612766576040805162461bcd60e51b81526020600482015260116024820152701a5b9d985b1a59081c9958da5c1a595b9d607a1b604482015290519081900360640190fd5b33600090815260036020526040902060010154818110156127ce576040805162461bcd60e51b815260206004820152601d60248201527f696e73756666696369656e74206665657320746f207769746864726177000000604482015290519081900360640190fd5b6127de818363ffffffff61318b16565b336000908152600360205260409020600101556127f96133fb565b6001600160a01b03166320283da984846040518363ffffffff1660e01b815260040180836001600160a01b03166001600160a01b0316815260200182815260200192505050600060405180830381600087803b15801561285857600080fd5b505af115801561286c573d6000803e3d6000fd5b5050604080516001600160a01b03871681526020810186905281513394507f4f1b51dd7a2fcb861aa2670f668be66835c4ee12b4bbbf037e4d0018f39819e493509081900390910190a2505050565b6119b28282600080600080611f09565b61135381600080611f40565b6128df612d88565b6128e7612e46565b6128ef612f03565b6001600160a01b038616600090815260036020526040812090612910612f9a565b6001600160a01b0316638a19c8bc6040518163ffffffff1660e01b815260040160206040518083038186803b15801561294857600080fd5b505afa15801561295c573d6000803e3d6000fd5b505050506040513d602081101561297257600080fd5b50516002808401549192508a916001600160a01b0316906129928b610db6565b600281111561299d57fe5b14156129be576129b483600163ffffffff61301716565b6004850155612a6d565b6001600160a01b038116158015906129e85750886001600160a01b0316816001600160a01b031614155b15612a6d576129f68a611ed1565b15612a325760405162461bcd60e51b815260040180806020018281038252603d8152602001806148be603d913960400191505060405180910390fd5b612a4383600163ffffffff61301716565b60048501558354612a5b90839063ffffffff61301716565b9150612a6d8185600001548a8a613ce4565b6001600160a01b03891660009081526004602090815260408083208684526003808201909352922090810154612ab557612aab828360000154614062565b6060015160038201555b6004810154612ad657612acc8283600a0154614062565b6080015160048201555b505060008211612b175760405162461bcd60e51b815260040180806020018281038252602881526020018061485b6028913960400191505060405180910390fd5b6002840180546001600160a01b0319166001600160a01b038b161790558354612b40908c613017565b8455612b4e8983888861409b565b8a15612c0957612b5c61433a565b6001600160a01b03166323b872dd33612b736133fb565b8e6040518463ffffffff1660e01b815260040180846001600160a01b03166001600160a01b03168152602001836001600160a01b03166001600160a01b031681526020018281526020019350505050602060405180830381600087803b158015612bdc57600080fd5b505af1158015612bf0573d6000803e3d6000fd5b505050506040513d6020811015612c0657600080fd5b50505b896001600160a01b0316816001600160a01b03168a6001600160a01b03167fe5917769f276ddca9f2ee7c6b0b33e1d1e1b61008010ce622c632dd20d168a238e8860000154604051808381526020018281526020019250505060405180910390a45050505050505050505050565b612c7f6139f9565b6002805467ffffffffffffffff191667ffffffffffffffff8316179055604080516020808252600f908201526e1d5b989bdb991a5b99d4195c9a5bd9608a1b8183015290517f9f5033568d78ae30f29f01e944f97b2216493bd19d1b46d429673acff3dcd674916060908290030190a150565b600080612cfd612f9a565b6001600160a01b0316638a19c8bc6040518163ffffffff1660e01b815260040160206040518083038186803b158015612d3557600080fd5b505afa158015612d49573d6000803e3d6000fd5b505050506040513d6020811015612d5f57600080fd5b505190506000612d6f8583613f8b565b9695505050505050565b6000546001600160a01b031681565b6000809054906101000a90046001600160a01b03166001600160a01b0316635c975abb6040518163ffffffff1660e01b815260040160206040518083038186803b158015612dd557600080fd5b505afa158015612de9573d6000803e3d6000fd5b505050506040513d6020811015612dff57600080fd5b505115610e74576040805162461bcd60e51b815260206004820152601060248201526f1cde5cdd195b481a5cc81c185d5cd95960821b604482015290519081900360640190fd5b612e4e612f9a565b6001600160a01b031663219bc76c6040518163ffffffff1660e01b815260040160206040518083038186803b158015612e8657600080fd5b505afa158015612e9a573d6000803e3d6000fd5b505050506040513d6020811015612eb057600080fd5b5051610e74576040805162461bcd60e51b815260206004820181905260248201527f63757272656e7420726f756e64206973206e6f7420696e697469616c697a6564604482015290519081900360640190fd5b6000612f0d612f9a565b6001600160a01b0316638a19c8bc6040518163ffffffff1660e01b815260040160206040518083038186803b158015612f4557600080fd5b505afa158015612f59573d6000803e3d6000fd5b505050506040513d6020811015612f6f57600080fd5b505133600090815260036020526040902060050154909150818110156119b2576119b23383836143a3565b60008054604080516c2937bab73239a6b0b730b3b2b960991b8152815190819003600d018120631c2d8fb360e31b8252600482015290516001600160a01b039092169163e16c7d9891602480820192602092909190829003018186803b15801561300357600080fd5b505afa1580156115eb573d6000803e3d6000fd5b600082820183811015611f02576040805162461bcd60e51b815260206004820152601b60248201527f536166654d6174683a206164646974696f6e206f766572666c6f770000000000604482015290519081900360640190fd5b6001600160a01b0384166000908152600360209081526040808320868452600781019092529091206130a38686610d83565b6130f0576040805162461bcd60e51b81526020600482015260196024820152781a5b9d985b1a59081d5b989bdb991a5b99c81b1bd8dac81251603a1b604482015290519081900360640190fd5b80548254613104908263ffffffff61301716565b835560008681526007840160205260408120818155600101556002830154613137906001600160a01b031682878761409b565b6002830154604080518881526020810184905281516001600160a01b03808c169416927f9f5b64cc71e1e26ff178caaa7877a04d8ce66fde989251870e80e6fbee690c17928290030190a350505050505050565b6000828211156131e2576040805162461bcd60e51b815260206004820152601e60248201527f536166654d6174683a207375627472616374696f6e206f766572666c6f770000604482015290519081900360640190fd5b50900390565b60005460408051672b32b934b334b2b960c11b81528151908190036008018120631c2d8fb360e31b8252600482015290516001600160a01b039092169163e16c7d9891602480820192602092909190829003018186803b15801561324b57600080fd5b505afa15801561325f573d6000803e3d6000fd5b505050506040513d602081101561327557600080fd5b50516001600160a01b03163314610e74576040805162461bcd60e51b815260206004820152601760248201527f63616c6c6572206d757374206265205665726966696572000000000000000000604482015290519081900360640190fd5b6000611f02620f42406132ec858563ffffffff61454116565b9063ffffffff61459a16565b60408051635d35e00760e01b8152600760048201526001600160a01b03831660248201529051738b2cd2D3363ED88701AFe2b31a30f6F6E4AA2C8391635d35e007916044808301926000929190829003018186803b15801561335957600080fd5b505af415801561336d573d6000803e3d6000fd5b5050505061338c61337d82612693565b6006549063ffffffff61318b16565b600655600061339e6001610acb612f9a565b6001600160a01b0383166000818152600460209081526040918290206006018490558151848152915193945091927ffee3e693fc72d0a0a673805f3e606c551f4c677b9072444b90dd2d0406bc995c929181900390910190a25050565b60008054604080516526b4b73a32b960d11b81528151908190036006018120631c2d8fb360e31b8252600482015290516001600160a01b039092169163e16c7d9891602480820192602092909190829003018186803b15801561300357600080fd5b620f4240101590565b600654604080516304aa129960e41b8152600760048201529051738b2cd2D3363ED88701AFe2b31a30f6F6E4AA2C8391634aa12990916024808301926020929190829003018186803b1580156134bb57600080fd5b505af41580156134cf573d6000803e3d6000fd5b505050506040513d60208110156134e557600080fd5b5051156136755760006007738b2cd2D3363ED88701AFe2b31a30f6F6E4AA2C836372e40b2690916040518263ffffffff1660e01b81526004018082815260200191505060206040518083038186803b15801561354057600080fd5b505af4158015613554573d6000803e3d6000fd5b505050506040513d602081101561356a57600080fd5b50519050600061357982612693565b905080871161358a57505050611257565b60408051635d35e00760e01b8152600760048201526001600160a01b03841660248201529051738b2cd2D3363ED88701AFe2b31a30f6F6E4AA2C8391635d35e007916044808301926000929190829003018186803b1580156135eb57600080fd5b505af41580156135ff573d6000803e3d6000fd5b5050506001600160a01b038316600090815260046020526040902060060187905550613631838263ffffffff61318b16565b6040805188815290519194506001600160a01b038416917ffee3e693fc72d0a0a673805f3e606c551f4c677b9072444b90dd2d0406bc995c9181900360200190a250505b604080516327dd54d360e11b8152600760048201526001600160a01b038089166024830152604482018890528086166064830152841660848201529051738b2cd2D3363ED88701AFe2b31a30f6F6E4AA2C8391634fbaa9a69160a4808301926000929190829003018186803b1580156136ed57600080fd5b505af4158015613701573d6000803e3d6000fd5b50505050613718858261301790919063ffffffff16565b6001600160a01b03871660009081526004602081815260408084209283018990556005830189905560001960068401558884526003830190915290912091925090613769908763ffffffff61393016565b60068290556040805186815290516001600160a01b038916917f65d72d782835d64c3287844a829608d5abdc7e864cc9affe96d910ab3db665e9919081900360200190a250505050505050565b600054604080516b2a34b1b5b2ba213937b5b2b960a11b8152815190819003600c018120631c2d8fb360e31b8252600482015290516001600160a01b039092169163e16c7d9891602480820192602092909190829003018186803b15801561381d57600080fd5b505afa158015613831573d6000803e3d6000fd5b505050506040513d602081101561384757600080fd5b50516001600160a01b03163314610e74576040805162461bcd60e51b815260206004820152601b60248201527f63616c6c6572206d757374206265205469636b657442726f6b65720000000000604482015290519081900360640190fd5b6138ad61473d565b6138b78383614062565b83546060820151919250901580156138ce57508281105b156138e8576138dd8482614062565b606090810151908301525b600a84015460808301511580156138fe57508381105b156139185761390d8582614062565b608090810151908401525b505092915050565b6001830191909155600290910155565b9055565b60006139606b033b2e3c9fd0803ce80000006132ec6139538686614604565b879063ffffffff61454116565b949350505050565b6080820151606083015160009061398957613984600180614604565b61398f565b83606001515b90508460040154600014156139ca576139bd6139b082858860000154613934565b839063ffffffff61301716565b600486015550611fc59050565b6139ed6139dc82858860000154613934565b60048701549063ffffffff61301716565b60048601555050505050565b6000809054906101000a90046001600160a01b03166001600160a01b0316638da5cb5b6040518163ffffffff1660e01b815260040160206040518083038186803b158015613a4657600080fd5b505afa158015613a5a573d6000803e3d6000fd5b505050506040513d6020811015613a7057600080fd5b50516001600160a01b03163314610e74576040805162461bcd60e51b815260206004820152601f60248201527f63616c6c6572206d75737420626520436f6e74726f6c6c6572206f776e657200604482015290519081900360640190fd5b600054604080516c2937bab73239a6b0b730b3b2b960991b8152815190819003600d018120631c2d8fb360e31b8252600482015290516001600160a01b039092169163e16c7d9891602480820192602092909190829003018186803b158015613b3657600080fd5b505afa158015613b4a573d6000803e3d6000fd5b505050506040513d6020811015613b6057600080fd5b50516001600160a01b03163314610e74576040805162461bcd60e51b815260206004820152601c60248201527f63616c6c6572206d75737420626520526f756e64734d616e6167657200000000604482015290519081900360640190fd5b6001600160a01b038516600090815260046020908152604080832086845260038101909252909120613bee61473d565b613bfc838460000154614062565b9050826008015483600701819055506000613c1b8884600101546132d3565b90506000613c2f898363ffffffff61318b16565b90506000613c468287600701548760000154613934565b9050613c6383611cbe83896008015461301790919063ffffffff16565b6008870155613c7985858463ffffffff61462616565b610ccd8b8b8a8a61409b565b6000546001600160a01b03163314610e74576040805162461bcd60e51b815260206004820152601960248201527f63616c6c6572206d75737420626520436f6e74726f6c6c657200000000000000604482015290519081900360640190fd5b6040805163b0138c4760e01b8152600760048201526001600160a01b03861660248201529051738b2cd2D3363ED88701AFe2b31a30f6F6E4AA2C839163b0138c47916044808301926020929190829003018186803b158015613d4557600080fd5b505af4158015613d59573d6000803e3d6000fd5b505050506040513d6020811015613d6f57600080fd5b505115613f38576000613d8185612693565b90506000613d95828663ffffffff61318b16565b90506000613da1612f9a565b6001600160a01b0316638a19c8bc6040518163ffffffff1660e01b815260040160206040518083038186803b158015613dd957600080fd5b505afa158015613ded573d6000803e3d6000fd5b505050506040513d6020811015613e0357600080fd5b505190506000613e1a82600163ffffffff61301716565b60408051631c11bf7f60e11b8152600760048201526001600160a01b03808c16602483015260448201879052808a166064830152881660848201529051919250738b2cd2D3363ED88701AFe2b31a30f6F6E4AA2C83916338237efe9160a480820192600092909190829003018186803b158015613e9657600080fd5b505af4158015613eaa573d6000803e3d6000fd5b5050600654613ec2925090508863ffffffff61318b16565b6006556001600160a01b038816600090815260046020819052604090912090810154831115613f0b5760008381526003820160205260409020613f0b908663ffffffff61393016565b6004810182905560008281526003820160205260409020613f32908563ffffffff61393016565b50505050505b6001600160a01b03841660009081526003602081905260409091200154613f65908463ffffffff61318b16565b6001600160a01b0390941660009081526003602081905260409091200193909355505050565b6001600160a01b03808316600090815260036020908152604080832060028101549094168352600490915281206001808401548454600586015490959194919392613fdc919063ffffffff61301716565b60028401549091506001600160a01b03908116908816811487831161401e576140188461401085600163ffffffff61318b16565b8a8a8a61467a565b90975095505b801561405657600884015461403a90889063ffffffff61301716565b965061405384600901548761301790919063ffffffff16565b95505b50505050509250929050565b61406a61473d565b6000828152600393840160208181526040832095860154606085015293909152909152600490910154608082015290565b6140a484611ed1565b1561430d5760006140b485612693565b905060006140c8828663ffffffff61301716565b905060006140d4612f9a565b6001600160a01b0316638a19c8bc6040518163ffffffff1660e01b815260040160206040518083038186803b15801561410c57600080fd5b505afa158015614120573d6000803e3d6000fd5b505050506040513d602081101561413657600080fd5b50519050600061414d82600163ffffffff61301716565b6040805163b0138c4760e01b8152600760048201526001600160a01b038b1660248201529051919250738b2cd2D3363ED88701AFe2b31a30f6F6E4AA2C839163b0138c4791604480820192602092909190829003018186803b1580156141b257600080fd5b505af41580156141c6573d6000803e3d6000fd5b505050506040513d60208110156141dc57600080fd5b5051156142fb5760408051631c11bf7f60e11b8152600760048201526001600160a01b03808b166024830152604482018690528089166064830152871660848201529051738b2cd2D3363ED88701AFe2b31a30f6F6E4AA2C83916338237efe9160a4808301926000929190829003018186803b15801561425b57600080fd5b505af415801561426f573d6000803e3d6000fd5b5050600654614287925090508863ffffffff61301716565b6006556001600160a01b0388166000908152600460208190526040909120908101548311156142d057600083815260038201602052604090206142d0908663ffffffff61393016565b600082815260038201602052604090206142f0908563ffffffff61393016565b600401819055614308565b6143088884838989613466565b505050505b6001600160a01b03841660009081526003602081905260409091200154613f65908463ffffffff61301716565b60008054604080516c2634bb32b832b2b92a37b5b2b760991b8152815190819003600d018120631c2d8fb360e31b8252600482015290516001600160a01b039092169163e16c7d9891602480820192602092909190829003018186803b15801561300357600080fd5b6001600160a01b0383166000908152600360205260408120906143cd83600163ffffffff61301716565b82546001840154600285015492935090916001600160a01b0316156144a7576143f68787613f8b565b60028601546001600160a01b031660009081526004602090815260408083208b84526003808201909352922090810154939550919350916144515781548881101561444f576144458382614062565b6060015160038301555b505b600481015461447d57600a8201548881101561447b576144718382614062565b6080015160048301555b505b60028601546001600160a01b038a8116911614156144a45760006009830181905560088301555b50505b600284015484546001600160a01b03808a169216907fd7eab0765b772ea6ea859d5633baf737502198012e930f257f90013d9b211094906144ef90869063ffffffff61318b16565b600188015461450590869063ffffffff61318b16565b604080519283526020830191909152818101889052606082018b9052519081900360800190a36005840195909555825550600101919091555050565b60008261455057506000610db0565b8282028284828161455d57fe5b0414611f025760405162461bcd60e51b815260040180806020018281038252602181526020018061483a6021913960400191505060405180910390fd5b60008082116145f0576040805162461bcd60e51b815260206004820152601a60248201527f536166654d6174683a206469766973696f6e206279207a65726f000000000000604482015290519081900360640190fd5b60008284816145fb57fe5b04949350505050565b6000611f02826132ec856b033b2e3c9fd0803ce800000063ffffffff61454116565b600082606001516000141561464557614640600180614604565b61464b565b82606001515b905061466c61465f82848760000154613934565b829063ffffffff61301716565b846003018190555050505050565b60008061468561473d565b61468f8888614062565b90508060600151600014156146af576146a9600180614604565b60608201525b6146b761473d565b6146c189886138a5565b90508060600151600014156146e1576146db600180614604565b60608201525b61471a61470d876147038560800151856080015161318b90919063ffffffff16565b8560600151613934565b869063ffffffff61301716565b925061472f8682606001518460600151613934565b935050509550959350505050565b6040518060a001604052806000815260200160008152602001600081526020016000815260200160008152509056fe756e626f6e6420616d6f756e74206d7573742062652067726561746572207468616e203063616c6c65722063616e277420626520616374697665206f72206d757374206861766520616c72656164792063616c6c65642072657761726420666f72207468652063757272656e7420726f756e64616d6f756e742069732067726561746572207468616e20626f6e64656420616d6f756e7463616c6c65722068617320616c72656164792063616c6c65642072657761726420666f72207468652063757272656e7420726f756e64536166654d6174683a206d756c7469706c69636174696f6e206f766572666c6f7764656c65676174696f6e20616d6f756e74206d7573742062652067726561746572207468616e2030776974686472617720726f756e64206d757374206265206265666f7265206f7220657175616c20746f207468652063757272656e7420726f756e6472656769737465726564207472616e73636f646572732063616e27742064656c656761746520746f7761726473206f746865722061646472657373657363616c6c6572206d75737420626520616e20616374697665207472616e73636f64657263616e277420757064617465207472616e73636f64657220706172616d732c2063757272656e7420726f756e64206973206c6f636b6564a265627a7a723158209f1c6f0a8c2b37ee97b60d069cd24e5746ceb03d21596cc6f20964b814173f2764736f6c634300050b0032",
  "deployedBytecode": "0x608060405234801561001057600080fd5b506004361061027f5760003560e01c80635c50c3561161015c57806392eefe9b116100ce578063b78d27dc11610087578063b78d27dc14610946578063eaffb3f914610972578063ee4e804a1461098f578063f10d1de1146109e3578063f595f1cc14610a0a578063f77c479114610a365761027f565b806392eefe9b146108085780639500ed9b1461082e5780639d0b2c7a146108625780639ef9df941461088e578063a64ad595146108b4578063ad3b1b471461091a5761027f565b80636cf6d675116101205780636cf6d6751461073b578063713f2216146107605780637fc4606f14610768578063818710561461079c57806388a6c749146107ca5780638b2f1652146107d25761027f565b80635c50c3561461062c5780635dce994814610634578063673a456b146106aa57806368ba170c146106c75780636bd9add4146106ed5761027f565b806327de9e32116101f5578063412f83b6116101b9578063412f83b6146105a45780634196ee75146105e957806343d3461a146105f1578063465501d31461061457806351720b411461061c5780635a2a75a9146106245761027f565b806327de9e32146104d55780632a4e0d55146104f25780633550aa101461050c5780633a080e93146105465780633aeb512c146105725761027f565b8063228cb73311610247578063228cb733146103be57806322bf9d7c146103c6578063235c96031461040257806324454fc41461044457806324b1babf1461049b57806325d5971f146104b85761027f565b80630584a37314610284578063062e98b8146102c2578063088023741461030e5780630fd02fc1146103485780631544fc6714610374575b600080fd5b6102c06004803603608081101561029a57600080fd5b506001600160a01b03813581169160208101359160408201358116916060013516610a3e565b005b6102c0600480360360c08110156102d857600080fd5b506001600160a01b03813581169160208101359160408201358116916060810135821691608082013581169160a0013516610b82565b6103346004803603602081101561032457600080fd5b50356001600160a01b0316610cda565b604080519115158252519081900360200190f35b6103346004803603604081101561035e57600080fd5b506001600160a01b038135169060200135610d83565b61039a6004803603602081101561038a57600080fd5b50356001600160a01b0316610db6565b604051808260028111156103aa57fe5b60ff16815260200191505060405180910390f35b6102c0610e69565b6102c0600480360360808110156103dc57600080fd5b506001600160a01b03813581169160208101359091169060408101359060600135610e76565b6104286004803603602081101561041857600080fd5b50356001600160a01b031661125e565b604080516001600160a01b039092168252519081900360200190f35b6104706004803603604081101561045a57600080fd5b506001600160a01b0381351690602001356112f5565b6040805195865260208601949094528484019290925260608401526080830152519081900360a00190f35b6102c0600480360360208110156104b157600080fd5b503561133b565b6102c0600480360360208110156104ce57600080fd5b5035611356565b6102c0600480360360208110156104eb57600080fd5b5035611577565b6104fa611583565b60408051918252519081900360200190f35b6102c06004803603608081101561052257600080fd5b508035906020810135906001600160a01b0360408201358116916060013516611608565b6102c06004803603604081101561055c57600080fd5b506001600160a01b0381351690602001356119a5565b6102c06004803603606081101561058857600080fd5b506001600160a01b0381351690602081013590604001356119b6565b6105d0600480360360408110156105ba57600080fd5b506001600160a01b038135169060200135611cf6565b6040805192835260208301919091528051918290030190f35b6104fa611d2a565b6102c06004803603604081101561060757600080fd5b5080359060200135611d30565b6104fa611d3d565b6104fa611d43565b6104fa611d49565b6104fa611d9d565b61065a6004803603602081101561064a57600080fd5b50356001600160a01b0316611da3565b604080519a8b5260208b0199909952898901979097526060890195909552608088019390935260a087019190915260c086015260e085015261010084015261012083015251908190036101400190f35b6102c0600480360360208110156106c057600080fd5b5035611dfd565b610334600480360360208110156106dd57600080fd5b50356001600160a01b0316611ed1565b6102c0600480360360c081101561070357600080fd5b508035906001600160a01b03602082013581169160408101358216916060820135811691608081013582169160a09091013516611f09565b610743611f20565b6040805167ffffffffffffffff9092168252519081900360200190f35b6102c0611f30565b6102c06004803603606081101561077e57600080fd5b508035906001600160a01b0360208201358116916040013516611f40565b6102c0600480360360408110156107b257600080fd5b506001600160a01b0381358116916020013516611fca565b61042861221f565b6107f8600480360360208110156107e857600080fd5b50356001600160a01b0316612273565b604051808260018111156103aa57fe5b6102c06004803603602081101561081e57600080fd5b50356001600160a01b0316612293565b6102c06004803603606081101561084457600080fd5b508035906001600160a01b03602082013581169160400135166122ef565b6104fa6004803603604081101561087857600080fd5b506001600160a01b03813516906020013561260c565b6104fa600480360360208110156108a457600080fd5b50356001600160a01b0316612693565b6108da600480360360208110156108ca57600080fd5b50356001600160a01b03166126b2565b6040805197885260208801969096526001600160a01b03909416868601526060860192909252608085015260a084015260c0830152519081900360e00190f35b6102c06004803603604081101561093057600080fd5b506001600160a01b0381351690602001356126ff565b6102c06004803603604081101561095c57600080fd5b50803590602001356001600160a01b03166128bb565b6102c06004803603602081101561098857600080fd5b50356128cb565b6102c0600480360360e08110156109a557600080fd5b508035906001600160a01b03602082013581169160408101358216916060820135811691608081013582169160a082013581169160c00135166128d7565b6102c0600480360360208110156109f957600080fd5b503567ffffffffffffffff16612c77565b6104fa60048036036040811015610a2057600080fd5b506001600160a01b038135169060200135612cf2565b610428612d79565b610a46612d88565b610a4e612e46565b610a56612f03565b6002610a6133610db6565b6002811115610a6c57fe5b14610abe576040805162461bcd60e51b815260206004820152601760248201527f63616c6c6572206d75737420626520756e626f6e646564000000000000000000604482015290519081900360640190fd5b610b3b6001610acb612f9a565b6001600160a01b0316638a19c8bc6040518163ffffffff1660e01b815260040160206040518083038186803b158015610b0357600080fd5b505afa158015610b17573d6000803e3d6000fd5b505050506040513d6020811015610b2d57600080fd5b50519063ffffffff61301716565b3360008181526003602052604090206004810192909255600290910180546001600160a01b0319166001600160a01b038716179055610b7c90848484613071565b50505050565b610b8a612d88565b610b92612e46565b610b9a612f03565b610ba58585856122ef565b336000908152600360205260408082206001600160a01b0389168352908220600682015491929091610bde90600163ffffffff61318b16565b905060008360070160008381526020019081526020016000206001015490508360070160008381526020019081526020016000206000808201600090556001820160009055505060008360060154905060405180604001604052808b8152602001838152508460070160008381526020019081526020016000206000820151816000015560208201518160010155905050610c876001856006015461301790919063ffffffff16565b5060028401546001600160a01b0316610cc15760028086015490850180546001600160a01b0319166001600160a01b039092169190911790555b610ccd8b828989613071565b5050505050505050505050565b6001600160a01b038116600090815260046020526040812081610cfb612f9a565b6001600160a01b0316638a19c8bc6040518163ffffffff1660e01b815260040160206040518083038186803b158015610d3357600080fd5b505afa158015610d47573d6000803e3d6000fd5b505050506040513d6020811015610d5d57600080fd5b505160058301549091508110801590610d795750816006015481105b925050505b919050565b6001600160a01b038216600090815260036020908152604080832084845260070190915290206001015415155b92915050565b6001600160a01b03811660009081526003602052604081208054610dde576002915050610d7e565b610de6612f9a565b6001600160a01b0316638a19c8bc6040518163ffffffff1660e01b815260040160206040518083038186803b158015610e1e57600080fd5b505afa158015610e32573d6000803e3d6000fd5b505050506040513d6020811015610e4857600080fd5b505160048201541115610e5f576000915050610d7e565b6001915050610d7e565b610e74600080611fca565b565b610e7e612d88565b610e866131e8565b6001600160a01b0384166000908152600360205260409020805415611208576001600160a01b038516600090815260036020526040812054610ec890856132d3565b6040805163b0138c4760e01b8152600760048201526001600160a01b0389166024820152905191925073__$d23c89be677d40ab24c636937040b6165f$__9163b0138c4791604480820192602092909190829003018186803b158015610f2d57600080fd5b505af4158015610f41573d6000803e3d6000fd5b505050506040513d6020811015610f5757600080fd5b505115610f6757610f67866132f8565b8154610f79908263ffffffff61318b16565b82556001610f8687610db6565b6002811115610f9157fe5b1415610fea5760028201546001600160a01b031660009081526003602081905260409091200154610fc8908263ffffffff61318b16565b60028301546001600160a01b0316600090815260036020819052604090912001555b806001600160a01b0386161561114f57600061100683866132d3565b90506110106133fb565b6001600160a01b031663e7a49c2b88836040518363ffffffff1660e01b815260040180836001600160a01b03166001600160a01b0316815260200182815260200192505050600060405180830381600087803b15801561106f57600080fd5b505af1158015611083573d6000803e3d6000fd5b5050505061108f6133fb565b6001600160a01b031663c7ee98c26110ad848463ffffffff61318b16565b6040518263ffffffff1660e01b815260040180828152602001915050600060405180830381600087803b1580156110e357600080fd5b505af11580156110f7573d6000803e3d6000fd5b5050604080516001600160a01b038b81168252602082018890528183018690529151918c1693507ff4b71fed8e2c9a8c67c388bc6d35ad20b9368a24eed6d565459f2b277b6c0c22925081900360600190a250611201565b6111576133fb565b6001600160a01b031663c7ee98c2826040518263ffffffff1660e01b815260040180828152602001915050600060405180830381600087803b15801561119c57600080fd5b505af11580156111b0573d6000803e3d6000fd5b5050604080516000808252602082018790528183015290516001600160a01b038b1693507ff4b71fed8e2c9a8c67c388bc6d35ad20b9368a24eed6d565459f2b277b6c0c2292509081900360600190a25b5050611257565b604080516001600160a01b038681168252600060208301819052828401529151918716917ff4b71fed8e2c9a8c67c388bc6d35ad20b9368a24eed6d565459f2b277b6c0c229181900360600190a25b5050505050565b6040805163e189dedb60e01b8152600760048201526001600160a01b0383166024820152905160009173__$d23c89be677d40ab24c636937040b6165f$__9163e189dedb91604480820192602092909190829003018186803b1580156112c357600080fd5b505af41580156112d7573d6000803e3d6000fd5b505050506040513d60208110156112ed57600080fd5b505192915050565b6001600160a01b03909116600090815260046020818152604080842094845260039485019091529091208054600182015460028301549483015492909301549094929392565b611343612d88565b61134b612e46565b611353612f03565b50565b61135e612d88565b611366612e46565b3360008181526003602090815260408083208584526007810190925290912090916113919084610d83565b6113de576040805162461bcd60e51b81526020600482015260196024820152781a5b9d985b1a59081d5b989bdb991a5b99c81b1bd8dac81251603a1b604482015290519081900360640190fd5b6113e6612f9a565b6001600160a01b0316638a19c8bc6040518163ffffffff1660e01b815260040160206040518083038186803b15801561141e57600080fd5b505afa158015611432573d6000803e3d6000fd5b505050506040513d602081101561144857600080fd5b50516001820154111561148c5760405162461bcd60e51b815260040180806020018281038252603b815260200180614883603b913960400191505060405180910390fd5b805460018083015460008681526007860160205260408120818155909201919091556114b66133fb565b6001600160a01b031663e7a49c2b33846040518363ffffffff1660e01b815260040180836001600160a01b03166001600160a01b0316815260200182815260200192505050600060405180830381600087803b15801561151557600080fd5b505af1158015611529573d6000803e3d6000fd5b5050604080518881526020810186905280820185905290513393507f1340f1a8f3d456a649e1a12071dfa15655e3d09252131d0f980c3b405cc8dd2e92509081900360600190a25050505050565b611353816000806122ef565b6000600773__$d23c89be677d40ab24c636937040b6165f$__63b32ece5890916040518263ffffffff1660e01b81526004018082815260200191505060206040518083038186803b1580156115d757600080fd5b505af41580156115eb573d6000803e3d6000fd5b505050506040513d602081101561160157600080fd5b5051905090565b611610612d88565b611618612e46565b611620612f9a565b6001600160a01b0316636841f2536040518163ffffffff1660e01b815260040160206040518083038186803b15801561165857600080fd5b505afa15801561166c573d6000803e3d6000fd5b505050506040513d602081101561168257600080fd5b5051156116c05760405162461bcd60e51b815260040180806020018281038252603781526020018061491e6037913960400191505060405180910390fd5b6116c98461345d565b61171a576040805162461bcd60e51b815260206004820152601c60248201527f696e76616c6964207265776172644375742070657263656e7461676500000000604482015290519081900360640190fd5b6117238361345d565b611774576040805162461bcd60e51b815260206004820152601b60248201527f696e76616c69642066656553686172652070657263656e746167650000000000604482015290519081900360640190fd5b61177d33611ed1565b6117ce576040805162461bcd60e51b815260206004820152601d60248201527f7472616e73636f646572206d7573742062652072656769737465726564000000604482015290519081900360640190fd5b336000908152600460205260408120906117e6612f9a565b6001600160a01b0316638a19c8bc6040518163ffffffff1660e01b815260040160206040518083038186803b15801561181e57600080fd5b505afa158015611832573d6000803e3d6000fd5b505050506040513d602081101561184857600080fd5b5051905061185533610cda565b15806118615750815481145b61189c5760405162461bcd60e51b815260040180806020018281038252604f815260200180614791604f913960600191505060405180910390fd5b60018201869055600282018590556040805163b0138c4760e01b815260076004820152336024820152905173__$d23c89be677d40ab24c636937040b6165f$__9163b0138c47916044808301926020929190829003018186803b15801561190257600080fd5b505af4158015611916573d6000803e3d6000fd5b505050506040513d602081101561192c57600080fd5b5051611963573360008181526003602081905260409091200154611963919061195c84600163ffffffff61301716565b8787613466565b6040805187815260208101879052815133927f7346854431dbb3eb8e373c604abf89e90f4865b8447e1e2834d7b3e4677bf544928290030190a2505050505050565b6119b28282600080610a3e565b5050565b6119be612d88565b6119c66137b6565b6119cf83611ed1565b611a20576040805162461bcd60e51b815260206004820152601d60248201527f7472616e73636f646572206d7573742062652072656769737465726564000000604482015290519081900360640190fd5b6000611a2a612f9a565b6001600160a01b0316638a19c8bc6040518163ffffffff1660e01b815260040160206040518083038186803b158015611a6257600080fd5b505afa158015611a76573d6000803e3d6000fd5b505050506040513d6020811015611a8c57600080fd5b50516001600160a01b03851660009081526004602090815260408083208054600782015486865260038301909452919093209394509192611acb61473d565b611ae585611ae088600163ffffffff61318b16565b6138a5565b905083861115611b425760018501546002860154611b0a91849163ffffffff61392016565b600485015486811015611b39576000818152600387016020526040902054611b3990849063ffffffff61393016565b85600801549350505b81546060820151158015611b5557508685145b15611c6e576000611b646133fb565b90506000611c1c611c13836001600160a01b0316632de22cdb6040518163ffffffff1660e01b815260040160206040518083038186803b158015611ba757600080fd5b505afa158015611bbb573d6000803e3d6000fd5b505050506040513d6020811015611bd157600080fd5b505160408051634d73184d60e11b815290516001600160a01b03871691639ae6309a916004808301926020929190829003018186803b158015610b0357600080fd5b84600554613934565b90506000611c2e8287600101546132d3565b90506000611c42838363ffffffff61318b16565b6003880154909150611c649086611c5f848263ffffffff61301716565b613934565b6060870152505050505b6000611c7e8a85600201546132d3565b90506000611c928b8363ffffffff61318b16565b90506000611ca1838886613934565b9050611cca82611cbe838c6009015461301790919063ffffffff16565b9063ffffffff61301716565b60098a0155611ce086868563ffffffff61396816565b50505050600a9094019490945550505050505050565b6001600160a01b03919091166000908152600360209081526040808320938352600790930190522080546001909101549091565b60055481565b6119b28282600080611608565b60065481565b60015481565b6000600773__$d23c89be677d40ab24c636937040b6165f$__63735bc2ca90916040518263ffffffff1660e01b81526004018082815260200191505060206040518083038186803b1580156115d757600080fd5b60055490565b6001600160a01b031660009081526004602081905260409091208054600182015460028301549383015460058401546006850154600786015460088701546009880154600a90980154969995989794969395929491939092565b611e056139f9565b6040805163a176adaf60e01b81526007600482015260248101839052905173__$d23c89be677d40ab24c636937040b6165f$__9163a176adaf916044808301926000929190829003018186803b158015611e5e57600080fd5b505af4158015611e72573d6000803e3d6000fd5b5050604080516020808252601490820152736e756d4163746976655472616e73636f6465727360601b8183015290517f9f5033568d78ae30f29f01e944f97b2216493bd19d1b46d429673acff3dcd6749350908190036060019150a150565b6001600160a01b0380821660008181526003602052604081206002810154919390929116148015611f025750805415155b9392505050565b611f18863387878787876128d7565b505050505050565b60025467ffffffffffffffff1681565b611f38613ace565b600654600555565b611f48612d88565b611f50612e46565b611f58612f03565b6002611f6333610db6565b6002811115611f6e57fe5b1415611fb9576040805162461bcd60e51b815260206004820152601560248201527418d85b1b195c881b5d5cdd08189948189bdb991959605a1b604482015290519081900360640190fd5b611fc533848484613071565b505050565b611fd2612d88565b611fda612e46565b6000611fe4612f9a565b6001600160a01b0316638a19c8bc6040518163ffffffff1660e01b815260040160206040518083038186803b15801561201c57600080fd5b505afa158015612030573d6000803e3d6000fd5b505050506040513d602081101561204657600080fd5b5051905061205333610cda565b61208e5760405162461bcd60e51b81526004018080602001828103825260238152602001806148fb6023913960400191505060405180910390fd5b336000908152600460205260409020548114156120dc5760405162461bcd60e51b81526004018080602001828103825260368152602001806148046036913960400191505060405180910390fd5b336000908152600460209081526040808320848452600381019092529091206001820154600283015461211691839163ffffffff61392016565b60048201548381101561214557600081815260038401602052604090205461214590839063ffffffff61393016565b600061214f6133fb565b6001600160a01b0316637dbedad584600001546005546040518363ffffffff1660e01b81526004018083815260200182815260200192505050602060405180830381600087803b1580156121a257600080fd5b505af11580156121b6573d6000803e3d6000fd5b505050506040513d60208110156121cc57600080fd5b505190506121dd3382878a8a613bbe565b84845560408051828152905133917f619caafabdd75649b302ba8419e48cccf64f37f1983ac4727cfb38b57703ffc9919081900360200190a250505050505050565b6000600773__$d23c89be677d40ab24c636937040b6165f$__632ebb2fed90916040518263ffffffff1660e01b81526004018082815260200191505060206040518083038186803b1580156115d757600080fd5b600061227e82611ed1565b1561228b57506001610d7e565b506000919050565b61229b613c85565b600080546001600160a01b0383166001600160a01b0319909116811790915560408051918252517f4ff638452bbf33c012645d18ae6f05515ff5f2d1dfb0cece8cbf018c60903f709181900360200190a150565b6122f7612d88565b6122ff612e46565b612307612f03565b600161231233610db6565b600281111561231d57fe5b14612367576040805162461bcd60e51b815260206004820152601560248201527418d85b1b195c881b5d5cdd08189948189bdb991959605a1b604482015290519081900360640190fd5b336000908152600360205260409020836123b25760405162461bcd60e51b815260040180806020018281038252602481526020018061476d6024913960400191505060405180910390fd5b80548411156123f25760405162461bcd60e51b81526004018080602001828103825260248152602001806147e06024913960400191505060405180910390fd5b60028101546001600160a01b0316600061240a612f9a565b6001600160a01b0316638a19c8bc6040518163ffffffff1660e01b815260040160206040518083038186803b15801561244257600080fd5b505afa158015612456573d6000803e3d6000fd5b505050506040513d602081101561246c57600080fd5b505160025490915060009061249290839067ffffffffffffffff1663ffffffff61301716565b60068501546040805180820182528a81526020808201858152600085815260078b01909252929020905181559051600191820155919250906124db90829063ffffffff61301716565b600686015584546124f2908963ffffffff61318b16565b8086556125a9576002850180546001600160a01b031916905560006004808701919091556040805163b0138c4760e01b81526007928101929092523360248301525173__$d23c89be677d40ab24c636937040b6165f$__9163b0138c47916044808301926020929190829003018186803b15801561256f57600080fd5b505af4158015612583573d6000803e3d6000fd5b505050506040513d602081101561259957600080fd5b5051156125a9576125a9336132f8565b6125b584898989613ce4565b60408051828152602081018a9052808201849052905133916001600160a01b038716917f2d5d98d189bee5496a08db2a5948cb7e5e786f09d17d0c3f228eb41776c24a069181900360600190a35050505050505050565b600080612617612f9a565b6001600160a01b0316638a19c8bc6040518163ffffffff1660e01b815260040160206040518083038186803b15801561264f57600080fd5b505afa158015612663573d6000803e3d6000fd5b505050506040513d602081101561267957600080fd5b5051905060006126898583613f8b565b5095945050505050565b6001600160a01b03166000908152600360208190526040909120015490565b6001600160a01b0390811660009081526003602081905260409091208054600182015460028301549383015460048401546005850154600690950154939792969590951694909390929091565b612707612d88565b61270f612e46565b612717612f03565b6001600160a01b038216612766576040805162461bcd60e51b81526020600482015260116024820152701a5b9d985b1a59081c9958da5c1a595b9d607a1b604482015290519081900360640190fd5b33600090815260036020526040902060010154818110156127ce576040805162461bcd60e51b815260206004820152601d60248201527f696e73756666696369656e74206665657320746f207769746864726177000000604482015290519081900360640190fd5b6127de818363ffffffff61318b16565b336000908152600360205260409020600101556127f96133fb565b6001600160a01b03166320283da984846040518363ffffffff1660e01b815260040180836001600160a01b03166001600160a01b0316815260200182815260200192505050600060405180830381600087803b15801561285857600080fd5b505af115801561286c573d6000803e3d6000fd5b5050604080516001600160a01b03871681526020810186905281513394507f4f1b51dd7a2fcb861aa2670f668be66835c4ee12b4bbbf037e4d0018f39819e493509081900390910190a2505050565b6119b28282600080600080611f09565b61135381600080611f40565b6128df612d88565b6128e7612e46565b6128ef612f03565b6001600160a01b038616600090815260036020526040812090612910612f9a565b6001600160a01b0316638a19c8bc6040518163ffffffff1660e01b815260040160206040518083038186803b15801561294857600080fd5b505afa15801561295c573d6000803e3d6000fd5b505050506040513d602081101561297257600080fd5b50516002808401549192508a916001600160a01b0316906129928b610db6565b600281111561299d57fe5b14156129be576129b483600163ffffffff61301716565b6004850155612a6d565b6001600160a01b038116158015906129e85750886001600160a01b0316816001600160a01b031614155b15612a6d576129f68a611ed1565b15612a325760405162461bcd60e51b815260040180806020018281038252603d8152602001806148be603d913960400191505060405180910390fd5b612a4383600163ffffffff61301716565b60048501558354612a5b90839063ffffffff61301716565b9150612a6d8185600001548a8a613ce4565b6001600160a01b03891660009081526004602090815260408083208684526003808201909352922090810154612ab557612aab828360000154614062565b6060015160038201555b6004810154612ad657612acc8283600a0154614062565b6080015160048201555b505060008211612b175760405162461bcd60e51b815260040180806020018281038252602881526020018061485b6028913960400191505060405180910390fd5b6002840180546001600160a01b0319166001600160a01b038b161790558354612b40908c613017565b8455612b4e8983888861409b565b8a15612c0957612b5c61433a565b6001600160a01b03166323b872dd33612b736133fb565b8e6040518463ffffffff1660e01b815260040180846001600160a01b03166001600160a01b03168152602001836001600160a01b03166001600160a01b031681526020018281526020019350505050602060405180830381600087803b158015612bdc57600080fd5b505af1158015612bf0573d6000803e3d6000fd5b505050506040513d6020811015612c0657600080fd5b50505b896001600160a01b0316816001600160a01b03168a6001600160a01b03167fe5917769f276ddca9f2ee7c6b0b33e1d1e1b61008010ce622c632dd20d168a238e8860000154604051808381526020018281526020019250505060405180910390a45050505050505050505050565b612c7f6139f9565b6002805467ffffffffffffffff191667ffffffffffffffff8316179055604080516020808252600f908201526e1d5b989bdb991a5b99d4195c9a5bd9608a1b8183015290517f9f5033568d78ae30f29f01e944f97b2216493bd19d1b46d429673acff3dcd674916060908290030190a150565b600080612cfd612f9a565b6001600160a01b0316638a19c8bc6040518163ffffffff1660e01b815260040160206040518083038186803b158015612d3557600080fd5b505afa158015612d49573d6000803e3d6000fd5b505050506040513d6020811015612d5f57600080fd5b505190506000612d6f8583613f8b565b9695505050505050565b6000546001600160a01b031681565b6000809054906101000a90046001600160a01b03166001600160a01b0316635c975abb6040518163ffffffff1660e01b815260040160206040518083038186803b158015612dd557600080fd5b505afa158015612de9573d6000803e3d6000fd5b505050506040513d6020811015612dff57600080fd5b505115610e74576040805162461bcd60e51b815260206004820152601060248201526f1cde5cdd195b481a5cc81c185d5cd95960821b604482015290519081900360640190fd5b612e4e612f9a565b6001600160a01b031663219bc76c6040518163ffffffff1660e01b815260040160206040518083038186803b158015612e8657600080fd5b505afa158015612e9a573d6000803e3d6000fd5b505050506040513d6020811015612eb057600080fd5b5051610e74576040805162461bcd60e51b815260206004820181905260248201527f63757272656e7420726f756e64206973206e6f7420696e697469616c697a6564604482015290519081900360640190fd5b6000612f0d612f9a565b6001600160a01b0316638a19c8bc6040518163ffffffff1660e01b815260040160206040518083038186803b158015612f4557600080fd5b505afa158015612f59573d6000803e3d6000fd5b505050506040513d6020811015612f6f57600080fd5b505133600090815260036020526040902060050154909150818110156119b2576119b23383836143a3565b60008054604080516c2937bab73239a6b0b730b3b2b960991b8152815190819003600d018120631c2d8fb360e31b8252600482015290516001600160a01b039092169163e16c7d9891602480820192602092909190829003018186803b15801561300357600080fd5b505afa1580156115eb573d6000803e3d6000fd5b600082820183811015611f02576040805162461bcd60e51b815260206004820152601b60248201527f536166654d6174683a206164646974696f6e206f766572666c6f770000000000604482015290519081900360640190fd5b6001600160a01b0384166000908152600360209081526040808320868452600781019092529091206130a38686610d83565b6130f0576040805162461bcd60e51b81526020600482015260196024820152781a5b9d985b1a59081d5b989bdb991a5b99c81b1bd8dac81251603a1b604482015290519081900360640190fd5b80548254613104908263ffffffff61301716565b835560008681526007840160205260408120818155600101556002830154613137906001600160a01b031682878761409b565b6002830154604080518881526020810184905281516001600160a01b03808c169416927f9f5b64cc71e1e26ff178caaa7877a04d8ce66fde989251870e80e6fbee690c17928290030190a350505050505050565b6000828211156131e2576040805162461bcd60e51b815260206004820152601e60248201527f536166654d6174683a207375627472616374696f6e206f766572666c6f770000604482015290519081900360640190fd5b50900390565b60005460408051672b32b934b334b2b960c11b81528151908190036008018120631c2d8fb360e31b8252600482015290516001600160a01b039092169163e16c7d9891602480820192602092909190829003018186803b15801561324b57600080fd5b505afa15801561325f573d6000803e3d6000fd5b505050506040513d602081101561327557600080fd5b50516001600160a01b03163314610e74576040805162461bcd60e51b815260206004820152601760248201527f63616c6c6572206d757374206265205665726966696572000000000000000000604482015290519081900360640190fd5b6000611f02620f42406132ec858563ffffffff61454116565b9063ffffffff61459a16565b60408051635d35e00760e01b8152600760048201526001600160a01b0383166024820152905173__$d23c89be677d40ab24c636937040b6165f$__91635d35e007916044808301926000929190829003018186803b15801561335957600080fd5b505af415801561336d573d6000803e3d6000fd5b5050505061338c61337d82612693565b6006549063ffffffff61318b16565b600655600061339e6001610acb612f9a565b6001600160a01b0383166000818152600460209081526040918290206006018490558151848152915193945091927ffee3e693fc72d0a0a673805f3e606c551f4c677b9072444b90dd2d0406bc995c929181900390910190a25050565b60008054604080516526b4b73a32b960d11b81528151908190036006018120631c2d8fb360e31b8252600482015290516001600160a01b039092169163e16c7d9891602480820192602092909190829003018186803b15801561300357600080fd5b620f4240101590565b600654604080516304aa129960e41b815260076004820152905173__$d23c89be677d40ab24c636937040b6165f$__91634aa12990916024808301926020929190829003018186803b1580156134bb57600080fd5b505af41580156134cf573d6000803e3d6000fd5b505050506040513d60208110156134e557600080fd5b505115613675576000600773__$d23c89be677d40ab24c636937040b6165f$__6372e40b2690916040518263ffffffff1660e01b81526004018082815260200191505060206040518083038186803b15801561354057600080fd5b505af4158015613554573d6000803e3d6000fd5b505050506040513d602081101561356a57600080fd5b50519050600061357982612693565b905080871161358a57505050611257565b60408051635d35e00760e01b8152600760048201526001600160a01b0384166024820152905173__$d23c89be677d40ab24c636937040b6165f$__91635d35e007916044808301926000929190829003018186803b1580156135eb57600080fd5b505af41580156135ff573d6000803e3d6000fd5b5050506001600160a01b038316600090815260046020526040902060060187905550613631838263ffffffff61318b16565b6040805188815290519194506001600160a01b038416917ffee3e693fc72d0a0a673805f3e606c551f4c677b9072444b90dd2d0406bc995c9181900360200190a250505b604080516327dd54d360e11b8152600760048201526001600160a01b03808916602483015260448201889052808616606483015284166084820152905173__$d23c89be677d40ab24c636937040b6165f$__91634fbaa9a69160a4808301926000929190829003018186803b1580156136ed57600080fd5b505af4158015613701573d6000803e3d6000fd5b50505050613718858261301790919063ffffffff16565b6001600160a01b03871660009081526004602081815260408084209283018990556005830189905560001960068401558884526003830190915290912091925090613769908763ffffffff61393016565b60068290556040805186815290516001600160a01b038916917f65d72d782835d64c3287844a829608d5abdc7e864cc9affe96d910ab3db665e9919081900360200190a250505050505050565b600054604080516b2a34b1b5b2ba213937b5b2b960a11b8152815190819003600c018120631c2d8fb360e31b8252600482015290516001600160a01b039092169163e16c7d9891602480820192602092909190829003018186803b15801561381d57600080fd5b505afa158015613831573d6000803e3d6000fd5b505050506040513d602081101561384757600080fd5b50516001600160a01b03163314610e74576040805162461bcd60e51b815260206004820152601b60248201527f63616c6c6572206d757374206265205469636b657442726f6b65720000000000604482015290519081900360640190fd5b6138ad61473d565b6138b78383614062565b83546060820151919250901580156138ce57508281105b156138e8576138dd8482614062565b606090810151908301525b600a84015460808301511580156138fe57508381105b156139185761390d8582614062565b608090810151908401525b505092915050565b6001830191909155600290910155565b9055565b60006139606b033b2e3c9fd0803ce80000006132ec6139538686614604565b879063ffffffff61454116565b949350505050565b6080820151606083015160009061398957613984600180614604565b61398f565b83606001515b90508460040154600014156139ca576139bd6139b082858860000154613934565b839063ffffffff61301716565b600486015550611fc59050565b6139ed6139dc82858860000154613934565b60048701549063ffffffff61301716565b60048601555050505050565b6000809054906101000a90046001600160a01b03166001600160a01b0316638da5cb5b6040518163ffffffff1660e01b815260040160206040518083038186803b158015613a4657600080fd5b505afa158015613a5a573d6000803e3d6000fd5b505050506040513d6020811015613a7057600080fd5b50516001600160a01b03163314610e74576040805162461bcd60e51b815260206004820152601f60248201527f63616c6c6572206d75737420626520436f6e74726f6c6c6572206f776e657200604482015290519081900360640190fd5b600054604080516c2937bab73239a6b0b730b3b2b960991b8152815190819003600d018120631c2d8fb360e31b8252600482015290516001600160a01b039092169163e16c7d9891602480820192602092909190829003018186803b158015613b3657600080fd5b505afa158015613b4a573d6000803e3d6000fd5b505050506040513d6020811015613b6057600080fd5b50516001600160a01b03163314610e74576040805162461bcd60e51b815260206004820152601c60248201527f63616c6c6572206d75737420626520526f756e64734d616e6167657200000000604482015290519081900360640190fd5b6001600160a01b038516600090815260046020908152604080832086845260038101909252909120613bee61473d565b613bfc838460000154614062565b9050826008015483600701819055506000613c1b8884600101546132d3565b90506000613c2f898363ffffffff61318b16565b90506000613c468287600701548760000154613934565b9050613c6383611cbe83896008015461301790919063ffffffff16565b6008870155613c7985858463ffffffff61462616565b610ccd8b8b8a8a61409b565b6000546001600160a01b03163314610e74576040805162461bcd60e51b815260206004820152601960248201527f63616c6c6572206d75737420626520436f6e74726f6c6c657200000000000000604482015290519081900360640190fd5b6040805163b0138c4760e01b8152600760048201526001600160a01b0386166024820152905173__$d23c89be677d40ab24c636937040b6165f$__9163b0138c47916044808301926020929190829003018186803b158015613d4557600080fd5b505af4158015613d59573d6000803e3d6000fd5b505050506040513d6020811015613d6f57600080fd5b505115613f38576000613d8185612693565b90506000613d95828663ffffffff61318b16565b90506000613da1612f9a565b6001600160a01b0316638a19c8bc6040518163ffffffff1660e01b815260040160206040518083038186803b158015613dd957600080fd5b505afa158015613ded573d6000803e3d6000fd5b505050506040513d6020811015613e0357600080fd5b505190506000613e1a82600163ffffffff61301716565b60408051631c11bf7f60e11b8152600760048201526001600160a01b03808c16602483015260448201879052808a16606483015288166084820152905191925073__$d23c89be677d40ab24c636937040b6165f$__916338237efe9160a480820192600092909190829003018186803b158015613e9657600080fd5b505af4158015613eaa573d6000803e3d6000fd5b5050600654613ec2925090508863ffffffff61318b16565b6006556001600160a01b038816600090815260046020819052604090912090810154831115613f0b5760008381526003820160205260409020613f0b908663ffffffff61393016565b6004810182905560008281526003820160205260409020613f32908563ffffffff61393016565b50505050505b6001600160a01b03841660009081526003602081905260409091200154613f65908463ffffffff61318b16565b6001600160a01b0390941660009081526003602081905260409091200193909355505050565b6001600160a01b03808316600090815260036020908152604080832060028101549094168352600490915281206001808401548454600586015490959194919392613fdc919063ffffffff61301716565b60028401549091506001600160a01b03908116908816811487831161401e576140188461401085600163ffffffff61318b16565b8a8a8a61467a565b90975095505b801561405657600884015461403a90889063ffffffff61301716565b965061405384600901548761301790919063ffffffff16565b95505b50505050509250929050565b61406a61473d565b6000828152600393840160208181526040832095860154606085015293909152909152600490910154608082015290565b6140a484611ed1565b1561430d5760006140b485612693565b905060006140c8828663ffffffff61301716565b905060006140d4612f9a565b6001600160a01b0316638a19c8bc6040518163ffffffff1660e01b815260040160206040518083038186803b15801561410c57600080fd5b505afa158015614120573d6000803e3d6000fd5b505050506040513d602081101561413657600080fd5b50519050600061414d82600163ffffffff61301716565b6040805163b0138c4760e01b8152600760048201526001600160a01b038b166024820152905191925073__$d23c89be677d40ab24c636937040b6165f$__9163b0138c4791604480820192602092909190829003018186803b1580156141b257600080fd5b505af41580156141c6573d6000803e3d6000fd5b505050506040513d60208110156141dc57600080fd5b5051156142fb5760408051631c11bf7f60e11b8152600760048201526001600160a01b03808b16602483015260448201869052808916606483015287166084820152905173__$d23c89be677d40ab24c636937040b6165f$__916338237efe9160a4808301926000929190829003018186803b15801561425b57600080fd5b505af415801561426f573d6000803e3d6000fd5b5050600654614287925090508863ffffffff61301716565b6006556001600160a01b0388166000908152600460208190526040909120908101548311156142d057600083815260038201602052604090206142d0908663ffffffff61393016565b600082815260038201602052604090206142f0908563ffffffff61393016565b600401819055614308565b6143088884838989613466565b505050505b6001600160a01b03841660009081526003602081905260409091200154613f65908463ffffffff61301716565b60008054604080516c2634bb32b832b2b92a37b5b2b760991b8152815190819003600d018120631c2d8fb360e31b8252600482015290516001600160a01b039092169163e16c7d9891602480820192602092909190829003018186803b15801561300357600080fd5b6001600160a01b0383166000908152600360205260408120906143cd83600163ffffffff61301716565b82546001840154600285015492935090916001600160a01b0316156144a7576143f68787613f8b565b60028601546001600160a01b031660009081526004602090815260408083208b84526003808201909352922090810154939550919350916144515781548881101561444f576144458382614062565b6060015160038301555b505b600481015461447d57600a8201548881101561447b576144718382614062565b6080015160048301555b505b60028601546001600160a01b038a8116911614156144a45760006009830181905560088301555b50505b600284015484546001600160a01b03808a169216907fd7eab0765b772ea6ea859d5633baf737502198012e930f257f90013d9b211094906144ef90869063ffffffff61318b16565b600188015461450590869063ffffffff61318b16565b604080519283526020830191909152818101889052606082018b9052519081900360800190a36005840195909555825550600101919091555050565b60008261455057506000610db0565b8282028284828161455d57fe5b0414611f025760405162461bcd60e51b815260040180806020018281038252602181526020018061483a6021913960400191505060405180910390fd5b60008082116145f0576040805162461bcd60e51b815260206004820152601a60248201527f536166654d6174683a206469766973696f6e206279207a65726f000000000000604482015290519081900360640190fd5b60008284816145fb57fe5b04949350505050565b6000611f02826132ec856b033b2e3c9fd0803ce800000063ffffffff61454116565b600082606001516000141561464557614640600180614604565b61464b565b82606001515b905061466c61465f82848760000154613934565b829063ffffffff61301716565b846003018190555050505050565b60008061468561473d565b61468f8888614062565b90508060600151600014156146af576146a9600180614604565b60608201525b6146b761473d565b6146c189886138a5565b90508060600151600014156146e1576146db600180614604565b60608201525b61471a61470d876147038560800151856080015161318b90919063ffffffff16565b8560600151613934565b869063ffffffff61301716565b925061472f8682606001518460600151613934565b935050509550959350505050565b6040518060a001604052806000815260200160008152602001600081526020016000815260200160008152509056fe756e626f6e6420616d6f756e74206d7573742062652067726561746572207468616e203063616c6c65722063616e277420626520616374697665206f72206d757374206861766520616c72656164792063616c6c65642072657761726420666f72207468652063757272656e7420726f756e64616d6f756e742069732067726561746572207468616e20626f6e64656420616d6f756e7463616c6c65722068617320616c72656164792063616c6c65642072657761726420666f72207468652063757272656e7420726f756e64536166654d6174683a206d756c7469706c69636174696f6e206f766572666c6f7764656c65676174696f6e20616d6f756e74206d7573742062652067726561746572207468616e2030776974686472617720726f756e64206d757374206265206265666f7265206f7220657175616c20746f207468652063757272656e7420726f756e6472656769737465726564207472616e73636f646572732063616e27742064656c656761746520746f7761726473206f746865722061646472657373657363616c6c6572206d75737420626520616e20616374697665207472616e73636f64657263616e277420757064617465207472616e73636f64657220706172616d732c2063757272656e7420726f756e64206973206c6f636b6564a265627a7a723158209f1c6f0a8c2b37ee97b60d069cd24e5746ceb03d21596cc6f20964b814173f2764736f6c634300050b0032",
  "libraries": {
    "SortedDoublyLL": "0x8b2cd2D3363ED88701AFe2b31a30f6F6E4AA2C83"
  },
  "devdoc": {
    "methods": {
      "bond(uint256,address)": {
        "params": {
          "_amount": "The amount of tokens to stake",
          "_to": "The address of the transcoder to stake towards"
        }
      },
      "bondForWithHint(uint256,address,address,address,address,address,address)": {
        "details": "If the caller is decreasing the stake of its old delegate in the transcoder pool, the caller can provide an optional hint for the insertion position of the old delegate via the `_oldDelegateNewPosPrev` and `_oldDelegateNewPosNext` params. If the caller is delegating to a delegate that is in the transcoder pool, the caller can provide an optional hint for the insertion position of the delegate via the `_currDelegateNewPosPrev` and `_currDelegateNewPosNext` params. In both cases, a linear search will be executed starting at the hint to find the correct position. In the best case, the hint is the correct position so no search is executed. See SortedDoublyLL.sol for details on list hints",
        "params": {
          "_amount": "The amount of tokens to stake.",
          "_currDelegateNewPosNext": "The address of the next transcoder in the pool for the current delegate",
          "_currDelegateNewPosPrev": "The address of the previous transcoder in the pool for the current delegate",
          "_oldDelegateNewPosNext": "The address of the next transcoder in the pool for the old delegate",
          "_oldDelegateNewPosPrev": "The address of the previous transcoder in the pool for the old delegate",
          "_owner": "The address of the owner of the bond",
          "_to": "The address of the transcoder to stake towards"
        }
      },
      "bondWithHint(uint256,address,address,address,address,address)": {
        "details": "If the caller is decreasing the stake of its old delegate in the transcoder pool, the caller can provide an optional hint for the insertion position of the old delegate via the `_oldDelegateNewPosPrev` and `_oldDelegateNewPosNext` params. If the caller is delegating to a delegate that is in the transcoder pool, the caller can provide an optional hint for the insertion position of the delegate via the `_currDelegateNewPosPrev` and `_currDelegateNewPosNext` params. In both cases, a linear search will be executed starting at the hint to find the correct position. In the best case, the hint is the correct position so no search is executed. See SortedDoublyLL.sol for details on list hints",
        "params": {
          "_amount": "The amount of tokens to stake.",
          "_currDelegateNewPosNext": "The address of the next transcoder in the pool for the current delegate",
          "_currDelegateNewPosPrev": "The address of the previous transcoder in the pool for the current delegate",
          "_oldDelegateNewPosNext": "The address of the next transcoder in the pool for the old delegate",
          "_oldDelegateNewPosPrev": "The address of the previous transcoder in the pool for the old delegate",
          "_to": "The address of the transcoder to stake towards"
        }
      },
      "claimEarnings(uint256)": {
        "params": {
          "_endRound": "The last round for which to claim token pools shares for a delegator"
        }
      },
      "constructor": {
        "details": "This constructor will not initialize any state variables besides `controller`. The following setter functions should be used to initialize state variables post-deployment: - setUnbondingPeriod() - setNumActiveTranscoders() - setMaxEarningsClaimsRounds()",
        "params": {
          "_controller": "Address of Controller that this contract will be registered with"
        }
      },
      "delegatorStatus(address)": {
        "params": {
          "_delegator": "Address of delegator"
        },
        "return": "bonded, unbonded or pending delegator status"
      },
      "getDelegator(address)": {
        "params": {
          "_delegator": "Address of delegator"
        },
        "return": "total amount bonded by '_delegator'amount of fees collected by '_delegator'address '_delegator' has bonded tototal amount delegated to '_delegator'round in which bond for '_delegator' became effectiveround for which '_delegator' has last claimed earningsID for the next unbonding lock created for '_delegator'"
      },
      "getDelegatorUnbondingLock(address,uint256)": {
        "params": {
          "_delegator": "Address of delegator",
          "_unbondingLockId": "ID of unbonding lock"
        },
        "return": "amount of stake locked up by unbonding lockround in which 'amount' becomes available for withdrawal"
      },
      "getFirstTranscoderInPool()": {
        "return": "address for transcoder with highest stake in transcoder pool"
      },
      "getNextTranscoderInPool(address)": {
        "params": {
          "_transcoder": "Address of a transcoder in the pool"
        },
        "return": "address for the transcoder after '_transcoder' in transcoder pool"
      },
      "getTotalBonded()": {
        "return": "total active stake for the current round"
      },
      "getTranscoder(address)": {
        "params": {
          "_transcoder": "Address of transcoder"
        },
        "return": "lastRewardRound Trancoder's last reward roundrewardCut Transcoder's reward cutfeeShare Transcoder's fee sharelastActiveStakeUpdateRound Round in which transcoder's stake was last updated while activeactivationRound Round in which transcoder became activedeactivationRound Round in which transcoder will no longer be activeactiveCumulativeRewards Transcoder's cumulative rewards that are currently activecumulativeRewards Transcoder's cumulative rewards (earned via its active staked rewards and its reward cut)cumulativeFees Transcoder's cumulative fees (earned via its active staked rewards and its fee share)lastFeeRound Latest round that the transcoder received fees"
      },
      "getTranscoderEarningsPoolForRound(address,uint256)": {
        "params": {
          "_round": "Round number",
          "_transcoder": "Address of transcoder"
        },
        "return": "totalStake Transcoder's total stake in '_round'transcoderRewardCut Transcoder's reward cut for '_round'transcoderFeeShare Transcoder's fee share for '_round'cumulativeRewardFactor The cumulative reward factor for delegator rewards calculation (only used after LIP-36)cumulativeFeeFactor The cumulative fee factor for delegator fees calculation (only used after LIP-36)"
      },
      "getTranscoderPoolMaxSize()": {
        "return": "transcoder pool max size"
      },
      "getTranscoderPoolSize()": {
        "return": "transcoder pool current size"
      },
      "isActiveTranscoder(address)": {
        "params": {
          "_transcoder": "Transcoder address"
        },
        "return": "true if transcoder is active"
      },
      "isRegisteredTranscoder(address)": {
        "params": {
          "_transcoder": "Transcoder address"
        },
        "return": "true if transcoder is self-bonded"
      },
      "isValidUnbondingLock(address,uint256)": {
        "params": {
          "_delegator": "Address of delegator",
          "_unbondingLockId": "ID of unbonding lock"
        },
        "return": "true if unbondingLock for ID has a non-zero withdraw round"
      },
      "pendingFees(address,uint256)": {
        "params": {
          "_delegator": "Address of delegator",
          "_endRound": "The last round to compute pending fees from"
        },
        "return": "Pending fees for '_delegator' since last claiming fees"
      },
      "pendingStake(address,uint256)": {
        "params": {
          "_delegator": "Address of delegator",
          "_endRound": "The last round to compute pending stake from"
        },
        "return": "Pending bonded stake for '_delegator' since last claiming rewards"
      },
      "rebond(uint256)": {
        "params": {
          "_unbondingLockId": "ID of unbonding lock to rebond with"
        }
      },
      "rebondFromUnbonded(address,uint256)": {
        "params": {
          "_to": "Address of delegate",
          "_unbondingLockId": "ID of unbonding lock to rebond with"
        }
      },
      "rebondFromUnbondedWithHint(address,uint256,address,address)": {
        "details": "If the delegate joins the transcoder pool, the caller can provide an optional hint for the delegate's insertion position in the pool via the `_newPosPrev` and `_newPosNext` params. A linear search will be executed starting at the hint to find the correct position. In the best case, the hint is the correct position so no search is executed. See SortedDoublyLL.sol for details on list hints",
        "params": {
          "_newPosNext": "Address of next transcoder in pool if the delegate joins the pool",
          "_newPosPrev": "Address of previous transcoder in pool if the delegate joins the pool",
          "_to": "Address of delegate",
          "_unbondingLockId": "ID of unbonding lock to rebond with"
        }
      },
      "rebondWithHint(uint256,address,address)": {
        "details": "If the delegate is in the transcoder pool, the caller can provide an optional hint for the delegate's insertion position in the pool via the `_newPosPrev` and `_newPosNext` params. A linear search will be executed starting at the hint to find the correct position. In the best case, the hint is the correct position so no search is executed. See SortedDoublyLL.sol details on list hints",
        "params": {
          "_newPosNext": "Address of next transcoder in pool if the delegate is in the pool",
          "_newPosPrev": "Address of previous transcoder in pool if the delegate is in the pool",
          "_unbondingLockId": "ID of unbonding lock to rebond with"
        }
      },
      "rewardWithHint(address,address)": {
        "details": "If the caller is in the transcoder pool, the caller can provide an optional hint for its insertion position in the pool via the `_newPosPrev` and `_newPosNext` params. A linear search will be executed starting at the hint to find the correct position. In the best case, the hint is the correct position so no search is executed. See SortedDoublyLL.sol for details on list hints",
        "params": {
          "_newPosNext": "Address of next transcoder in pool if the caller is in the pool",
          "_newPosPrev": "Address of previous transcoder in pool if the caller is in the pool"
        }
      },
      "setController(address)": {
        "params": {
          "_controller": "Controller contract address"
        }
      },
      "setNumActiveTranscoders(uint256)": {
        "params": {
          "_numActiveTranscoders": "Number of active transcoders"
        }
      },
      "setUnbondingPeriod(uint64)": {
        "params": {
          "_unbondingPeriod": "Rounds between unbonding and possible withdrawal"
        }
      },
      "slashTranscoder(address,address,uint256,uint256)": {
        "params": {
          "_finder": "Finder that proved a transcoder violated a slashing condition. Null address if there is no finder",
          "_finderFee": "Percentage of penalty awarded to finder. Zero if there is no finder",
          "_slashAmount": "Percentage of transcoder bond to be slashed",
          "_transcoder": "Transcoder address"
        }
      },
      "transcoder(uint256,uint256)": {
        "details": "Percentages are represented as numerators of fractions over MathUtils.PERC_DIVISOR",
        "params": {
          "_feeShare": "% of fees paid to delegators by a transcoder",
          "_rewardCut": "% of reward paid to transcoder by a delegator"
        }
      },
      "transcoderStatus(address)": {
        "params": {
          "_transcoder": "Address of transcoder"
        },
        "return": "registered or not registered transcoder status"
      },
      "transcoderTotalStake(address)": {
        "params": {
          "_transcoder": "Address of transcoder"
        },
        "return": "total bonded stake for a delegator"
      },
      "transcoderWithHint(uint256,uint256,address,address)": {
        "details": "Percentages are represented as numerators of fractions over MathUtils.PERC_DIVISOR. If the caller is going to be added to the pool, the caller can provide an optional hint for the insertion position in the pool via the `_newPosPrev` and `_newPosNext` params. A linear search will be executed starting at the hint to find the correct position - in the best case, the hint is the correct position so no search is executed. See SortedDoublyLL.sol for details on list hints",
        "params": {
          "_feeShare": "% of fees paid to delegators by a transcoder",
          "_newPosNext": "Address of next transcoder in pool if the caller joins the pool",
          "_newPosPrev": "Address of previous transcoder in pool if the caller joins the pool",
          "_rewardCut": "% of reward paid to transcoder by a delegator"
        }
      },
      "transferBond(address,uint256,address,address,address,address)": {
        "details": "If the original delegate is in the transcoder pool, the caller can provide an optional hint for the insertion position of the delegate via the `_oldDelegateNewPosPrev` and `_oldDelegateNewPosNext` params. If the target delegate is in the transcoder pool, the caller can provide an optional hint for the insertion position of the delegate via the `_newDelegateNewPosPrev` and `_newDelegateNewPosNext` params.     * In both cases, a linear search will be executed starting at the hint to find the correct position. In the best case, the hint is the correct position so no search is executed. See SortedDoublyLL.sol for details on list hints",
        "params": {
          "_amount": "Portion of the bond to transfer to receiver",
          "_delegator": "Receiver of the bond",
          "_newDelegateNewPosNext": "Address of next transcoder in pool if the delegate is in the pool",
          "_newDelegateNewPosPrev": "Address of previous transcoder in pool if the delegate is in the pool",
          "_oldDelegateNewPosNext": "Address of next transcoder in pool if the delegate remains in the pool",
          "_oldDelegateNewPosPrev": "Address of previous transcoder in pool if the delegate remains in the pool"
        }
      },
      "unbond(uint256)": {
        "params": {
          "_amount": "Amount of tokens to unbond"
        }
      },
      "unbondWithHint(uint256,address,address)": {
        "details": "If the caller remains in the transcoder pool, the caller can provide an optional hint for its insertion position in the pool via the `_newPosPrev` and `_newPosNext` params. A linear search will be executed starting at the hint to find the correct position. In the best case, the hint is the correct position so no search is executed. See SortedDoublyLL.sol details on list hints",
        "params": {
          "_amount": "Amount of tokens to unbond",
          "_newPosNext": "Address of next transcoder in pool if the caller remains in the pool",
          "_newPosPrev": "Address of previous transcoder in pool if the caller remains in the pool"
        }
      },
      "updateTranscoderWithFees(address,uint256,uint256)": {
        "params": {
          "_fees": "Fees to be added to the fee pool",
          "_transcoder": "Transcoder address"
        }
      },
      "withdrawStake(uint256)": {
        "params": {
          "_unbondingLockId": "ID of unbonding lock to withdraw with"
        }
      }
    },
    "title": "BondingManager"
  },
  "userdoc": {
    "methods": {
      "bond(uint256,address)": {
        "notice": "Delegate stake towards a specific address"
      },
      "bondForWithHint(uint256,address,address,address,address,address,address)": {
        "notice": "Delegates stake \"on behalf of\" another address towards a specific address and updates the transcoder pool using optional list hints if needed"
      },
      "bondWithHint(uint256,address,address,address,address,address)": {
        "notice": "Delegates stake towards a specific address and updates the transcoder pool using optional list hints if needed"
      },
      "claimEarnings(uint256)": {
        "notice": "Claim token pools shares for a delegator from its lastClaimRound through the end round"
      },
      "constructor": "BondingManager constructor. Only invokes constructor of base Manager contract with provided Controller address",
      "delegatorStatus(address)": {
        "notice": "Computes delegator status"
      },
      "getDelegator(address)": {
        "notice": "Return delegator info"
      },
      "getDelegatorUnbondingLock(address,uint256)": {
        "notice": "Return delegator's unbonding lock info"
      },
      "getFirstTranscoderInPool()": {
        "notice": "Returns transcoder with most stake in pool"
      },
      "getNextTranscoderInPool(address)": {
        "notice": "Returns next transcoder in pool for a given transcoder"
      },
      "getTotalBonded()": {
        "notice": "Return total bonded tokens"
      },
      "getTranscoder(address)": {
        "notice": "Return transcoder information"
      },
      "getTranscoderEarningsPoolForRound(address,uint256)": {
        "notice": "Return transcoder's earnings pool for a given round"
      },
      "getTranscoderPoolMaxSize()": {
        "notice": "Returns max size of transcoder pool"
      },
      "getTranscoderPoolSize()": {
        "notice": "Returns size of transcoder pool"
      },
      "isActiveTranscoder(address)": {
        "notice": "Return whether a transcoder is active for the current round"
      },
      "isRegisteredTranscoder(address)": {
        "notice": "Return whether a transcoder is registered"
      },
      "isValidUnbondingLock(address,uint256)": {
        "notice": "Return whether an unbonding lock for a delegator is valid"
      },
      "pendingFees(address,uint256)": {
        "notice": "Returns pending fees for a delegator from its lastClaimRound through an end round"
      },
      "pendingStake(address,uint256)": {
        "notice": "Returns pending bonded stake for a delegator from its lastClaimRound through an end round"
      },
      "rebond(uint256)": {
        "notice": "Rebond tokens for an unbonding lock to a delegator's current delegate while a delegator is in the Bonded or Pending status"
      },
      "rebondFromUnbonded(address,uint256)": {
        "notice": "Rebond tokens for an unbonding lock to a delegate while a delegator is in the Unbonded status"
      },
      "rebondFromUnbondedWithHint(address,uint256,address,address)": {
        "notice": "Rebond tokens for an unbonding lock to a delegate while a delegator is in the Unbonded status and updates the transcoder pool using an optional list hint if needed"
      },
      "rebondWithHint(uint256,address,address)": {
        "notice": "Rebond tokens for an unbonding lock to a delegator's current delegate while a delegator is in the Bonded or Pending status and updates the transcoder pool using an optional list hint if needed"
      },
      "reward()": {
        "notice": "Mint token rewards for an active transcoder and its delegators"
      },
      "rewardWithHint(address,address)": {
        "notice": "Mint token rewards for an active transcoder and its delegators and update the transcoder pool using an optional list hint if needed"
      },
      "setController(address)": {
        "notice": "Set controller. Only callable by current controller"
      },
      "setCurrentRoundTotalActiveStake()": {
        "notice": "Called during round initialization to set the total active stake for the round. Only callable by the RoundsManager"
      },
      "setNumActiveTranscoders(uint256)": {
        "notice": "Set maximum number of active transcoders. Only callable by Controller owner"
      },
      "setUnbondingPeriod(uint64)": {
        "notice": "Set unbonding period. Only callable by Controller owner"
      },
      "slashTranscoder(address,address,uint256,uint256)": {
        "notice": "Slash a transcoder. Only callable by the Verifier"
      },
      "transcoder(uint256,uint256)": {
        "notice": "Sets commission rates as a transcoder and if the caller is not in the transcoder pool tries to add it"
      },
      "transcoderStatus(address)": {
        "notice": "Computes transcoder status"
      },
      "transcoderTotalStake(address)": {
        "notice": "Returns total bonded stake for a transcoder"
      },
      "transcoderWithHint(uint256,uint256,address,address)": {
        "notice": "Sets commission rates as a transcoder and if the caller is not in the transcoder pool tries to add it using an optional list hint"
      },
      "transferBond(address,uint256,address,address,address,address)": {
        "notice": "Transfers ownership of a bond to a new delegator using optional hints if needed     * If the receiver is already bonded to a different delegate than the bond owner then the stake goes to the receiver's delegate otherwise the receiver's delegate is set as the owner's delegate"
      },
      "unbond(uint256)": {
        "notice": "Unbond an amount of the delegator's bonded stake"
      },
      "unbondWithHint(uint256,address,address)": {
        "notice": "Unbond an amount of the delegator's bonded stake and updates the transcoder pool using an optional list hint if needed"
      },
      "updateTranscoderWithFees(address,uint256,uint256)": {
        "notice": "Update transcoder's fee pool. Only callable by the TicketBroker"
      },
      "withdrawFees(address,uint256)": {
        "notice": "Withdraws fees to the caller"
      },
      "withdrawStake(uint256)": {
        "notice": "Withdraws tokens for an unbonding lock that has existed through an unbonding period"
      }
    },
    "notice": "Manages bonding, transcoder and rewards/fee accounting related operations of the Livepeer protocol"
  }
}